,further research line,further research prefix,further research suffix,publication date,title,primary category,categories,authors,abstract
6901,"Although models with multiple
                phases of inﬂation could satisfy the observational constraints on the length of
                inﬂation, these models require further study of the dynamics and the spectrum of
                perturbations.",We only consider a single phase of inﬂation.,"This implies that, in the case of multiple regions that satisfy the
                above constraints, we choose the region that is closest to the Minkowski vacuum,
                as this would be the ﬁrst N e-folds of inﬂation that we would observe.",2022-05-30 09:37:51+00:00,CMB constraints on monodromy inflation at strong coupling,astro-ph.CO,"['astro-ph.CO', 'gr-qc', 'hep-th']","[arxiv.Result.Author('Edmund J. Copeland'), arxiv.Result.Author('Francesc Cunillera'), arxiv.Result.Author('Adam Moss'), arxiv.Result.Author('Antonio Padilla')]","We carry out a thorough numerical examination of field theory monodromy
inflation at strong coupling. We perform an MCMC analysis using a Gaussian
likelihood, fitting multiparameter models using CMB constraints on the spectral
index and the tensor to scalar ratio. We show that models with uniquely
positive Wilson coefficients are ruled out. If there are coefficients that can
take on both signs, there can be a cancellation of terms that flattens the
potentials and allows one to satisfy current data, and forecasts with strong
constraints on the tensor to scalar ratio. Models of field theory monodromy are
naturally enhanced to include a mechanism for canceling off radiative
corrections to vacuum energy, via vacuum energy sequestering (VES). Although
they include a much larger parameter space, we find that a similar numerical
examination yields no significant change in the Bayesian evidence for VES
enhanced models, with naturalness considerations making them more attractive
from a theoretical perspective."
7029,"This encourages us to further study the HCGs environment
                                                                              in the future, such as the characteristics of neighbouring structures
                                                                              and their impact on the dynamics and distribution of HCGs and their
                                                                              populations.","of the HCGs, that is, in some cases, there are other halos and their
                                                                              associated galaxies that belong to the environment rather than the
                                                                              group.","MNRAS 000, 1–13 (2022)
8 Jessica N. López-Sánchez et al.",2022-06-01 20:46:48+00:00,Compact Groups in GDM Cosmological Simulations,astro-ph.CO,"['astro-ph.CO', 'astro-ph.GA']","[arxiv.Result.Author('Jessica N. López-Sánchez'), arxiv.Result.Author('Erick Munive-Villa'), arxiv.Result.Author('Ana Avilez-López'), arxiv.Result.Author('Oscar M. Martínez-Bravo')]","In this work, we study some properties of the Hickson Compact Groups (HCGs)
using N-body simulations for the Generalized Dark Matter (GDM) model, described
by three free functions, the sound speed, the viscosity and the equation of
state. We consider three GDM models associated with different values of the
free functions to neglect collisional effects. We constructed the initial seeds
of our simulations according to the matter power spectrum of GDM linear
perturbations, which hold a cut-off at small scales, and explored their effects
on the non-linear structure formation at small and intermediate scales. We
generated mock catalogues of galaxies for different models and classify HCGs by
implementing an algorithm that adapts the original selection method for mock
catalogues. Once the HCGs samples are classified, we analyzed their properties
and compared them between models. We found that a larger amount of HCGs are
counted in GDM simulations in comparison to CDM counts. This difference
suggests that HCGs can proliferate within GDM despite the suppressed
substructure, which indicates a possible modification in the HCG formation
process within models where DM is not perfectly like CDM. Additionally, we
identified different mechanisms of clustering, for models with a large amount
of galaxy-halos self-agglomerate because of their abundance while models with
fewer galaxy-halos need massive halos acting as a dominant potential well.
Finally, by comparing distributions of different observables of simulated HCGs
against observations, we found a good agreement in the intrinsic properties.
However, a discrepancy in the velocity dispersion remains unsolved."
7191,"It may also provide a better ﬁt of the spectral tilt to the CMB values, which
motivates further study in this direction.","Generalizing our model to the α-attractors
may relax some constraints and lead to a diﬀerent relation between SUSY breaking and
PBH DM.","22
Acknowledgements

YA was supported by the Chulalongkorn University CUniverse research promotion project
(grant CUAASC), and the Thailand science research and innovation fund under the project
CU FRB65 ind (2) 107 23 37.",2022-06-06 13:15:42+00:00,"Inflation, SUSY breaking, and primordial black holes in modified supergravity coupled to chiral matter",astro-ph.CO,"['astro-ph.CO', 'gr-qc', 'hep-th']","[arxiv.Result.Author('Yermek Aldabergenov'), arxiv.Result.Author('Andrea Addazi'), arxiv.Result.Author('Sergei V. Ketov')]","We propose a novel model of the modified (Starobinsky-like) old-minimal-type
supergravity coupled to a chiral matter superfield, that can {\it
simultaneously} describe multi-field inflation, primordial black hole (PBH)
formation, dark matter (DM), and spontaneous supersymmetry (SUSY) breaking
after inflation in a Minkowski vacuum. The PBH masses in our supergravity model
of double slow-roll inflation, with a short phase of ""ultra-slow-roll"" between
two slow-roll phases, are close to $10^{18}$ g. We find that a significant PBH
fraction in the allowed mass window requires the very high SUSY breaking scale
with the gravitino mass close to the scalaron (inflaton) mass $M$ of the order
$10^{13}$ GeV. Our supergravity model favors the {\it composite} nature of DM
as a mixture of PBH and heavy gravitinos as the lightest SUSY particles. The
composite DM significantly relaxes fine-tuning needed for the whole PBH-DM. The
PBH-DM fraction is derived, and the second-order gravitational wave background
induced by the enhanced scalar perturbations is calculated. Those gravitational
waves may be accessible by the future space-based gravitational
interferometers."
7192,"It may also provide a better ﬁt of the spectral tilt to the CMB values, which
motivates further study in this direction.","Generalizing our model to the α-attractors
may relax some constraints and lead to a diﬀerent relation between SUSY breaking and
PBH DM.","22
Acknowledgements

YA was supported by the Chulalongkorn University CUniverse research promotion project
(grant CUAASC), and the Thailand science research and innovation fund under the project
CU FRB65 ind (2) 107 23 37.",2022-06-06 13:15:42+00:00,"Inflation, SUSY breaking, and primordial black holes in modified supergravity coupled to chiral matter",astro-ph.CO,"['astro-ph.CO', 'gr-qc', 'hep-th']","[arxiv.Result.Author('Yermek Aldabergenov'), arxiv.Result.Author('Andrea Addazi'), arxiv.Result.Author('Sergei V. Ketov')]","We propose a novel model of the modified (Starobinsky-like) old-minimal-type
supergravity coupled to a chiral matter superfield, that can {\it
simultaneously} describe multi-field inflation, primordial black hole (PBH)
formation, dark matter (DM), and spontaneous supersymmetry (SUSY) breaking
after inflation in a Minkowski vacuum. The PBH masses in our supergravity model
of double slow-roll inflation, with a short phase of ""ultra-slow-roll"" between
two slow-roll phases, are close to $10^{18}$ g. We find that a significant PBH
fraction in the allowed mass window requires the very high SUSY breaking scale
with the gravitino mass close to the scalaron (inflaton) mass $M$ of the order
$10^{13}$ GeV. Our supergravity model favors the {\it composite} nature of DM
as a mixture of PBH and heavy gravitinos as the lightest SUSY particles. The
composite DM significantly relaxes fine-tuning needed for the whole PBH-DM. The
PBH-DM fraction is derived, and the second-order gravitational wave background
induced by the enhanced scalar perturbations is calculated. Those gravitational
waves may be accessible by the future space-based gravitational
interferometers."
7292,constraining power requires further study.,2013).,"As such, MFs are only eﬀective cosmological probes in
simulations if masking is taken into account.",2022-06-08 13:16:55+00:00,Minkowski Functionals in Joint Galaxy Clustering & Weak Lensing Analyses,astro-ph.CO,['astro-ph.CO'],"[arxiv.Result.Author('Nisha Grewal'), arxiv.Result.Author('Joe Zuntz'), arxiv.Result.Author('Tilman Tröster'), arxiv.Result.Author('Alexandra Amon')]","We investigate the inclusion of clustering maps in a weak lensing Minkowski
functional (MF) analysis of DES-like and LSST-like simulations to constrain
cosmological parameters. The standard 3x2pt approach to lensing and clustering
data uses two-point correlations as its primary statistic; MFs, morphological
statistics describing the shape of matter fields, provide additional
information for non-Gaussian fields. Previous analyses have studied MFs of
lensing convergence maps; in this project we explore their simultaneous
application to clustering maps. We employ a simplified linear galaxy bias
model, and using a lognormal curved sky measurement and Monte Carlo Markov
Chain (MCMC) sampling process for parameter inference, we find that MFs do not
yield any information in the $\Omega_{\rm m}$ -- $\sigma_8$ plane not already
generated by a 3x2pt analysis. However, we expect that MFs should improve
constraining power when nonlinear baryonic and other small-scale effects are
taken into account. As with a 3x2pt analysis, we find a significant improvement
to constraints when adding clustering data to MF-only and MF$+C_\ell$ shear
measurements, and strongly recommend future higher order statistics be measured
from both convergence and clustering maps."
7438,"We emphasise that we do not need
further study.","But the issue of the exact form of the     individual mock realizations, and so we see no reason not to apply
PDF for FoG corrections to the 2-halo term is a problem that merits       the same model to the real data.","to assume that the mocks are completely realistic, as long as they are
                                                                          qualitatively similar to reality.",2022-06-10 12:49:48+00:00,Galaxy and Mass Assembly (GAMA): Probing galaxy-group correlations in redshift space with the halo streaming model,astro-ph.CO,['astro-ph.CO'],"[arxiv.Result.Author('Qianjun Hang'), arxiv.Result.Author('John A. Peacock'), arxiv.Result.Author('Shadab Alam'), arxiv.Result.Author('Yan-Chuan Cai'), arxiv.Result.Author('Katarina Kraljic'), arxiv.Result.Author('Marcel van Daalen'), arxiv.Result.Author('M. Bilicki'), arxiv.Result.Author('B. W. Holwerda'), arxiv.Result.Author('J. Loveday')]","We have studied the galaxy-group cross-correlations in redshift space for the
Galaxy And Mass Assembly (GAMA) Survey. We use a set of mock GAMA galaxy and
group catalogues to develop and test a novel 'halo streaming' model for
redshift-space distortions. This treats 2-halo correlations via the streaming
model, plus an empirical 1-halo term derived from the mocks, allowing accurate
modelling into the nonlinear regime. In order to probe the robustness of the
growth rate inferred from redshift-space distortions, we divide galaxies by
colour, and divide groups according to their total stellar mass, calibrated to
total mass via gravitational lensing. We fit our model to correlation data, to
obtain estimates of the perturbation growth rate, $f\sigma_8$, validating
parameter errors via the dispersion between different mock realizations. In
both mocks and real data, we demonstrate that the results are closely
consistent between different subsets of the group and galaxy populations,
considering the use of correlation data down to some minimum projected radius,
$r_{\rm min}$. For the mock data, we can use the halo streaming model to below
$r_{\rm min} = 5h^{-1}$ Mpc, finding that all subsets yield growth rates within
about 3% of each other, and consistent with the true value. For the actual GAMA
data, the results are limited by cosmic variance: $f\sigma_8=0.29\pm 0.10$ at
an effective redshift of 0.20; but there is every reason to expect that this
method will yield precise constraints from larger datasets of the same type,
such as the DESI bright galaxy survey."
7439,2014 showed                 2-halo term is a problem that merits further study.,"But
the 2-halo term can also pair centrals with centrals (assumed to have             the issue of the exact form of the PDF for FoG corrections to the
negligible pairwise dispersion – although Reid et al.","that the actual pairwise velocity could be √up to 30% of 𝜎) and satel-
lites with satellites (pairwise dispersion 2𝜎), so the average rms                   In summary, we therefore have two models with similar real-space
pairwise dispersion depends on the fraction of haloes that contain a              correlations, but diﬀerent degrees of RSD: (1) QD: quasilinear dis-
satellite.",2022-06-10 12:49:48+00:00,Galaxy and Mass Assembly (GAMA): Probing galaxy-group correlations in redshift space with the halo streaming model,astro-ph.CO,['astro-ph.CO'],"[arxiv.Result.Author('Qianjun Hang'), arxiv.Result.Author('John A. Peacock'), arxiv.Result.Author('Shadab Alam'), arxiv.Result.Author('Yan-Chuan Cai'), arxiv.Result.Author('Katarina Kraljic'), arxiv.Result.Author('Marcel van Daalen'), arxiv.Result.Author('M. Bilicki'), arxiv.Result.Author('B. W. Holwerda'), arxiv.Result.Author('J. Loveday')]","We have studied the galaxy-group cross-correlations in redshift space for the
Galaxy And Mass Assembly (GAMA) Survey. We use a set of mock GAMA galaxy and
group catalogues to develop and test a novel 'halo streaming' model for
redshift-space distortions. This treats 2-halo correlations via the streaming
model, plus an empirical 1-halo term derived from the mocks, allowing accurate
modelling into the nonlinear regime. In order to probe the robustness of the
growth rate inferred from redshift-space distortions, we divide galaxies by
colour, and divide groups according to their total stellar mass, calibrated to
total mass via gravitational lensing. We fit our model to correlation data, to
obtain estimates of the perturbation growth rate, $f\sigma_8$, validating
parameter errors via the dispersion between different mock realizations. In
both mocks and real data, we demonstrate that the results are closely
consistent between different subsets of the group and galaxy populations,
considering the use of correlation data down to some minimum projected radius,
$r_{\rm min}$. For the mock data, we can use the halo streaming model to below
$r_{\rm min} = 5h^{-1}$ Mpc, finding that all subsets yield growth rates within
about 3% of each other, and consistent with the true value. For the actual GAMA
data, the results are limited by cosmic variance: $f\sigma_8=0.29\pm 0.10$ at
an effective redshift of 0.20; but there is every reason to expect that this
method will yield precise constraints from larger datasets of the same type,
such as the DESI bright galaxy survey."
7910,"These studies show that a prism can
produce spectral time series with S/N suﬃcient for the goals I and III listed above (redshift measurements and SED
constraints), with conclusive results on goal II (typing) needing further study with a core-collapse SN time-series model.","Section 3 outlines
our evaluation of this survey according to the three uses of spectroscopy above.","Section 3 also performs a simple survey optimization, maximizing the number of SNe Ia useful for diﬀerent purposes
and forecasting the cosmological constraints possible with those SNe.",2022-06-21 18:00:01+00:00,Evaluating and Optimizing a Slitless Prism for Nancy Grace Roman Space Telescope SN Cosmology,astro-ph.CO,"['astro-ph.CO', 'astro-ph.IM']","[arxiv.Result.Author('David Rubin'), arxiv.Result.Author('Greg Aldering'), arxiv.Result.Author('Tri L. Astraatmadja'), arxiv.Result.Author('Charlie Baltay'), arxiv.Result.Author('Aleksandar Cikota'), arxiv.Result.Author('Susana E. Deustua'), arxiv.Result.Author('Sam Dixon'), arxiv.Result.Author('Andrew Fruchter'), arxiv.Result.Author('L. Galbany'), arxiv.Result.Author('Rebekah Hounsell'), arxiv.Result.Author('Saul Perlmutter'), arxiv.Result.Author('Ben Rose')]","This work presents a set of studies addressing the use of the low-dispersion
slitless prism on Roman for SN spectroscopy as part of the Roman High Latitude
Time Domain Survey (HLTDS). We find SN spectral energy distributions including
prism data carry more information than imaging alone at fixed total observing
time, improving redshift measurements and sub-typing of SNe. The Roman field of
view will typically include ~ 10 SNe Ia at observable redshifts at a range of
phases (the multiplexing of host galaxies is much greater as they are always
present), building up SN spectral time series without targeted observations. We
show that fitting these time series extracts more information than stacking the
data over all the phases, resulting in a large improvement in precision for SN
Ia subclassification measurements. A prism on Roman thus significantly enhances
scientific opportunities for the mission, and is particularly important for the
Roman SN cosmology program to provide the systematics-controlled measurement
that is a focus of the Roman dark energy mission. Optimizing the prism
parameters, we conclude that the blue cutoff should be set as blue as the prism
image quality allows (~ 7500A), the red cutoff should be set to ~ 18000A to
minimize thermal background, and the two-pixel dispersion should be >~ 70."
7911,"Appendix C performs a preliminary optimization
that suggests ∼ 25% or 0.125 years for the prism is a reasonable option, but this needs further study.","We select the middle two options, and also consider 0.5 years not as a
serious proposal, but just as a comparison to imaging-only surveys.","6 To impose some regularization on the solution, we use a 2D 3rd-order spline as our basis, with eight nodes in phase and 20 in wavelength.",2022-06-21 18:00:01+00:00,Evaluating and Optimizing a Slitless Prism for Nancy Grace Roman Space Telescope SN Cosmology,astro-ph.CO,"['astro-ph.CO', 'astro-ph.IM']","[arxiv.Result.Author('David Rubin'), arxiv.Result.Author('Greg Aldering'), arxiv.Result.Author('Tri L. Astraatmadja'), arxiv.Result.Author('Charlie Baltay'), arxiv.Result.Author('Aleksandar Cikota'), arxiv.Result.Author('Susana E. Deustua'), arxiv.Result.Author('Sam Dixon'), arxiv.Result.Author('Andrew Fruchter'), arxiv.Result.Author('L. Galbany'), arxiv.Result.Author('Rebekah Hounsell'), arxiv.Result.Author('Saul Perlmutter'), arxiv.Result.Author('Ben Rose')]","This work presents a set of studies addressing the use of the low-dispersion
slitless prism on Roman for SN spectroscopy as part of the Roman High Latitude
Time Domain Survey (HLTDS). We find SN spectral energy distributions including
prism data carry more information than imaging alone at fixed total observing
time, improving redshift measurements and sub-typing of SNe. The Roman field of
view will typically include ~ 10 SNe Ia at observable redshifts at a range of
phases (the multiplexing of host galaxies is much greater as they are always
present), building up SN spectral time series without targeted observations. We
show that fitting these time series extracts more information than stacking the
data over all the phases, resulting in a large improvement in precision for SN
Ia subclassification measurements. A prism on Roman thus significantly enhances
scientific opportunities for the mission, and is particularly important for the
Roman SN cosmology program to provide the systematics-controlled measurement
that is a focus of the Roman dark energy mission. Optimizing the prism
parameters, we conclude that the blue cutoff should be set as blue as the prism
image quality allows (~ 7500A), the red cutoff should be set to ~ 18000A to
minimize thermal background, and the two-pixel dispersion should be >~ 70."
8148,"However, this is
                      not always achievable with currently available methods, so further research in these areas
                      is needed.","Careful calibration and accounting for their eﬀects are therefore
                      necessary for them not to limit the cosmological insights to be gained.","It is possible that other systematic issues associated with photo-zs that have not
                      yet been identiﬁed could also compromise cosmological inference at a comparable level to
                      the eﬀects discussed here.",2022-06-27 21:11:19+00:00,Photometric Redshifts for Next-Generation Surveys,astro-ph.CO,"['astro-ph.CO', 'astro-ph.GA']","[arxiv.Result.Author('Jeffrey A. Newman'), arxiv.Result.Author('Daniel Gruen')]","Photometric redshifts are essential in studies of both galaxy evolution and
cosmology, as they enable analyses of objects too numerous or faint for
spectroscopy. The Rubin Observatory, Euclid, and Roman Space Telescope will
soon provide a new generation of imaging surveys with unprecedented area
coverage, wavelength range, and depth. To take full advantage of these
datasets, further progress in photometric redshift methods is needed. In this
review, we focus on the greatest common challenges and prospects for
improvement in applications of photo-$z$'s to the next generation of surveys:
  - Gains in $performance$ -- i.e., the precision of redshift estimates for
individual galaxies -- could greatly enhance studies of galaxy evolution and
some probes of cosmology.
  - Improvements in $characterization$ -- i.e., the accurate recovery of
redshift $distributions$ of galaxies in the presence of uncertainty on
individual redshifts -- are urgently needed for cosmological measurements with
next-generation surveys.
  - To achieve both of these goals, improvements in the scope and treatment of
the samples of spectroscopic redshifts which make high-fidelity photo-$z$'s
possible will also be needed.
  For the full potential of the next generation of surveys to be reached, the
characterization of redshift distributions will need to improve by roughly an
order of magnitude compared to the current state of the art, requiring progress
on a wide variety of fronts. We conclude by presenting a speculative evaluation
of how photometric redshift methods and the collection of the necessary
spectroscopic samples may improve by the time near-future surveys are
completed."
8277,"In each of these ﬁve volumes, we
choose one MW-like halo and select all of the self-bound substructures (subhalos) within the

                                                         –2–
virial radius1 of the MW-like halo for further study.",Level 1 or high resolution).,"The DM particle mass at this resolution
is mDM 5 × 104 M , the initial gas particle mass is mg 1.0 × 104 M , and the maximum
physical softening length is = 134 pc.",2022-06-30 19:17:12+00:00,Velocity-dependent J-factors for Milky Way dwarf spheroidal analogues in cosmological simulations,astro-ph.CO,"['astro-ph.CO', 'astro-ph.GA', 'hep-ph']","[arxiv.Result.Author('Keagan Blanchette'), arxiv.Result.Author('Erin Piccirillo'), arxiv.Result.Author('Nassim Bozorgnia'), arxiv.Result.Author('Louis E. Strigari'), arxiv.Result.Author('Azadeh Fattahi'), arxiv.Result.Author('Carlos S. Frenk'), arxiv.Result.Author('Julio F. Navarro'), arxiv.Result.Author('Till Sawala')]","We study the impact of the dark matter velocity distribution modelling on
signals from velocity-dependent dark matter annihilation in Milky Way dwarf
spheroidal galaxies. Using the high resolution APOSTLE simulations, we identify
analogues corresponding to Milky Way dwarf spheroidal galaxies, and from these
directly determine the dark matter pair-wise relative velocity distribution,
and compare to best-fitting Maxwell-Boltzmann distribution models. For three
velocity-dependent annihilation models, p-wave, d-wave, and the Sommerfeld
model, we quantify the errors introduced when using the Maxwell-Boltzmann
parameterization. We extract a simple power-law relation between the maximum
circular velocity of the dwarf spheroidal analogue and the peak speed of the
Maxwell-Boltzmann distribution. We show that this relation can be used to
accurately calculate the dark matter relative velocity distribution, and find
that it allows us to estimate the dark matter annihilation signal without the
need to directly calculate the relative velocity distribution for each galaxy.
The scatter in the J-factors calculated from the analogues dominates the
uncertainty obtained when compared to the J-factor as determined from the
observational data for each dwarf spheroidal, with the largest scatter from
d-wave models and the smallest from Sommerfeld models."
