,further research line,further research prefix,further research suffix,publication date,title,primary category,categories,authors,abstract
10267,"The non-Gaussian corrections require

further study and are beyond the scope of this work.","In this work we are chieﬂy concerned with the

large scale limit of the density ﬁeld, where Gaussian statistics can be applied.","For the remainder of the paper, we will focus speciﬁcally on the
Minkowski tensor W10,2, and consign the more complicated W20,2 statistic to Appendix A.",2022-08-22 09:21:43+00:00,Minkowski Tensors in Redshift Space -- Beyond the Plane Parallel Approximation,astro-ph.CO,['astro-ph.CO'],"[arxiv.Result.Author('Stephen Appleby'), arxiv.Result.Author('Joby P. Kochappan'), arxiv.Result.Author('Pravabati Chingangbam'), arxiv.Result.Author('Changbom Park')]","The Minkowski tensors (MTs) can be used to probe anisotropic signals in a
field, and are well suited for measuring the redshift space distortion (RSD)
signal in large scale structure catalogs. We consider how the linear RSD signal
can be extracted from a field without resorting to the plane parallel
approximation. A spherically redshift space distorted field is both anisotropic
and inhomogeneous. We derive expressions for the two point correlation
functions that elucidate the inhomogeneity, and then explain how the breakdown
of homogeneity impacts the volume and ensemble averages of the tensor Minkowski
functionals. We construct the ensemble average of these quantities in
curvilinear coordinates and show that the ensemble and volume averages can be
approximately equated, but this depends on our choice of definition of the
volume average of a tensor and the radial distance between the observer and
field. We then extract the tensor Minkowski functionals from spherically
redshift space distorted, Gaussian random fields and gravitationally evolved
dark matter density fields at $z=0$ to test if we can successfully measure the
Kaiser RSD signal. For the dark matter field we find a significant, $\sim 10\%$
anomalous signal in the MT component parallel to the line of sight that is
present even on large scales $R_{\rm G} \gtrsim 15 \, {\rm Mpc}$, in addition
to the Kaiser effect. This is due to the line of sight component of the MT
being significantly contaminated by the Finger of God effect, which can be
approximately modelled by an additional damping term in the cumulants."
10488,"So far, much work has been examined about the swampland program in literature;
you can see Ref.s [1–37] for further study.","Therefore, eﬀective low-energy theories compatible with these
swampland conjectures are aligned with quantum gravity, which can be of great help in ﬁnding
a solution to advance this great question that has occupied researchers for years, namely, quan-
tum gravity.","The swampland program has played an important

                                  2
role in ﬁnding phenomena consistent with quantum gravity.",2022-08-27 22:20:21+00:00,Scalar Weak Gravity Conjecture and Inflationary Models,astro-ph.CO,"['astro-ph.CO', 'gr-qc', 'hep-th']","[arxiv.Result.Author('J. Sadeghi'), arxiv.Result.Author('M. R. Alipour'), arxiv.Result.Author('S. Noori Gashti')]","In [arXiv:2208.09842], Yuennan and Channuie examined four inflation models,
such as Composite NJL Inflation(NJLI), Glueball Inflation(GI), super Yang-Mills
Inflation (SYMI), and Orientifold Inflation (OI) from further refining the dS
swampland conjecture (FRSDC) perspective. They found that all models violate
the dS swampland conjecture(DSC) but are compatible with (FRSDC) through manual
adjustment of free parameters of the mentioned conjecture. Now, in this
article, we want to check each of the mentioned inflation models with two other
conjectures of the swampland program: scalar weak gravity conjecture (SWGC) and
strong scalar weak gravity conjecture (SSWGC). We want to study the
simultaneous compatibility of each model with these two new conjectures.
Despite being consistent with (FRSDC), we find that all models are not
compatible with the other conjectures of the Swampland program in all regions,
and these conjectures are only satisfied in a specific area. Also, Due to the
presence of constant parameter ($\phi_{0}$) in the higher orders derivatives,
the (SYMI) and (OI) among all the models are more compatible with all
conjectures of the swampland program. They can provide a more significant
amount of satisfaction with all of them. They can be suitable and accurate
inflation models for a more profound examination of universe developments. We
determined a particular region for these models is compatible with (FRSDC),
(SWGC), and (SSWGC) simultaneously."
10489,"2.3 Model III: SYMI

We also brieﬂy explain this model, which you can see [1] for further study.","We will also challenge this model with two other conjectures of the swampland
program and describe the results in detail.","The action in
Jordan’s frame for this model is generally expressed in the following form according to the
non-minimally coupled gravity structure.",2022-08-27 22:20:21+00:00,Scalar Weak Gravity Conjecture and Inflationary Models,astro-ph.CO,"['astro-ph.CO', 'gr-qc', 'hep-th']","[arxiv.Result.Author('J. Sadeghi'), arxiv.Result.Author('M. R. Alipour'), arxiv.Result.Author('S. Noori Gashti')]","In [arXiv:2208.09842], Yuennan and Channuie examined four inflation models,
such as Composite NJL Inflation(NJLI), Glueball Inflation(GI), super Yang-Mills
Inflation (SYMI), and Orientifold Inflation (OI) from further refining the dS
swampland conjecture (FRSDC) perspective. They found that all models violate
the dS swampland conjecture(DSC) but are compatible with (FRSDC) through manual
adjustment of free parameters of the mentioned conjecture. Now, in this
article, we want to check each of the mentioned inflation models with two other
conjectures of the swampland program: scalar weak gravity conjecture (SWGC) and
strong scalar weak gravity conjecture (SSWGC). We want to study the
simultaneous compatibility of each model with these two new conjectures.
Despite being consistent with (FRSDC), we find that all models are not
compatible with the other conjectures of the Swampland program in all regions,
and these conjectures are only satisfied in a specific area. Also, Due to the
presence of constant parameter ($\phi_{0}$) in the higher orders derivatives,
the (SYMI) and (OI) among all the models are more compatible with all
conjectures of the swampland program. They can provide a more significant
amount of satisfaction with all of them. They can be suitable and accurate
inflation models for a more profound examination of universe developments. We
determined a particular region for these models is compatible with (FRSDC),
(SWGC), and (SSWGC) simultaneously."
10490,"So far, much work has been examined about the swampland program in literature;
you can see Ref.s [1–39] for further study.","Therefore, eﬀective low-energy theories compatible with these
swampland conjectures are aligned with quantum gravity, which can be of great help in ﬁnding
a solution to advance this great question that has occupied researchers for years, namely, quan-
tum gravity.","The swampland program has played an important

                                  2
role in ﬁnding phenomena consistent with quantum gravity.",2022-08-27 22:20:21+00:00,Scalar Weak Gravity Conjecture in Super Yang-Mills Inflationary Model,astro-ph.CO,"['astro-ph.CO', 'gr-qc', 'hep-th']","[arxiv.Result.Author('Jafar Sadeghi'), arxiv.Result.Author('Mohammad Reza Alipour'), arxiv.Result.Author('Saeed Noori Gashti')]","In this article, we want to check four inflation models, such as composite
NJL inflation (NJLI), Glueball inflation(GI), super Yang-Mills inflation
(SYMI), and Orientifold inflation (OI), with two conjectures of the swampland
program: scalar weak gravity conjecture (SWGC) and strong scalar weak gravity
conjecture (SSWGC) since all these models violate the dS swampland
conjecture(DSC) but are compatible with further refining de Sitter swampland
conjecture (FRDSSC) through manual adjustment of free parameters of the
mentioned conjecture. We want to study the simultaneous compatibility of each
model with these two new conjectures. Despite being consistent with (FRDSSC),
we find that all models are not compatible with the other conjectures of the
Swampland program in all regions, and these conjectures are only satisfied in a
specific area. Also, due to the presence of constant parameter $(\phi_{0})$ in
the higher orders derivatives, the (SYMI) and (OI) among all the models are
more compatible with all conjectures of the swampland program. These models can
provide a more significant amount of satisfaction with all of them. They can be
suitable and accurate inflation models for a more profound examination of
universe developments. We determined a particular region for these models is
compatible with (FRDSSC), (SWGC), and (SSWGC) simultaneously"
10491,"2.3 Model III: SYMI

We also brieﬂy explain this model, which you can see [1] for further study.","We will also challenge this model with two other conjectures of the swampland
program and describe the results in detail.","The action in
Jordan’s frame for this model is generally expressed in the following form according to the
non-minimally coupled gravity structure [42],

       SJ = d4x√−g − M 2 + Nc2ξΛ2(φ/φ0)2 R + LSY M             (24)
                                      2

                                  7
where

       LSY M = − Nc2 (ϕϕ†)−2/3∂µϕ∂µϕ† − 4αNc2 (ϕϕ†)2/3 ln ϕ ln ϕ†
                α                     9                  Λ3  Λ3

       ϕ     φ3                                                    (25)
       Λ3 = φ0

       φ0 = 3Nc 2 1/2Λ.",2022-08-27 22:20:21+00:00,Scalar Weak Gravity Conjecture in Super Yang-Mills Inflationary Model,astro-ph.CO,"['astro-ph.CO', 'gr-qc', 'hep-th']","[arxiv.Result.Author('Jafar Sadeghi'), arxiv.Result.Author('Mohammad Reza Alipour'), arxiv.Result.Author('Saeed Noori Gashti')]","In this article, we want to check four inflation models, such as composite
NJL inflation (NJLI), Glueball inflation(GI), super Yang-Mills inflation
(SYMI), and Orientifold inflation (OI), with two conjectures of the swampland
program: scalar weak gravity conjecture (SWGC) and strong scalar weak gravity
conjecture (SSWGC) since all these models violate the dS swampland
conjecture(DSC) but are compatible with further refining de Sitter swampland
conjecture (FRDSSC) through manual adjustment of free parameters of the
mentioned conjecture. We want to study the simultaneous compatibility of each
model with these two new conjectures. Despite being consistent with (FRDSSC),
we find that all models are not compatible with the other conjectures of the
Swampland program in all regions, and these conjectures are only satisfied in a
specific area. Also, due to the presence of constant parameter $(\phi_{0})$ in
the higher orders derivatives, the (SYMI) and (OI) among all the models are
more compatible with all conjectures of the swampland program. These models can
provide a more significant amount of satisfaction with all of them. They can be
suitable and accurate inflation models for a more profound examination of
universe developments. We determined a particular region for these models is
compatible with (FRDSSC), (SWGC), and (SSWGC) simultaneously"
10570,"log(1010As) and the baryon den-
                                                              sity do not suﬀer important changes from the standard
   We further study the four preferred models selected        values.","The spec-
                                                              tral index is reduced as well as the optical depth to the
    A. Cosmologies and Cosmological Parameters                epoch of reionization.","in the previous section by running MCMC chains with
the joint data set P18+BAO16+SN+R21.",2022-08-30 17:54:09+00:00,"Early versus Phantom Dark Energy, Self-Interacting, Extra, or Massive Neutrinos, Primordial Magnetic Fields, or a Curved Universe: An Exploration of Possible Solutions to the $H_0$ and $σ_8$ Problems",astro-ph.CO,"['astro-ph.CO', 'hep-ph']","[arxiv.Result.Author('Helena García Escudero'), arxiv.Result.Author('Jui-Lin Kuo'), arxiv.Result.Author('Ryan E. Keeley'), arxiv.Result.Author('Kevork N. Abazajian')]","In this paper we explore the existing tensions in the local cosmological
expansion rate, $H_0$, and amplitude of the clustering of large-scale structure
at $8\, h^{-1}\mathrm{Mpc}$, $\sigma_8$, as well as models that claim to
alleviate these tensions. We consider seven models: evolving dark energy
($w$CDM), extra radiation ($N_\mathrm{eff}$), massive neutrinos, curvature,
primordial magnetic fields (PMF), self-interacting neutrino models, and early
dark energy (EDE). We test these models against three data sets that span the
full range of measurable cosmological epochs, have significant precision, and
are well-tested against systematic effects: the Planck 2018 cosmic microwave
background data, the Sloan Digital Sky Survey baryon acoustic oscillation scale
measurements, and the Pantheon catalog of Type Ia supernovae. We use the recent
SH0ES $H_0$ measurement and several measures of $\sigma_8$ (and its related
parameter $S_8=\sigma_8\sqrt{\Omega_\mathrm{m}/0.3}$). We find that four models
are above the ""strong"" threshold in Bayesian model selection, $w$CDM,
$N_\mathrm{eff}$, PMF, and EDE. However, only EDE also relieves the $H_0$
tension in the full data sets to below 2$\sigma$. Contrarily, no model
alleviates the $S_8/\sigma_8$ tension in the full data set, nor does better
than $\Lambda$CDM in the combined case of both $H_0$ and $S_8/\sigma_8$
tensions."
10571,"We further study the four preferred models selected      We check that the value of θ∗ derived from the best-ﬁt
in the previous section by running MCMC chains with         value of parameters in Table III is consistent with P18.","However, we note that
                                                            since the redshift of CMB photon decoupling is changed
    A. Cosmologies and Cosmological Parameters              in PMF paradigm, θMC is no longer a good approxima-
                                                            tion to the actual angular scale of the sound horizon θ∗.",the joint dataset P18+BAO16+SN+R21.,2022-08-30 17:54:09+00:00,"Early or phantom dark energy, self-interacting, extra, or massive neutrinos, primordial magnetic fields, or a curved universe: An exploration of possible solutions to the $H_0$ and $σ_8$ problems",astro-ph.CO,"['astro-ph.CO', 'hep-ph']","[arxiv.Result.Author('Helena García Escudero'), arxiv.Result.Author('Jui-Lin Kuo'), arxiv.Result.Author('Ryan E. Keeley'), arxiv.Result.Author('Kevork N. Abazajian')]","In this paper we explore the existing tensions in the local cosmological
expansion rate, $H_0$, and amplitude of the clustering of large-scale structure
at $8\, h^{-1}\mathrm{Mpc}$, $\sigma_8$, as well as models that claim to
alleviate these tensions. We consider seven models: evolving dark energy
($w$CDM), extra radiation ($N_\mathrm{eff}$), massive neutrinos, curvature,
primordial magnetic fields (PMF), self-interacting neutrino models, and early
dark energy (EDE). We test these models against three data sets that span the
full range of measurable cosmological epochs, have significant precision, and
are well-tested against systematic effects: the Planck 2018 cosmic microwave
background data, the Sloan Digital Sky Survey baryon acoustic oscillation scale
measurements, and the Pantheon catalog of Type Ia supernovae. We use the recent
SH0ES $H_0$ measurement and several measures of $\sigma_8$ (and its related
parameter $S_8=\sigma_8\sqrt{\Omega_\mathrm{m}/0.3}$). We find that four models
are above the ""strong"" threshold in Bayesian model selection, $w$CDM,
$N_\mathrm{eff}$, PMF, and EDE. However, only EDE also relieves the $H_0$
tension in the full data sets to below 2$\sigma$. Contrarily, no model
alleviates the $S_8/\sigma_8$ tension in the full data set, nor does better
than $\Lambda$CDM in the combined case of both $H_0$ and $S_8/\sigma_8$
tensions."
10617,"At constant density, the compres-   jects requires further study.","Their role in the formation of compact ob-
exo-ergic processes).","sional heating vanishes, and we evolve the network for
a free-fall time at the virial density.",2022-08-31 18:48:29+00:00,The Minimum Mass of Compact Objects from Dissipative Dark Matter,astro-ph.CO,['astro-ph.CO'],"[arxiv.Result.Author('James Gurian'), arxiv.Result.Author('Michael Ryan'), arxiv.Result.Author('Sarah Schon'), arxiv.Result.Author('Donghui Jeong'), arxiv.Result.Author('Sarah Shandera')]","We study the minimum mass of dark compact objects formed in dissipative
dark-matter halos and show that the simple atomic-dark-matter model consistent
with all current observations can create low-mass fragments that can evolve
into compact objects forbidden by stellar astrophysics. We model the collapse
of the dark halo's dense core by tracing the thermo-chemical evolution of a
uniform-density volume element under two extreme assumptions for density
evolution: hydrostatic equilibrium and pressure-free collapse. We then compute
the opacity-limited minimum fragment mass from the minimum temperature achieved
in these calculations."
10682,2010) cleared the sample and retained 557 supernovae for further study.,"Following several principles, the authors (Amanullah et al.","We will also use the
observational material of these 557 stars without making any changes.",2022-09-01 15:47:27+00:00,The evolving absolute magnitude of type 1a supernovae and its critical impact on the cosmological parameters,astro-ph.CO,['astro-ph.CO'],"[arxiv.Result.Author('A. P. Mahtessian'), arxiv.Result.Author('G. S. Karapetian'), arxiv.Result.Author('M. A. Hovhannisyan'), arxiv.Result.Author('L. A. Mahtessian')]","In this work, a computer optimization model has been developed that allows
one to load the initial observation data of supernovae 1a into a table and,
simply, by searching for the best fit between observations and theory, obtain
the values of the parameters of cosmological models. Naturally, the initial
data are redshifts z and apparent magnitudes m at the maximum brightness of
supernovae. For better fit between theory and observation, Pearson's Chi2
(Chi-squared) goodness-of-fit test was used. The results are obtained for the
LCDM model and, for comparison, the model with a zero cosmological constant. In
order to improve the fit between observed data and theory, the optimization is
carried out assuming that the absolute magnitude of supernovae is not constant,
but evolves with time. It is assumed that the dependence of the absolute
magnitude on the redshift is linear: M=M(z=0)+ez, where e is the evolution
coefficient of the absolute magnitude of type 1a supernovae."
10850,"In this regard, the future
                                                                             Nancy Roman Space Telescope, with its wide ﬁeld of view, will
                                                                             provide a large number of NIR light-curves of SNe Ia at higher
                                                                             redshift, allowing a full NIR Hubble-Lemaître diagram of SN Ia
                                                                             up to redshifts of 2.5; and (iii) further study the NIR standardiza-
                                                                             tion of SNe Ia light-curves in order to reduce the scatter of their
                                                                             absolute peak magnitudes and therefore their distance estima-
                                                                             tion.","The largest diﬀerences in                the James Webb Space Telescope will naturally take over from
                                                                             the eﬀort made by the HST in obtaining NIR Cepheid imaging of
                                                                             more in number and also further galaxies to increase independent
                                                                             Cepheid-based distances of SN Ia hosts; (ii) increase the number
                                                                             of well-observed Hubble-ﬂow SNe Ia.","As suggested by our test in section 5.3, some improvement
                                                                             is possible by taking into account light-curve parameters, but
                                                                             deﬁnitely more work is needed to determine this more reliably;

Article number, page 14 of 20
Galbany, de Jaeger, Riess, et al.",2022-09-06 14:56:01+00:00,An updated measurement of the Hubble constant from near-infrared observations of Type Ia supernovae,astro-ph.CO,['astro-ph.CO'],"[arxiv.Result.Author('Lluís Galbany'), arxiv.Result.Author('Thomas de Jaeger'), arxiv.Result.Author('Adam Riess'), arxiv.Result.Author('Tomás E. Müller-Bravo'), arxiv.Result.Author('Suhail Dhawan'), arxiv.Result.Author('Kim Phan'), arxiv.Result.Author('Maximillian Stritzinger'), arxiv.Result.Author('Emir Karamehmetoglu'), arxiv.Result.Author('Bruno Leibundgut'), arxiv.Result.Author('Erik Peterson'), arxiv.Result.Author(""W. D'Arcy Kenworthy""), arxiv.Result.Author('Joel Johanson'), arxiv.Result.Author('Kate Maguire'), arxiv.Result.Author('Saurabh W. Jha')]","We present a measurement of the Hubble constant ($H_0$) using type Ia
supernova (SNe Ia) in the near-infrared (NIR) from the recently updated sample
of SNe Ia in nearby galaxies with distances measured via Cepheid
period-luminosity relations by the SHOES project. We collect public
near-infrared photometry of up to 19 calibrator SNe Ia and further 57 SNe Ia in
the Hubble flow ($z>0.01$), and directly measure their peak magnitudes in the
$J$ and $H$ band by Gaussian processes and spline interpolation. Calibrator
peak magnitudes together with Cepheid-based distances are used to estimate the
average absolute magnitude in each band, while Hubble-flow SNe are used to
constrain the zero-point intercept of the magnitude-redshift relation. Our
baseline result of $H_0$ is $72.3\pm1.4$ (stat) $\pm1.4$ (syst) km s$^{-1}$
Mpc$^{-1}$ in the $J$ band and $72.3\pm1.3$ (stat) $\pm1.4$ (syst) km s$^{-1}$
Mpc$^{-1}$ in the $H$ band, where the systematic uncertainties include the
standard deviation of up to 21 variations of the analysis, the 0.7\% distance
scale systematic from SHOES Cepheid anchors, a photometric zeropoint
systematic, and a cosmic variance systematic. Our final measurement represents
a measurement with a precision of 2.8\% in both bands. The variant with the
largest change in $H_0$ is when limiting the sample to SNe from CSP and CfA
programmes, noteworthy because these are the best calibrated, yielding
$H_0\sim75$ km s$^{-1}$ Mpc$^{-1}$ in both bands. We demonstrate stretch and
reddening corrections are still useful in the NIR to standardize SN Ia NIR peak
magnitudes. Based on our results, in order to improve the precision of the
$H_0$ measurement with SNe Ia in the NIR in the future, we would need to
increase the number of calibrator SNe Ia, be able to extend the
Hubble-Lema\^itre diagram to higher-z, and include standardization procedures
to help reducing the NIR intrinsic scatter."
