,further research line,further research prefix,further research suffix,publication date,title,primary category,categories,authors,abstract
2203,"Third, further research similar to that conducted here is needed to measure the
efficacy of the technological through analog approaches (e.g., posters in transit stations) [70].","Second, development of alternative
forms of outreach and service provision should be done in collaboration with sex industry workers
across the full spectrum of autonomy, in line with suggestions for community-driven technology
development [19].","Only
with this data can we effectively prioritize the strategies that are most effective and have the lowest
risk of harm.",2022-02-19 05:12:34+00:00,Ethics and Efficacy of Unsolicited Anti-Trafficking SMS Outreach,cs.CY,['cs.CY'],"[arxiv.Result.Author('Rasika Bhalerao'), arxiv.Result.Author('Nora McDonald'), arxiv.Result.Author('Hanna Barakat'), arxiv.Result.Author('Vaughn Hamilton'), arxiv.Result.Author('Damon McCoy'), arxiv.Result.Author('Elissa M. Redmiles')]","The sex industry exists on a continuum based on the degree of work autonomy
present in labor conditions: a high degree exists on one side of the continuum
where independent sex workers have a great deal of agency, while much less
autonomy exists on the other side, where sex is traded under conditions of
human trafficking. Organizations across North America perform outreach to sex
industry workers to offer assistance in the form of services (e.g., healthcare,
financial assistance, housing), prayer, and intervention. Increasingly,
technology is used to look for trafficking victims or facilitate the provision
of assistance or services, for example through scraping and parsing sex
industry workers' advertisements into a database of contact information that
can be used by outreach organizations. However, little is known about the
efficacy of anti-trafficking outreach technology, nor the potential risks of
using it to identify and contact the highly stigmatized and marginalized
population of those working in the sex industry.
  In this work, we investigate the use, context, benefits, and harms of an
anti-trafficking technology platform via qualitative interviews with multiple
stakeholders: the technology developers (n=6), organizations that use the
technology (n=17), and sex industry workers who have been contacted or wish to
be contacted (n=24). Our findings illustrate misalignment between developers,
users of the platform, and sex industry workers they are attempting to assist.
In their current state, anti-trafficking outreach tools such as the one we
investigate are ineffective and, at best, serve as a mechanism for spam and, at
worst, scale and exacerbate harm against the population they aim to serve. We
conclude with a discussion of best practices for technology-facilitated
outreach efforts to minimize risk or harm to sex industry workers while
efficiently providing needed services."
2334,"Unlike [12], which only shows real-time outages, the devel-                       Next, if an outage exists in the table for processed outages,
oped dashboard stores the captured data to create a com-                          but not anymore in the table for currently crawled outages, it
prehensive archive of outages, which is publicly available to                     is inserted into the historical outage table and removed from
facilitate further research.",outages and inserts them into the table for processed outages.,"On an interactive map, it shows                      the processed outage table.",2022-02-22 17:51:00+00:00,Outing Power Outages: Real-time and Predictive Socio-demographic Analytics for New York City,cs.CY,['cs.CY'],"[arxiv.Result.Author('Samuel Eckstrom'), arxiv.Result.Author('Graham Murphy'), arxiv.Result.Author('Eileen Ye'), arxiv.Result.Author('Samrat Acharya'), arxiv.Result.Author('Robert Mieth'), arxiv.Result.Author('Yury Dvorkin')]","Electrical outages continue to occur despite technological innovations and
improvements to electric power distribution infrastructure. In this paper, we
describe a tool that was designed to acquire and collect data on electric power
outages in New York City since July 2020. The electrical outages are then
displayed on a front-end application, which is publicly available. We use the
collected outage data to analyze these outages and their socio-economic impacts
on electricity vulnerable population groups. We determined that there was a
slightly negative linear relationship between income and number of outages.
Finally, a Markov Influence Graph was created to better understand the spatial
and temporal relationships between outages."
2502,"CPU runtimes for the Python-based portion of the process chain
differed starkly for both tracks, pointing to avenues for further research.","Formal
and informal documentation channels are highlighted to outline available resources for
flattening learning curves.","These results
demonstrate that the Python ecosystem offers local governments powerful tools, free of
vendor lock-in and licensing fees, to produce performant and consistently formatted
visualisations for both internal and public distribution.",2022-02-26 10:23:29+00:00,Python for Smarter Cities: Comparison of Python libraries for static and interactive visualisations of large vector data,cs.CY,['cs.CY'],"[arxiv.Result.Author('Gregor Herda'), arxiv.Result.Author('Robert McNabb')]","Local governments, as part of 'smart city' initiatives and to promote
interoperability, are increasingly incorporating open-source software into
their data management, analysis, and visualisation workflows. Python, with its
concise and natural syntax, presents a low barrier to entry for municipal staff
without computer science backgrounds. However, with regard to geospatial
visualisations in particular, the range of available Python libraries has
diversified to such an extent that identifying candidate libraries for specific
use cases is a challenging undertaking. This study therefore assesses
prominent, actively-developed visualisation libraries in the Python ecosystem
with respect to their suitability for producing visualisations of large vector
datasets. A simple visualisation task common in urban development is used to
produce near-identical thematic maps across static and an interactive 'tracks'
of comparison. All short-listed libraries were able to generate the sample map
products for both a small and larger dataset. Code complexity differed more
strongly for interactive visualisations. Formal and informal documentation
channels are highlighted to outline available resources for flattening learning
curves. CPU runtimes for the Python-based portion of the process chain differed
starkly for both tracks, pointing to avenues for further research. These
results demonstrate that the Python ecosystem offers local governments powerful
tools, free of vendor lock-in and licensing fees, to produce performant and
consistently formatted visualisations for both internal and public
distribution."
2512,"The selected user profiles and the granted rights, on the other hand,
are only examples that are up for discussion and which need to be specified and challenged in further research.","Here, the attributed-based access control shall be emphasized because this represents non-rigid boundary
conditions in preparation for future regulations.","However, the data integration scenario distinguishes four levels of action layering data storage, data harmonization,
interfaces and the data input/data output layer, which harmonizes the application scenario and the digital
ecosystem.",2022-02-26 19:45:31+00:00,Unique Device Identification Based Linkage of Hierarchically Accessible Data Domains in Prospective Hospital Data Ecosystems,cs.CY,['cs.CY'],"[arxiv.Result.Author('Karol Kozak'), arxiv.Result.Author('André Seidel'), arxiv.Result.Author('Nataliia Matvieieva'), arxiv.Result.Author('Constanze Neupetsch'), arxiv.Result.Author('Uwe Teicher'), arxiv.Result.Author('Gordon Lemme'), arxiv.Result.Author('Anas Ben Achour'), arxiv.Result.Author('Martin Barth'), arxiv.Result.Author('Steffen Ihlenfeldt'), arxiv.Result.Author('Welf-Guntram Drossel')]","The electronic health record (EHR) targets the systematized collection of
patient-specific electronically-stored health data. Currently the EHR is an
evolving concept driven by ongoing technical developments and open or unclear
legal issues concerning used medical technologies, data integration from other
domains and unclear access roles. This paper addresses cross-domain data
integration, data fusion and access control using the specific example of a
Unique Device Identification (UDI) expanded hip implant. In fact, the
integration of technical focus data into the hospital information system (HIS)
is discussed and presented based on surgically relevant information. Moreover,
the acquisition of social focus databased on mHealth is approached, which also
covers data integration and networking with therapeutic intervention or acute
diagnostics data. Data integration from heterogeneous domains is covered while
using a data ecosystem with hierarchical access based on a shell embedded role
model, which includes staggered access scenarios."
2669,"Understanding social commerce: A systematic
                                                                                  literature review and directions for further research.",2016.,"International Journal of
                                                                                  Information Management 36, 6 (2016), 1075–1088.",2022-03-02 04:25:52+00:00,Beyond Virtual Bazaar: How Social Commerce Promotes Inclusivity for the Traditionally Underserved Community in Chinese Developing Regions,cs.CY,"['cs.CY', 'cs.HC']","[arxiv.Result.Author('Zhilong Chen'), arxiv.Result.Author('Hancheng Cao'), arxiv.Result.Author('Xiaochong Lan'), arxiv.Result.Author('Zhicong Lu'), arxiv.Result.Author('Yong Li')]","The disadvantaged population is often underserved and marginalized in
technology engagement: prior works show they are generally more reluctant and
experience more barriers in adopting and engaging with mainstream technology.
Here, we contribute to the HCI4D and ICTD literature through a novel ""counter""
case study on Chinese social commerce (e.g., Pinduoduo), which 1) first
prospers among the traditionally underserved community from developing regions
ahead of the more technologically advantaged communities, and 2) has been
heavily engaged by this community. Through 12 in-depth interviews with social
commerce users from the traditionally underserved community in Chinese
developing regions, we demonstrate how social commerce, acting as a ""counter"",
brings online the traditional offline socioeconomic lives the community has
lived for ages, fits into the community's social, cultural, and economic
context, and thus effectively promotes technology inclusivity. Our work
provides novel insights and implications for building inclusive technology for
the ""next billion"" population."
2943,"3.2 Health Information Disorder Detection

   Finally, we also advocate further research on the design        Due to the spread of online information disorder, a second as-
and evaluation of alternative interaction protocols [Cabitza et    pect that needs to be addressed is to identify different forms
al., 2021] stipulating how human decision makers could use,
and in some case even collaborate, with AI-based decision
support systems, in order to mitigate the risk of having cog-
nitive biases, like automation bias, automation complacency,
AI over-reliance and its opposite, the prejudice against the
machine [Cabitza, 2019], which undermine the effectiveness
of communication pollution in different media formats, in-        5 Organized Research Initiatives
cluding in the health domain; in this context several solu-
tions have been proposed in recent years [Cui et al., 2020;          • CLEFeHealth 2021 – Task 2: Consumer Health Search.","tiple right and complementary interpretations are possible to
coexist for a single case [Basile et al., 2021].","Dharawat et al., 2020; Hou et al., 2019; Upadhyay et al.,               Evaluation Lab held in conjunction with CLEF 2021:
2021; Zhao et al., 2021].",2022-02-19 14:48:22+00:00,Responsible AI in Healthcare,cs.CY,"['cs.CY', 'cs.AI', 'cs.IR', 'cs.LG']","[arxiv.Result.Author('Federico Cabitza'), arxiv.Result.Author('Davide Ciucci'), arxiv.Result.Author('Gabriella Pasi'), arxiv.Result.Author('Marco Viviani')]","This article discusses open problems, implemented solutions, and future
research in the area of responsible AI in healthcare. In particular, we
illustrate two main research themes related to the work of two laboratories
within the Department of Informatics, Systems, and Communication at the
University of Milano-Bicocca. The problems addressed concern, in particular,
{uncertainty in medical data and machine advice}, and the problem of online
health information disorder."
2955,"Finally, challenges and future directions are provided for    of different policies of incentives, Alberto L opez Santiago,
                                        further research.","Focusing on the impacts
                                        works.",et al.,2022-01-19 07:46:32+00:00,All one needs to know about shared micromobility simulation: a complete survey,cs.CY,"['cs.CY', 'physics.soc-ph']","[arxiv.Result.Author('Yixuan Liu'), arxiv.Result.Author('Yuhan Tang'), arxiv.Result.Author('Yati Liu')]","As the shared micromobility becomes a part of our daily life and environment,
we expect the number of low-speed modes for first-and-last mile trips to grow
rapidly. The shared micomobility is expected to serve billions of humans,
bringing us considerable advantages. With this growth, shared micromobility
simulation such as docked stations based shared bikes, dockless shared bikes
and e-scooters, are regarded as promising solutions to deal with a large number
of first-and-last mile trips. In this paper, we first provide a comprehensive
overview of shared micromobility simulation and its related validation metrics.
Next, we classify the research topics of shared micromobility simulation,
summarize, and classify the existing works. Finally, challenges and future
directions are provided for further research."
2956,"Recommendation – It is recommended to have further research on how critical and auto
ticket affects the mental health of resources and its direct impact to businesses.","Researchers provided solutions such as knowledge Management and Dashboard to
document all the solutions encountered and monitor the SLA’s and incoming tickets.","It is also
recommended to have a study on how knowledge management work and help resources
to identify correct workaround despite of having a lot of troubleshooting guides.",2022-02-13 05:06:47+00:00,Impact of Critical and Auto Ticket: Analysis for Management and Workers Productivity in using a Ticketing System,cs.CY,['cs.CY'],"[arxiv.Result.Author('Kent Darryl Aglibar'), arxiv.Result.Author('Nelson Rodelas')]","Ticketing system is common in Technical Support in Information Technology
Industry. At present time, even management is using it. It serves as a way to
connect the company and the client, end to end. The researchers conducted
research where it aims to come up with a solution on how we are going to
prevent, troubleshoot, and give insight for possible business impact to those
everyday issues. Researchers used data collection to gather data from
management, support workers, and Service Now open-source ticketing system to
visualize the ticketing system application. Critical ticket gives a lot of
pressure to the resources as they needed to resolve the incident in accordance
with the service level agreement. Having knowledge management helps resource to
find references on how to deal with the incident. It helps them to execute
workaround quickly and think of a way on how to resolve it permanently. It is
concluded that critical and auto ticket affects the everyday productivity of
the worker especially teaching new employees despite ongoing critical
incidents. Researchers provided solutions such as knowledge Management and
Dashboard to document all the solutions encountered and monitor the SLA and
incoming tickets. It is recommended to have further research on how critical
and auto ticket affects the mental health of resources and its direct impact to
businesses. It is also recommended to have a study on how knowledge management
work and help resources to identify correct workaround despite of having a lot
of troubleshooting guides."
2957,"Lastly, for further study, researchers will survey other IT
companies who are using or not a Ticketing System.","This is helpful especially for both live production and a
management-related team that supports manufacturing companies and real-time
application consumer use.","1002
REFERENCES

Al-Hawari, F., &amp; Barham, H. (2019).",2022-02-13 05:06:47+00:00,Impact of Critical and Auto Ticket: Analysis for Management and Workers Productivity in using a Ticketing System,cs.CY,['cs.CY'],"[arxiv.Result.Author('Kent Darryl Aglibar'), arxiv.Result.Author('Nelson Rodelas')]","Ticketing system is common in Technical Support in Information Technology
Industry. At present time, even management is using it. It serves as a way to
connect the company and the client, end to end. The researchers conducted
research where it aims to come up with a solution on how we are going to
prevent, troubleshoot, and give insight for possible business impact to those
everyday issues. Researchers used data collection to gather data from
management, support workers, and Service Now open-source ticketing system to
visualize the ticketing system application. Critical ticket gives a lot of
pressure to the resources as they needed to resolve the incident in accordance
with the service level agreement. Having knowledge management helps resource to
find references on how to deal with the incident. It helps them to execute
workaround quickly and think of a way on how to resolve it permanently. It is
concluded that critical and auto ticket affects the everyday productivity of
the worker especially teaching new employees despite ongoing critical
incidents. Researchers provided solutions such as knowledge Management and
Dashboard to document all the solutions encountered and monitor the SLA and
incoming tickets. It is recommended to have further research on how critical
and auto ticket affects the mental health of resources and its direct impact to
businesses. It is also recommended to have a study on how knowledge management
work and help resources to identify correct workaround despite of having a lot
of troubleshooting guides."
2958,"Others include supporting the development of AI literacy21 in the
social sciences and humanities so that the next generation of students, schol-
ars, and practitioners are well versed in the technical and social aspects of

   20using quantitative, qualitative, and/or mixed methodologies
   21which itself requires further research, see e.g.","Some of the required actions are
traditional academic endeavours, such as writing articles, creating discussion
forums, writing blogs, holding conferences (and conferences within confer-
ences), teaching about needs in courses, and of course conducting rigorous
research.","[59] for an initial attempt
                          Springer Nature 2021 LATEX template

                                                  Needs and Artiﬁcial Intelligence 21

conversations.",2022-02-18 15:16:22+00:00,Needs and Artificial Intelligence,cs.CY,"['cs.CY', 'cs.AI']","[arxiv.Result.Author('Soheil Human'), arxiv.Result.Author('Ryan Watkins')]","Throughout their history, homo sapiens have used technologies to better
satisfy their needs. The relation between needs and technology is so
fundamental that the US National Research Council defined the distinguishing
characteristic of technology as its goal ""to make modifications in the world to
meet human needs"". Artificial intelligence (AI) is one of the most promising
emerging technologies of our time. Similar to other technologies, AI is
expected ""to meet [human] needs"". In this article, we reflect on the
relationship between needs and AI, and call for the realisation of needs-aware
AI systems. We argue that re-thinking needs for, through, and by AI can be a
very useful means towards the development of realistic approaches for
Sustainable, Human-centric, Accountable, Lawful, and Ethical (HALE) AI systems.
We discuss some of the most critical gaps, barriers, enablers, and drivers of
co-creating future AI-based socio-technical systems in which [human] needs are
well considered and met. Finally, we provide an overview of potential threats
and HALE considerations that should be carefully taken into account, and call
for joint, immediate, and interdisciplinary efforts and collaborations."
2980,"Regardless, an overhaul at the
global level overtime is needed to strengthen data privacy              The dataset and the source code for the project will be
                                                                     made openly available for further research in this area.",between these variables.,"ACKNOWLEDGMENT

                                                                               While he was unable to be included in this paper's
                                                                     authorship due to his current research obligations and
                                                                     guidelines, we, the authors, would like to acknowledge the
                                                                     help, guidance, and support received from Mr. FirstName
                                                                     LastName.",2022-02-27 21:22:48+00:00,Associating eHealth Policies and National Data Privacy Regulations,cs.CY,"['cs.CY', 'cs.CR']","[arxiv.Result.Author('Saurav K. Aryal'), arxiv.Result.Author('Peter A. Keiller')]","As electronic data becomes the lifeline of modern society, privacy concerns
increase. These concerns are reflected by the European Union's enactment of the
General Data Protection Regulation (GDPR), one of the most comprehensive and
robust privacy regulations globally. This project aims to evaluate and
highlight associations between eHealth systems' policies and personal data
privacy regulations. Using bias-corrected Cramer's V and Thiel's U tests, we
found weak and zero associations between e-health systems' rules and
protections for data privacy. A simple decision tree model is trained, which
validates the association scores obtained"
3025,"First, further research is required for establishing specific and full-fledged guidelines or automated tools to
evaluate individual criteria proposed in the framework.","The system accountability benchmark paves the way for three major lines of future work that are also sequentially
linked.","The second line of work would be towards developing mature
auditing procedures that elaborate on what to audit, when to audit, who audits, and how audits must be conducted.",2022-03-01 18:56:45+00:00,System Cards for AI-Based Decision-Making for Public Policy,cs.CY,"['cs.CY', 'cs.AI']","[arxiv.Result.Author('Furkan Gursoy'), arxiv.Result.Author('Ioannis A. Kakadiaris')]","Decisions in public policy are increasingly being made or assisted by
automated decision-making algorithms. Many of these algorithms process personal
data for tasks such as predicting recidivism, assisting welfare decisions,
identifying individuals using face recognition, and more. While potentially
improving efficiency and effectiveness, such algorithms are not inherently free
from issues such as bias, opaqueness, lack of explainability, maleficence, and
the like. Given that the outcomes of these algorithms have significant impacts
on individuals and society and are open to analysis and contestation after
deployment, such issues must be accounted for before deployment. Formal audits
are a way towards ensuring algorithms that are used in public policy meet the
appropriate accountability standards. This work, based on an extensive analysis
of the literature, proposes a unifying framework for system accountability
benchmark for formal audits of artificial intelligence-based decision-aiding
systems in public policy as well as system cards that serve as scorecards
presenting the outcomes of such audits. The benchmark consists of 50 criteria
organized within a four by four matrix consisting of the dimensions of (i)
data, (ii) model, (iii) code, (iv) system and (a) development, (b) assessment,
(c) mitigation, (d) assurance. Each criterion is described and discussed
alongside a suggested measurement scale indicating whether the evaluations are
to be performed by humans or computers and whether the evaluation outcomes are
binary or on an ordinal scale. The proposed system accountability benchmark
reflects the state-of-the-art developments for accountable systems, serves as a
checklist for future algorithm audits, and paves the way for sequential work as
future research."
