,further research line,further research prefix,further research suffix,publication date,title,primary category,categories,authors,abstract
11077,"Since some philosophical theories such as longtermism say that exis-
       tential risk reduction has extremely high value, further research would be
       valuable.","Although previous work and this
       report arrive at some useful conclusions, there is still substantial uncer-

                                                  16
       tainty about existential risk and which actions would be useful to reduce
       it.","Also, until relatively recently research on existential risk and
       AI strategy has been neglected.",2022-08-30 15:49:11+00:00,How Do AI Timelines Affect Existential Risk?,cs.CY,['cs.CY'],[arxiv.Result.Author('Stephen McAleese')],"Superhuman artificial general intelligence could be created this century and
would likely be a significant source of existential risk. Delaying the creation
of superintelligent AI (ASI) could decrease total existential risk by
increasing the amount of time humanity has to work on the AI alignment problem.
  However, since ASI could reduce most risks, delaying the creation of ASI
could also increase other existential risks, especially from advanced future
technologies such as synthetic biology and molecular nanotechnology.
  If AI existential risk is high relative to the sum of other existential risk,
delaying the creation of ASI will tend to decrease total existential risk and
vice-versa.
  Other factors such as war and a hardware overhang could increase AI risk and
cognitive enhancement could decrease AI risk. To reduce total existential risk,
humanity should take robustly positive actions such as working on existential
risk analysis, AI governance and safety, and reducing all sources of
existential risk by promoting differential technological development."
11078,"Beyond the prevalent assess-
ment that existing legislations are not appropriate for the wide range of AI applications, the
results show a partly fragmented, heterogeneous or unspecified field of ideas, and uncovers
uncertainty and ambiguities which should serve as a focal point both for further research and
political negotiations.","It provides an overarching regulatory picture by synthesizing the proposals and
assessments stemming from literature across different disciplines.","Our review did not aim to develop an ideal regulatory model including
responsible actors, processes, and instruments.",2022-09-07 11:29:30+00:00,"Tackling problems, harvesting benefits -- A systematic review of the regulatory debate around AI",cs.CY,"['cs.CY', 'cs.AI']","[arxiv.Result.Author('Anja Folberth'), arxiv.Result.Author('Jutta Jahnel'), arxiv.Result.Author('Jascha Bareis'), arxiv.Result.Author('Carsten Orwat'), arxiv.Result.Author('Christian Wadephul')]","How to integrate an emerging and all-pervasive technology such as AI into the
structures and operations of our society is a question of contemporary
politics, science and public debate. It has produced a considerable amount of
international academic literature from different disciplines. This article
analyzes the academic debate around the regulation of artificial intelligence
(AI). The systematic review comprises a sample of 73 peer-reviewed journal
articles published between January 1st, 2016, and December 31st, 2020. The
analysis concentrates on societal risks and harms, questions of regulatory
responsibility, and possible adequate policy frameworks, including risk-based
and principle-based approaches. The main interests are proposed regulatory
approaches and instruments. Various forms of interventions such as bans,
approvals, standard-setting, and disclosure are presented. The assessments of
the included papers indicate the complexity of the field, which shows its
prematurity and the remaining lack of clarity. By presenting a structured
analysis of the academic debate, we contribute both empirically and
conceptually to a better understanding of the nexus of AI and regulation and
the underlying normative decisions. A comparison of the scientific proposals
with the proposed European AI regulation illustrates the specific approach of
the regulation, its strengths and weaknesses."
11079,"This stock of knowledge is a viable basis for further research and public discussions that
are necessary in many respects, in particular for the evaluation of the emerging regulatory
frameworks with respect to effectivity, legitimacy or coherence.","Instead, we have shown that there is already a
rich source of scientific knowledge which can be transferred and adopted for regulatory pur-
poses.","Furthermore, the emergence
of new AI applications with specific risks requires continuous adaptations of the regulatory
frameworks.",2022-09-07 11:29:30+00:00,"Tackling problems, harvesting benefits -- A systematic review of the regulatory debate around AI",cs.CY,"['cs.CY', 'cs.AI']","[arxiv.Result.Author('Anja Folberth'), arxiv.Result.Author('Jutta Jahnel'), arxiv.Result.Author('Jascha Bareis'), arxiv.Result.Author('Carsten Orwat'), arxiv.Result.Author('Christian Wadephul')]","How to integrate an emerging and all-pervasive technology such as AI into the
structures and operations of our society is a question of contemporary
politics, science and public debate. It has produced a considerable amount of
international academic literature from different disciplines. This article
analyzes the academic debate around the regulation of artificial intelligence
(AI). The systematic review comprises a sample of 73 peer-reviewed journal
articles published between January 1st, 2016, and December 31st, 2020. The
analysis concentrates on societal risks and harms, questions of regulatory
responsibility, and possible adequate policy frameworks, including risk-based
and principle-based approaches. The main interests are proposed regulatory
approaches and instruments. Various forms of interventions such as bans,
approvals, standard-setting, and disclosure are presented. The assessments of
the included papers indicate the complexity of the field, which shows its
prematurity and the remaining lack of clarity. By presenting a structured
analysis of the academic debate, we contribute both empirically and
conceptually to a better understanding of the nexus of AI and regulation and
the underlying normative decisions. A comparison of the scientific proposals
with the proposed European AI regulation illustrates the specific approach of
the regulation, its strengths and weaknesses."
11080,"To stimulate
further research, the data and code are available publicly at:      [6] Yanjie Fu, Hui Xiong, Yong Ge, Zijun Yao, Yu Zheng, and Zhi-Hua
https://github.com/IndigoPurple/PATE.","Journal of Property
prediction accuracy and also enhance performance by de-                  Valuation and Investment, 1998.
signing complex variants of existing models.",While we aim to use                Zhou.,2022-08-29 12:31:10+00:00,"PATE: Property, Amenities, Traffic and Emotions Coming Together for Real Estate Price Prediction",cs.CY,['cs.CY'],"[arxiv.Result.Author('Yaping Zhao'), arxiv.Result.Author('Ramgopal Ravi'), arxiv.Result.Author('Shuhui Shi'), arxiv.Result.Author('Zhongrui Wang'), arxiv.Result.Author('Edmund Y. Lam'), arxiv.Result.Author('Jichang Zhao')]","Real estate prices have a significant impact on individuals, families,
businesses, and governments. The general objective of real estate price
prediction is to identify and exploit socioeconomic patterns arising from real
estate transactions over multiple aspects, ranging from the property itself to
other contributing factors. However, price prediction is a challenging
multidimensional problem that involves estimating many characteristics beyond
the property itself. In this paper, we use multiple sources of data to evaluate
the economic contribution of different socioeconomic characteristics such as
surrounding amenities, traffic conditions and social emotions. Our experiments
were conducted on 28,550 houses in Beijing, China and we rank each
characteristic by its importance. Since the use of multi-source information
improves the accuracy of predictions, the aforementioned characteristics can be
an invaluable resource to assess the economic and social value of real estate.
Code and data are available at: https://github.com/IndigoPurple/PATE"
11081,"To stimulate
further research, the data and code are available publicly at:      [6] Yanjie Fu, Hui Xiong, Yong Ge, Zijun Yao, Yu Zheng, and Zhi-Hua
https://github.com/IndigoPurple/PATE.","Journal of Property
prediction accuracy and also enhance performance by de-                  Valuation and Investment, 1998.
signing complex variants of existing models.",While we aim to use                Zhou.,2022-08-29 12:31:10+00:00,"PATE: Property, Amenities, Traffic and Emotions Coming Together for Real Estate Price Prediction",cs.CY,['cs.CY'],"[arxiv.Result.Author('Yaping Zhao'), arxiv.Result.Author('Ramgopal Ravi'), arxiv.Result.Author('Shuhui Shi'), arxiv.Result.Author('Zhongrui Wang'), arxiv.Result.Author('Edmund Y. Lam'), arxiv.Result.Author('Jichang Zhao')]","Real estate prices have a significant impact on individuals, families,
businesses, and governments. The general objective of real estate price
prediction is to identify and exploit socioeconomic patterns arising from real
estate transactions over multiple aspects, ranging from the property itself to
other contributing factors. However, price prediction is a challenging
multidimensional problem that involves estimating many characteristics beyond
the property itself. In this paper, we use multiple sources of data to evaluate
the economic contribution of different socioeconomic characteristics such as
surrounding amenities, traffic conditions and social emotions. Our experiments
were conducted on 28,550 houses in Beijing, China and we rank each
characteristic by its importance. Since the use of multi-source information
improves the accuracy of predictions, the aforementioned characteristics can be
an invaluable resource to assess the economic and social value of real estate.
Code and data are available at: https://github.com/IndigoPurple/PATE"
11270,"The problem of measurement of impact and a general monitoring, evaluation and learning
(MEL) framework is generally diﬃcult, so also points to areas for further research to eﬀectively make participatory
methods part of regular practice [35].","Investing in such types of participation may appear
wasteful when outcomes are measured using blunt instruments such as cost-beneﬁt analysis, and it could instead be
the limitations of the metrics we use to evaluate participatory approaches that are an obstacle to the eﬀective use of
participatory approaches.",Expertise and Incentives.,2022-09-15 19:20:13+00:00,Power to the People? Opportunities and Challenges for Participatory AI,cs.CY,['cs.CY'],"[arxiv.Result.Author('Abeba Birhane'), arxiv.Result.Author('William Isaac'), arxiv.Result.Author('Vinodkumar Prabhakaran'), arxiv.Result.Author('Mark Díaz'), arxiv.Result.Author('Madeleine Clare Elish'), arxiv.Result.Author('Iason Gabriel'), arxiv.Result.Author('Shakir Mohamed')]","Participatory approaches to artificial intelligence (AI) and machine learning
(ML) are gaining momentum: the increased attention comes partly with the view
that participation opens the gateway to an inclusive, equitable, robust,
responsible and trustworthy AI.Among other benefits, participatory approaches
are essential to understanding and adequately representing the needs, desires
and perspectives of historically marginalized communities. However, there
currently exists lack of clarity on what meaningful participation entails and
what it is expected to do. In this paper we first review participatory
approaches as situated in historical contexts as well as participatory methods
and practices within the AI and ML pipeline. We then introduce three case
studies in participatory AI.Participation holds the potential for beneficial,
emancipatory and empowering technology design, development and deployment while
also being at risk for concerns such as cooptation and conflation with other
activities. We lay out these limitations and concerns and argue that as
participatory AI/ML becomes in vogue, a contextual and nuanced understanding of
the term as well as consideration of who the primary beneficiaries of
participatory activities ought to be constitute crucial factors to realizing
the benefits and opportunities that participation brings."
11508,"This is an exciting development
in the industry and one that warrants further research in due course.","Applying the same
approach to venture capital firms as they do to startups, Founder Institute are now “working
to launch 1,000 new venture capital firms over the next five years to support innovative
companies worldwide that are working to make an impact”.","References

Agnew, H. (2022, April 13).",2022-09-13 01:17:39+00:00,Sustainable Venture Capital,cs.CY,"['cs.CY', 'econ.GN', 'q-fin.EC', 'K.1; K.4.1; K.5.2']",[arxiv.Result.Author('Sam Johnston')],"Sustainability initiatives are set to benefit greatly from the growing
involvement of venture capital, in the same way that other technological
endeavours have been enabled and accelerated in the post-war period. With the
spoils increasingly being shared between shareholders and other stakeholders,
this requires a more nuanced view than the finance-first methodologies deployed
to date. Indeed, it is possible for a venture-backed sustainability startup to
deliver outstanding results to society in general without returning a cent to
investors, though the most promising outcomes deliver profit with purpose,
satisfying all stakeholders in ways that make existing 'extractive' venture
capital seem hollow.
  To explore this nascent area, a review of related research was conducted and
social entrepreneurs & investors interviewed to construct a questionnaire
assessing the interests and intentions of current & future ecosystem
participants. Analysis of 114 responses received via several sampling methods
revealed statistically significant relationships between investing preferences
and genders, generations, sophistication, and other variables, all the way down
to the level of individual UN Sustainable Development Goals (SDGs)."
