,further research line,further research prefix,further research suffix,publication date,title,primary category,categories,authors,abstract
11932,"The purpose of this paper is to further study of the
                                                      Mitsch order on modules by investigating basic properties via endomorphism
                                                      rings.","The Mitsch order is already known as a natural partial order for
                                                      semigroups and rings.","And so this study also contribute to the results related to the orders
                                                      on rings.",2022-10-02 08:15:24+00:00,The Natural partial order on modules,math.RA,"['math.RA', '06A06, 06F25, 06F99, 16B99']","[arxiv.Result.Author('Tugba Pakel'), arxiv.Result.Author('Tugce Pekacar Calci'), arxiv.Result.Author('Sait Halicioglu'), arxiv.Result.Author('Abdullah Harmanci'), arxiv.Result.Author('Burcu Ungor')]","The Mitsch order is already known as a natural partial order for semigroups
and rings. The purpose of this paper is to further study of the Mitsch order on
modules by investigating basic properties via endomorphism rings. And so this
study also contribute to the results related to the orders on rings. As a
module theoretic analog of the Mitsch order, we show that this order is a
partial order on arbitrary modules. Among others, lattice properties of the
Mitsch order and the relations between the Mitsch order and the other
well-known orders, such as, the minus order, the Jones order, the direct sum
order and the space pre-order on modules are studied. In particular, we prove
that the minus order is the Mitsch order and we supply an example to show that
the converse does not hold in general."
11939,"16  JUN ZHAO AND BO HOU

                                                 References

 [1] C. Bai, A further study on non-abelian phase spaces: left-symmetric algebraic approach and related geome-
      try.","The data that support the ﬁndings of this study are available from the corre-
sponding author upon reasonable request.",Rev.,2022-10-02 09:12:39+00:00,The cohomology of left-symmetric conformal algebra and its applications,math.RA,['math.RA'],"[arxiv.Result.Author('Jun Zhao'), arxiv.Result.Author('Bo Hou')]","In this paper, we develop a cohomology theory of a left-symmetric conformal
algebra and study its some applications. We define the cohomology of a
left-symmetric conformal algebra, and then give an isomorphism between the
cohomology spaces of the left-symmetric conformal algebra and its sub-adjacent
Lie conformal algebra. As applications of the cohomology theory, we study
linear deformations, formal $1$-parameter deformations, $T^*$-extensions of a
left-symmetric conformal algebra respectively and obtain some properties."
11940,"16  JUN ZHAO AND BO HOU

                                                 References

 [1] C. Bai, A further study on non-abelian phase spaces: left-symmetric algebraic approach and related geome-
      try.","The data that support the ﬁndings of this study are available from the corre-
sponding author upon reasonable request.",Rev.,2022-10-02 09:12:39+00:00,The cohomology of left-symmetric conformal algebra and its applications,math.RA,['math.RA'],"[arxiv.Result.Author('Jun Zhao'), arxiv.Result.Author('Bo Hou')]","In this paper, we develop a cohomology theory of a left-symmetric conformal
algebra and study its some applications. We define the cohomology of a
left-symmetric conformal algebra, and then give an isomorphism between the
cohomology spaces of the left-symmetric conformal algebra and its sub-adjacent
Lie conformal algebra. As applications of the cohomology theory, we study
linear deformations, formal $1$-parameter deformations, $T^*$-extensions of a
left-symmetric conformal algebra respectively and obtain some properties."
12304,"In 2022, further study in the context of vector
                                          spaces was carried by Krishna and Johnson [26].","In 2021, by identifying essential mechanisms of dilation theory, Bhat, De and Rakshit [8] obtained sur-
                                          prising results in the set theory context and vector spaces.","We note that another vector space variant is also studied
                                          by Han, Larson, Liu and Liu [23].",2022-09-27 14:00:05+00:00,"Indefinite Halmos, Egervary and Sz.-Nagy Dilations",math.RA,"['math.RA', 'math.AC', 'math.OA', '47A20, 16D10, 46C20']",[arxiv.Result.Author('K. Mahesh Krishna')],"Let $\mathcal{M}$ be an indefinite inner product module over a *-ring of
characteristic 2. We show that every self-adjoint operator on $\mathcal{M}$
admits Halmos, Egervary and Sz.-Nagy dilations."
13400,[31] had a further study the properties of even-order tensors with Einstein product.,Ji et al.,"The notion
of the Drazin inverse of a square matrix to an even-order square tensor were extended.",2022-11-05 07:46:08+00:00,The generalized inverses of the quaternion tensor via the T-product,math.RA,['math.RA'],"[arxiv.Result.Author('Hongwei Jin'), arxiv.Result.Author('Peifeng Zhou'), arxiv.Result.Author('Hongjie Jiang'), arxiv.Result.Author('Xiaoji Liu')]","In this article, specific definitions of the Moore-Penrose inverse, Drazin
inverse of the quaternion tensor and the inverse along two quaternion tensors
are introduced under the T-product. Some characterizations, representations and
properties of the defined inverses are investigated. Moreover, algorithms are
established for computing the Moore-Penrose inverse, Drazin inverse of the
quaternion tensor and the inverse along two quaternion tensors, respectively."
13401,[14] had a further study on the generalized inverses of tensors.,Behera et al.,"Several characterizations of
                                         generalized inverses of tensors are provided.",2022-11-05 07:53:00+00:00,The generalized inverses of tensors via the C-Product,math.RA,['math.RA'],"[arxiv.Result.Author('Hongwei Jin'), arxiv.Result.Author('Shumin Xu'), arxiv.Result.Author('Hongjie Jiang'), arxiv.Result.Author('Xiaoji Liu')]","This paper studies the issues about the generalized inverses of tensors under
the C-Product. The aim of this paper is threefold. Firstly, this paper present
the definition of the Moore-Penrose inverse, Drazin inverse of tensors under
the C-Product. Moreover, the inverse along a tensor is also introduced.
Secondly, this paper gives some other expressions of the generalized inverses
of tensors by using several decomposition forms of tensors. Finally, the
algorithms for the Moore-Penrose inverse, Drazin inverse of tensors and the
inverse along a tensor are established."
13423,"In this paper we
                                                   give a further study of the notion of a strongly π-∗-regular ring, which is the
                                                   ∗-version of strongly π-regular rings and which was originally introduced by
                                                   Cui-Wang in J. Korean Math.","Recall that a ring R is called strongly π-regular if, for every a ∈ R,
                                                   there is a positive integer n such that an ∈ an+1R ∩ Ran+1.",Soc.,2022-11-06 23:11:46+00:00,On strongly pi-regular rings with involution,math.RA,"['math.RA', '16E50, 16W10']","[arxiv.Result.Author('Jian Cui'), arxiv.Result.Author('Peter Danchev')]","Recall that a ring R is called strongly pi-regular if, for every a in R,
there is a positive integer n such that a^n belongs to the intersection of
a^{n+1}R and Ra^{n+1}. In this paper we give a further study of the notion of a
strongly pi-star-regular ring, which is the star-version of strongly pi-regular
rings and which was originally introduced by Cui-Wang in J. Korean Math. Soc.
(2015). We also establish various properties of these rings and give several
new characterizations in terms of (strong) pi-regularity and involution. Our
results also considerably extend recent ones in the subject due to Cui-Yin in
Algebra Colloq. (2018) proved for pi-star-regular rings and due to Cui-Danchev
in J. Algebra Appl. (2020) proved for star-periodic rings."
13595,"Exploratory results show that the situation splits into two cases depending
on whether the parameter p is zero or not, leading to potential further study.","In the case d = 2 appears a new family of Lie algebras
indexed when char k = 2 by a couple of scalars (p, q) ∈ k × k× such that
p2 − 4q is not a square in k and whose Lie brackets on a basis {x, y, z} are
given by

                     [x, y] = −qz, [x, z] = y + pz, [y, z] = 0.","References

 [1] J. Alev and F. Dumas.",2022-11-10 17:22:26+00:00,Rational equivalence for enveloping algebras of three-dimensional Lie algebras,math.RA,"['math.RA', '16S30, 16K40, 16K20, 16S36, 17B35']","[arxiv.Result.Author('Jacques Alev'), arxiv.Result.Author('François Dumas'), arxiv.Result.Author('César Lecoutre')]","We study from the point of view of rational equivalence the enveloping
algebras of Lie algebras of dimension 3 whose derived Lie subalgebra is of
dimension 2, over an algebraically closed base field in arbitrary
characteristics."
13705,"Preliminaries

    In this section, we give some basic theories for further research, such as the singular value
decomposition (SVD for short) of real matrix, characterizations of star partial order and DMPGI
and so on.",2.,THEOREM 2.1 (SVD).,2022-11-14 07:20:10+00:00,Characterizations and properties of dual matrix star orders,math.RA,"['math.RA', '15A09, 06A06']","[arxiv.Result.Author('Hongxing Wang'), arxiv.Result.Author('Pei Huang')]","In this paper, we introduce D-star order, T-star order and P-star order on
the class of dual matrices. By applying matrix decomposition and dual
generalized inverses, we discuss properties, characterizations and relations
among these orders, and illustrate their relations with examples."
