,further research line,further research prefix,further research suffix,publication date,title,primary category,categories,authors,abstract
11545,"5.5 Recommendations for further research

With our findings on how TEDx speakers frame and approach their popular communication about
quantum science and technologies, further questions on the popularisation and societal engagement
of quantum technology come up.","It is expected that for example
first generation quantum cryptography and specific quantum sensors have a high technology
readiness level compared to other quantum technology applications (European Quantum Flagship,
2020) and therefore might have societal implications before quantum computing.","For example, journalists and experts might frame quantum
technology differently from one another, similar to what Droog et al.",2022-09-21 11:11:40+00:00,Is everything quantum spooky and weird? An exploration of popular communication about quantum science and technology in TEDx talks,physics.ed-ph,"['physics.ed-ph', 'physics.soc-ph', 'quant-ph']","[arxiv.Result.Author('Aletta Lucia Meinsma'), arxiv.Result.Author('Sanne Willemijn Kristensen'), arxiv.Result.Author('W. Gudrun Reijnierse'), arxiv.Result.Author('Ionica Smeets'), arxiv.Result.Author('Julia Cramer')]","Researchers point to four potential issues related to the popularisation of
quantum science and technology. These include a lack of explaining underlying
quantum concepts of quantum 2.0 technology, framing quantum science and
technology as spooky and enigmatic, framing quantum technology narrowly in
terms of public good and having a strong focus on quantum computing. To date,
no research has yet assessed whether these potential issues are actually
present in popular communication about quantum science. In this content
analysis, we have examined the presence of these potential issues in 501 TEDx
talks with quantum science and technology content. Results show that while most
experts (70%) explained at least one underlying quantum concept (superposition,
entanglement or contextuality) of quantum 2.0 technology, only 28% of the
non-experts did so. Secondly, the spooky/enigmatic frame was present in about a
quarter of the talks. Thirdly, a narrow public good frame was found,
predominantly by highlighting the benefits of quantum science and technology
(found in over 6 times more talks than risks). Finally, the main focus was on
quantum computing at the expense of other quantum technologies. In conclusion,
the proposed frames are indeed found in TEDx talks, there is indeed a focus on
quantum computing, but at least experts explain underlying quantum concepts
often."
12643,"3.1.3 Research questions and hypotheses
Sungur and Tekkaya (2006) suggest further research to find out to what extent soft skills influence
academic performance in IBL and PBL settings.","In a study by Hwang (2018), a positive correlation between teamwork skills and improved
performance at an Enterprise Resource Planning simulation with university students could be found.","The master thesis of Poier (2021) stated as the research question was: How does proficiency in soft
skills influence student performance in IBL situations?",2022-10-18 07:35:04+00:00,Development of Soft Skills via IYPT,physics.ed-ph,['physics.ed-ph'],"[arxiv.Result.Author('Boyka Aneva'), arxiv.Result.Author('Sergej Faletič'), arxiv.Result.Author('Mihály Hömöstrei'), arxiv.Result.Author('Péter Jenei'), arxiv.Result.Author('František Kundracik'), arxiv.Result.Author('Assen Kyuldjiev'), arxiv.Result.Author('Thomas Lindner'), arxiv.Result.Author('Hynek Němec'), arxiv.Result.Author('Harald Puhr'), arxiv.Result.Author('Martin Plesch')]","We investigated how students perceive the role of IYPT (www.iypt.org)
participation in their development of soft skills. We also investigated how
students teachers assess the contribution of YPT participation to students soft
skills development. Third, we link self-reported soft-skill development to
performance in research tasks, as assessed by international panels of experts
in the context of a physics competition. Taken together, the three steps, by
triangulating the relationship between inquiry-based learning and soft-skill
development, allow building inference about how inquiry-based learning helps
students build soft skills, and how these soft skills influence student
performance in research tasks. The data for the three stages includes 308
student responses for stage one, 33 teacher responses for stage two, and 794
expert (teachers, researchers, and university professors) assessments of
student performance for stage three. Condensing the detailed findings from our
analysis, we suggest thirteen guidelines for developing soft skills in students
below."
12644,"3.1.3 Research questions and hypotheses
Sungur and Tekkaya (2006) suggest further research to find out to what extent soft skills influence
academic performance in IBL and PBL settings.","In a study by Hwang (2018), a positive correlation between teamwork skills and improved
performance at an Enterprise Resource Planning simulation with university students could be found.","The master thesis of Poier (2021) stated as the research question was: How does proficiency in soft
skills influence student performance in IBL situations?",2022-10-18 07:35:04+00:00,Development of Soft Skills via IYPT,physics.ed-ph,['physics.ed-ph'],"[arxiv.Result.Author('Boyka Aneva'), arxiv.Result.Author('Sergej Faletič'), arxiv.Result.Author('Mihály Hömöstrei'), arxiv.Result.Author('Péter Jenei'), arxiv.Result.Author('František Kundracik'), arxiv.Result.Author('Assen Kyuldjiev'), arxiv.Result.Author('Thomas Lindner'), arxiv.Result.Author('Hynek Němec'), arxiv.Result.Author('Harald Puhr'), arxiv.Result.Author('Martin Plesch')]","We investigated how students perceive the role of IYPT (www.iypt.org)
participation in their development of soft skills. We also investigated how
students teachers assess the contribution of YPT participation to students soft
skills development. Third, we link self-reported soft-skill development to
performance in research tasks, as assessed by international panels of experts
in the context of a physics competition. Taken together, the three steps, by
triangulating the relationship between inquiry-based learning and soft-skill
development, allow building inference about how inquiry-based learning helps
students build soft skills, and how these soft skills influence student
performance in research tasks. The data for the three stages includes 308
student responses for stage one, 33 teacher responses for stage two, and 794
expert (teachers, researchers, and university professors) assessments of
student performance for stage three. Condensing the detailed findings from our
analysis, we suggest thirteen guidelines for developing soft skills in students
below."
13483,"For further research, it will be analyzed using paired sample t-test with the help of SPSS

22 to know which aspects of process skill are significantly improved.","It

can be seen that there is an improvement in mean values for the eight aspects of the science
process skills.","The results are shown

Proceedings The 2017 International Conference on Research in Education - Sanata Dharma University - Page 133
in Table 4.",2022-11-08 04:59:28+00:00,Improving the science process skills of physics education students by using guided inquiry practicum,physics.ed-ph,['physics.ed-ph'],[arxiv.Result.Author('Albertus Hariwangsa Panuluh')],"This research investigate that science process skills significantly improve
after doing some practicum activities. The research population are fifth
semester physics education students and the research sample are fifth semester
physics education students who was doing electricity and magnetism experiment C
class course. We used two questionnaires, the first one is given to the
students after doing three experiment activities and the second one is given
after doing six experiment activities. This research is quantitative research
using paired sample t test analysis that compared the first questionnaires
score and the second questionnaires by using SPSS software. The result
indicates that the number of practicum activities is able to improve the
science process skills significantly."
