url,title,further research,primary category,label,x,y,z
http://arxiv.org/pdf/2205.10194v3,New compressed cover tree for k-nearest neighbor search,"It was shown experimentally that mergegram produces excellent
results in 2d shape recognition when it was combined with Perslay-neural network architecture. No work is ever complete, therefore it is important to highlight a few possible further research
directions:

     Paired-trees: Worst-time complexities for k-nearest neighbors and the minimum spanning

                                                              123
124  Yury Elkin

tree problem can be potentially improved by using cover trees of both query and reference sets. Given query and reference sets Q, R we wish to develop an algorithm that scans through all
relevant pairs of Q × R in time O(cO(1) · max{|Q|, |R|}), where c is an expansion constant that
depends on sets Q,R. ",cs.CG,B,0.27304238,0.024257626,0.51598644
http://arxiv.org/pdf/2205.10194v4,A new compressed cover tree for k-nearest neighbour search and the stable-under-noise mergegram of a point cloud,"Follows from Theorem 4.4.14 by noting that |H (T (R))| ≤ log2(∆(|R|)). 4.5 Discussions: past challenges, contributions, and future work

The motivations were the past challenges in the proof of time complexities in [61, Theorem 5.1],
which attempted to solve metric minimum spanning tree problem in O(|R| · log2(|R|)) time. Section 4.2 and 4.3 show that the provided proof was incorrect. ",cs.CG,B,0.24524544,0.34543878,-0.15591526
http://arxiv.org/pdf/2205.11338v2,Temporal Network Analysis Using Zigzag Persistence,"networks from chaotic signals tend to have persistence diagrams with many features in 𝐻1 when compared to their
periodic counterpart. The fact that this labeling is done with only the user’s choice of threshold for what is considered
a high-persistence point makes this a potentially exciting avenue for future work to understand how it can be used in
the case of labeling intermittency in time series. Additionally, note in the persistence diagram in Fig. ",cs.CG,B,-0.29981053,0.59613764,0.19800818
http://arxiv.org/pdf/2205.14151v1,Interactive and Robust Mesh Booleans,"Two examples of our interactive rotation demo: one mesh rotates on top of the other while the system executes a Boolean operator in real time. We leave this improvement for future work to obtain additional          Size libigl (𝑡)         FA(𝑡 )         Ours (𝑡)
speedups. 25K  0.22/0.78/0.39  0.03/0.12/0.07  0.01/0.04/0.02
   Rotation demo. ",cs.CG,C,-0.106404856,-0.0367959,-0.014010081
http://arxiv.org/pdf/2206.06273v1,Learning Joint Surface Atlases,"We further oﬀer other technical contributions,
such as learning the 2D domain by optimizing a sampling probability distribution, analyzing
the eﬀect of incorporating normals in the optimization, and introducing a repulsive loss to
have a more even point distribution. We believe our work is an important step towards
learning consistent atlases and it will inspire future work on further improving quality of
atlases, such as modeling transition maps, minimizing seams, and distortion. 9
Acknowledgments Thanks to F. Darmon, R. Loiseau, E. Vincent for their feedbacks on
the manuscript; E. Shechtman , D. Picard, Y. Siglidis and G. Ponimatkin for inspiring
discussions; and B. George for code suggestions; This work was partly supported by ANR
project EnHerit ANR-17-CE23-0008, Labex Bézout, gifts from Adobe to École des Ponts
and HPC resources from GENCI-IDRIS (2021-AD011011937R1). ",cs.CG,C,-0.19191253,-0.085647896,0.108137056
http://arxiv.org/pdf/2206.06513v1,Fiberwise dimensionality reduction of topologically complex data with vector bundles,"We believe that the
main algorithm of Section 4 can be adjusted to account for different local dimensions by allowing the
cocycle Ω between patches with different dimension to be a matrix in a Stiefel manifold, instead of
an orthogonal matrix. With respect to (2), our procedures are robust with respect to limited amount
of noise, and the problem of devising extensions robust to outliers is left as future work. With respect to (3), there are several ways to obtain non-linear initial representations. ",cs.CG,C,-0.12749843,0.08818704,0.078828305
http://arxiv.org/pdf/2206.07496v1,"Normalization, Square Roots, and the Exponential and Logarithmic Maps in Geometric Algebras of Less than 6D","However, by applying the approach set out in [8] to the existing literature on normalization
                                        [4–7], a signature agnostic normalization procedure in geometric algebras of 𝑛 < 6 was found. While the 𝑛 ≥ 6
                                        limit remains intractable, the signature agnostic approach laid out in the current work provides additional insights
                                        that might guide future work towards 𝑛 = 6 and beyond. Fortunately however, many popular algebras are of
                                        dimension 𝑛 < 6. ",cs.CG,C,-0.0183433,-0.019944495,-0.043391213
http://arxiv.org/pdf/2206.07496v2,"Normalization, Square Roots, and the Exponential and Logarithmic Maps in Geometric Algebras of Less than 6D","However, by applying the approach set out in [8] to the existing literature on normalization
                                        [4–7], a signature agnostic normalization procedure in geometric algebras of 𝑛 < 6 was found. While the 𝑛 ≥ 6
                                        limit remains intractable, the signature agnostic approach laid out in the current work provides additional insights
                                        that might guide future work towards 𝑛 = 6 and beyond. Fortunately however, many popular algebras are of
                                        dimension 𝑛 < 6. ",cs.CG,C,-0.0183433,-0.019944495,-0.043391213
http://arxiv.org/pdf/2206.09699v1,FoR$^2$M: Recognition and Repair of Foldings in Mesh Surfaces. Application to 3D Object Degradation,"5 EXPERIMENTAL EVALUATION

5.1 Qualitative Results

Since no quantitative benchmark exists for the speciﬁc type
of problem, a qualitative evaluation will be performed based
on the quality of the method’s output mesh surfaces in
comparison to the input 3D models. In order to make the results of the proposed method
comparable against existing and future works on the prob-
lem of 3D mesh folding, the experiments have been per-
formed on publicly available 3D models from well known
repositories. The selection of the speciﬁc models was made
based on the diversity of their shape and surface character-
istics. ",cs.CG,C,-0.2946024,-0.33918583,-0.04472671
http://arxiv.org/pdf/2206.10504v1,A Theory of Sub-Barcodes,"Note,
this means it is faster to test sub-barcodes than to compute bottleneck matchings. In future work we will expand the theory of barcode functors and show how sub-barcodes and
factorizations appear implicitly in prior work, oﬀering a new perspective on barcodes, the persistence
measure, and interleaving. In particular, we will apply the theory of generalized interleavings [25,
35] to δ-smoothed persistence modules Vδ : Vδ1 Vδ2 given by pre-composition with a natural
transformation of monotone functions:

                δ1                        Vδ1

             S  δ T V Vec              S  Vδ Vec. ",cs.CG,B,0.039557632,0.333944,0.19558096
http://arxiv.org/pdf/2206.11456v1,Metric Optimization in Penner Coordinates,"Theoretically, it is a question about intersection between a linear
                                                                        subspace of dimension |𝐸| − |𝐸𝑏 | where |𝐸𝑏 | is the number of bound-
                                                                        ary edges, and the nonlinear manifold of angle-constrained metric,
                                                                        of dimension |𝐸| − |𝑉 |. It is an interesting question for future work. ACKNOWLEDGMENTS
                                                                        NSF

                                                                        REFERENCES

                                                                        Mirela Ben-Chen, Craig Gotsman, and Guy Bunin. ",cs.CG,C,-0.14794414,-0.08932167,-0.15637863
http://arxiv.org/pdf/2206.11481v1,A Novel Algorithm for Exact Concave Hull Extraction,"This content-adaptive strategy ensures that the performance on each file has maximal quality
with minimal user input. In future work, we suggest that one could effectively apply AGCR to both visualization and
retrieval of images in 2D and in higher dimensions. We already enable the extraction of region
contours in the Wavefront OBJ format, opening avenues for immediate visualization in 3D
rendering pipelines. ",cs.CG,B,-0.09131042,-0.18907931,0.40062353
http://arxiv.org/pdf/2206.14423v1,The Mutual Visibility Problem for Fat Robots,"Also, our algorithm solves the Mutual Visi-
bility problem in O(n) rounds. For future work, it is interesting to extend our
algorithm for non-rigid movements of robots and also for semi-synchronous and
asynchronous computations, or to remove the assumption that n is known to
the corner robots in one round. Finally, reducing the number of colors to two or
showing that this is impossible are interesting open questions. ",cs.CG,B,0.046481494,0.0230133,-0.048996463
http://arxiv.org/pdf/2206.14423v2,The Mutual Visibility Problem for Fat Robots,"Also, our algorithm solves the Mutual Visibility problem
in O(n) rounds. For future work, it is interesting to extend our algorithm for
non-rigid movements of robots and also for semi-synchronous and asynchronous
computations. References

 1. ",cs.CG,B,0.12639503,0.061915897,-0.048940897
http://arxiv.org/pdf/2206.14911v1,Minimum Weight Euclidean $(1+\varepsilon)$-Spanners,"Finally, we note that Steiner points can substantially improve the weight of a
(1 + ε)-spanner in Euclidean space [5, 24, 25]. It is left for future work to study the minimum
weight of a Euclidean Steiner (1 + ε)-spanner for n points in the unit square [0, 1]2 or unit cube
[0, 1]d; and for an n × n section of the integer lattice. References

 [1] A. Karim Abu-Aﬀash, Gali Bar-On, and Paz Carmi. ",cs.CG,B,0.073444374,-0.039434344,-0.31078967
http://arxiv.org/pdf/2206.14911v2,Minimum Weight Euclidean $(1+\varepsilon)$-Spanners,"Finally, we note that Steiner points can substantially improve the

weight of a (1 + ε)-spanner in Euclidean space [9, 36, 34]. It is left for future work to study the

minimum weight of a Euclidean Steiner (1 + ε)-spanner for n points in the unit cube [0, 1]d; and

for an n × . . ",cs.CG,B,0.03972289,-0.049678102,-0.30067068
http://arxiv.org/pdf/2206.15339v1,Abstract morphing using the Hausdorff distance and Voronoi diagrams,"Another direction is to develop other morphs that guarantee a smooth change of
some distance measure other than the Hausdorﬀ distance; we noted that it is unclear how
to employ the Fr´echet distance for morphing in the presence of multiple components. A more practically oriented direction for further research would be to develop a less naive
method of ﬁlling gaps than the mixed morph. It does not necessarily make sense to use the
same radius for the closing operator everywhere, which sometimes closes gaps that will be
opened again. ",cs.CG,B,-0.20030683,0.049571052,0.13248871
http://arxiv.org/pdf/2207.02990v1,Value-Offset Bifiltrations for Digital Images,"In Section 5 we present our experimental results, including
runtimes and properties of our biﬁltrations computed from sample images. We conclude in Section 6
with discussion and directions for future work. 2 Mathematical Preliminaries

2.1 Images and Filtrations

We regard a digital image as a ﬁnite set of pixels P ⊂ N2 along with a function f : P → R that assigns
a grayscale intensity/color value to each pixel. ",cs.CG,B,0.06281777,0.06359227,0.14428711
http://arxiv.org/pdf/2207.07211v1,Computing Optimal Kernels in Two Dimensions,"The bound of 1 ´ 4ε on the approximation factor is most likely not tight. Proving a sharp bound
on the approximation factor is an interesting problem for further research. Corollary 6.4. ",cs.CG,B,0.3301195,0.25977004,-0.2829726
http://arxiv.org/pdf/2207.08511v1,Edit Distance between Merge Trees,"41–50, 2014.
application to data analysis and visualization using various
computational experiments. In future work, we plan to                        [8] D. M. Thomas and V. Natarajan, “Multiscale symmetry detection
develop a theoretical analysis of the stability properties                         in scalar ﬁelds by clustering contours,” IEEE Trans. Vis. ",cs.CG,C,-0.22186525,-0.050823025,0.28357646
http://arxiv.org/pdf/2208.05062v1,Implicit High-Order Meshing using Boundary and Interface Fitting,"We have demonstrated that the method is eﬀective
for generating boundary- and interface-ﬁtted meshes for nontrivial curvilinear geometries. In future work, we will improve the method by developing mesh reﬁnement strategies
for hexahedral and tetrahedral meshes, which are required when the mesh topology limits
how well the mesh can ﬁt to the target surface (Section 3.2). We will also explore ways for
aligning meshes to domains with sharp features [26, 43], as we currently assume that the
level set function σ used in (8) is suﬃciently smooth around its zero level set. ",cs.CG,C,-0.32851952,-0.3137374,-0.0621721
http://arxiv.org/pdf/2208.05850v1,A Deformation-based Edit Distance for Merge Trees,"Graph. Forum, 35(3):643–667,
   In future work, we want to study stability properties of the new                   2016. doi: 10.1111/cgf.12933
distance (speciﬁcally comparing the unconstrained and one-degree
versions in this regard), parallel algorithms for more practical run-            [9] T. Jiang, L. Wang, and K. Zhang. Alignment of trees - an alternative
ning times on complex datasets, and a possible adaptation to contour                  to tree edit. ",cs.CG,B_centroid,0.117070064,0.12673862,0.22769792
http://arxiv.org/pdf/2208.07128v1,Tetrahedralization of a Hexahedral Complex,"We have also shown that using
a predeﬁned set of face cuts restricts the triangulation in certain instances and the use of Steiner points is
warranted to completely solve the triangulation problem for hexahedra. In future work, we plan to implement the algorithm above in the PETSc (Balay et al., 2022a,b) libraries
in order to convert meshes with tensor product cells to simplicial cells as part of its DMPlex mesh capabili-
ties (Knepley and Karpeev, 2009; Lange et al., 2016; Knepley et al., 2017). Acknowledgments

We gratefully acknowledge the support of the Computational Infrastructure for Geodynamics project NSF
EAR-0949446, as well as support from the Department of Energy Applied Math Research program under
U.S. DOE Contract DE-AC02-06CH11357. ",cs.CG,C,-0.16876566,-0.15841767,0.07198441
http://arxiv.org/pdf/2208.07148v1,Reduced Connectivity for Local Bilinear Jacobi Sets,"In sum, our method enables the reliable
approach. It takes all relevant forces into account, being inertia of              and fast identiﬁcation of topological structures within the droplet
the liquid and the ambient gas, the surface tension of the interface,              impact for further analysis of the phenomena. as well as friction losses, and gravity. ",cs.CG,C,-0.39791027,-0.10096875,-0.17632115
http://arxiv.org/pdf/2208.07148v2,Reduced Connectivity for Local Bilinear Jacobi Sets,"In sum, our method enables the reliable
approach. It takes all relevant forces into account, being inertia of              and fast identiﬁcation of topological structures within the droplet
the liquid and the ambient gas, the surface tension of the interface,              impact for further analysis of the phenomena. as well as friction losses, and gravity. ",cs.CG,C,-0.39791027,-0.10096875,-0.17632115
http://arxiv.org/pdf/2208.07567v1,Computing Smallest Convex Intersecting Polygons,"One could
also try to generalize the set of objects, for example, adapting the minimum area algorithm
to arbitrary convex objects. We propose the following open questions for further study. Is there a polynomial-time exact algorithm for the minimum area convex intersecting
    polygon of segments? ",cs.CG,B,0.060459975,-0.256105,-0.11157083
http://arxiv.org/pdf/2208.11275v1,Halving by a Thousand Cuts or Punctures,"It is natural to further investigate this connection. Ultimately,
improving and simplifying Rubin’s construction in 2d seems like a worthy problem for further research. Beyond that, this work emphasize the “rounding is approximation” approach. ",cs.CG,B,0.025386576,-0.012590329,-0.121351436
http://arxiv.org/pdf/2208.14264v1,Approximation Algorithm for Minimum $p$ Union Under a Geometric Setting,"In Subsection 2.3, local solutions to these subproblems are

assembled to yield a (4, 1+1 ε )-bicriteria approximate solution to the DkSH-US instance,
                                                      1
which,  by  the  previous  relation,  yields  a  (  1+   ε  ,  4  )  -  bicr  it  er  ia  approximate  solution  to  the

MinpU-US instance. Section 3 concludes the paper with some discussions on future work. 2 Approximation Algorithm for MinpU-US

2.1 Preliminaries

    In this subsection, we formally deﬁne the MinpU problem and the DkSH problem, and
reveals a relation between then in terms of bicriteria algorithms. ",cs.CG,B,0.2645368,0.027093714,-0.10957021
