url,title,further research,primary category,label,x,y,z
http://arxiv.org/pdf/2202.07799v1,"A Survey on Scheduling Techniques in the Edge Cloud: Issues, Challenges and Future Directions","Experiments show that the proposed           2) Artiﬁcial Fish Swarm Based Approach: In swarm-
work is near-optimal compared with other competitors. based intelligence algorithms, the artiﬁcial ﬁsh swarm
The author would like to improve this work as future work     algorithm [?] is the promising optimization approach based
and also eager to see the malfunction aspects of MESch. ",cs.DC,A,0.030681893,-0.003902413,0.2606855
http://arxiv.org/pdf/2202.08008v1,Near-Shortest Path Routing in Hybrid Communication Networks,"This could potentially make it of interest when studying routing or distance
   approximation problems on UDGs in the CONGEST or Broadcast-CONGEST models or for
   simplification of existing algorithms. We also believe that the grid graph abstraction and its
   properties will be useful for future work in the HYBRID setting, making it a springboard for
   the case of UDGs with radio-holes. 1.3 Overview

   The first step is the computation of a simple, yet surprisingly useful abstract graph structure
   on UDG(V ), which we call a grid graph Γ. ",cs.DC,B,-0.027539292,0.26938304,-0.14974111
http://arxiv.org/pdf/2202.08463v1,A Creativity Survey of Parallel Sorting Algorithm,"Section IV
introduces the comparison of experimental analysis in related literature. Section V discusses the
research opportunities in future work and Section VI concludes the paper. 2 CLASSIFICATION OF RESEARCH OBJECTS

                                                                        2
                            Table 1: Different Research Objects

Parallel Sorting Algorithm              CPU                 Platform                Others
                            Ⅰ. ",cs.DC,A,-0.14557564,-0.09057471,0.23332018
http://arxiv.org/pdf/2202.09518v1,Distributed Out-of-Memory NMF of Dense and Sparse Data on CPU/GPU Architectures with Automatic Model Selection for Exascale Data,"Also,
latent features is shown in Section 4. We ﬁnally conclude       based on the update rules, several variants of NMF algo-
with summaries and suggestions of possible future work          rithms exist such as Hierarchical Alternating Least Squares
directions in Section 5. (HALS) [26], Alternating Non-negative Least Squares with
                                                                Block Principle Pivoting (ANLS-BPP) [20], and Block co-
   0. pyDNMFk: https://github.com/lanl/pyDNMFk                  ordinate descent algorithm (BCD) [19]. ",cs.DC,B,-0.09169988,0.37624526,0.03995177
http://arxiv.org/pdf/2202.09518v2,Distributed Out-of-Memory NMF of Dense and Sparse Data on CPU/GPU Architectures with Automatic Model Selection for Exascale Data,"benchmark results and the validation of benchmark results
    • We incorporate a batching approach for inter-node           on a synthetic dataset with a predetermined number of
         communication, which provides a unique ability to        latent features is shown in Section 4. We ﬁnally conclude
         perform out-of-memory NMF while using multiple           with summaries and suggestions of possible future work
         GPUs for the bulk of computations. directions in Section 5. ",cs.DC,B_centroid,-0.34406248,0.019881893,-0.14006132
http://arxiv.org/pdf/2202.10217v1,I/O-Optimal Algorithms for Symmetric Linear Algebra Kernels,"In addition to our theoretical lower bound results, our algo-
                                                                           rithms provide insights about how to make use of the symmetry
          = OCC ( ) +          OCT ( , ) + TBS ( , )                       to reduce communications. In future works, it might be possible
                                                                           to improve the lower order terms of our results, to obtain eﬃcient
                           =1                                              algorithms for not so large values of . More importantly, we be-
                                                                           lieve that the insight provided by this paper can be a starting point
               2                                                           to obtain communication eﬃcient parallel algorithms for symmet-
                                                                           ric linear algebra kernels. ",cs.DC,B,-0.16963176,0.3863051,-0.2400176
http://arxiv.org/pdf/2202.11385v1,Compositional Model Checking of Consensus Protocols Specified in TLA+ via Interaction-Preserving Abstraction,"It also shows that the compositional model checking based
on IPA can signiﬁcantly reduce the checking cost. In our future work, we will apply the IPA framework to more scenarios, in-
volving complex and subtle distributed protocols other than distributed consen-
sus. We will also investigate whether the IPA framework can be used to reduce
the cost of code-level model checking of distributed system implementations. ",cs.DC,C,0.21922217,-0.056442797,-0.18942235
http://arxiv.org/pdf/2202.11646v1,LUCE: A Blockchain-based data sharing platform for monitoring data license accountability and compliance,"Further, in section 6, we follow with the current state of the art for data sharing solutions. We
conclude this paper in section 7 with a discussion on current and future work. 2 Background

In this section, we brieﬂy discuss background work on blockchain, smart contracts, and GDPR. ",cs.DC,C,0.48858082,0.078992486,-0.07700197
http://arxiv.org/pdf/2202.11655v1,TEE-based decentralized recommender systems: The raw data sharing redemption,"would shrink. For these reasons, we leave for future work the
                                                                        assessment of the impact of gradient compression with respect
      b) Scalability evaluation: Although crucial in decentral-         to the choice of model or raw data sharing in decentralized
ized systems, scalability is a direct consequence of network            training. Moreover, data non-iidness is well-known to have a
topology and sharing algorithm [40]. ",cs.DC,B,-0.013427256,0.066475734,-0.18005875
http://arxiv.org/pdf/2202.11655v2,TEE-based decentralized recommender systems: The raw data sharing redemption,"would shrink. For these reasons, we leave for future work the
                                                                        assessment of the impact of gradient compression with respect
      b) Scalability evaluation: Although crucial in decentral-         to the choice of model or raw data sharing in decentralized
ized systems, scalability is a direct consequence of network            training. Moreover, data non-iidness is well-known to have a
topology and sharing algorithm [40]. ",cs.DC,B,-0.013427256,0.066475734,-0.18005875
http://arxiv.org/pdf/2202.11819v1,Improving Scalability with GPU-Aware Asynchronous Tasks,"MPI processes are virtualized as chare objects, allowing an                  Wait
arbitrary number of ‘processes’ to be run on a set number
of PEs. Although AMPI provides an easy on-ramp for MPI                                            Wait
developers to beneﬁt from the adaptive features of Charm++,
we focus on Charm++ in this paper and leave explorations                  Kernel 0                                  Kernel 0
with AMPI as future work. Kernel 1
                                                                 GPU                Kernel 1
B. GPU-Aware Communication                                       Time                                          Asynchronous
                                                                          Synchronous                           completion
   Without support for GPU memory from the underlying                     completion
communication library, applications need explicit host-device
data transfers to stage GPU buffers on host memory for           Fig. ",cs.DC,B,-0.19886523,-0.18170115,-0.1895663
http://arxiv.org/pdf/2202.12397v1,Time Complexity of Consensus in Dynamic Networks Under Oblivious Message Adversaries,"We discovered a close relation between the number of iterations of the decision algorithm and the consensus

termination time, and the importance of the existence and number of root-compatible connected components in the

refined indistinguishability graph. Our work opens several interesting avenues for future work. For example, while we have presented a combinatorial

approach, it would be interesting to study the time complexity of the consensus problem from a topological perspective

as well. ",cs.DC,C,0.14798376,0.34192994,-0.14939585
http://arxiv.org/pdf/2202.12662v2,VLSM: Validating Labelled State Transition and Message Production Systems,"Future work will
also show examples of equivocation limited validators, including consensus protocols that are safe and non-
trivial. Consensus protocols that are live and high performance in limited synchronization faults are also
left for future work. References

 [1] Amitanand S. Aiyer, Lorenzo Alvisi, Allen Clement, Mike Dahlin, Jean-Philippe Martin, and Carl Porth. ",cs.DC,C_centroid,0.34712332,0.1931001,-0.25823754
http://arxiv.org/pdf/2202.12662v3,Validating Labelled State Transition and Message Production Systems: A Theory for Modelling Faulty Distributed Systems,"In future
work will also show more examples of equivocation limited validators, including consensus protocols
that are safe and non-trivial. Further specifying consensus protocols that exhibit provable liveness and
high performance in systems with limited synchronization faults is also left for future work. References

 [1] Amitanand S. Aiyer, Lorenzo Alvisi, Allen Clement, Mike Dahlin, Jean-Philippe Martin & Carl Porth (2005):
      BAR fault tolerance for cooperative services. ",cs.DC,C,0.43024492,0.14116073,-0.23649825
http://arxiv.org/pdf/2202.13037v1,Joint Offloading Decision and Resource Allocation for Vehicular Fog-Edge Computing Networks: A Contract-Stackelberg Approach,"Numerical results demonstrate the effectiveness of
our proposed incentive mechanism and trading mechanism, reveal the trends of energy consumption and ofﬂoading
decisions on various parameters, and show the performance comparison between our work and the other existing
MEC ofﬂoading framework in vehicular networks. Our future work will include two aspects. First, based on HVC
framework, combined with speciﬁc vehicle-to-everything applications (e.g., sensor data sharing and processing, use
cases of automatic driving or advanced driving), the proposed algorithm will be veriﬁed with real objects. ",cs.DC,C,0.21093231,-0.030666636,0.06457499
http://arxiv.org/pdf/2202.13408v1,Scalable Byzantine Fault Tolerance via Partial Decentralization,"Addressing          by the protocol. For instance, Hybster requires certificates using
this limitation is left as future work. at least three different counters for different protocol phases (e.g.,
                                                                         checkpoints, view changes). ",cs.DC,C,0.2096371,-0.0036845673,-0.04917161
http://arxiv.org/pdf/2202.13747v1,A Blockchain Cloud Computing Middleware for Academic Manuscript Submission,"ed., 2018. Guide to publishing
    As for future works, our system’s architecture
should be expanded to a multithread application             in psychology journals. Cambridge University
which would substantially increase the hash
generation uptimes for all the available devices in         Press. ",cs.DC,A,0.058897693,-0.034450065,0.15463288
http://arxiv.org/pdf/2202.13747v2,A Blockchain Cloud Computing Middleware for Academic Manuscript Submission,"act both as a server and a client, thus providing the
necessary information and statuses to the blockchain. https://dx.doi.org/10.1002/leap.1092

    As for future works, our system’s architecture            [6] Sternberg, R.J. ed., 2018. ",cs.DC,C,0.48650992,0.018796265,-0.08419683
http://arxiv.org/pdf/2202.13880v1,Allocating Duplicate Copies for IoT Data in Cloud Computing Based on Harmony Search Algorithm,"The results of implementing the proposed
heuristic methods operate slowly in selecting data centers for      approach are evaluated in Section 5. Finally, Section 6 presents
data replication, meta-heuristic methods can be a better            the conclusion and future works. alternative choice [2]. ",cs.DC,A,0.07082687,-0.23008704,0.05842808
http://arxiv.org/pdf/2202.13954v1,Implementation Technologies of an Advanced Cloud-based System for Distribution Operations,"Finally, the monitoring module of the routing and scheduling subsystem offers the visualization of the routes
produced by the vehicle routing modules (static and dynamic). Through this module, the routes are sent either to
vehicle devices or to the company's information systems for further analysis . This module can also be used for real-
time tracking of vehicle routes. ",cs.DC,A,0.09860724,-0.080723405,0.18125454
http://arxiv.org/pdf/2203.00219v1,FedREP: Towards Horizontal Federated Load Forecasting for Retail Energy Providers,"Available:
technologies. We will explore these topics in the future works. https://doi.org/10.1145/1878431.1878446

                             REFERENCES                                          [8] W. Kleiminger, C. Beckel, T. Staake, and S. Santini, “Occupancy
                                                                                      detection from electricity consumption data,” ser. ",cs.DC,A,0.06696333,0.07183734,0.34261727
http://arxiv.org/pdf/2203.00427v1,Making use of supercomputers in financial machine learning,"This study will be presented in a future work. 5 Conclusion and future works

We have designed an interpretable predictive algorithm and executed it on an
HPC machine. It appears that the limiting factor for taking advantage of a large
14  P. Cotte et al. ",cs.DC,B,-0.123569176,0.06615436,0.2767771
http://arxiv.org/pdf/2203.00611v1,Learning Intermediate Representations using Graph Neural Networks for NUMA and Prefetchers Optimization,"Section IV presents the experiments. Section V
discusses limitations and future work. Section VI presents the       2) Aggregate: aggregates all messages that are received
related works in prefetching and NUMA optimizations, and                 from neighbouring nodes. ",cs.DC,A,-0.050345354,-0.10182053,0.022881897
http://arxiv.org/pdf/2203.01107v1,ReStore: In-Memory REplicated STORagE for Rapid Recovery in Fault-Tolerant Algorithms,"By using
the proposal implementation of the fault-tolerance mechanisms included in the
new MPI 4.0 standard, our library can be used by applications on HPC systems
once the new standard is implemented. Possible future work includes a recovery
of lost redundancy after a failure using a variation of consistent hashing. This
further decreases the probability to lose all copies of any data. ",cs.DC,B,-0.025250005,-0.022402026,-0.14318617
http://arxiv.org/pdf/2203.01107v2,ReStore: In-Memory REplicated STORagE for Rapid Recovery in Fault-Tolerant Algorithms,"So for n total data blocks, we pick a random starting PE i
This is a restriction in the API, not the underlying algorithm,                                                                      and request data blocks i · n/p to (i + 0.01 · p) · n/p. This
and will be removed in future work. simulates the requests expected if 1 % of PEs fail at once. ",cs.DC,C,0.0035197325,0.16583085,0.11550203
http://arxiv.org/pdf/2203.01297v1,Sparse matrix multiplication in the low-bandwidth model,"Also, we expect that the techniques that we present here are
applicable also beyond the specific case of supported low-bandwidth model and uniformly sparse matrices. 1.4 Open questions
For future work, there are four main open question:

   (1) What is the smallest 𝛼 such that uniformly sparse matrix multiplication can be solved in 𝑂 (𝑑𝛼 ) rounds in the
        supported low-bandwidth model? (2) Can we eliminate the assumption that there is a support (i.e., the structure of the matrices is known)? ",cs.DC,B,-0.1866619,0.30159378,-0.21490094
http://arxiv.org/pdf/2203.01297v2,Sparse matrix multiplication in the low-Bandwidth model,"multiplication in 𝑂 (𝑑1.907) rounds in the supported low-bandwidth
model. 1.4 Open questions

   It should be noted that the value of the matrix multiplication                         For future work, there are four main open question:

exponent 𝜔 can depend on the ground field or ring we are operating                           (1) What is the smallest 𝛼 such that uniformly sparse matrix mul-
over. The current best bound 𝜔 < 2.3728596 [1] holds over any                                     tiplication can be solved in 𝑂 (𝑑𝛼 ) rounds in the supported
field and at least certain rings such as integers, and Theorem 1.1                                low-bandwidth model? ",cs.DC,B,-0.20732158,0.3904072,-0.18721223
http://arxiv.org/pdf/2203.01297v3,Sparse Matrix Multiplication in the Low-Bandwidth Model,"Also, we
expect that the techniques that we present here are applicable also beyond the speciﬁc case of
supported low-bandwidth model and uniformly sparse matrices. 1.4 Open questions

For future work, there are four main open question:

    (1) What is the smallest α such that uniformly sparse matrix multiplication can be solved
          in O(dα) rounds in the supported low-bandwidth model? (2) Can we eliminate the assumption that there is a support (i.e., the structure of the
          matrices is known)? ",cs.DC,B,-0.18018141,0.31447953,-0.21768975
http://arxiv.org/pdf/2203.02527v1,Linear Run Time of Persistent Homology Computation with GPU Parallelization,"Analytically, with many large GPUs, O(N ) run time
growth is possible. However, we’ve ignored memory transfers and latencies which could be
researched in future work. Future work also includes the straight forward extension to the
higher order homology groups. ",cs.DC,B,-0.28665078,0.082852535,-0.12611862
http://arxiv.org/pdf/2203.02527v2,Linear Run Time of Persistent Homology Computation with GPU Parallelization,"Analytically, with many large GPUs, O(N ) run time
growth is possible. However, we’ve ignored memory transfers and latencies which could be
researched in future work. Future work also includes the straight forward extension to the
higher order homology groups. ",cs.DC,B,-0.28665078,0.082852535,-0.12611862
http://arxiv.org/pdf/2203.02684v1,EsDNN: Deep Neural Network based Multivariate Workload Prediction Approach in Cloud Environment,"To achieve efficient and accurate prediction results, a sliding window-based
approach for multivariate time series prediction is applied to convert the original dataset into
supervised learning-based time series data. Thereafter, a GRU-based deep learning network, named
esDNN is proposed for future workload prediction. 4.1 Sliding Window for Multivariate Time Series Forecasting

Time series forecasting requires the dataset to contain a set of time-dependent data, regardless
of whether the time units of the dataset are seconds, minutes, or hours. ",cs.DC,B,-0.21497503,-0.015198333,0.3036661
http://arxiv.org/pdf/2203.03119v1,Fabchain: Managing Audit-able 3D Print Job over Blockchain,"of Fabchain. In future work, we plan to implement applications
C. Applicability of Fabchain
                                                                   which enable everyone to fabricate products with liability. In this section, we discuss the applicability of Fabchain. ",cs.DC,C,0.34147626,0.08381797,0.16988498
http://arxiv.org/pdf/2203.04015v1,A Compilation Flow for the Generation of CNN Inference Accelerators on FPGAs,"reduced precision arithmetic to ﬁt more operations per DSP
and alleviate memory requirements. We leave addressing these          HPIPE [23] is a FPGA sparse network acceleration archi-
limitations to future work. tecture and graph compiler. ",cs.DC,B,-0.3249605,-0.029271059,-0.2980463
http://arxiv.org/pdf/2203.04159v1,AI for Next Generation Computing: Emerging Trends and Future Directions,"IoT deﬁnes each robot as an item capable of interacting with other IoT things and other
robots [98]. Literature reported [97, 98, 99] that deep learning approaches for placement robot tasks in fog, however
further research is needed. In the future, methods and scheduling algorithms for fog computing’s application placement
problem will need to be established depending on the types and categories of request applications, according to research
and evaluations of literature [100]. ",cs.DC,A,-0.04442421,-0.12508464,0.14024217
http://arxiv.org/pdf/2203.04258v1,RAPTEE: Leveraging trusted execution environments for Byzantine-tolerant peer sampling services,"The same authors [2], [3] employ
count-min sketches to unbias a biased stream of identiﬁers. [4] O. Babaoglu, G. Canright, A. Deutsch, G. A. D. Caro, F. Ducatelle, L. M.
Adopting a similar technique in RAPTEE could constitute                      Gambardella, N. Ganguly, M. Jelasity, R. Montemanni, A. Montresor
interesting future work. et al., “Design patterns from biology for distributed computing,” ACM
                                                                             Transactions on Autonomous and Adaptive Systems (TAAS), vol. ",cs.DC,C,0.1057781,0.08473243,0.016443811
http://arxiv.org/pdf/2203.05072v1,Exoshuffle: Large-Scale Shuffle at the Application Level,"If the distributed future is passed to another task
ﬁt in memory. This is a current limitation in Ray that we plan           that is scheduled on a remote node, the remote NodeManager
to address in future work (§7). copies the dependencies to its local object store (Fig. ",cs.DC,A,0.09787232,-0.038224462,-0.07095447
http://arxiv.org/pdf/2203.05072v2,Exoshuffle: Large-Scale Shuffle at the Application Level,"If the distributed future is passed to another task
ﬁt in memory. This is a current limitation in Ray that we plan           that is scheduled on a remote node, the remote NodeManager
to address in future work (§7). copies the dependencies to its local object store (Fig. ",cs.DC,A,0.09787232,-0.038224462,-0.07095447
http://arxiv.org/pdf/2203.05072v3,Exoshuffle: Large-Scale Shuffle at the Application Level,"ﬁt in memory. This is a current limitation in Ray that we plan
                                                                                                                  to address in future work (§7). 4.1 Coordination: The Distributed Object Store
                                                                                                                  4.1.3 Task Scheduling
Previous shufﬂe systems implement distributed coordination
via an external shufﬂe service (ESS), a specialized process                                                       Achieving high throughput in shufﬂe requires a high level of
deployed to each node that orchestrates block transfers (Fig-                                                     task parallelism and the ability to load-balance evenly across
ure 4a). ",cs.DC,A,-0.026183961,-0.17902723,-0.16477239
http://arxiv.org/pdf/2203.05158v1,Devouring the Leader Bottleneck in BFT Consensus,"In reality, system performances are also limited by
many factors such as replicas’ storage and processing capac-                                                          1000 2000 3000 4000 5000
ities. The analysis of these bottlenecks are orthogonal to this                                                      Number of Measured Delays per 1 min
work and will be addressed in the future work. (a) Heat map of measured delays. ",cs.DC,A,-0.13003391,-0.16920611,-0.034613248
http://arxiv.org/pdf/2203.05158v2,Devouring the Leader Bottleneck in BFT Consensus,"In reality, system performances are also limited by
many factors such as replicas’ storage and processing capac-                                                          1000 2000 3000 4000 5000
ities. The analysis of these bottlenecks are orthogonal to this                                                      Number of Measured Delays per 1 min
work and will be addressed in the future work. (a) Heat map of measured delays. ",cs.DC,A,-0.13003391,-0.16920611,-0.034613248
http://arxiv.org/pdf/2203.05158v3,Scaling Blockchain Consensus via a Robust Shared Mempool,"In 49th Annual IEEE/IFIP International Conference on
HotStuff. In our future work, we plan to extend Stratus to                                Dependable Systems and Networks, DSN 2019, Portland, OR, USA, June
multi-leader BFT protocols. 24-27, 2019, pages 568–580. ",cs.DC,A,0.12942399,-0.012799067,-0.127264
http://arxiv.org/pdf/2203.05161v1,Container Orchestration in Edge and Fog Computing Environments for Real-Time IoT Applications,"Compared to the native Fogbus2 frame-
work, the new system (i.e., O-FogBus2) enables resource limit control, health
check, and self-healing from failure to cope with the ever-changing number and
functionality of connected IoT devices. We identiﬁed several future works to further improve the container orches-
tration for eﬃcient resource management in hybrid computing environments. Firstly, we can consider implementing elastic scalability to automatically add or
remove computing resources according to the demands of IoT applications. ",cs.DC,A,0.13391158,-0.41424388,-0.02607382
