url,title,further research,primary category,label,x,y,z
http://arxiv.org/pdf/2201.00613v1,Squeeze: Efficient Compact Fractals for Tensor Core GPUs,"Future improvements to tensor cores, both in
quantity and performance, would provide an even higher improvement. As future work, it would
be useful to come up with a way to build arbitrary fractal structures by combining diﬀerent NBB
fractals at each scale level, as well as to extend Squeeze to support compact processing on 3D and
higher-dimensional fractals. As a ﬁnal conclusion, the proposed approach can be adopted by the
community to accelerate simulations on NBB fractals and understand phenomena at larger scales. ",cs.DC,B,-0.27031696,0.14180976,-0.10458835
http://arxiv.org/pdf/2201.01366v1,RTNN: Accelerating Neighbor Search Using Hardware Ray Tracing,"Speedups from
the bundling algorithm tends to be overly aggressive under                                this approximation would be significant, given that Step 2 is
a larger 𝐾. We leave it to future work to investigate a better                            much more costly than Step 1.
bundling algorithm under large 𝐾s. General-Purpose Irregular Processor Given the suc-
7 Related Work                                                                            cess of today’s GPGPUs for regular algorithms, one would
                                                                                          naturally wonder how a ray tracing-based GPU can be used
Section 2.1 provides an overview of neighbor search. ",cs.DC,B,-0.35097873,-0.017114088,-0.052926883
http://arxiv.org/pdf/2201.01366v2,RTNN: Accelerating Neighbor Search Using Hardware Ray Tracing,"Speedups from
the bundling algorithm tends to be overly aggressive under                                this approximation would be significant, given that Step 2 is
a larger 𝐾. We leave it to future work to investigate a better                            much more costly than Step 1.
bundling algorithm under large 𝐾s. General-Purpose Irregular Processor Given the suc-
7 Related Work                                                                            cess of today’s GPGPUs for regular algorithms, one would
                                                                                          naturally wonder how a ray tracing-based GPU can be used
Section 2.1 provides an overview of neighbor search. ",cs.DC,B,-0.35097873,-0.017114088,-0.052926883
http://arxiv.org/pdf/2201.01446v1,Extending the limit of molecular dynamics with ab initio accuracy to 10 billion atoms,"2021. Reactive uptake of N2O5 by
code still has accuracy problems and will be our future work. atmospheric aerosol is dominated by interfacial processes. ",cs.DC,A,-0.040570576,-0.0014600754,0.2332221
http://arxiv.org/pdf/2201.02179v1,wCQ: A Fast Wait-Free Queue with Bounded Memory Usage,"Though Kogan-Petrank’s method can be used to create wait-free queues with CAS [14], wCQ addresses unique chal-
lenges since it avoids dynamic allocation and uses F&A. We hope that wCQ will spur further research in creating better
performing wait-free data structures with F&A. Availability

We provide code for wCQ at https://github.com/rusnikola/wfqueue. ",cs.DC,A,0.020673145,-0.003419729,-0.18558191
http://arxiv.org/pdf/2201.02179v2,wCQ: A Fast Wait-Free Queue with Bounded Memory Usage,"queues with CAS [18], wCQ addresses unique challenges since it
                                                                          avoids dynamic allocation and uses F&A. We hope that wCQ will
   Though SimQueue [7] uses F&A and outperforms Michael &                 spur further research in creating better performing wait-free data
Scott’s FIFO queue by aggregating concurrent operations with one          structures with F&A. CAS, it is still not that performant. ",cs.DC,A,0.006579661,-0.054177538,-0.08236569
http://arxiv.org/pdf/2201.02460v1,A SIMD algorithm for the detection of epistatic interactions of any order,"Finally, Section 5                  ory that measures the amount of information obtainable from
discusses the conclusions extracted from this study, reﬂects on             one variable through the observation of another. Subsection 2.3
its limitations and comments on some lines of future work. covers the calculation of this metric. ",cs.DC,C,0.074338324,0.27017716,0.39486763
http://arxiv.org/pdf/2201.03331v1,Fiuncho: a program for any-order epistasis detection in CPU clusters,"The main limitation of Fiuncho is its computational complexity, which
makes its cost prohibitive for large-scale studies and high interaction orders. For this reason, future work should focus on improving the exhaustive strategy
so that its computational complexity can be reduced while not losing the
epistasis detection capabilities characteristic of these methods. Fiuncho is distributed as open-source software, available to all the scientiﬁc
community in its Github repository1. ",cs.DC,C,-0.00652752,0.18469335,0.2244555
http://arxiv.org/pdf/2201.03331v2,Fiuncho: a program for any-order epistasis detection in CPU clusters,"The main limitation of Fiuncho is its computational complexity, which
makes its cost prohibitive for large-scale studies and high interaction orders. For this reason, future work should focus on improving the exhaustive strategy
so that its computational complexity can be reduced while not losing the
epistasis detection capabilities characteristic of these methods. Fiuncho is distributed as open-source software, available to all the scientiﬁc
community in its Github repository1. ",cs.DC,C,-0.00652752,0.18469335,0.2244555
http://arxiv.org/pdf/2201.03331v3,Fiuncho: a program for any-order epistasis detection in CPU clusters,"The main limitation of Fiuncho is its computational complexity, which
makes its cost prohibitive for large-scale studies and high interaction orders. For this reason, future work should focus on improving the exhaustive strategy
so that its computational complexity can be reduced while not losing the
epistasis detection capabilities characteristic of these methods. Fiuncho is distributed as open-source software, available to all the scientiﬁc
community in its Github repository1. ",cs.DC,C,-0.00652752,0.18469335,0.2244555
http://arxiv.org/pdf/2201.03486v1,Successive Approximation Coding for Distributed Matrix Multiplication,"However, in contrast to ǫ-                                                                                         AjBj when i = j is
approximate MatDot codes, the G-SAC method improves on
this estimate as m increases by achieving a close to zero av-                                                                                     E Tr (AiBi)T (Aj Bj )  = λ4E  A(0)B(0)  2  ,  (8)
                                                                                                                                                                                          F
                                                                                    13

while when i = j is                                                                 set of workers of different computational abilities. We aim to

       E Tr (AiBi)T (AiBi)                 =E     AiBi     2                        provide optimal parameters of SAC with respect to such a
                                                           F
                                                                                    heterogeneous distributed system in future works. = λ4E            A(0)B(0)  2   + λ2E     A(0)Bi(1)         2  +
                                    F                               F                                            REFERENCES

         + λ2E       A(i1)B(0)      2   +E        A(i1)Bi(1)  2     . ",cs.DC,B,-0.2399689,0.25818563,0.01740637
http://arxiv.org/pdf/2201.03749v1,Utilizing Parallelism in Smart Contracts on Decentralized Blockchains by Taming Application-Inherent Conflicts,"We need        approach is further outlined in several other papers [1, 27, 28]. Our
further research on parallel execution incentives, and the EVM           discussion of the determinism of blockchain transaction execution
needs to be extended with a parallel scheduler. ""OCC with det. ",cs.DC,C,0.19497734,0.062347803,-0.2063165
http://arxiv.org/pdf/2201.03749v2,Utilizing Parallelism in Smart Contracts on Decentralized Blockchains by Taming Application-Inherent Conflicts,"We need        approach is further outlined in several other papers [1, 29, 30]. Our
further research on parallel execution incentives, and the EVM           discussion of the determinism of blockchain transaction execution
needs to be extended with a parallel scheduler. OCC-DA provides          was inspired by these works. ",cs.DC,C,0.2008004,0.034228787,-0.20515649
http://arxiv.org/pdf/2201.03861v1,HEROv2: Full-Stack Open-Source Research Platform for Heterogeneous Computing,"22–31, 2020.
performance computing, real-time processing, in-network
                                                                                  [19] A. Kurth et al., “HERO: An open-source research platform for
processing, transprecision accelerators, and parallel program-                          HW/SW exploration of heterogeneous manycore systems,” in
                                                                                        Proceedings of the 2nd Workshop on AutotuniNg and ADaptivity
ming. We expect future work to evolve in the directions                                 AppRoaches for Energy Efﬁcient HPC Systems, ser. ANDARE ’18. ",cs.DC,B,-0.34231216,-0.21318027,-0.09959766
http://arxiv.org/pdf/2201.04322v1,Gridiron: A Technique for Augmenting Cloud Workloads with Network Bandwidth Requirements,"It is possible to use the RNN-based
         B ≤ C/(P/2)2 = 40, 000/(30/2)2 ≈ 177.78 Mbps                       workload as the base VM workload and apply the Gridiron technique
                                                                            to generate realistic VDC workloads. We leave this to future work. which means that the VDC workloads will be free from problematic-
by-construction network-bound failures as long as vlinks’ bandwidth            The same Azure team released version 2 (V2) of the Resource
do not exceed 177 Mbps. ",cs.DC,A,-0.020614523,-0.14925674,0.06864717
http://arxiv.org/pdf/2201.04614v1,SIMD Lossy Compression for Scientific Data,"For CESM and Hurricane data, we
% of Theoretical Achieved                                                          improve rate-distortion up to 18.9% and 32% respectively. This improvement can be further advanced by future work,
TABLE III: Theoretical and actual speedup for vecSZ over it’s                      such as implementation of an improved compression method
serial implementation, pSZ, averaged for all applications. for remaining outlier data, which we currently handle via a
                                                                                   lossless compressor pass. ",cs.DC,B,-0.22043797,0.10257472,0.01811183
http://arxiv.org/pdf/2201.05429v1,Energy-efficient workflow scheduling based on workflow structures under deadline and budget constraints in the cloud,"Workﬂow                                   REEWS     SMWSO   SMWSH           determined, it can help to produce better results. MONTAGE 50                                       3          2       1             In our future work, we intend to investigate on the schedul-
MONTAGE 100                                      3          2       1
MONTAGE 200                                      3          1       1          ing of multiple concurrent workﬂows, and also to deal with
MONTAGE 500                                      3          1       1          the uncertainty nature of cloud environments by using machine
                                                                               learning. MONTAGE 1000                                 3           1              1                  CONFLICT OF INTEREST

CYBERSHAKE 50                                1           3              2

CYBERSHAKE 100                               1           3              1      The authors declare that they have no conﬂict of interest. ",cs.DC,A,0.06359726,-0.12924741,0.20541784
http://arxiv.org/pdf/2201.05872v1,QoS-Aware Resource Placement for LEO Satellite Edge Computing,"6 Discussion & Future Work

We have shown how the d-hops placement algorithm for 2D tori can be extended
for QoS-aware resource placement in satellite networks. Nevertheless, some open
questions remain that warrant further research. 6.1 Application for Service Placement

Unlike static compute resource placement, service placement, e.g., placing a
database within a given distance of clients on the satellite network, can leverage
service migration. ",cs.DC,A,0.09424333,-0.19147635,-0.10208038
http://arxiv.org/pdf/2201.05872v2,QoS-Aware Resource Placement for LEO Satellite Edge Computing,"Nevertheless, some open questions remain
mean 10ms. In case of the Starlink B shell, the low number          that warrant further research. of planes leads to a high distance between planes. ",cs.DC,B,-0.041094325,0.17014521,0.07779533
http://arxiv.org/pdf/2201.06843v1,Surrogate-assisted distributed swarm optimisation for computationally expensive models,"362. [6] K.-F. Man, K.-S. Tang, S. Kwong, Genetic algorithms: concepts and ap-
   In future work, the parallel optimisation process could be im-            plications [in engineering design], IEEE transactions on Industrial Elec-
proved by a combination of diﬀerent optimisation algorithms                  tronics 43 (5) (1996) 519–534. which can provide diﬀerent capabilities in terms of exploration         [7] A. Ponsich, A. L. Jaimes, C. A. C. Coello, A survey on multiobjec-
and exploitation of the search space. ",cs.DC,B,-0.19728035,0.06323545,0.11121807
http://arxiv.org/pdf/2201.07215v1,Layerwise Geo-Distributed Computing between Cloud and IoT,"Though the division number M is not explicitly discussed
this time, it is an important factor which impacts the final performance of data processing. It is necessary to investigate the factor
with scalability in future work [26]. Acknowledgment

This work is partly supported by Special Fund for Strategic Pilot Technology of Chinese Academy of Sciences under Grant No. ",cs.DC,B,-0.21746683,0.14843038,-0.0064205956
http://arxiv.org/pdf/2201.07435v1,Workflows Community Summit: Tightening the Integration between Computing Facilities and Scientific Workflows,"These workﬂow systems are created and used by thousands
of researchers and developers, leading to a rapidly growing corpus of workﬂows research publications. The
resulting workﬂow system technology landscape is fragmented, which may present signiﬁcant barriers for
future workﬂow users due to many seemingly comparable, yet usually mutually incompatible, systems that
exist. In order to tackle some of the challenges described above, the DOE-funded ExaWorks [4] and NSF-funded
WorkﬂowsRI [5] projects have organized in 2021 a series of events entitled the “Workﬂows Community
Summit”. ",cs.DC,A,0.138628,-0.2012181,0.32818753
http://arxiv.org/pdf/2201.07598v1,Near-Optimal Sparse Allreduce for Distributed Deep Learning,"exhibits better scalablity than the allgather-based sparse                                                                We foresee that our scheme will play an important role in
allreduce, but its communication overhead also significantly                                                              scalable distributed training for large-scale models with low
increases, since the more workers, the more severe the fill-                                                              communication overhead. In future work, we aim to further
in problem [36]. On 256 GPUs, O𝑘-Top𝑘 outperforms all                                                                     utilize O𝑘-Top𝑘 to reduce the communication overhead in
counterparts by 3.29x-12.95x. ",cs.DC,B,-0.28301278,0.04773191,-0.23003086
http://arxiv.org/pdf/2201.07598v2,Near-Optimal Sparse Allreduce for Distributed Deep Learning,"exhibits better scalablity than the allgather-based sparse                                                                We foresee that our scheme will play an important role in
allreduce, but its communication overhead also significantly                                                              scalable distributed training for large-scale models with low
increases, since the more workers, the more severe the fill-                                                              communication overhead. In future work, we aim to further
in problem [36]. On 256 GPUs, O𝑘-Top𝑘 outperforms all                                                                     utilize O𝑘-Top𝑘 to reduce the communication overhead in
counterparts by 3.29x-12.95x. ",cs.DC,B,-0.28301278,0.04773191,-0.23003086
http://arxiv.org/pdf/2201.07705v1,"GEMEL: Model Merging for Memory-Efficient, Real-Time Video Analytics at the Edge","§A lists these values per workload. parallelism for merged models to future work. 3 Motivation
Workload construction. ",cs.DC,A,-0.14562514,-0.08823646,0.20959668
http://arxiv.org/pdf/2201.08228v1,High Performance Parallel I/O and In-Situ Analysis in the WRF Model with ADIOS2,"Data from multiple compute ranks are         • E3SM [17]
      merged (”quilted”) together by a dedicated I/O rank by          • Trilinos [18]
      means of MPI communication calls and kept in system             • PETSc [19]
      memory until they are written to PFS. This option is not
      investigated in this work, but should be investigated in        ADIOS2 offers a number of different engines that can be
      future works. selected at runtime. ",cs.DC,B,-0.16228324,-0.07844874,-0.15670556
http://arxiv.org/pdf/2201.08440v1,A Guide to Particle Advection Performance,"The third type of gap is in cost modeling. While our              [7] T. McLoughlin, R. S. Laramee, R. Peikert, F. H. Post, and M. Chen,
cost model is useful in the context of providing a guide for                 “Over two decades of integration-based, geometric ﬂow visualization,”
particle advection performance, future work could make the                   in Computer Graphics Forum, vol. 29, no. ",cs.DC,B,-0.15891185,0.0539639,0.20399204
http://arxiv.org/pdf/2201.08560v1,Bit-GraphBLAS: Bit-Level Optimizations of Matrix-Centric Graph Processing on GPU,"concurrent binary-neural-networks for acceleration [38], Bit-
                                                                       GraphBLAS can also be extended to support heterogeneous
   For Bit-GraphBLAS, in the 521 binary matrices dataset,              graphs with short bit-width. We set this as future work. the patterns with better performance fall into three main
categories: diagonal, block, and stripe (reference the classi-            Platform Portability: Although in the evaluation we show-
ﬁcation in Table V). ",cs.DC,B,-0.31070337,0.10710448,-0.20325822
http://arxiv.org/pdf/2201.08560v2,Bit-GraphBLAS: Bit-Level Optimizations of Matrix-Centric Graph Processing on GPU,"concurrent binary-neural-networks for acceleration [39], Bit-
                                                                      GraphBLAS can also be extended to support heterogeneous
   For Bit-GraphBLAS, in the 521 binary matrices dataset,             graphs with short bit-width. We set this as future work. the patterns with better performance fall into three main
categories: diagonal, block, and stripe (reference the classi-           Platform Portability: Although in the evaluation we show-
ﬁcation in Table V). ",cs.DC,B,-0.3103702,0.10899192,-0.20525604
http://arxiv.org/pdf/2201.09242v1,Task Scheduling in Cloud Computing Using Hybrid Meta-heuristic: A Review,"In section 4, a

literature review of hybrid meta-heuristic techniques for scheduling is presented. Section 5 and 6 gives a tabular
summary of the related works and comparison of performance metrics respectively and the conclusion and the
future work are presented in section 7. 2 Task Scheduling In Cloud

The task scheduling in cloud environment is an NP-complete problem so it is hard to find an optimal solution in
polynomial time. ",cs.DC,A,0.013034828,-0.31353542,0.10952836
http://arxiv.org/pdf/2201.09356v1,SToN: A New Fundamental Trade-off for Distributed Data Storage Systems,"This implies that the ideal storage solution for some of the distributed
environments such as Fog computing cannot satisfy the properties we expect. As future work, we plan to extend our
proof for emerging data locator protocols if they ever appear in literature and look for methods to achieve the best
compromise between these properties for a given distributed system application. References

 [1] Flavio Bonomi, Rodolfo Milito, Jiang Zhu, and Sateesh Addepalli. ",cs.DC,A,0.2500072,-0.096770875,-0.26700073
http://arxiv.org/pdf/2201.09539v1,A Blockchain-Based Distributed Computational Resource Trading System for Industrial Internet of Things Considering Multiple Preferences,"167, p.
                                                                                              102710, 2020.
ing. Therefore, combining our resource trading strategy with
computational workload prediction will be another direction                             [20] Y. Lu, X. Huang, Y. Dai, S. Maharjan, and Y. Zhang, “Blockchain and
of our future work. federated learning for privacy-preserved data sharing in industrial IoT,”
                                                                                              IEEE Transactions on Industrial Informatics, vol. ",cs.DC,C,0.27716357,-0.012030583,0.05561887
http://arxiv.org/pdf/2201.09539v2,A Blockchain-Based Distributed Computational Resource Trading System for Industrial Internet of Things Considering Multiple Preferences,"167, p.
                                                                                              102710, 2020.
ing. Therefore, combining our resource trading strategy with
computational workload prediction will be another direction                             [20] Y. Lu, X. Huang, Y. Dai, S. Maharjan, and Y. Zhang, “Blockchain and
of our future work. federated learning for privacy-preserved data sharing in industrial IoT,”
                                                                                              IEEE Transactions on Industrial Informatics, vol. ",cs.DC,C,0.27716357,-0.012030583,0.05561887
http://arxiv.org/pdf/2201.09539v3,A Blockchain-Based Distributed Computational Resource Trading System for Industrial Internet of Things Considering Multiple Preferences,"Finally, computational workload prediction

                               6                                                                   can help to bring more intelligence to collaborative com-

                               4                                                                   putation task ofﬂoading. Therefore, combining our resource

                               2                                MPM                                trading strategy with computational workload prediction will
                                                                DA
                                       corr = −0.9752                                              be another direction of our future work. 0                                                                                                REFERENCES

                                   0.4      0.5       0.6       0.7       0.8       0.9       1.0   [1] Y. Gao, “Using artiﬁcial intelligence approach to design the product
                                                                                                         creative on 6G industrial internet of things,” International Journal of
                                                 Requester Reputation                                    Systems Assurance Engineering and Management, vol. ",cs.DC,A,0.0618971,-0.19357839,0.1496208
http://arxiv.org/pdf/2201.09833v1,Cache Allocation in Multi-Tenant Edge Computing via online Reinforcement Learning,"3: Sensitivity of the system                                                            art SPSA. As part of the future work, we intend to consider

                  0.8     Q-Learning      SPSA     Optimal                          100                                            scenarios with time varying popularity and to extend our work
                                                                                     50
                  0.7                                                                  0                                           to multiple resources e.g., storage, CPU, RAM, etc. We would
                                                                                    −50
                  0.6                                                              −100                                            also consider a distributed scenario with multiple edge nodes. ",cs.DC,A,-0.0022877967,-0.021255456,0.07191315
