url,title,further research,primary category,label,x,y,z
http://arxiv.org/pdf/2203.14719v1,Tackling the Crowdsourced Delivery Problem at Scale through a Set-Partitioning Formulation and Novel Decomposition Heuristic,"38
Yang et al (2022)
Moreover, a future crowdsourced delivery system may include connected automated vehicles (CAVs) that
are owned by individuals but rented out to logistics providers during certain portions of the day. Therefore,
further research could combine the usage of shared CAVs for people trips and PDO delivery to achieve
better objectives, such as reducing the carbon emission and the total cost. Another research direction involves integrating crowdsourced delivery with other modes of freight and
passenger transport, such as transit vehicles or drones. ",cs.DC,A,0.30320495,-0.12760393,0.19178064
http://arxiv.org/pdf/2203.14801v1,SyncMesh: Improving Data Locality for Function-as-a-Service in Meshed Edge Networks,"Future Generation
                                                                                                   Computer Systems 114 (2021). In future work we plan to further extend the SyncMesh proto-
type, include more complex analysis workloads and evaluate our                               [22] Maryam Sheikh Sofla, Mostafa Haghi Kashani, Ebrahim Mahdipour, and Reza
approach on real-world edge devices. In addition, we intend to                                     Faghih Mirzaee. ",cs.DC,A,-0.0669711,-0.1413276,-0.18449022
http://arxiv.org/pdf/2203.14803v1,MixNN: A design for protecting deep learning models,"... In our future work, we will consider whether non-interactive
                                                                   zero knowledge proof [24], [25] can be used to verify each
                  ci−1 = Epki−1 (op = 3, ci, Ai),                  layer’s input and output. ci = Epki (op = 3, cn, An),
                                    ...                            C. Model privacy

                      cn = Epkn (op = 3, Au). ",cs.DC,C,0.14020894,0.44899118,0.060509995
http://arxiv.org/pdf/2203.14803v2,MixNN: A design for protecting deep learning models,"If he/she ﬁnds any problems in that phase, the designer should replace
the current n layers with new ones. In our future work, we will consider whether non-interactive zero knowledge
proof [23, 24] can be used to verify each layer’s input and output. 4.3. ",cs.DC,C,0.07251291,0.35383213,-0.04273252
http://arxiv.org/pdf/2204.00470v1,Continuous Integration of Data Histories into Consistent Namespaces,"The ability to replicate state with
    In this paper we’ve written down a deterministic interleaving   ‘Just In Time’ streaming of just the necessary dependencies is
process for clocking proper process time over a spanning            a realistic alternative to extensive caching, and this could be
network of data handlers [2], in which the propagation of           optimized with machine learning enabled smart caching. Many
key value versions is automated, following the principles well      details remain that we’ll return to in future work. known in Internet address scaling. ",cs.DC,A,0.0049860426,-0.120026514,-0.11319387
http://arxiv.org/pdf/2204.00711v1,Optimizing Error-Bounded Lossy Compression for Three-Dimensional Adaptive Mesh Refinement Simulations,"2014. A
                                                                                                                      survey of high level frameworks in block-structured adaptive mesh refinement
   In future work, we will apply our hybrid compression approach                                                      packages. J. ",cs.DC,B,-0.20279351,0.101189695,0.010576247
http://arxiv.org/pdf/2204.00711v2,TAC: Optimizing Error-Bounded Lossy Compression for Three-Dimensional Adaptive Mesh Refinement Simulations,"With our level-wised compression approach, we are able to
                                                                          tune the error-bound ratio of fine and coarse levels to be 3:1 and 2:1
3D baseline   CR    Rel Mass Diff  Cell Nums Diff                         for better power-spectrum and halo-finder analyses, respectively,
 TAC (1:1)   198.5      6.66E-04          39.00                           under the same compression ratio. TAC (2:1)   198.5      4.97E-04          28.00
             198.6     4.49E-04          25.00                               In future work, we will apply our hybrid compression approach
                                                                          to more AMR simulations. We will also address the issue of rela-
   Similar to the error-bound configuration analysis done for power       tively low throughput on small AMR datasets. ",cs.DC,B,-0.3711236,0.096354105,0.052163076
http://arxiv.org/pdf/2204.00711v3,TAC: Optimizing Error-Bounded Lossy Compression for Three-Dimensional Adaptive Mesh Refinement Simulations,"With our level-wised compression approach, we are able to
                                                                          tune the error-bound ratio of fine and coarse levels to be 3:1 and 2:1
3D baseline   CR    Rel Mass Diff  Cell Nums Diff                         for better power-spectrum and halo-finder analyses, respectively,
 TAC (1:1)   198.5      6.66E-04          39.00                           under the same compression ratio. TAC (2:1)   198.5      4.97E-04          28.00
             198.6     4.49E-04          25.00                               In future work, we will apply our hybrid compression approach
                                                                          to more AMR simulations. We will also address the issue of rela-
   Similar to the error-bound configuration analysis done for power       tively low throughput on small AMR datasets. ",cs.DC,B,-0.3711236,0.096354105,0.052163076
http://arxiv.org/pdf/2204.00764v1,A Study of Real-World Data Races in Golang,"races in Go programs. We hope that this work will inspire                        https://pkg.go.dev/sync/atomic
future work towards enabling dynamic race detection during
continuous integration, developing program analyses for de-                [22] Oracle Corp. ∼2022. Java Futures. ",cs.DC,A,0.1190453,-0.1348679,0.03424764
http://arxiv.org/pdf/2204.00764v2,A Study of Real-World Data Races in Golang,"Or-
races in Go programs. We hope that this work will inspire                        acle Corp. https://docs.oracle.com/javase/tutorial/java/javaOO/
future work towards enabling dynamic race detection during                       lambdaexpressions.html
continuous integration, developing program analyses for de-
tecting Go races, and designing language features such that                [24] Golang developers ∼2022. Welcome to a tour of Go. ",cs.DC,A,0.030196609,-0.0795595,0.09078521
http://arxiv.org/pdf/2204.00843v1,Privacy-preserving Anomaly Detection in Cloud Manufacturing via Federated Transformer,"1–33, 2015.
methods on four benchmark data sets. In future work, we will
explore a framework for real-time detection of data anomalies                    [16] M. Ozsoy, K. N. Khasawneh, C. Donovick, I. Gorelik, N. Abu-Ghazaleh,
at each edge device under the premise of protecting data                               and D. Ponomarev, “Hardware-based malware detection using low-level
privacy and ﬁnding new abnormal situations. architectural features,” IEEE Transactions on Computers, vol. ",cs.DC,B,-0.026361024,-0.012223133,0.020023031
http://arxiv.org/pdf/2204.00878v1,Find Another Me Across the World -- Large-scale Semantic Trajectory Analysis Using Spark,"By default, we apply 3-Sequential Shingling in our
                                                             SSH algorithm which means that trajectories with less
    • Centralized: This is a centralized approach that       than three matching locations will not be considered
         performs the calculation on the entire dataset. for further analysis. The reason to use at least 3-
         It calculates the semantic similarity of each pair  sequential shingling is due to the consideration that
         of trajectories. ",cs.DC,B,-0.032312185,0.0969775,0.012276041
http://arxiv.org/pdf/2204.00979v1,Breaking Blockchain's Communication Barrier with Coded Computation,"FUTURE WORK AND CONCLUDING REMARKS

   This paper focuses on verifying the validity of new transactions, but does not discuss how nodes can learn if an old transaction
has already been redeemed. Directions for future work include incorporating light nodes, and developing algorithms for them

                                                                       17
Bit Complexity (P d2 log N )  100

                              50

                              0           5  10  15  20            25                                        30
                                       0

                                             Security Level µ (%)

Fig. 3. ",cs.DC,C,0.2722937,0.23044008,-0.13737184
http://arxiv.org/pdf/2204.01202v1,ScaleSFL: A Sharding Solution for Blockchain-Based Federated Learning,"ceedings of the 2016 ACM SIGSAC conference on computer and communications
                                                                                                  security, pages 308–318, 2016. As ongoing and future work, we further explore the details of
a sharded solution applied to the blockchain. Specifically, we aim                          [18] Anifat M. Olawoyin, Carson K. Leung, and Qi Wen. ",cs.DC,C,0.36869457,0.19112563,-0.16111541
http://arxiv.org/pdf/2204.01872v1,Internet of Things: System Reference Architecture,"Portions of the developed algorithms, such as inference engines, that require fewer execution
resources can be placed at the edge nodes. The two sides tend to work in tandem, with the edge
executing algorithms locally to generate inferences and act upon them and/or report them to the cloud
for further analysis and model improvements as appropriate. 5 IOT SYSTEM CLOUD COMPONENTS

   This section describes cloud components that provide the IoT system functionality. ",cs.DC,A,0.09713137,-0.29533657,-0.012561057
http://arxiv.org/pdf/2204.02235v1,At the Locus of Performance: A Case Study in Enhancing CPUs with Copious 3D-Stacked Cache,"Figure 1 overviews our           We choose to base our future processor design on the
result, and we see that for a subset of problem sizes, the 3-times  A64FX processor [29]. The Arm-based A64FX processor
larger L3 capacity of Milan-X yields up-to 3.4x improvements        from Fujitsu is currently powering Supercomputer Fugaku [5],
over baseline Milan for this memory-bound application, which        which, as of April 2022, leads the TOP500 [30] (for HPL
motivates us to further research 3D-stacked caches. and HPCG; cf. ",cs.DC,B,-0.34080473,-0.12862498,-0.114218876
http://arxiv.org/pdf/2204.02869v1,Characterization of different user behaviors for demand response in data centers,"It is a radical behavior but to be considered in a suﬃciency approach. 7 Conclusion and future works

In this paper, we study four diﬀerent ways for a user of a data center to curtail
her load for a certain period of time by changing submission behavior. These
User behaviors for demand response in data centers  13

behaviors are delaying, degrading, reconﬁguring or renouncing to the jobs dur-
ing the time period. ",cs.DC,A,0.23060429,-0.23901603,0.14536154
http://arxiv.org/pdf/2204.03413v1,On the Price of Locality in Static Fast Rerouting,"In other             packet bounces back (distance to source = 2). We only visit
words, there is a fundamental distinction between r = 1 and              a node v of distance 3 if v = t. Moreover, if the st-distance
all larger r, which is to be investigated in future work:                is at most 3, we will also reach t from s, as (without the hop
                                                                         to the destination or stopping when ﬁnding the destination),
Theorem 2. For each r ∈ N : r ≥ 2 holds: There exists an                 our algorithm traverses all links E1 incident to the destination
r-tolerant graph G with a minor G that is not r-tolerant. ",cs.DC,C,0.059281804,0.25002962,-0.15506938
http://arxiv.org/pdf/2204.04312v1,The History of the Grid,"11. Summary and future work

Technology pundit George Gilder remarked in 2000 [90] that “when the
network is as fast as the computer’s internal links, the machine
disintegrates across the net into a set of special purpose appliances.” It is
this disintegration that underpins the Grid (and, more recently, the cloud)
vision of on-demand, elastic access to computer power. High-speed
networks also allow for the aggregation of resources from many
distributed locations, often within the contexts of virtual organizations;
this aggregation has proved to be equally or even more important for
many users. ",cs.DC,A,0.10565756,-0.3073733,-0.03556478
http://arxiv.org/pdf/2204.04371v1,Learning to Dispatch Multi-Server Jobs in Bipartite Graphs with Unknown Service Rates,"As an example, the most   also suitable for accumulated queuing and latency mini-
classic policy JSQ [16] dispatches each new arrvied job to the   mization. We leave this to our future work. shortest queue available. ",cs.DC,A,0.13414061,-0.10831983,-0.092871584
http://arxiv.org/pdf/2204.04599v1,Optimal Round and Sample-Size Complexity for Partitioning in Parallel Sorting,"oblivious sorting algorithms. However, lower bounds are not known
                                           2                                                 in those contexts, we leave this for future work. We believe our input
                                                                                             distribution and the technique to applying distribution theory of
    We note that 𝑌𝑖 assumes events 𝑌2, . ",cs.DC,C,0.11063534,0.48793405,-0.056765445
http://arxiv.org/pdf/2204.04599v2,Optimal Round and Sample-Size Complexity for Partitioning in Parallel Sorting,"oblivious sorting algorithms. However, lower bounds are not known
                                           2                                                 in those contexts, we leave this for future work. We believe our input
                                                                                             distribution and the technique to applying distribution theory of
    We note that 𝑌𝑖 assumes events 𝑌2, . ",cs.DC,C,0.11063534,0.48793405,-0.056765445
http://arxiv.org/pdf/2204.04599v3,Optimal Round and Sample-Size Complexity for Partitioning in Parallel Sorting,"oblivious sorting algorithms. However, lower bounds are not known
                                           2                                                 in those contexts, we leave this for future work. We believe our input
                                                                                             distribution and the technique to applying distribution theory of
    We note that 𝑌𝑖 assumes events 𝑌2, . ",cs.DC,C,0.11063531,0.487934,-0.05676543
http://arxiv.org/pdf/2204.04599v4,Optimal Round and Sample-Size Complexity for Partitioning in Parallel Sorting,"However, lower bounds are not known                                                     Mathematics, USA, 938–948. in those contexts, we leave this for future work. We believe our input
distribution and the technique to applying distribution theory of                                               [18] Tom Leighton. ",cs.DC,C,0.059229985,0.46232888,0.1665372
http://arxiv.org/pdf/2204.04599v5,Optimal Round and Sample-Size Complexity for Partitioning in Parallel Sorting,"Related partitioning problems: [5] studied sorting algorithms with asymmetric read and write
costs while [7, 6] studied cache oblivious sorting algorithms. However, lower bounds are not
known in those contexts, we leave this for future work. We believe our input distribution and
the technique to applying distribution theory of runs can be a valuable tool in addressing other
theoretical problems such as semisort [14] and quantile computation [9]. ",cs.DC,B,-0.06293586,0.25032845,-0.14619672
http://arxiv.org/pdf/2204.04633v1,A Distributed Real-Time Recommender System for Big Data Streams,"Additionally, the splitting and replication mechanism can be
tested with other streaming recommender algorithms and with diﬀerent forgetting tech-
niques like sliding window and gradual forgetting. These are also interesting directions
for future work. Acknowledgment

    The work by Ahmed Awad is funded by the European Regional Development Funds
via the Mobilitas Plus programme (grant MOBTT75). ",cs.DC,C,0.07655847,0.067775615,0.06506814
http://arxiv.org/pdf/2204.05710v1,Computing Without Borders: The Way Towards Liquid Computing,"Although consuming no
exam sessions on CrownLabs [31], an open-source project              local resources, they are nonetheless present in etcd, partially
started during the coronavirus pandemic onset to deliver remote      counting towards the Kubernetes limits. This is inherent in the
computing laboratories, later extended and integrated with           VK approach: future work could focus on additional ofﬂoading
the ofﬁcial exams platform of our university. It allows each         solutions that are more suitable for high cardinality scenarios,
candidate to access her own dedicated remote application             trading off full API compliance with increased scalability. ",cs.DC,A,0.09959565,-0.21452612,0.21298824
http://arxiv.org/pdf/2204.05710v2,Computing Without Borders: The Way Towards Liquid Computing,"RELATED WORK
local resources, they are nonetheless present in etcd, partially
counting towards the Kubernetes limits. This is inherent in the        The effort towards a transparent resource continuum dates
VK approach: future work could focus on additional ofﬂoading        back to the eighties and the concept of distributed operating
solutions that are more suitable for high cardinality scenarios,    systems, aiming to abstract a set of independent, autonomous
trading off full API compliance with increased scalability. and communicating CPUs that appear to users as a single
                                                                    computer [34], [35]. ",cs.DC,A,0.15373954,-0.35228127,0.045537136
http://arxiv.org/pdf/2204.06282v1,Celestial: Virtual Software System Testbeds for the LEO Edge,"To
                                                                          further improve the accuracy of emulated testbeds, experiences
6.7 Future Work on LEO Edge Systems                                       and data of real LEO edge deployments are needed. We hope that
                                                                          Celestial, which we have published as open-source, can be of
With its scale and dynamic topology, the LEO edge poses signif-           great use in this further research on and development of LEO edge
icant challenges for applications. To simplify the deployment of          computing. ",cs.DC,B,-0.1459451,-0.11183017,-0.043390974
http://arxiv.org/pdf/2204.06282v2,Celestial: Virtual Software System Testbeds for the LEO Edge,"To
                                                                          further improve the accuracy of emulated testbeds, experiences
6.7 Future Work on LEO Edge Systems                                       and data of real LEO edge deployments are needed. We hope that
                                                                          Celestial, which we have published as open-source, can be of
With its scale and dynamic topology, the LEO edge poses signif-           great use in this further research on and development of LEO edge
icant challenges for applications. To simplify the deployment of          computing. ",cs.DC,B,-0.1459451,-0.11183017,-0.043390974
http://arxiv.org/pdf/2204.07104v1,cu_FastTucker: A Faster and Stabler Stochastic Optimization for Parallel Sparse Tucker Decomposition on Multi-GPUs,"The experimental results show that cuFast-
                0.696915 (3.62X)      1.761734 (2.61X)           Tucker has linear computational time and space overheads
cuFastTucker         0.192428                                    and cuFastTucker runs at least 2.62X and at most 747.54X
                                           0.672929              faster than STODA approaches. In the future works, we
                                                                 will explore how to take advantages of cuFastTucker to
6.3 Comparison with STOA Approaches                              accelerate and compress modern Deep Neural Networks,
                                                                 etc, CNN, LSTM, RNN, and Transformer. Fig. ",cs.DC,B,-0.44041914,0.016714899,-0.09231242
http://arxiv.org/pdf/2204.07336v1,Preparing for the Future -- Rethinking Proxy Apps,"Together with a curated list of micro-benchmarks and slimmed-
down number of (non-overlapping) proxy-application, these Octopodes build the targets for the co-design, where
micro-benchmarks are used to specify and test the necessary peak performance of a system, Octopodes are to be used
in conjunction with other co-design tools (e.g. architecture simulators) to select the best hardware for existing and
predicted/future workload by the co-design team and the hardware vendor. To demonstrate the hardware capabilities,
the vendors shall be allowed more tuning freedom for the Octopodes, i.e., changes of algorithm, implementation,
integer/ﬂoating-point precision, data layout, etc., as long as the intended result remains the same, the changes are
properly communicated, and not only the algorithm is benchmarked (but also the necessary time for the pre/post-
execution transformation of the data). ",cs.DC,A,-0.22256495,-0.17714168,0.021006146
http://arxiv.org/pdf/2204.07725v1,Is Blockchain for Internet of Medical Things a Panacea for COVID-19 Pandemic?,"We also provide use cases of
                                        blockchain-enabled IoMT on ﬁghting against the COVID-19 pandemic, including the prevention of infectious diseases,
                                        location sharing and contact tracing, and the supply chain of injectable medicines. We also outline future work in this
                                        area. Keywords: Blockchain, Internet of Medical Things, Security, Privacy, COVID-19

                                        1. ",cs.DC,C,0.39871234,0.04571645,-0.053959917
http://arxiv.org/pdf/2204.08354v1,Unveiling User Behavior on Summit Login Nodes as a User,"The login nodes on an HPC system represent a gateway to the system
which is often overlooked when considering the capabilities and performance of
the overall system. We argue that the experience on the login nodes may impact
a user’s perception of and behavior on the system, thus inﬂuencing whether and
how the user continues to utilize that system in future work. In this paper, we attempt to identify long-term usage patterns by collecting
observational data on the login nodes from the Summit leadership class super-
computer hosted at the Oak Ridge Leadership Computing Facility (OLCF) at
Oak Ridge National Laboratory (ORNL). ",cs.DC,A,0.10879078,-0.23934451,0.24195269
http://arxiv.org/pdf/2204.08962v1,"CEDR -- A Compiler-integrated, Extensible DSSoC Runtime","Section 6 discusses other work in this area and contextualizes CEDR within
it. Finally, Section 7 concludes by summarizing this work and discussing avenues for future work. 2 CEDR OVERVIEW

CEDR is composed of two components: a compilation workflow and a runtime workflow. ",cs.DC,C,0.053279117,0.0728294,0.21341714
http://arxiv.org/pdf/2204.09437v1,Search-based Methods for Multi-Cloud Configuration,"Micky:
cost and time savings in production. As future work, we are                             A cheaper alternative for selecting cloud instances. In 2018 IEEE 11th
planning to perform a similar in-depth study, but for another                           International Conference on Cloud Computing (CLOUD), pages 409–416,
category of workloads, namely ML inference applications. ",cs.DC,A,-0.030071655,-0.34912738,0.11885663
http://arxiv.org/pdf/2204.09796v1,Distributed Runtime Verification of Metric Temporal Properties for Cross-Chain Protocols,"We conducted
                         TransferFrom = alice                              extensive synthetic experiments on trace generated by the
                                                                           UPPAAL tool and a set of blockchain smart contracts. + apr.premium.amount
                                                                              For future work, we plan to study the trade off among
   3) Analysis of Results: We put our monitor to test the traces           accuracy and scalability of our approach. Another important
generated by the Trufﬂe-Ganache framework. ",cs.DC,C,0.23740932,0.1665178,0.061200492
http://arxiv.org/pdf/2204.10402v1,Parallel Vertex Cover Algorithms on GPUs,"Since then, and                       difﬁcult instances of the problem and on graphs with high
after a long series of works [5], [33]–[36], the asymptotic                     average degree. Our implementations have been open sourced
upper bound on the running time of PVC was improved to                          to enable further research on parallel solutions to the vertex
O(1.2738k + kn) by Chen et al. [4]. ",cs.DC,B,-0.15735869,0.21424946,-0.1207281
