url,title,further research,primary category,label,x,y,z
http://arxiv.org/pdf/2203.11491v1,Making Recommender Systems Forget: Learning and Unlearning for Erasable Recommendation,"Instead of training models on each group in isolation and
   Speciﬁcally, we take the following three steps to learn col-                  aggregating them, SeqTrain module trains the model on the
laborative embedding: (i) using R to build the correspond-                       whole dataset to preserve collaborative information. We
ing hypergraph; (ii) for each user, performing random walk                       achieve this by training the model sequentially on all groups,
to obtain its relations, which transforms the task to sequence                   and we further study the effect of training order. embedding; (iii) applying the sequence embedding technique,
e.g., Word2Vec [Church, 2017], to learn the collaborative em-                    Training Order
bedding. ",cs.IR,A,0.10723229,0.18284097,-0.13644567
http://arxiv.org/pdf/2203.13088v1,Introducing Neural Bag of Whole-Words with ColBERTer: Contextualized Late Interactions using Enhanced Reduction,"lines 6 & 8), only the reduced recall of the BOW2 indexing is carried
                                                                         over. This a great result for the robustness of our system, it shows
   A curious path for future work based on the results of Table 3        that it can be deployed in a variety of approaches, and practitioners
would be to use a conservative loss setting (such as line 6) that does   are not locked into a specific retrieval approach. For example if one
not force a lot of the word removal gates to become zero (so as to       has made large investments in an inverted index system, they could
not take away capacity from the loss surface for the ranking tasks),     build on these investments with Uni-ColBERTer. ",cs.IR,A,-0.11353995,0.079290494,-0.24717721
http://arxiv.org/pdf/2203.13769v1,An Audit of Misinformation Filter Bubbles on YouTube: Bubble Bursting and Recent Behavior Changes,"Real users also like or dislike
videos, subscribe to channels, leave comments or click on the search results or recommendations. A more human-like
bot simulation, with these interactions and possible inclusion of human biases bursting remains our future work. Nevertheless, our audit showed that YouTube (similar to other platforms), despite their best efforts so far, can
still promote misinformation seeking behavior to some extent. ",cs.IR,B,0.106518455,0.047357414,0.35831523
http://arxiv.org/pdf/2203.13995v1,Transfer of codebook latent factors for cross-domain recommendation with non-overlapping data,"Section 4 discusses the experimental results. Section 5 contains the conclusion and
future work. 2 Related Work

Though collaborative ﬁltering based recommender systems have become the norm these days, they have trouble in
making accurate recommendations due to data sparsity problem, i.e., very little actual information available. ",cs.IR,B,0.26449913,-0.049131766,0.06910776
http://arxiv.org/pdf/2203.14037v1,Data Augmentation Strategies for Improving Sequential Recommender Systems,"• We suggest the possibility of further performance improvements of other current state-of-the-art models, where
           data augmentation is applied in the preprocessing step while maintaining the overall model architecture. In this
           regard, we expect that future works can verify if data augmentation can serve as an universal preprocessing
           technique in the design of recommender systems. 2 Related Works

2.1 Sequential Recommendation

Traditional recommendation aims to model general and global preferences of users based on the assumption that user-
item relationships are not dynamic but static, which is intrinsically bound to ignore the order of user-item interactions
in the model. ",cs.IR,B,0.43803418,-0.035210125,-0.0244861
http://arxiv.org/pdf/2203.14232v1,Leveraging Search History for Improving Person-Job Fit,"Besides search history, there are other kinds of side information for person-
job ﬁt. As future work, we will consider developing a more general approach to
leverage various kinds of side information in a uniﬁed way. Acknowledgements

This work was partially supported by the National Natural Science Foundation
of China under Grant No. ",cs.IR,A,-0.14651786,0.18530945,0.18024528
http://arxiv.org/pdf/2203.14541v1,Specialized Document Embeddings for Aspect-based Similarity of Research Papers,"2018. Explicit Retrofitting of Distributional Word
uation with user feedback is subject to future work. Vectors. ",cs.IR,A,-0.032367323,0.3057028,-0.021945821
http://arxiv.org/pdf/2203.15328v1,Compact Token Representations with Contextual Quantization for Efficient Document Re-ranking,"There is an about 1.2%     ColBERTv2. Our future work is to investigate the
improvement using MarginMSE. Figure 2 gives              above issue further and study the use of CQ in other
an explanation why MarginMSE is more effective. ",cs.IR,C,-0.18926525,-0.16341665,-0.046796247
http://arxiv.org/pdf/2203.15789v1,Revisiting Neighborhood-based Link Prediction for Collaborative Filtering,"With the sparse matrix                        tion to existing standard linkage scores. We further study how our
                                                                                          approach is robust to varying levels of interaction noise that could
𝑀 stored in the Compressed Sparse Row (CSR) format, calculating                           be seen in real-world data. In total, we craft this section to answer
                                                                                          the following Research Questions (RQ):
      𝑇  𝑀   takes  𝑂 (𝑙  ·  𝑚𝑖𝑛 (𝑢,  𝑖))  time,  where    the  selection    between  𝑢
                                                                                               • RQ1: How does our proposed method perform compared to
𝑀𝑀                                                                                                competitive SOTA works? ",cs.IR,C,-0.06476698,-0.1037799,-0.06029585
http://arxiv.org/pdf/2203.15876v1,Self-Supervised Learning for Recommender Systems: A Survey,"1–38, 2019.
when combined with the technique of knowledge distilla-
tion [148], [149], SSL may largely compensate for the ac-                   [7] X. Liu, F. Zhang, Z. Hou, L. Mian, Z. Wang, J. Zhang, and
curacy degradation of on-device recommendation models. J. Tang, “Self-supervised learning: Generative or contrastive,”
Currently, on-device self-supervised recommendation has                             IEEE TKDE, 2021.
not been explored, and we believe it deserves further study. [8] K. He, H. Fan, Y. Wu, S. Xie, and R. Girshick, “Momentum con-
9.5 Towards General-Purpose Pre-training                                            trast for unsupervised visual representation learning,” in CVPR,
                                                                                    2020, pp. ",cs.IR,B,0.22347195,0.007780239,-0.18656272
http://arxiv.org/pdf/2203.16161v1,Recommendation of Compatible Outfits Conditioned on Style,"More interest-
ingly, SATCORec chooses items which can make a pronounced style statement. Since in this paper we have focused on compatibility and employed a traditional
beam search for outﬁt generation, an immediate future work would be to explore
more sophisticated generation algorithms. References

 1. ",cs.IR,C,-0.12580101,-0.07669501,-0.09369311
http://arxiv.org/pdf/2203.16663v1,Robust Reputation Independence in Ranking Systems for Multiple Sensitive Attributes,"However, a more
ﬁne-grained analysis would allow us to understand how robust is the system
when bribing diﬀerent demographic groups (e.g., assessing if minorities are also
more vulnerable). To focus on our core contribution, we leave this perspective
as future work. Despite these limitations, our multi-attribute mitigation method opens to
new avenues of research in the ﬁeld of reputation-based ranking systems, with
a clear connection to other retrieval systems. ",cs.IR,B,0.16948698,0.024919154,0.24536549
http://arxiv.org/pdf/2204.00279v1,Proactively Control Privacy in Recommender Systems,"Second, more sophisticated

platform mechanisms are also worth exploring. Last but not least, deploying online experiments

and analyzing users’ decisions in real-world can facilitate further research. REFERENCES

 [1] Monireh Abdoos. ",cs.IR,A,0.025322283,-0.021868218,0.53856075
http://arxiv.org/pdf/2204.00279v2,Studying the Impact of Data Disclosure Mechanism in Recommender Systems via Simulation,"Recent
mechanism design works also turn to the perspectives of deep neural network based mechanism
designs, which can be explored with our proposed framework. Last but not least, deploying online
experiments and analyzing users’ decisions in real-world can facilitate further researches. ACM Transactions on Information Systems, Vol. ",cs.IR,B,0.05222731,0.027678737,0.06541097
http://arxiv.org/pdf/2204.00280v1,A Versatile Framework for Evaluating Ranked Lists in terms of Group Fairness and Relevance,"are available from https://waseda.box.com/GFR20220401targz . Table 5 shows the corresponding DistrSim scores as well as the                                Our future work includes further investigation of the properties
final revcnt-GF scores. Table 5(a) shows that for Topic 416, GFNMD                         of the similarity functions in the context of group-fair ranking
disagrees with GFJSD and GFRNOD precisely because DistrSimNMD                              evaluation, and implementing this framework in a shared task. ",cs.IR,C,-0.0046656597,-0.12226365,0.016524877
http://arxiv.org/pdf/2204.00281v1,i-Razor: A Neural Input Razor for Feature Selection and Dimension Search in Large-Scale Recommender Systems,"to derive the desired embedding configuration. To further study                 To study the impact of 𝑐𝑝𝑡, we investigate how i-Razor performs
the role of these two components, we propose and compare the                    with the change of 𝑐𝑝𝑡, while fixing other parameters (𝜏 = 0.05, 𝜆 =
following four variants:                                                        0.0001). As shown in Figure 3, larger 𝑐𝑝𝑡 leads to larger value of
                                                                                Params, which is straightforward as more embedding blocks and
   (1) i-Razor+0: using the CPT-based pruning algorithm while                   fields would be reserved. ",cs.IR,C,-0.1654226,-0.06158465,-0.17397645
http://arxiv.org/pdf/2204.00308v1,Model-agnostic Counterfactual Synthesis Policy for Interactive Recommendation,"2018. DRN: A deep reinforcement learning framework
for future works, we are planning to make more exploration to                                   for news recommendation. In Proceedings of the 2018 World Wide Web Conference. ",cs.IR,B,0.26473176,0.120563954,-0.12838256
http://arxiv.org/pdf/2204.00716v1,CharacterBERT and Self-Teaching for Improving the Robustness of Dense Retrievers on Queries with Typos,"These
  con [46];                                                                results suggest that, on queries without typos, using Character-
                                                                           BERT as the core of the dense retrievers’ encoders tends to have
• CharacterBERT-DR+Aug: this relies on our proposed Character-             similar effectiveness as the use of BERT. It is expected, although
  BERT based dense retriever, and uses the augmentation-based typo-        not empirically proven here, that the adaptation of CharacterBERT
  aware training approach by Zhuang and Zuccon [46];                       to the same training regimes of ANCE and TCT-ColBERTv2 would
                                                                           lead to effectiveness similar to these more advance methods: We
• StandardBERT-DR+ST: the BERT-based dense retriever is trained            leave confirming this hypothesis to future work. using our proposed Self-Teaching method: thus is it similar to the
  StandardBERT-DR+Aug where the augmentation-based typo-aware                 We then turn our attention to the results obtained on queries
  training approach is replaced by Self-Teaching                           without typos when training with methods that attempt to make
                                                                           DRs more robust on queries with typos – namely runs f-i, which
• CharacterBERT-DR+ST: this relies on our proposed CharacterBERT           are based on StandardBERT-DR or CharacterBERT-DR and the two
  based dense retriever and our Self-Teaching method. ",cs.IR,A,-0.16088071,0.34069312,-0.25785002
http://arxiv.org/pdf/2204.00716v2,CharacterBERT and Self-Teaching for Improving the Robustness of Dense Retrievers on Queries with Typos,"This is due to the fact that the number of token    do not find statistically significant differences, except for MAP
embeddings constructed by Character-CNNs is usually smaller than       for standardBERT-DR+Aug. We further study on this dataset what
the number of token embeddings constructed by the WordPiece            is the relative percentage of queries with typos that need to be
tokenizer. Thus, for the same query, the self-attention computation    present in a dataset to prefer the use of CharacterBERT-DR+ST over
in the BERT transformer layers is often less time consuming for        StandardBERT-DR. ",cs.IR,A,-0.1466319,0.32615232,-0.27982238
http://arxiv.org/pdf/2204.00752v1,Modeling Dynamic User Preference via Dictionary Learning for Sequential Recommendation,"And similarly the     data. The second future work is to introduce non-linearity
Recurrent Recommender Network (RRN) [62] proposed to            when combing the static user preferences and dynamic user
employ LSTM [22] to capture the dynamics of both users          preferences, which may further improve the performance
and items. Complementary to the RNN-based methods,              of the proposed method [18]. ",cs.IR,B,0.4022503,0.03108731,-0.10693099
http://arxiv.org/pdf/2204.00815v1,Unbiased Top-k Learning to Rank with Causal Likelihood Decomposition,"Once the examination 𝐸 is intervened artificially,
Assumption (3): The click probability on 𝑑 is equal to its rel-
   evance 𝑅(x) if and only if 𝑑 always be examined:

      𝐸 ≡ 1 ⇐⇒ Pr(𝐶 = 1|x) = 𝑅(x). 1

                                                                               Some studies also discuss the trust bias[2, 40], which will be our future work. Conference’17, July 2017, Washington, DC, USA                                                                                                                                   Haiyuan Zhao, et al. ",cs.IR,C,-0.14494826,-0.086472996,0.2682972
http://arxiv.org/pdf/2204.00849v1,Transformer-Empowered Content-Aware Collaborative Filtering,"textual modality, but can be applied to any other modalities that pro-
vide already good item/user representations for recommendation. [12] Danyang Liu, Jianxun Lian, Shiyin Wang, Ying Qiao, Jiun-Hung Chen,
We leave these promising extensions as future work. Guangzhong Sun, and Xing Xie. ",cs.IR,B,0.35649204,0.1490447,-0.008179918
http://arxiv.org/pdf/2204.00926v1,Learning to Augment for Casual User Recommendation,"dation for users who have very few observed interactions [46, 48]. For future work, we are interested in extending such a “learning to
Most of these works rely on side information or contextual data          augment” concept to other application scenarios (e.g., cross-domain,
                                                                         cold-start) for improving the robustness and adaptivity of different
                                                                         recommendation systems. Moreover, we are interested in extend-
                                                                         ing our augmentation policy from the bandit setup studied here to
                                                                         the reinforcement learning setup, where the agent chooses editing
                                                                         actions depending on its previous decisions. ",cs.IR,B,0.2797189,0.07848827,-0.0159101
http://arxiv.org/pdf/2204.00970v1,A Dynamic Meta-Learning Model for Time-Sensitive Cold-Start Recommendations,"Increasing
     No Interactions in the Current Period                      the size didn’t improve the results as shown in Figure 6 for
                                                                three datasets. So, we choose 32 for each attribute and the
We further study the model performance where a user             ﬁnal embedding size is set as 160.
doesn’t have any interaction in the current period. In this
case, our time-speciﬁc module utilizes global user factors in-        Periodical Recommendation Results
stead of user-speciﬁc factors due to lack of interaction, and
hence no adaptation is made. ",cs.IR,B,0.19237785,-0.053842515,0.051013555
http://arxiv.org/pdf/2204.01089v1,Virtual Relational Knowledge Graphs for Recommendation,"applied. Our future work shall investigate how to combine the inference
                                                                          capability of a KG for recommendation. Table 2 presents the experiment results. ",cs.IR,B,0.23393886,-0.07318445,0.045036525
http://arxiv.org/pdf/2204.01089v2,VRKG4Rec: Virtual Relational Knowledge Graphs for Recommendation,"We also want to use our
VRKG4Rec model on MindSpore2 4, which is a new deep learning                                 of the Twenty-Ninth AAAI Conference on Artificial Intelligence, January 25-30,
computing framework. These problems are left for future work. 2015, Austin, Texas, USA. ",cs.IR,C,-0.13512968,-0.07564096,-0.26674783
http://arxiv.org/pdf/2204.01089v3,VRKG4Rec: Virtual Relational Knowledge Graphs for Recommendation,"computing framework. These problems are left for future work. (2)It is labor-intensive and time-consuming when applying on KG
of large scale. ",cs.IR,C,-0.29475248,-0.19600517,0.07168711
http://arxiv.org/pdf/2204.01321v1,PRADA: Practical Black-Box Adversarial Attacks against Neural Ranking Models,"SpanBERT: Improving pre-training by representing and pre-
documents or low-ranked documents. In the future work, we aim                                     dicting spans. TACL 8 (2020), 64–77. ",cs.IR,A,-0.07407753,0.21611354,-0.051261522
http://arxiv.org/pdf/2204.01321v2,PRADA: Practical Black-Box Adversarial Attacks against Neural Ranking Models,"SpanBERT: Improving pre-training by representing and pre-
documents or low-ranked documents. In the future work, we aim                                     dicting spans. TACL 8 (2020), 64–77. ",cs.IR,A,-0.07407753,0.21611354,-0.051261522
http://arxiv.org/pdf/2204.01321v3,PRADA: Practical Black-Box Adversarial Attacks against Neural Ranking Models,"Qair: Practical query-efficient black-box attacks for image
documents or low-ranked documents. In the future work, we aim                                     retrieval. In CVPR. ",cs.IR,C,-0.15846318,-0.0043722615,-0.028183175
http://arxiv.org/pdf/2204.02002v1,Micro-Behavior Encoding for Session-based Recommendation,"This line of thoughts, though interesting, would                     M@10        22.64        24.41    25.21
make the model much more complicated than its current form. M@20        23.49        25.15    26.06
We have to leave the bulk of experiments for the future work. H@5         21.53        23.09    24.17
                                                                                H@10        32.01        32.99    34.75
B. Dyadic relational encoding with SGNN-HN                                      H@20        43.67        43.92    46.29
                                                                                M@5         11.61        13.28    13.98
   In Section V-E (Figure 5), we do witness the high utility of                 M@10        13.00        14.59    15.38
dyadic relational patterns for recommendation effectiveness. ",cs.IR,B,0.23603973,-0.06332283,0.022285253
http://arxiv.org/pdf/2204.02363v1,Towards Best Practices for Training Multilingual Dense Retrieval Models,"[4] also
                                                                                         made use of mBERT for retrieval in a many-to-many scenario. They
In summary, we provide practitioners with a “how to” guide for                           train a QA model that can answer a query in any language by re-
building multilingual search applications and researchers with a                         trieving evidence from a multilingual collection and generating an
solid foundation for future work in multilingual dense retrieval. answer in the query language. ",cs.IR,A,-0.095384,0.45393175,-0.074615374
http://arxiv.org/pdf/2204.02906v1,Knowledge Base Index Compression via Dimensionality and Precision Reduction,"Note the log scale on the x-axis  leave a more detailed exploration of these ﬁndings
and the truncation of the y-axis. for future work. few samples (lower-bounded by 128 which is also          2 0.3   5.2            35.2  2 0.6   8.1             31.9
the number of dimensions used for this experiment). ",cs.IR,C,-0.3712609,-0.2758728,0.14953682
http://arxiv.org/pdf/2204.02906v2,Knowledge Base Index Compression via Dimensionality and Precision Reduction,"Note the log scale on the x-axis  leave a more detailed exploration of these ﬁndings
and the truncation of the y-axis. for future work. few samples (lower-bounded by 128 which is also          2 0.3   5.2            35.2  2 0.6   8.1             31.9
the number of dimensions used for this experiment). ",cs.IR,C,-0.3712609,-0.2758728,0.14953682
http://arxiv.org/pdf/2204.03096v1,From Little Things Big Things Grow: A Collection with Seed Studies for Medical Systematic Review Literature Search,"However, we leave such                      detailed analysis of our collection. Here, we found that as a unique
investigation for future work. We perform our evaluation on the                   set of studies before query construction, only a small portion of
included studies that did not appear in the retrieved set of studies. ",cs.IR,A,-0.24418443,0.13022588,0.23138252
http://arxiv.org/pdf/2204.03096v2,From Little Things Big Things Grow: A Collection with Seed Studies for Medical Systematic Review Literature Search,"Our test collection will promote the development and real-
istic evaluation of methods that seed studies can be used to improve
systematic review literature search. This includes methods we al-
ready explored in this paper like screening prioritisation [20, 34] and
query formulation [30], and some we leave for future works such as
active learning [8] or MeSH term suggestion [33], etc. Such methods
can have considerable real-world impacts, as systematic reviews
are highly time consuming and costly. ",cs.IR,A,-0.08009928,0.17366119,0.17789756
http://arxiv.org/pdf/2204.03208v1,A Joint Learning Approach for Semi-supervised Neural Topic Modeling,"preprint arXiv:1907.05545. In future work, we hope to further experiment      Caitlin Doogan and Wray Buntine. 2021. ",cs.IR,C,-0.37171465,-0.15209305,0.09940876
http://arxiv.org/pdf/2204.03505v1,Integrating Rankings into Quantized Scores in Peer Review,"By providing Area Chairs the information aggregated across all

                                                                     13
the reviewers who reviewed their assigned papers, we need to ensure that it should not inadvertently reveal the review
information of paper(s) outside their scope. Another direction of future work is that of global versus subgroup accuracy. For example, some subgroups of papers might have a larger inter-reviewer disagreement, or fewer reviewer-provided
comparisons than other papers, because of their ﬁelds. ",cs.IR,C,-0.04752817,0.0070198667,0.26286247
http://arxiv.org/pdf/2204.03706v1,Introducing a Framework and a Decision Protocol to Calibrate Recommender Systems,"In addition, we showed the possibilities of implementing the calibrated system
following the framework division in components to provide an easier way to be implemented and
tested. As a future work, we plan to investigate other calibration measures and compare the effect of
the post-processing in the collaborative filtering and content-based filtering. Another extension
is to explore different types of distribution, for instance, compare the normalized against the
non-normalized ones. ",cs.IR,B,0.24703367,-0.2505446,0.07743945
http://arxiv.org/pdf/2204.03827v1,IA-GCN: Interactive Graph Convolutional Network for Recommendation,"This implies         teractive graph convolution for recommendation and opens up a
        that reasonable layer weights could help distill information        new research line. In future work, we will follow the direction of
        from high-order neighbors more effectively. the attention mechanism and exploit various attention mechanisms
                                                                            e.g. ",cs.IR,B,0.29545468,0.14183652,-0.086884126
