url,title,further research,primary category,label,x,y,z
http://arxiv.org/pdf/2202.03392v2,Large-scale Personalized Video Game Recommendation via Social-aware Contextualized Graph Neural Network,"Junliang et al. [52] discuss that                 We leave several research directions in game recommendations
explicit social links are not all reliable due to the existence of spam-        as to future work. Firstly, dwelling time measures user direct game
mers and bots. ",cs.IR,B,0.32106978,-0.027297962,0.3139986
http://arxiv.org/pdf/2202.04333v1,Who to Watch Next: Two-side Interactive Networks for Live Broadcast Recommendation,"In addition, we also develop a co-retrieval mechanism
third one is to measure the CVR performance from the user aspect,                               to reduce the high computation costs of the interactive network
which is called UCVR metric defined as UCTR = #conversions on users                             from the item aspect. For future work, it would be interesting to
                                                                                                combine TWINS with multi-tasking learning techniques to effec-
                                                                        #impressions on users   tively use user various behaviors (e.g., click, like, comment). where #conversions on users is the number of users that have per-                               Acknowledgments. ",cs.IR,B,0.15280846,0.10945715,-0.026492266
http://arxiv.org/pdf/2202.04972v1,IHGNN: Interactive Hypergraph Neural Network for Personalized Product Search,"Long et al. [23] used popularity combined with relevance      future work, we consider using attention mechanisms in both hy-
to improve product ranking. Guo et al. ",cs.IR,B,0.1445483,0.11278191,0.14542711
http://arxiv.org/pdf/2202.04975v1,FedAttack: Effective and Covert Poisoning Attack on Federated Recommendation via Hard Sampling,"existing defense and detection mechanisms for federated learning. Our work shows existing federated recommendation methods can
4.7 Gradient Visualization                                                                                                           be vulnerable, and the design of future federated recommender
                                                                                                                                     systems should be more secure and robust to these attacks, which
Finally, we use PCA to visualize the gradients on benign clients and                                                                 is one of our future work. Byzantine clients to see whether they are visually distinguishable, as
REFERENCES                                                                                [32] Steffen Rendle, Christoph Freudenthaler, Zeno Gantner, and Lars Schmidt-Thieme. ",cs.IR,B,0.20537032,-0.06325875,0.056107998
http://arxiv.org/pdf/2202.05456v1,NEAT: A Label Noise-resistant Complementary Item Recommender System with Trustworthy Evaluation,"With a predeﬁned p-value for        the default train (INS-T) and test (INS-E) split provided by
the statistic signiﬁcance, we can create the high quality co-       Instacart dataset. To further study the model performance, we
purchase labels for evaluations. For clarity, we denote the         collect a proprietary dataset (WMT) with a larger scale from
item pairs which pass the Chi-squared test and O1 > E1              Walmart e-Commerce platform (www.walmart.com) following
as the positively-dependent item pairs and the item pairs           the same format of Instacart, where the sequence order of
which pass the Chi-squared test and O1 <= E1 as the                 transactions are kept and the order of purchases in the same
negatively-dependent item pairs in the rest of our paper. ",cs.IR,C,-0.069978476,-0.14469782,0.05864944
http://arxiv.org/pdf/2202.06081v1,Modeling User Behavior with Graph Convolution for Personalized Product Search,"Extensive ex-
                                                                                               periments on public datasets demonstrate the effectiveness of our
Figure 4: Ablation study of the time interval 𝑅 for successive                                 approach. In future work, we plan to investigate the possibility
graph construction. The results in HR@10 and NDCG@10                                           of applying our approach on dynamic behavior graphs for user
are reported. ",cs.IR,C,-0.1282227,-0.033610053,0.25388017
http://arxiv.org/pdf/2202.06129v1,RETE: Retrieval-Enhanced Temporal Event Forecasting on Unified Query Product Evolutionary Graph,"Algorithm 1: The optimization process for RETE. systematic study for optimal segmentation as our future work. Ta-
                                                                        ble 5 in Appendix A.4 summarizes the statistics of the experimental
   Input: Evolutionary knowledge graph {G1, · · · , G𝑇 } and            datasets. ",cs.IR,C,-0.22182389,-0.104172684,-0.055104923
http://arxiv.org/pdf/2202.06197v1,Web-Based File Clustering and Indexing for Mindoro State University,"For instance, when dealing with universities’ websites, we may want to separate
professors’ home pages from students’ home pages, and pages for courses from pages
for research projects. This kind of clustering can benefit further analysis and utilization of
the dataset such as information retrieval and information extraction, by grouping similar
types of information sources together. The user will start at the top of the list and follow it down examining the
documents one at a time. ",cs.IR,A,0.010847079,0.22350284,0.16375092
http://arxiv.org/pdf/2202.06200v1,Improving Graph Collaborative Filtering with Neighborhood-enriched Contrastive Learning,"Figure 2 shows that, after rescaled with
their means and standard deviations of log-transformed data, the recruitment time-
series collapse onto a standard log-normal distribution. I further study the diﬀerences between two consecutive values in (raw) recruit-
ment time-series, where the original time-series is detrended by subtracting the
mean trend. Based on the Kolmogorov-Smirnov test with data aggregated across
72 stocks, while the null hypothesis that the (rescaled) log-transformed data are
normally distributed cannot be rejected with a p-value of 9.54 × 10−2, the null
hypothesis that the successive diﬀerences of the (rescaled) recruitment series are
normally distributed should be rejected with a p-value of 1.14 × 10−12. ",cs.IR,C,-0.35880822,-0.19198601,0.17946684
http://arxiv.org/pdf/2202.06200v2,Improving Graph Collaborative Filtering with Neighborhood-enriched Contrastive Learning,"strate the effectiveness of the proposed NCL . We speculate that a more uniform distribution of embeddings en-
dows a better capacity to model the diverse user preferences or                    As future work, we will extend our framework to other rec-
item characteristics. As shown in previous studies [30], there exists           ommendation tasks, such as sequential recommendation. ",cs.IR,B_centroid,0.41766798,0.15042004,-0.03005195
http://arxiv.org/pdf/2202.06306v1,An Analysis of Variations in the Effectiveness of Query Performance Prediction,"As part of our analysis, we have
found that certain factors, such as variations in the IR eﬀectiveness measures,
has a greater impact in terms of QPP outcomes than other factors, such as
variations in the choice of IR models. An important outcome arising from this
study is that further research on QPP should place greater emphasis on a clear
speciﬁcation of the experimental setup to enable better reproducibility. In future
we plan to expand our evaluations beyond the TREC Robust dataset. ",cs.IR,C,-0.20462489,-0.16868457,0.014891
http://arxiv.org/pdf/2202.06337v1,Learning to Rank from Relevance Judgments Distributions,"These experiments consolidated our hypothesis and showed en-
couraging results on the usage of probabilistic loss functions also on this dataset. As future work, we plan to further develop the proposed neural architecture to
take advantage of probability distributions on model weights – i.e. employing
Bayesian neural layers [3] – and to evaluate the performance of the proposed
loss functions to train a model based on implicit user feedback signals such as
clicks and dwell time. ",cs.IR,B,0.1526415,0.024069319,-0.14317876
http://arxiv.org/pdf/2202.06701v1,UA-FedRec: Untargeted Attack on Federated News Recommendation,"more than 1% malicious clients, let alone with defense. Second, our     As a future work, we plan to study effective defense methods on fed-
UA-FedRec outperforms model poisoning attacks (LIE and Fang)            erated news recommendation systems to defend against UA-FedRec. with both Norm-Bounding and Multi-Krum defenses. ",cs.IR,B,0.18592083,-0.112704426,0.06824992
http://arxiv.org/pdf/2202.07296v1,Roomsemble: Progressive web application for intuitive property search,"INTRODUCTION                             The rest of this work is organized as follows: we present
                                                                                                           related work in Section 2; image modeling techniques and
                                           One of the last domains to be disrupted by technology is        the overall application architecture in Section 3; Section 4
                                        real estate, with research mainly focusing on price predictions    describes the user study, metrics used and results obtained; we
                                        [5], [9], [10], and [12]. Although price is one of the most        discuss the results and conclude the paper with suggestions for
                                        important factors in making a decision, it is usually not the      future work in Section 5.
                                        only factor that motivates buyers. On the contrary, every
                                        transaction in the real estate market begins with a search for                              II. ",cs.IR,C,-0.08365898,-0.19596168,0.076375924
http://arxiv.org/pdf/2202.07371v1,Personalized Prompt Learning for Explainable Recommendation,"Extensive experiments demonstrate the effectiveness of our approaches in generating
high-quality explanations as measured by text quality and explainability metrics. As future works, we are immensely interested in whether the generated explanations possess bias
or stereotype against certain social groups and how to mitigate them, as reported in recent studies
[33, 45] that pre-trained models exhibit societal bias towards different groups of people. Besides
explanation generation for recommender systems, we also plan to adopt our approaches to other
applications of personalized natural language generation, such as personalized question answering
systems and personalized conversational agents. ",cs.IR,B,0.2130619,0.19191787,0.16928123
http://arxiv.org/pdf/2202.08959v1,Deep Interest Highlight Network for Click-Through RatePrediction in Trigger-Induced Recommendation,"Experiment setups as well as the corresponding
                                                                          results and analysis are presented in Section 4. We finally conclude
                                                                          the paper and discuss the future work in Section 5. Deep Interest Highlight Network for Click-Through Rate Prediction in Trigger-Induced Recommendation  WWW ’22, April 25–29, 2022, Virtual Event, Lyon, France

2 RELATED WORK                                                           (UIN), which responds to generate a precise probability score to pre-
                                                                         dict user’s intent on the trigger item; 3) Fusion Embedding Module
In this section, we will review the related work from following          (FEM), which adaptively fuses trigger item and target item embed-
three respects briefly: Feature Interaction, User Behavior Modelling     dings based on the result of UIN; and (4) Hybrid Interest Extracting
and Trigger-Induced Recommendation. ",cs.IR,B,0.3666574,0.13573705,-0.03660499
http://arxiv.org/pdf/2202.08959v2,Deep Interest Highlight Network for Click-Through Rate Prediction in Trigger-Induced Recommendation,"Experiment setups as well as the corresponding
                                                                          results and analysis are presented in Section 4. We finally conclude
                                                                          the paper and discuss the future work in Section 5. Deep Interest Highlight Network for Click-Through Rate Prediction in Trigger-Induced Recommendation  WWW ’22, April 25–29, 2022, Virtual Event, Lyon, France

2 RELATED WORK                                                           (UIN), which responds to generate a precise probability score to pre-
                                                                         dict user’s intent on the trigger item; 3) Fusion Embedding Module
In this section, we will review the related work from following          (FEM), which adaptively fuses trigger item and target item embed-
three respects briefly: Feature Interaction, User Behavior Modelling     dings based on the result of UIN; and (4) Hybrid Interest Extracting
and Trigger-Induced Recommendation. ",cs.IR,B,0.3666574,0.13573705,-0.03660499
http://arxiv.org/pdf/2202.08960v1,"Toward a traceable, explainable, and fairJD/Resume recommendation system","Moreover, to cover more domains, additional sources of knowledge (tags from
StackOverﬂow, quora, etc) may be added using the associations’ rules (same as
related to)[87]. Although, expanding ontologies knowledge bases and labeling

                                                  45
diﬀerent multilingual categories will be a future work, due to the task complexity
challenges. Figure 13: The hierarchy structure of the ESCO ontology [6]
    The occupation pillar organises the occupation concepts in ESCO. ",cs.IR,A,-0.17352307,0.30089283,0.07716024
http://arxiv.org/pdf/2202.08963v1,Understanding and Shifting Preferences for Battery Electric Vehicles,"and hypothesize performance may improve with additional
                                                                      demographics. However, the improvement would trade off
                          (t) = 0.4 (1)                               with a requirement for more training episodes to learn the
                                  1 + (1 × 10−5)t                     larger space, which we leave for future work. The learning rate is similarly annealed according to the fol-                    Discussion and Future Work
lowing schedule. ",cs.IR,C,-0.2585508,-0.15374534,0.024749741
http://arxiv.org/pdf/2202.09502v1,Graph Spring Network and Informative Anchor Selection for Session-based Recommendation,"345–354. items as another interesting future work. [11] A. Luo, P. Zhao, Y. Liu, F. Zhuang, D. Wang, J. Xu, J. Fang,
                                                                      and V. S. Sheng, “Collaborative self-attention network for session-
                                                                      based recommendation.” in IJCAI, 2020, pp. ",cs.IR,B,0.31299388,0.04138139,0.058207765
http://arxiv.org/pdf/2202.09508v1,Who Are the Best Adopters? User Selection Model for Free Trial Item Promotion,"7: Results under different tree depth. our future work. Next, we set depth from one to four to further explore                                                                                             ACKNOWLEDGMENTS
how different tree depth inﬂuences the efﬁciency and per-
formance of SMILE on the Movielens100K dataset. ",cs.IR,C,-0.29329234,-0.03223795,0.003053505
http://arxiv.org/pdf/2202.09508v2,Who Are the Best Adopters? User Selection Model for Free Trial Item Promotion,"7: Results under different tree depth. our future work. Next, we set depth from one to four to further explore                                                                                             ACKNOWLEDGMENTS
how different tree depth inﬂuences the efﬁciency and per-
formance of SMILE on the Movielens100K dataset. ",cs.IR,C,-0.29329234,-0.03223795,0.003053505
http://arxiv.org/pdf/2202.09730v1,Graph-based Extractive Explainer for Recommendations,"In addition, currently the scoring function’s weights in our ILP were
manually set. Learning-based methods can be introduced to optimize it for better performance in
our future work. Acknowledgments

This work is supported by the National Science Foundation under grant IIS-1553568, IIS-1718216
and IIS-2007492. ",cs.IR,C,-0.05498773,-0.2374919,-0.0939496
http://arxiv.org/pdf/2202.10221v1,Tracking environmental policy changes in the Brazilian Federal Official Gazette,"While a rule-based system working
jointly with domain experts already deliver immeasurable value when it comes
to policy monitoring, it is also paramount that the latest NLP technologies be
considered to increase the scalability and performance of these systems. Hence,
among the future work are the expansion of the annotated datasets, as well as
the improvement of the best models presented here so that they can keep the
quality and stability of the classiﬁcation for a greater number of classes. 10  F. Cac¸a˜o et al. ",cs.IR,A,-0.0176134,0.13671489,0.015333128
http://arxiv.org/pdf/2202.10241v1,VRConvMF: Visual Recurrent Convolutional Matrix Factorization for Movie Recommendation,"Pooling 1 to 4 in Fig. 7 represent the
visual features of 4 pooling layers from shallow to deep                                                        In the future work, we will crawl corresponding trailers
in the VGG19 network respectively. These single-layers of                                                    information of movies directly and transfer them into textual
visual information are combined with RConvMF respectively. ",cs.IR,A,-0.1048155,0.10624941,-0.17185321
http://arxiv.org/pdf/2202.10326v1,A Deep Learning Approach for Repairing Missing Activity Labels in Event Logs for Process Mining,"Since both methods                    B. FURTHER ANALYSIS OF OUR PROPOSED METHOD
rely on trace clustering algorithms, only a small portion of                 To further analysis the performance of our proposed method,
activity labels can be deleted. In addition, only one activity               we evaluated our method with more event logs and miss-
was deleted in each trace. ",cs.IR,C,-0.15045622,-0.03571826,0.18163812
http://arxiv.org/pdf/2202.10326v2,A Deep Learning Approach for Repairing Missing Activity Labels in Event Logs for Process Mining,"The ﬁrst group of experiments compared the performance of our proposed
method with existing methods to repair missing activity labels in event logs. The second group
of experiments performed further analysis to prove the effectiveness of our method. We implemented our approach in Python 3.7.1 based on Tensorﬂow 2.7.0. ",cs.IR,A,-0.20062351,0.07009212,0.0829743
http://arxiv.org/pdf/2202.10842v3,KuaiRec: A Fully-observed Dataset and Insights for Evaluating Recommender Systems,"It also contains a
• With this unique dataset, we design experiments to illustrate how                  set of missing-complete-at-random (MCAR) data by asking 5,400
  data density and exposure bias affect the evaluation of recom-                     users to give ratings on 10 items that are randomly selected from
  mendations. We further study the effect of estimating the missing                  1,000 items. values, i.e., matrix completion, on the evaluation results. ",cs.IR,B,0.15227413,-0.03406284,0.23113477
http://arxiv.org/pdf/2202.10870v1,Socialformer: Social Network Inspired Long Document Modeling for Document Ranking,"In order to compare
between words. For further analysis, we remove one strategy at a          the impact of different sparsity on graph partition, we select a
time to observe the impact on the MS MARCO dataset. In addition,          document with 2,000 tokens, and set the sparsity of the graph at
we use random sampling that the probability of establishing each          0.99, 0.97, 0.95, 0.93 level respectively following Eq. ",cs.IR,A,-0.1830779,0.07947743,0.08591876
http://arxiv.org/pdf/2202.11527v1,A new LDA formulation with covariates,"A disadvantage of our method is the computational cost (especially in large datasets with many sample units and
categories) compared to models using variational Bayes methods. A possible future work would be to consider a
version of this model with a variational inference approach. Page 19 of 25
                                                    A new LDA formulation with covariates. ",cs.IR,C,-0.048162766,-0.047770612,0.08022543
http://arxiv.org/pdf/2202.12081v1,Community Trend Prediction on Heterogeneous Graph in E-commerce,"From the perspective of age,                                                        advance. For future work, it would be interesting to investigate how
attribute tags of the two communities differ significantly. There                                                       to dynamically divide the communities according to preferences. ",cs.IR,A,0.0034143776,0.01837838,0.39904082
http://arxiv.org/pdf/2202.12826v1,A Systematic Literature Review about Idea Mining: The Use of Machine-driven Analytics to Generate Ideas,"Thus, this study could summarize techniques and heuristics for idea gen-
eration for enthusiastic practitioners. It could also serve as a basis for future work in
academia. Ideas are sources of innovation, and hence the result of this study is a valua-
ble contribution to the industry, startups, accelerators, incubators, government agen-
cies, etc. ",cs.IR,C,-0.2941715,0.10909692,0.30825034
http://arxiv.org/pdf/2202.13090v1,Disentangling Long and Short-Term Interests for Recommendation,"During
which many sequential encoders and loss functions can be utilized. our experiments, we tried to add an independent loss between the
We leave the further study as future work. two interests as, and AUC drops by 0.01, which verifies our point. ",cs.IR,C,-0.16260508,-0.2519395,-0.28197613
http://arxiv.org/pdf/2202.13307v1,The Unfairness of Active Users and Popularity Bias in Point-of-Interest Recommendation,"Moreover, we observe that a primary challenge many
models face is the unfairness of popularity bias. As for future work, we plan to
extend our experiments on more datasets from diﬀerent domains (e.g., marking
in e-commerce [34], media-streaming, e-fashion [13]) and models such as session-
based [28], neural [8] and content-based systems [15]. Investigating the diﬀerent
type of bias, such as gender bias, can be a potential direction for future research. ",cs.IR,B,0.20223436,0.049677417,0.1769115
http://arxiv.org/pdf/2202.13307v2,The Unfairness of Active Users and Popularity Bias in Point-of-Interest Recommendation,"Moreover, we observe that a primary challenge many
models face is the unfairness of popularity bias. As for future work, we plan to
extend our experiments on more datasets from diﬀerent domains (e.g., marking
in e-commerce [34], media-streaming, e-fashion [13]) and models such as session-
based [28], neural [8] and content-based systems [15]. Investigating the diﬀerent
type of bias, such as gender bias, can be a potential direction for future research. ",cs.IR,B,0.20223436,0.049677417,0.1769115
http://arxiv.org/pdf/2202.13446v1,The Unfairness of Popularity Bias in Book Recommendation,"Additionally, our results suggest
that an underlying tradeoﬀ exists between personalization and fairness of popu-
larity bias in Diverse and Bestseller-focused groups, that is, algorithms with high
personalization abilities tend to experience fairness issues. Thus, further research
could be worthwhile into implementing a recommendation algorithm that can
ﬁnd the optimal tradeoﬀ between personalization and the unfairness of popu-
larity biases to enhance the system’s overall eﬀectiveness. Finally, it would be
interesting to investigate popularity bias on other domains and algorithms such
as session-based [23], content-based [17], or reinforcement learning-based recom-
mendation [4] methods, as well as incorporating further evaluation metrics such
as novelty and coverage. ",cs.IR,B,0.38466915,-0.002286982,0.2179824
http://arxiv.org/pdf/2202.13506v1,Keyword Optimization in Sponsored Search Advertising: A Multi-Level Computational Framework,"Table 1 presents the resulting
performance of our MKOF and two baseline strategies. Strategy          Payoff

                            Case-1          Case-2

3 Note that determining the number of campaigns and the number of adgroups is beyond scope of this research, which might
be covered in the future work. 15
    MKOF                       11,938,036             61,585
BASE2-Ratio                    10,387,413             57,992
BASE1-Origin                   11,108,298             57,605

Table 1. ",cs.IR,C,-0.133976,-0.1397002,0.116861306
http://arxiv.org/pdf/2202.13556v1,Filter-enhanced MLP is All You Need for Sequential Recommendation,"We set                                                         requires to be further investigated. We leave it into future works. the number of the learnable filter blocks as 2, the batch size is set as                                               For hidden size, we can see that the best value is about 64. ",cs.IR,C,-0.21098,-0.18621436,-0.26105356
