url,title,further research,primary category,label,x,y,z
http://arxiv.org/pdf/2203.00232v1,Extended Graph Temporal Classification for Multi-Speaker End-to-End ASR,"As shown in Table 2, we obtain       experiments on the LibriMix 2-speaker dataset, showing promising
averaged test TERs for PIT-CTC and GTC-e of 22.8% and 25.0%            results demonstrating the feasibility of the approach. In future work,
respectively, from which we can tell that the token recognition per-   we will explore other applications of GTC-e and investigate ways to
formance is comparable. It indicates that we should consider how to    improve the performance of extended GTC on multi-speaker ASR
improve the speaker prediction in the next step. ",cs.SD,C,-0.20862906,-0.05555178,-0.048773043
http://arxiv.org/pdf/2203.00951v1,Speaker Adaption with Intuitive Prosodic Features for Statistical Parametric Speech Synthesis,"demonstrated that our proposed models with prosodic features can
   Comparing the MOS results of male speakers (Fig 4(a) and 4(c))
with female speakers (Fig 4(b) and 4(d)), we can see that the overall  achieve lower acoustic distortion and higher subjective similarity
scores (both naturalness and similarity) of female speakers were
higher than that of male speakers, which may also be attributed to     compared to baseline models. Our future work will focus on inte-
the gender-imbalance issue in the AISHELL-3 dataset, as mentioned
above in Section 3.4. Comparing Baseline-Enc and Baseline-Emb,         grating more intuitive acoustic features that can describe speaker
Baseline-Enc achieved higher similarity MOS than Baseline-Emb for
speaker 0966 (𝑝 = 7.0 × 10−5) and the similarity differences were      characteristics into our model and investigating the disentangle-
insignificant for the other three speakers (𝑝 > 0.05). ",cs.SD,C,-0.2914445,0.013485538,-0.18022808
http://arxiv.org/pdf/2203.01118v1,A multi-task learning for cavitation detection and cavitation intensity recognition of valve acoustic signals,"Although the proposed method has improved recognition of the incipient cavitation recognition, which is still relatively
low. In future work, convolutional neural networks (CNN) have achieved remarkable results in mechanical device
health management due to their stronger capability of representation learning. Therefore, we directly extract deeper and
more expressive valve cavitation features using the 1D CNN to enhance the performance of valve cavitation detection
and cavitation intensity recognition. ",cs.SD,A,0.15548262,-0.029163957,0.5290799
http://arxiv.org/pdf/2203.01118v2,A multi-task learning for cavitation detection and cavitation intensity recognition of valve acoustic signals,"Although the proposed method has improved recognition of the incipient cavitation recognition, which is still relatively
low. In future work, convolutional neural networks (CNN) have achieved remarkable results in mechanical device
health management due to their stronger capability of representation learning. Therefore, we directly extract deeper and
more expressive valve cavitation features using the 1D CNN to enhance the performance of valve cavitation detection
and cavitation intensity recognition. ",cs.SD,A,0.15548262,-0.029163957,0.5290799
http://arxiv.org/pdf/2203.01205v1,Audio Self-supervised Learning: A Survey,"Such a
between SSL methods and other confusing machine learning           kind of generative contrastive model has been successfully
                                                                   investigated for NLP tasks, such as in ELETRA [168], but
   3https://superbbenchmark.org/                                   rarely been explored for audio SSL. Hence, we did not
   4http://lebenchmark.com/
   5https://neuralaudio.ai/hear2021-holistic-evaluation-of-audio-
representations.html
20

introduce it as an audio SSL form in the literature review,         as ‘image’ to some SSL models designed for CV tasks [37],
though it should be naturally considered for future works. [89], [93]. ",cs.SD,C,-0.16012494,-0.027447902,0.07191235
http://arxiv.org/pdf/2203.02678v1,NeuralDPS: Neural Deterministic Plus Stochastic Model with Multiband Excitation for Noise-Controllable Waveform Generation,"Finally, we
show the effectiveness of editing speech based on the proposed        [13] Q. Hu, K. Richmond, J. Yamagishi, and J. Latorre, “An experi-
framework. Decoupling the various components of the neural                  mental comparison of multiple vocoder types,” in Eighth ISCA
vocoder to achieve richer voice editing is the future work. Workshop on Speech Synthesis, 2013. ",cs.SD,C,-0.315041,-0.10963112,-0.03624361
http://arxiv.org/pdf/2203.02942v1,C-P Map: A Novel Evaluation Toolkit for Speaker Verification,"The C-P map of the TSP                         techniques. As for the future work, more comprehensive anal-
system (System 4) corresponds to CPref (·) and the C-P map of                      ysis will be conducted to understand the behavior of different
the ASP system (System 6) corresponds to CPtest(·). It can be                      models at different locations on the C-P map. ",cs.SD,A,0.45078406,-0.077271715,-0.36052537
http://arxiv.org/pdf/2203.02967v1,Variational Auto-Encoder based Mandarin Speech Cloning,"4. Some additional tagging for future work (e.g., scenarios, emotions and overviews). Private dataset was produced with the consent of the speaker, but unfortunately we cannot make it public in
addition to the samples used for experiments due to the agreement. ",cs.SD,A,0.045738406,-0.15208596,-0.08761948
http://arxiv.org/pdf/2203.03190v1,Speaker recognition by means of a combination of linear and nonlinear predictive models,"We believe that           magnitude than the LPCC coefficients. with additional research this results can be improved. Main
subjects that must be studied are:                                     2.3 Nonlinear codebook generation
    • An algorithm for clustering the frames. ",cs.SD,A,0.28503132,0.105094105,-0.113674924
http://arxiv.org/pdf/2203.04099v1,VoViT: Low Latency Graph-based Audio-Visual Voice Separation Transformer,"evaluate AV speech separation systems in singing voice, showing empirically that the characteristics of the singing
voice differ substantially from the ones of speech. As future work we would like to explore lighter and faster embedding generators for the transformer and different
optimisations in its architecture which leads to a fast and powerful system. 10
VoViT  A PREPRINT

References

E Colin Cherry. ",cs.SD,C,-0.25276613,0.14745533,-0.11321402
http://arxiv.org/pdf/2203.04099v2,VoViT: Low Latency Graph-based Audio-Visual Voice Separation Transformer,"For the first time, we evalu-
ate AV speech separation systems in singing voice, showing empirically that the
characteristics of the singing voice differ substantially from the ones of speech. As future work we would like to explore lighter and faster embedding gen-
erators for the transformer and different optimisations in its architecture which
leads to a fast and powerful system. Acknowledgments. ",cs.SD,C,-0.20269275,0.13814205,-0.06851897
http://arxiv.org/pdf/2203.04638v1,Speaker Identification Experiments Under Gender De-Identification,"Identification rates

                                                                     VI. Conclusion and future work

                                                                   In this paper, we studied the potential of voice transformation
                                                                   for gender de-identification. The method does not require
                                                                   enrolment of speakers for de-identification thus greatly
                                                                   extending possible applications of the system. ",cs.SD,C,-0.24861307,-0.06928542,-0.13400446
http://arxiv.org/pdf/2203.04696v1,Robust Federated Learning Against Adversarial Attacks for Speech Emotion Recognition,"Thus, adversarial training doesn’t
adversarial attacks; a comparison with work on centralised training   effectively defend against the iterative attacks. on DEMoS; and ﬁnally, considerations regarding future work that
could be conducted with our pipeline. As a result, we propose the randomisation – the second defence
                                                                      strategy within our pipeline – to be more effective, via utilising
    White-box attack comparison: In our work, we analyse two          resizing and padding by random proportions on the test data at
types of adversarial white-box attacks, single-step attacks (i. e.,   inference time. ",cs.SD,A,0.13286465,-0.25498977,0.26656985
http://arxiv.org/pdf/2203.06064v1,Climate Change & Computer Audition: A Call to Action and Overview on Audio Intelligence to Help Save the Planet,"It constitutes a major challenge for
real world applications as it makes model selection and, more crucially, model testing harder, leading to catastrophic
failures during deployment. This is of particular importance for a large-scale deployment required for environmental
monitoring, where a model will have to perform equally well across several different locations, and, correspondingly,
needs to be addressed via further research. For audio analysis in particular, the notion of generalisation is closely linked to that of robustness to different
perturbations, a topic that has received considerable attention over the years. ",cs.SD,B,-0.017032541,0.19253612,-0.012765428
http://arxiv.org/pdf/2203.06220v1,"Infrastructure-free, Deep Learned Urban Noise Monitoring at $\sim$100mW","(Note that we            918.5       0.9976  0.9951  0.9951                               Online
eschew adaptation of the frequency that is used for discovery: this           908        0.9973  0.9946  0.9965
is to achieve fault-tolerance, so that nodes that are inadvertently          922.5       0.9972  0.9941  0.9926  1       1       1
not up during adaption are not excluded from the WSN.) 912        0.9971  0.9946  0.9962
                                                                             910.5       0.9970  0.9960  0.9959  2
                                                                              903        0.9950  0.9951  0.9934
                                                                             917.5       0.9863  0.9942  0.9174  3
                                                                              910        0.9957  0.9939  0.9947
                                                                              918        0.9967  0.9941  0.9938  4       5
                                                                          All others     0.8866  0.8991  0.8924
                                                                                                                 5       2       2

                                                                                                                         4

                                                                                                                         3       3

                                                                                                                                 4

                                                                                                                                 5
Infrastructure-free, Deep Learned Urban Noise Monitoring at ∼100mW                                                               ICCPS’ 22, May 4-6, 2022, Milan, Italy

Table 9: Impact of density increase on reliability if node duty         Figure 10: Likelihood of occurrence of engine, human-voice
cycle remains unchanged                                                 or alert noise source in contiguous 2-hour periods

Edge Degrees  Total Sent  Total Received  PRR                           case for updating native software components such as the CNN
                                                                        model in the field remains a relevant consideration for future work,
        2       102217         100142     0.9797                        as we expect active learning and federated learning support at the
        4        62421          55084     0.8825                        mote level to become increasingly important for long lived systems. 5        42601          29085     0.6915                        This suggests that we either refine the eMote interpreter via a JIT
                                                                        compiler to reduce the slowdown incurred in the VM (especially
while maintaining network connectivity as well as to yield afford-      for compute-intensive tasks) and migrate these components to
able coverage. ",cs.SD,A,0.36806342,0.04793774,-0.04385634
http://arxiv.org/pdf/2203.06517v1,SA-SASV: An End-to-End Spoof-Aggregated Spoofing-Aware Speaker Verification System,"Further, the SASV-EER is improved from the 6.05%
                                                                   produced by prior state of the art approaches to 1.81% without
     SASV-Baseline2                  8.75 16.01 12.23              an ensembling strategy. Using an ensemble would likely further
                                                                   boost the performance and we will explore this in future work. SA-SASV              1.81 9.01 0.78
                                                                                      6. ",cs.SD,A,0.22794929,-0.04051472,0.0012346944
http://arxiv.org/pdf/2203.06517v3,SA-SASV: An End-to-End Spoof-Aggregated Spoofing-Aware Speaker Verification System,"A larger dataset and differ-
and SV-EER therefore show a different tendency in the train-       ent encoders would likely boost the performance of the
ing and evaluation stages. We believe it is a reasonable solution  SV-EER and we will explore this in future work. The
to train end-to-end SASV systems on complete ASV and CM            code described here is available in open-source form from:
datasets to avoid the overﬁtting problem. ",cs.SD,A,0.15698919,-0.13298663,0.053890705
http://arxiv.org/pdf/2203.06583v1,Bi-Sampling Approach to Classify Music Mood leveraging Raga-Rasa Association in Indian Classical Music,"Psychol. 6:513. doi: 10.3389/fpsyg.2015.00513
challenges, which the researchers hope the future researchers
would be able to resolve with further study. Accuracy of 0.77               [15] Mukherjee, Samarpita & Mukherjee, Roan. ",cs.SD,A,0.20903656,-0.19258304,-0.2721581
http://arxiv.org/pdf/2203.07996v1,Leveraging Uni-Modal Self-Supervised Learning for Multimodal Audio-Visual Speech Recognition,"The
results are shown in Table 8. The audio-only model                  As there has not emerged a dominating cross-
trained with 28 hours data achieves a WER of 3.4%,               modality self-supervised learning approach in the
which is a little bit worse than the one trained with            ﬁeld of AVSR, in future work, we are going to ex-
224 hours data. The result indicates that for the                plore two more directions in the self-supervised
audio-only model, the self-supervised model pre-                 learning scenario based on this work. ",cs.SD,B,-0.14615688,0.07040938,0.21184528
http://arxiv.org/pdf/2203.07996v2,Leveraging Unimodal Self-Supervised Learning for Multimodal Audio-Visual Speech Recognition,"As there has not emerged a dominating cross-           Alexei Baevski, Yuhao Zhou, Abdelrahman Mohamed,
modality self-supervised learning approach in the            and Michael Auli. 2020. wav2vec 2.0: A frame-
ﬁeld of AVSR, in future work, we are going to                work for self-supervised learning of speech repre-
explore two more directions in the self-supervised           sentations. In Advances in Neural Information
learning scenario based on this work. ",cs.SD,C,-0.24441528,-0.17099465,0.16108263
http://arxiv.org/pdf/2203.08439v2,Instance-level loss based multiple-instance learning framework for acoustic scene classification,"labels for instance-level labels was good for instance clustering
in this study. Therefore, for future work, we plan to improve the       BC-ResNet-ASC-8 [43] was the winner system in the
proposed system into an MIL-based recording device-invariant       DCASE challenge 2021 task 1-A. BC-ResNet was ﬁrst pro-
ASC system with similar model complexity, in which instances       posed for a low-complexity keyword spotting system that con-
will be embedded in the instance-space regardless of device        sisted of FDW and TDW convolutional layers to reduce model
characteristics. ",cs.SD,C,-0.019072535,-0.038749762,0.28803843
http://arxiv.org/pdf/2203.08490v1,Learning Audio Representations with MLPs,"In order to enable fast pretraining and have an extremely eﬃcient method, kwmlp has
compromised in certain aspects, such as the pretraining dataset or task, and the model size. In future works, we would like to explore self-supervised representation learning methods
with similar all-MLP architectures on larger and richer audio corpuses, such as LibriSpeech
(Panayotov et al., 2015), AudioSet (Gemmeke et al., 2017) or Synth1B1 (Turian et al.,
2021), among others. One fact the HEAR challenge has made apparent is that perhaps it is
diﬃcult to learn truly generalized and holistic representations from solely one type of audio
data, such as speech. ",cs.SD,C,-0.21482983,-0.00036114268,0.27681005
http://arxiv.org/pdf/2203.09098v1,TMS: A Temporal Multi-scale Backbone Design for Speaker Embedding,"performance in ASV. Conclusions and future works are given
                                                                  in Section V.

C. Our focus and contributions                                        II. PROPOSED TEMPORAL MULTI-SCALE STRATEGY

   Considering the problems mentioned above, in this paper,          The general sketch of the proposed TMS module was intro-
we propose an effective speaker embedding model with inte-        duced in Fig. ",cs.SD,C,-0.13534771,-0.053113222,-0.08384605
http://arxiv.org/pdf/2203.09295v1,Assessing Progress of Parkinson s Disease Using Acoustic Analysis of Phonation,"clinical neurologists/psychologists and compare it to estima-
                                                                   tion error that was measured in this work. Other interesting
   Next, we tried to ﬁnd a possible candidate for preliminary      idea for future work would be to deeper investigate relations
PD assessment using Spearman’s rank correlation between            between speech and depression or sleep disorders. It is well
particular feature vector and selected clinical information. ",cs.SD,A,0.08193847,-0.08866576,-0.25142464
http://arxiv.org/pdf/2203.09402v1,Robust and Complex Approach of Pathological Speech Signal Analysis,"This would enable
       doctors to start the treatment very early and slow down the progress. We are going to deal with these issues in future works. However this research is very dependent on good
databases and especially in the case of voice pathology identiﬁcation, as in its ﬁrst stage, there is still a lack
of suitable training data. ",cs.SD,C,-0.12639263,-0.086441875,-0.016761832
http://arxiv.org/pdf/2203.09849v1,Neural Predictor for Black-Box Adversarial Attacks on Speech Recognition,"building robust ASR systems. In future work, we will further
                                                                               extend our method to targeted attacks. It would also be interest-
                                                                               ing to study the performance of NP-Attack on different network
                                                                               architectures of the neural predictor. ",cs.SD,A,0.18263534,-0.27335685,0.20053263
http://arxiv.org/pdf/2203.09893v1,A Lightweight Instrument-Agnostic Model for Polyphonic Note Transcription and Multipitch Estimation,"The main            computational requirements. We hope to encourage further research
reason for the difference in performance seems to be due to the onset        into low-resource, multi-purpose AMT systems and believe that the
detection accuracy which is higher in OF, since Acc is more similar          proposed solution can be a valuable baseline. for both methods (42.8% for OF vs. 37.5% for NMP). ",cs.SD,A,0.44361895,-0.05122405,-0.061564043
http://arxiv.org/pdf/2203.09893v2,A Lightweight Instrument-Agnostic Model for Polyphonic Note Transcription and Multipitch Estimation,"The main            computational requirements. We hope to encourage further research
reason for the difference in performance seems to be due to the onset        into low-resource, multi-purpose AMT systems and believe that the
detection accuracy which is higher in OF, since Acc is more similar          proposed solution can be a valuable baseline. for both methods (42.8% for OF vs. 37.5% for NMP). ",cs.SD,A,0.44361895,-0.05122405,-0.061564043
http://arxiv.org/pdf/2203.09961v1,Personalized filled-pause generation with group-wise prediction models,"performance improvement for those speakers. More-
over, our future work will involve synthesizing spon-     Levelt, W. J. (1983). ",cs.SD,B,-0.013126836,0.1832803,-0.1727045
http://arxiv.org/pdf/2203.09961v2,Personalized Filled-pause Generation with Group-wise Prediction Models,"More-
personalized model for inference. over, our future work will involve synthesizing spon-
                                                          taneous speech containing FPs predicted by the group-
4.5.6. Discussion                                         dependent models proposed in this paper and subjec-
                                                          tively evaluating individuality. ",cs.SD,C,-0.16607156,-0.12435925,-0.17791587
http://arxiv.org/pdf/2203.10425v1,A Study on Robustness to Perturbations for Representations of Environmental Sound,"876–924, 2019.
can help choose among different perturbations to be used as
augmentations for making sound event detection models more                      [17] J. Ardouin, L. Charpentier, M. Lagrange, F. Gontier, N. Fortin,
robust. D. Ecotie`re, J. Picaut, and C. Mietlicky, “An innovative low cost sensor
                                                                                      for urban sound monitoring,” in INTER-noise and noise-con congress
   As a future work, we intend to repeat this study for a                             and conference proceedings, vol. 258, no. ",cs.SD,B,0.04843998,0.26012093,0.07573563
http://arxiv.org/pdf/2203.10425v2,A Study on Robustness to Perturbations for Representations of Environmental Sound,"2226–2237. As future work, we intend to repeat this study for a wide
variety of embeddings and datasets and extend the analysis                     [15] J. M. Lo´pez, J. Alonso, C. Asensio, I. Pavo´n, L. Gasco´, and G. de Arcas,
to include correlations between distance metrics and different                       “A digital signal processor based acoustic sensor for outdoor noise
sound event classes. monitoring in smart cities,” Sensors, vol. ",cs.SD,B,-0.021528529,0.2989726,0.08687036
http://arxiv.org/pdf/2203.10425v3,A Study on Robustness to Perturbations for Representations of Environmental Sound,"models more robust. [13] J. Salamon, D. MacConnell, M. Cartwright, P. Li, and J. P. Bello,
   In future work, we intend to repeat this study on a wide               “Scaper: A library for soundscape synthesis and augmentation,” in 2017
variety of embeddings and datasets and extend the analysis                IEEE Workshop on Applications of Signal Processing to Audio and
to include correlations between distance metrics and different            Acoustics (WASPAA). IEEE, 2017, pp. ",cs.SD,B_centroid,-0.18053403,0.35101998,0.048953414
http://arxiv.org/pdf/2203.10473v1,ECAPA-TDNN for Multi-speaker Text-to-speech Synthesis,"Besides, to lighten the burden
the x-vector model can discern the utterance from the same          of subjective evaluation, we are the ﬁrst to adopt automatic
speaker, but the distribution of ECAPA-TDNN is more con-            MOS predictors to assess our testing results and these mod-
tinuous which suggests that ECAPA-TDNN can capture even             els show great potential. For future work, we will continue to
the subtle speaker characteristics from different utterances spo-   investigate the performance of few-shot multi-speaker speech
ken by the same speaker. It is important to be noticed that the     synthesis. ",cs.SD,C,-0.32757738,-0.081941806,-0.14771602
http://arxiv.org/pdf/2203.10473v2,ECAPA-TDNN for Multi-speaker Text-to-speech Synthesis,"Previous    els show great potential. For future work, we will continue to
studies [24] suggest that the continuous distribution of speaker    investigate the performance of few-shot multi-speaker speech
embeddings has better performance in the multi-speaker TTS          synthesis. task. ",cs.SD,C,-0.2653516,0.007973291,-0.10419738
http://arxiv.org/pdf/2203.10750v1,WeSinger: Data-augmented Singing Voice Synthesis with Auxiliary Losses,"For brevity, the ground-truth  higher quality and naturalness and achieve state-of-the-art per-
durations are used as the target duration for systems to synthe-  formance on the public corpus Opencpop. For future work, we
size. The calculated results are listed in Table 3 and we can     will investigate how to improve the robustness further and adapt
come to the following conclusions: 1) With the progressive        to any unseen singer with few-shot learning. ",cs.SD,C,-0.044952504,-0.030648643,-0.01992938
