url,title,further research,primary category,label,x,y,z
http://arxiv.org/pdf/2205.04328v1,"Insights on Modelling Physiological, Appraisal, and Affective Indicators of Stress using Audio Features","In contrast, the
STL network trained on the appraisal target shows a slight                      [5] A. Baird, S. Amiriparian, N. Cummins, S. Sturmbauer, J. Janson,
tendency towards the arithmetic task. This shows how stress                            E.-M. Messner, H. Baumeister, N. Rohleder, and B. W. Schuller,
may manifest differently in the two TSST tasks; future work                            “Using speech to predict sequentially measured cortisol levels during
could thus treat them separately. a Trier Social Stress Test,” in Proc. ",cs.SD,A,0.07340926,-0.19086531,-0.22866395
http://arxiv.org/pdf/2205.04923v1,Gamified Speaker Comparison by Listening,"This necessarily limits the
                                                                   statistical power of ﬁndings. We nonetheless hope our work
                                                                   to inspire further research or applications. A game perceived
                                                                   sufﬁciently ‘cool’ may have the potential to go viral. ",cs.SD,A,0.24477537,-0.05509187,-0.21906573
http://arxiv.org/pdf/2205.05330v1,Generalized Fast Multichannel Nonnegative Matrix Factorization Based on Gaussian Scale Mixtures for Blind Source Separation,"It is thus necessary to
                                                                      approximately compute φ˜−ft1 using an MH sampler as in [17]. C. Existing Instances of GSM-FastMNMF                                 Investigation of the existence and derivation of a closed-form
                                                                      expression of φ˜−ft1 remains as future work. We show that N -FastMNMF (Section II-D1), t-FastMNMF
(Section II-D2), leptokurtic GG-FastMNMF (Section II-D3),
IEEE/ACM TRANSACTIONS ON AUDIO, SPEECH, AND LANGUAGE PROCESSING, VOL. ",cs.SD,A,0.13724087,0.011113949,-0.12257011
http://arxiv.org/pdf/2205.05448v2,Symphony Generation with Permutation Invariant Language Model,"This section introduces the novel symphony dataset we                                                                                       6.3 Music BPE Result
propose and presents two stages in the training process 1 . After constructing a vocabulary list of length 1, 000 with
   1 Our code, demos, dataset and further analysis can be accessed at                                                                       Music BPE algorithm, the top-5 merged pairs shown in
https://symphonynet.github.io                                                                                                               Fig. 4 with the highest frequency are: (D4, F 4), (C4, E4),
                                                                          Model  CDH S O P

                                                                          Baseline 3.5 3.57 3.07 3.00 3.21 3.29

                                                                  Chord   BPE    3.64 3.64 3.14 3.15 3.43 3.29

                                                                          3D + BPE 3.71 3.72 3.21 3.07 3.5 3.5

                                                                          Human 4.43 3.43 4.14 4.36 4.14 4.14

                                                                          Baseline 3.79 2.79 3.21 3.43 3.36 3.36

                                                                  Prime   BPE    3.86 3.5 3.5 3.5 3.64 3.86

                                                                          3D + BPE 3.86 3.14 3.43 3.57 3.93 3.64

                                                                          Human 4.36 3.57 4.36 4.00 4.36 4.36

                                                                          Baseline 3.52 3.46 3.04 3.07 3.11 3.07

                                                                  Uncondi. ",cs.SD,B,0.07916619,0.26292193,-0.06760667
http://arxiv.org/pdf/2205.05580v1,Scream Detection in Heavy Metal Music,"REFERENCES
                       7. CONCLUSION
                                                               [1] O. Nieto, “Unsupervised clustering of extreme vocal
We introduced a new annotated dataset to aid and encourage          effects,” in Proceedings of the 10th International Con-
further research in vocal detection in heavy metal music. ference Advances in Quantitative Laryngology, 2013, p.
Both the dataset and code have been made publicly avail-           115.
able. ",cs.SD,B,-0.13362896,0.1906061,0.05394144
http://arxiv.org/pdf/2205.05871v1,Towards Robust Unsupervised Disentanglement of Sequential Data -- A Case Study Using Music Audio,"to consistently work over a wide range of settings. Our evalua-
                                                                       tion focuses on the ability to robustly achieve disentanglement,
6.5 Multiple Global Factors                                            and we leave evaluations on multi-modal data generation from
We now consider both the fourth and ﬁfth octaves when syn-             unconditional prior sampling for future work. We would also
thesising the dMelodies dataset, introducing octave number as          like to verify the applicability of TS-DSAE to modalities be-
the other global factor of variation in addition to instrument         yond the music audio datasets. ",cs.SD,B,0.0173762,0.2875734,-0.072820395
http://arxiv.org/pdf/2205.05871v2,Towards Robust Unsupervised Disentanglement of Sequential Data -- A Case Study Using Music Audio,"to consistently work over a wide range of settings. 3 Our
                                                                       evaluation focuses on the ability to robustly achieve disen-
6.5 Multiple Global Factors                                            tanglement, and we leave evaluations on multi-modal data
We now consider both the fourth and ﬁfth octaves when syn-             generation from unconditional prior sampling for future work. thesising the dMelodies dataset, introducing octave number as          We would also like to verify the applicability of TS-DSAE to
the other global factor of variation in addition to instrument         modalities beyond the music audio datasets. ",cs.SD,B,0.04434688,0.29389042,-0.113017686
http://arxiv.org/pdf/2205.06053v1,Unified Source-Filter GAN with Harmonic-plus-Noise Source Excitation Generation,"The proposed
             0.10  12  3.80 3.45 ± 0.06                            method has also shown comparative F0 controllability as the
                                                                   WORLD vocoder which is a conventional vocoder with strong
             0.10  13  3.32 3.28 ± 0.07                            F0 controllability while signiﬁcantly outperforming WORLD in
                                                                   sound quality. For future work, we intend to further improve the
             0.10  13  3.39 3.42 ± 0.06                            sound quality of HN-uSFGAN to tackle the occasional buzzy
                                                                   noises in the unvoiced segments. top rows of Table1. ",cs.SD,B,-0.021160575,0.2147085,0.0014670901
http://arxiv.org/pdf/2205.06053v2,Unified Source-Filter GAN with Harmonic-plus-Noise Source Excitation Generation,"The proposed
             0.10  12  3.80 3.45 ± 0.06                            method has also shown comparative F0 controllability as the
                                                                   WORLD vocoder which is a conventional vocoder with strong
             0.10  13  3.32 3.28 ± 0.07                            F0 controllability while signiﬁcantly outperforming WORLD in
                                                                   sound quality. For future work, we intend to further improve the
             0.10  13  3.39 3.42 ± 0.06                            sound quality of HN-uSFGAN to tackle the occasional buzzy
                                                                   noises in the unvoiced segments. 4.2.1. ",cs.SD,B,-0.018663425,0.21088654,0.0065998286
http://arxiv.org/pdf/2205.07450v1,PRISM: Pre-trained Indeterminate Speaker Representation Model for Speaker Diarization and Speaker Verification,"each system assigns segments to the corresponding clusters. For future works we are interested in investigating PRISM’s
     Both x-vector clustering system and end-to-end diarization    effects on the other speech related tasks such as target speaker
system with encoder-decoder based attractors are compared to       extraction, overlapping speech detection, etc. Even though the
our proposed system, as listed in table 4. ",cs.SD,C,-0.12819438,0.05431927,-0.006769385
http://arxiv.org/pdf/2205.07450v2,PRISM: Pre-trained Indeterminate Speaker Representation Model for Speaker Diarization and Speaker Verification,"each system assigns segments to the corresponding clusters. For future works we are interested in investigating PRISM’s
     Both x-vector clustering system and end-to-end diarization    effects on the other speech related tasks such as target speaker
system with encoder-decoder based attractors are compared to       extraction, overlapping speech detection, etc. Even though the
our proposed system, as listed in table 4. ",cs.SD,C,-0.12819438,0.05431927,-0.006769385
http://arxiv.org/pdf/2205.07682v1,L3-Net Deep Audio Embeddings to Improve COVID-19 Detection from Smartphone Data,"Available:
mobile devices. https://doi.org/10.1145/3465398

   As a future work, we would like to make an extensive                [3] Q.-V. Pham, D. C. Nguyen, T. Huynh-The, W.-J. Hwang, and P. N.
comparison of different deep audio embeddings models for                    Pathirana, “Artiﬁcial intelligence (ai) and big data for coronavirus
COVID-19 detection and, if other datasets are available,                    (covid-19) pandemic: A survey on the state-of-the-arts,” IEEE Access,
for the automatic detection of other important diseases, like               vol. ",cs.SD,B,-0.089743495,0.06906847,0.23378435
http://arxiv.org/pdf/2205.09667v1,The AI Mechanic: Acoustic Vehicle Characterization Neural Networks,"There is value
in developing a real-world application that would make it easy for a consumer to collect data on their mobile
device and store the waveform at its original 48 kHz sampling rate to prevent lossy compression or frequency attenuation. Another avenue for future work to address the lack of data, especially in underrepresented classes, would be generative
modeling. In particular, Generative Adversarial Networks (GANs) [26] have shown great power in developing realistic
samples in numerous ﬁelds, most notably facial recognition. ",cs.SD,A,-0.006112065,-0.0017235279,0.31042314
http://arxiv.org/pdf/2205.11738v1,Adaptive Few-Shot Learning Algorithm for Rare Sound Event Detection,"So, we follow the exper-                 improvement over baselines. iments from [41], such a out-of-domain testing could display
the ability of few-shot learning methods to generalize [42],                  In future work we plan to further analyze why adaptive
[43]. Following the previous setup, the selected AudioSet [44]             training of current state-of-the-art models does not yield
with 99 events for meta-train, meta-validation with 21 events              substantial improvements in the multi-shots setting. ",cs.SD,B,-0.073089756,0.0359425,0.2399953
http://arxiv.org/pdf/2205.11738v2,Adaptive Few-Shot Learning Algorithm for Rare Sound Event Detection,"mon and some patterns exist in other sounds as well such as
bell ringing. On the other hand animal sounds such as “dog                    In future work we plan to further analyze why adaptive
growling” rarely resemble other sounds. The gain of meta-                  training of current state-of-the-art models does not yield
learning approaches over supervised baselines are diminished               substantial improvements in the multi-shots setting. ",cs.SD,B,-0.14972,0.14585748,0.18071708
http://arxiv.org/pdf/2205.12594v1,Heterogeneous Reservoir Computing Models for Persian Speech Recognition,"Besides, in this study, we only reported the performance in terms of frame
recognition accuracy. It remains for future works to conduct recognition tasks at phoneme and word levels. 6 Acknowledgments

Fatemeh Hadeaghi’s research was supported by the Deutsche Forschungsgemeinschaft, Germany (TRR 169/A2). ",cs.SD,C,-0.055122096,-0.09520917,-0.04718619
http://arxiv.org/pdf/2205.14329v1,Speech Augmentation Based Unsupervised Learning for Keyword Spotting,"In Sec. V,         and compared with other unsupervised approaches, including
we conclude with the summary of the paper and future works. CPC [23], APC [24] and MPC [25]. ",cs.SD,A,0.45481527,-0.08101537,-0.13803735
http://arxiv.org/pdf/2205.14411v1,Feature Pyramid Attention based Residual Neural Network for Environmental Sound Classification,"The
experimental results are shown in Section 4. The conclusion and future work
about our research come in Section 5. 2. ",cs.SD,A,0.44211847,-0.04961499,-0.21071702
http://arxiv.org/pdf/2205.14701v1,Modeling Beats and Downbeats with a Time-Frequency Transformer,"The improvement
varies across different datasets. Our proposed models perform bet-            For future work, we will try to mitigate the sub-optimal issue
ter than the baseline by a wider margin for non-pop-centric datasets:    (see Section 4.4) with better solutions, as we expect it is currently
Ballroom and Hainsworth. In particular, the performance difference       the limitation for SpecTNT to improve beat tracking. ",cs.SD,B,0.08668265,0.23548672,-0.0010713576
http://arxiv.org/pdf/2205.15195v1,Personalized Acoustic Echo Cancellation for Full-duplex Communications,"Overall,              iliary information. In future work, we will test whether speaker
GTCNN-Es outperforms pGTCNN-Ex in all three scenarios                   recognition models with lower equal error rates will provide
(D1, D2, D3). Obviously, “knowing who is talking” is far more           consistent performance gain for the AEC models, and explore
important than “knowing who you are talking to”. ",cs.SD,C,-0.15547955,-0.20449609,0.0235313
http://arxiv.org/pdf/2205.15195v2,Personalized Acoustic Echo Cancellation for Full-duplex Communications,"In
far-end speaker can improve PESQ and ERLE scores. Overall,              future work, we will test whether more advanced speaker recog-
GTCNN-Es outperforms pGTCNN-Ex in all three scenarios                   nition models with lower equal error rates will provide consis-
(D1, D2, D3). Obviously, “knowing who is talking” is far more           tent performance gain for the AEC models, and explore more
important than “knowing who you are talking to”. ",cs.SD,C,-0.16701974,-0.198374,-0.14243518
http://arxiv.org/pdf/2205.15360v1,Revisiting Audio Pattern Recognition for Asthma Medication Adherence: Evaluation with the RDA Benchmark Suite,"Aerosol devices deliver a ﬁxed medication dose, rapidly
                                        paper revisits audio pattern recognition and machine learning             and directly into the airways, from a pressurized canister,
                                        techniques for asthma medication adherence assessment and                 containing a medication/propellant mixture [14], [15]. The
                                        presents the Respiratory and Drug Actuation (RDA) Suite1 for              efﬁcient and effective management of asthma is strongly
                                        benchmarking and further research. The RDA Suite includes a               connected with the patient adherence to the prescribed action
                                        set of tools for audio processing, feature extraction and classiﬁca-      plan, while reduced adherence has been strongly linked with
                                        tion and is provided along with a dataset consisting of respiratory       signiﬁcant indicators of health degradation. ",cs.SD,B,0.05119632,0.114707634,0.109889366
http://arxiv.org/pdf/2205.15360v2,Revisiting Audio Pattern Recognition for Asthma Medication Adherence: Evaluation with the RDA Benchmark Suite,"This               containing a medication/propellant mixture [14], [15]. The
                                       paper revisits audio pattern recognition and machine learning             efﬁcient and effective management of asthma is strongly
                                       techniques for asthma medication adherence assessment and                 connected with the patient adherence to the prescribed action
                                       presents the Respiratory and Drug Actuation (RDA) Suite1 for              plan, while reduced adherence has been strongly linked with
                                       benchmarking and further research. The RDA Suite includes a               signiﬁcant indicators of health degradation. ",cs.SD,B,0.009196404,0.12730683,0.1175694
http://arxiv.org/pdf/2205.15370v1,Guided-TTS 2: A Diffusion Model for High-quality Adaptive Text-to-Speech with Untranscribed Data,"Although we do not release the code, due to the adaptation ability of the diffusion-based model,
we expect that the adaptive TTS technology is highly likely to be misused like Deepfake. We leave
the research on anti-spooﬁng that distinguishes generated speech from real audio as future work,
considering the potential for misuse of Guided-TTS 2. 16 ",cs.SD,C,-0.22078797,-0.053855617,0.028056834
http://arxiv.org/pdf/2206.00454v1,Towards Context-Aware Neural Performance-Score Synchronisation,"Future work  162

relatively unexplored for music alignment. An example of such a positive feedback
loop is presented in Figure 6.1, providing a vision for future work. To this end,
research on optimal ways to eﬀectively leverage user context as well as developing
eﬀective techniques for adapting an existing model to a stream of manual corrections
could be explored. ",cs.SD,B,-0.019695822,0.25983715,-0.11350541
http://arxiv.org/pdf/2206.00635v1,Speech Artifact Removal from EEG Recordings of Spoken Word Production with Tensor Decomposition,"Eight speakers were right-
of extracted components used by the matrix decomposition          handed, and the rest were corrected-to-right. One subject was
was also beneﬁcial when applying CP decomposition, such           removed from further analysis due to a high rate of errors. as ICA, which uses the number of sources in the brain [5]. ",cs.SD,A,0.1533924,-0.09194504,-0.110345766
http://arxiv.org/pdf/2206.01071v1,Partitura: A Python Package for Symbolic Music Processing,"The package
functionalities are detailed in Section 2, and in Section 3 we provide a short usage example. Finally, in Section 4 we draw some conclusions on this paper and discuss possible future work. 1 Related Work

Among the available Python packages for parsing and processing music in symbolic formats,
there are two that stand out in terms of popularity and usability, Pretty MIDI and music21. ",cs.SD,B,0.07386005,0.26082426,-0.13249397
http://arxiv.org/pdf/2206.01104v1,The match file format: Encoding Alignments between Scores and Performances,"This paper marks the release of the
stable version 1.0.0 but further modiﬁcations are to be expected to support more features and
solve problems that arise from its usage in practical applications. Other future works involve a
graphical utility for the visualization and modiﬁcation of alignments and tools to create them
automatically (at least partially) given a corresponding score and performance. Acknowledgements

This project receives funding from the European Research Council (ERC) under the European
Union’s Horizon 2020 research and innovation programme, grant agreement No 101019375
(Whither Music?). ",cs.SD,B,0.08792461,0.35228345,-0.06443719
http://arxiv.org/pdf/2206.02211v1,Variable-rate hierarchical CPC leads to acoustic unit discovery in speech,"Yet, by being many-to-one mappings, they could make it impossible
to retrieve the original constituents after compression. We consider that an interesting objective for
future work is characterizing the patterns of the discovered pseudo-units sequences, and perhaps
investigate their correlation with models of human speech perception. 6 Related Work

Perhaps the most widely used variable-length feature discovery approach in deep learning is the
extraction of text tokens using byte-pair encodings [Sennrich et al., 2015] or unigram pieces [Kudo
and Richardson, 2018]. ",cs.SD,C,-0.1166591,-0.15384854,0.25682604
http://arxiv.org/pdf/2206.02211v2,Variable-rate hierarchical CPC leads to acoustic unit discovery in speech,"Yet, by being many-to-one mappings, they could make it impossible
to retrieve the original constituents after compression. We consider that an interesting objective for
future work is characterizing the patterns of the discovered pseudo-units sequences, and perhaps
investigate their correlation with models of human speech perception. 6 Related Work

Perhaps the most widely used variable-length feature discovery approach in deep learning is the
extraction of text tokens using byte-pair encodings [Sennrich et al., 2015] or unigram pieces [Kudo
and Richardson, 2018]. ",cs.SD,C,-0.1166591,-0.15384854,0.25682604
http://arxiv.org/pdf/2206.02211v3,Variable-rate hierarchical CPC leads to acoustic unit discovery in speech,"Yet, by being many-to-one mappings, they could make it impossible
to retrieve the original constituents after compression. We consider that an interesting objective for
future work is characterizing the patterns of the discovered pseudo-units sequences, and perhaps
investigate their correlation with models of human speech perception. 6 Related Work

Perhaps the most widely used variable-length feature discovery approach in deep learning is the
extraction of subword units from text [Schuster and Nakajima, 2012, Sennrich et al., 2016, Kudo
and Richardson, 2018]. ",cs.SD,C,-0.12667742,-0.16494182,0.23263013
http://arxiv.org/pdf/2206.02284v2,Tagged-MRI Sequence to Audio Synthesis via Self Residual Attention Guided Heterogeneous Translator,"Therefore, our
framework oﬀered the potential to help clinicians improve treatment strategies
for patients with speech-related disorders. In future work, we will investigate the
use of full three-dimensional plus time tagged-MRI sequences as well as tracking
information from tagged-MRI to achieve spectrogram synthesis. Acknowledgements

This work is supported by NIH R01DC014717, R01DC018511, and R01CA133015. ",cs.SD,C,-0.12402443,0.12170267,0.0155949965
http://arxiv.org/pdf/2206.02284v3,Tagged-MRI Sequence to Audio Synthesis via Self Residual Attention Guided Heterogeneous Translator,"Therefore, our
framework oﬀered the potential to help clinicians improve treatment strategies
for patients with speech-related disorders. In future work, we will investigate the
use of full three-dimensional plus time tagged-MRI sequences as well as tracking
information from tagged-MRI to achieve spectrogram synthesis. Acknowledgements

This work is supported by NIH R01DC014717, R01DC018511, and R01CA133015. ",cs.SD,C,-0.12402443,0.12170267,0.0155949965
http://arxiv.org/pdf/2206.02671v1,Canonical Cortical Graph Neural Networks and its Application for Speech Enhancement in Future Audio-Visual Hearing Aids,"Finally, it also showed itself to be less depen-
dent on a more extended prior-frame sequence, i.e., high values of k, since the
memory can store and track temporal information. Regarding future work, we aim to extend a similar cortical-based architecture
to convolutional neural networks and applications to two-dimensional data. We
also aim to implement the model on chips for training and inference for possible
future implementation in hearing-aid devices for AV speech enhancement. ",cs.SD,C,-0.15851535,0.009671267,0.31822455
http://arxiv.org/pdf/2206.02671v2,Canonical Cortical Graph Neural Networks and its Application for Speech Enhancement in Future Audio-Visual Hearing Aids,"Finally, it also showed itself to be less depen-
dent on a more extended prior-frame sequence, i.e., high values of k, since the
memory can store and track temporal information. Regarding future work, we aim to extend a similar cortical-based architecture
to Convolutional Neural Networks and applications to two-dimensional data. We
also aim to implement the model on chips for training and inference for possible
future implementation in hearing aid devices for AV speech enhancement. ",cs.SD,C,-0.16290909,0.015004149,0.31733912
http://arxiv.org/pdf/2206.03351v1,AS2T: Arbitrary Source-To-Target Adversarial Attack on Speaker Recognition Systems,"abs/1704.03453, 2017.
this asymmetric phenomenon. (iii) Another future work is
to investigate defense solutions against adversarial attacks                 [20] Y. Liu, X. Chen, C. Liu, and D. Song, “Delving into transferable
in the speaker recognition domains under various settings. adversarial examples and black-box attacks,” in ICLR, 2017. ",cs.SD,C,-0.15128866,-0.12352571,0.18334875
