url,title,further research,primary category,label,x,y,z
http://arxiv.org/pdf/2203.14409v1,SMP-PHAT: Lightweight DoA Estimation by Merging Microphone Pairs,"This makes SMP-PHAT well-
suited for embedded processing on portable devices with lim-            ∆
ited computing ressources. In future work, the method could
be adapted for multiple sound source localization, and combine          SRP
with sound source tracking algorithms. Time-frequency mask-
ing could also be introduced to ﬁlter undesirable sound sources  Additions SMP
and focus on sources of interest, such as speech. ",cs.SD,B,-0.080068775,0.31139013,-0.007202739
http://arxiv.org/pdf/2203.14688v1,Training speaker recognition systems with limited data,"Such a change could then perhaps result in even better perfor-
                                                                                             mance on the tiny datasets, and speciﬁcally on tiny-few-sessions. We are also interested in future work pre-training on a dataset
                                                                                             other than LibriSpeech, which has limited variability per speaker. It might also be relevant to pre-train on VoxCeleb2, so that the
                                                                                             model has a prior on speech patterns, requiring less ﬁne-tuning. ",cs.SD,C,-0.21364838,-0.10376151,-0.008556189
http://arxiv.org/pdf/2203.14725v1,vTTS: visual-text to speech,"When listening to speech    speech, and 3) it can generate more natural speech from OOV
synthesized from the Koruri typeface, 79% of the listeners an-     and rare characters. In future work, we plan to apply our method
swered that it sounded joyful, and 89% of the listeners answered   to a variety of media such as manga or posters. We hope that
that it sounded sad when listening to speech synthesized from      this research will serve as a ﬁrst benchmark in the development
the Aiharahudemozikaisyo typeface. ",cs.SD,C,-0.25228179,0.011936726,-0.24248748
http://arxiv.org/pdf/2203.15249v1,MFA-Conformer: Multi-scale Feature Aggregation Conformer for Automatic Speaker Verification,"Our ablation study shows the com-
                                                                      bination of local and global feature modeling can lead to the
                                                                      robust speaker embedding extraction, this can provide inspira-
                                                                      tion for the future ASV system design and acceleration. In the
                                                                      future work, we will extend the MFA-Conformer for streaming
                                                                      speaker recognition scenarios. 6. ",cs.SD,C,-0.16420598,0.08246104,0.054341782
http://arxiv.org/pdf/2203.15249v2,MFA-Conformer: Multi-scale Feature Aggregation Conformer for Automatic Speaker Verification,"Our ablation study shows the com-
                                                                 bination of local and global feature modeling can lead to the
       12 2.61 0.224 2.65 0.238                                  robust speaker embedding extraction, this can provide inspira-
                                                                 tion for the future ASV system design and acceleration. In the
       1 3.38 0.280 3.73 0.308                                   future work, we will extend the MFA-Conformer for streaming
                                                                 speaker recognition scenarios. Conformer 3 2.15 0.186 2.14 0.195
                 6 1.29 0.137 1.63 0.153                                       6. ",cs.SD,C,-0.09362187,0.050183944,-0.018692411
http://arxiv.org/pdf/2203.15276v1,Applying Syntax$\unicode{x2013}$Prosody Mapping Hypothesis and Prosodic Well-Formedness Constraints to Neural Sequence-to-Sequence Speech Synthesis,"psychological reality of the phonological structures. However,
                                                                                                                 since the principles of neural net TTS are different from those
baseline 2 (phonemes, accents, initial lowering, and dependency length)                                          of human speech, this proposal needs further research toward
    4N: k i / n o o #6 y a / m a \ n a sh i n o #1 m o / r i \ g u ch i n o #1 a / n i \ y o m e n o             improving the psychological reality of computational models. #1 w a / r u \ g u ch i o #2 k o / o e N d e #1 ts U / t a e t a . ",cs.SD,C,-0.14259803,-0.17436282,-0.17770627
http://arxiv.org/pdf/2203.15335v2,Iranian Modal Music (Dastgah) detection using deep neural networks,"The variety of art-
                                                             ists and instruments in the Nava dataset is an appropriate
Figure 5. Confusion matrix                                   starting point for future works that could create a bench-
                                                             mark. Furthermore, in our opinion, the cooperation of
        Mode      Precision  Recall  F1-Score  Support       online music platforms, artists, and scientists in this field
                                                             can be valuable in creating a more suitable dataset, includ-
        Shur        0.90     0.90      0.90      63          ing ensemble performances, in which the samples can be
       Segah        0.89     0.83      0.86      69          labeled by Gushe instead of Dastgah. ",cs.SD,B,0.13146396,0.22254667,-0.018727252
http://arxiv.org/pdf/2203.15377v1,Spoofing-Aware Speaker Verification by Multi-Level Fusion,"ous work [30]. In the future work, we will introduce more CM
models to investigate the potential of the proposed method. [20] J.-w. Jung, H.-j. ",cs.SD,A,0.4197049,-0.026821136,-0.17348975
http://arxiv.org/pdf/2203.15379v2,VoiceMe: Personalized voice generation in TTS,"faces moving from a 2.7 MOS at iteration 0 to a MOS of 4.0          and face rather than intelligibility. For future work, we may
(‘Good match’) in the later iterations (Wilcoxon rank sum test,     also explore running iterations within the same participants and
Z = .42, p < 0.001, Bonferroni-adjusted). The trend is followed     without aggregating multiple responses per iteration (see [10, 9]
by the cartoons (Wilcoxon rank sum test, Z = .18, p < 0.001,        for an exploration of these options). ",cs.SD,A,0.41990578,-0.14204787,-0.1837413
http://arxiv.org/pdf/2203.15468v1,Machine Composition of Korean Music via Topological Data Analysis and Artificial Neural Network,"Also, the current research used a rather simple periodic extension method for
generating the training data set from the given seed music. Our future work will conduct a study on
how to provide training data when the number of considered music pieces is small. These should be
fully considered for the construction of more generalized machine composition of Korean music. ",cs.SD,B,0.06019949,0.38220453,-0.022475727
http://arxiv.org/pdf/2203.15568v1,A Dataset for Speech Emotion Recognition in Greek Theatrical Plays,"effective. This indicates that future works in the
ﬁeld of recognizing emotions in theatrical data should     Ekman, P. (1992). An argument for basic emotions. ",cs.SD,B,0.006145619,-0.044366635,-0.25446594
http://arxiv.org/pdf/2203.15683v1,DRSpeech: Degradation-Robust Text-to-Speech Synthesis with Frame-Level and Utterance-Level Acoustic Representation Learning,"In the Noise condition,      outperformed existing noise-robust TTS methods with respect
the average MOS of Noise-robust TTS was greater than that of       to both objective and subjective measures in conditions includ-
Degraded GT and Enhancement TTS; this is consistent with the       ing reverberation. Our future work includes conducting experi-
result of the previous study [3]. Moreover, DRSpeech outper-       ments with a wider variety of types of distortion. ",cs.SD,C,-0.043367274,0.1605148,-0.16850564
http://arxiv.org/pdf/2203.15683v2,DRSpeech: Degradation-Robust Text-to-Speech Synthesis with Frame-Level and Utterance-Level Acoustic Representation Learning,"Because a                 ing reverberation. Our future work includes conducting experi-
noise is added to the entire speech utterance, DRSpeech, which            ments with a wider variety of types of distortion. considers global conditions, may be expected to achieve better
results than Noise-robust TTS. ",cs.SD,C,-0.21834895,-0.0032999003,-0.20909753
http://arxiv.org/pdf/2203.15873v1,An Overview & Analysis of Sequence-to-Sequence Emotional Voice Conversion,"Similarly, the dataset in Choi and Hahn [20] includes       of samples; however, there are non-speech utterances included,
100 sentences in 4 different emotional categories (neutral, anger,    such as laughter and yawn. The collection and release of suit-
happiness, and sadness) pronounced by 5 Korean actors and 5           able datasets to the public would foster further research in this
Korean actresses, for a total of 4 000 utterances. promising ﬁeld and help improve the performance. ",cs.SD,C,-0.2074888,-0.1728811,-0.18376034
http://arxiv.org/pdf/2203.15966v1,Federated Domain Adaptation for ASR with Full Self-Supervision,"We highlight that ﬁnetuning only        tion costs by adapting only a subset of weights in the model. the key/value matrices in the attention not only achieves a low    We will further explore effects of non-IIDness and differential
target domain WER (4.32), but also prevents catastrophic for-      privacy on our proposed techniques as part of future work. getting on the source domain as the number of updates increases
(see ﬁgure 3). ",cs.SD,A_centroid,0.32666957,-0.32799554,0.13462588
http://arxiv.org/pdf/2203.15966v2,Federated Domain Adaptation for ASR with Full Self-Supervision,"Second, we explored
                                                                   techniques reducing the FL compute and network communica-
Attention               8.2 (11%)         4.35        6.16         tion costs by adapting only a subset of weights in the model. We will further explore effects of non-IID-ness and differential
KeyValue ( 5 ) 4.1 (5.7%)                 4.32        5.95         privacy on our proposed techniques as part of future work. Predictor               1.7 (2.5%)        4.68        6.19

Joiner                  3.1 (4.4%)        4.70        6.20

Bias                    0.2 (0.3%)        4.35        5.75
                   5. ",cs.SD,A,0.32953334,-0.37003115,0.0062699206
http://arxiv.org/pdf/2203.16037v1,Enhancing Zero-Shot Many to Many Voice Conversion with Self-Attention VAE,"taining the generated voice quality of VAE while signiﬁcantly
                                                                    increasing speaker classiﬁcation accuracy of converted utterance
     For each converted utterance, the voice quality is measured    of seen/unseen speakers. In future work, we plan to extend the
by MOSNet [26] that predicts human ratings of converted speech. self-attention layer in this study to more advanced form and
MOSnet score ranges from 1 to 5, with lowest score of 1 and         explore cross-attention as well for speaker conversion tasks. ",cs.SD,C,-0.26539564,-0.16353318,-0.12830856
http://arxiv.org/pdf/2203.16037v2,Enhancing Zero-Shot Many to Many Voice Conversion with Self-Attention VAE,"Evaluation                                                    while signiﬁcantly increasing speaker classiﬁcation accuracy
                                                                 of converted utterance of seen/unseen speakers. In future work,
   To evaluate our method, we consider two objective metrics:    we plan to explore some of the feature extraction and attention
i) voice quality and ii) speaker classiﬁcation accuracy. Both    structures in [26] to further reduce generalization error. ",cs.SD,C,-0.28320932,-0.09494436,-0.13162927
http://arxiv.org/pdf/2203.16085v1,"Combination of Time-domain, Frequency-domain, and Cepstral-domain Acoustic Features for Speech Commands Classification","In section 3, we intro-                                                      Pre-processed
duce the back-end feature score linear combination method. In                                                           waveform
section 4, we discuss the experimental setup and results, and ﬁ-
nally, we provide a conclusion of the paper and some directions                                                Sampled
for future work in Section 5.                                                                                  value

                                                                                                                                                                                                         TTiimmee

2. Features Extraction

2.1. ",cs.SD,B,0.18009596,0.13360733,0.060169157
http://arxiv.org/pdf/2203.16085v2,"Combination of Time-domain, Frequency-domain, and Cepstral-domain Acoustic Features for Speech Commands Classification","In section 3, we intro-                                                      Pre-processed
duce the back-end feature score linear combination method. In                                                           waveform
section 4, we discuss the experimental setup and results, and ﬁ-
nally, we provide a conclusion of the paper and some directions                                                Sampled
for future work in Section 5.                                                                                  value

                                                                                                                                                                                                         TTiimmee

2. Features Extraction

2.1. ",cs.SD,B,0.18009596,0.13360733,0.060169157
http://arxiv.org/pdf/2203.16141v1,Example-based Explanations with Adversarial Attacks for Respiratory Sound Analysis,"Experiments show that our approach can
# Criticism  35                                                                             outperform the baselines, and achieve average score of 52.89 %
                                                                                            and unweighted average recall of 46.82 %. In future work, we
                      25                                                                    will explore the affect of adversarial attacks by analysing the
                                                                                            attention map of adversarial data. We also plan to explore other
             18          1513     89                                                        types of explanations such as counterfactuals [34]. ",cs.SD,A,0.08353703,-0.32293063,0.14460018
http://arxiv.org/pdf/2203.16646v1,Generation of Speaker Representations Using Heterogeneous Training Batch Assembly,"Inspired by the concept of guided learning
VBD-based resegmentation have a good combination effect. in [32], our future work will focus on how to make better
                                                                    use of speaker-change information, such as letting the output
   2) The CHiME-6 task: In the CHiME-6 task, we compared            of the last ResNet-based layer (prior to temporal pooling)
different speaker diarization systems in terms of 3 metrics,        contain information to distinguish the temporal speaker-change
including the DER, Jaccard error rate (JER) [31], and word          characteristics. error rate (WER). ",cs.SD,C,-0.2138995,-0.07263737,0.039885987
http://arxiv.org/pdf/2203.16738v1,Improving speaker de-identification with functional data analysis of f0 trajectories,"It should be noted that FDA in this study
focused on mean curves of voice conditions while examining curves of individ-
ual speakers might have revealed more details about the relation of speaker-
dependent and disguise-dependent f0 variation. Using FDA for modelling voice
disguise strategies and speaker-dependent f0 curves would be a potential topic
for future work. 7. ",cs.SD,C,-0.15440801,0.020437023,-0.32098573
http://arxiv.org/pdf/2203.16772v1,Learning Decoupling Features Through Orthogonality Regularization,"Our pro-
                                                                posed method reaches SOTA. In future work, we will explore
Model                 KWS               SV                      the usability of orthogonality regularization in other tasks,
                                                                such as speaker veriﬁcation and emotion classiﬁcation; intent
KWS single-task 1.86 ± 0.10             -                       detection and text sentimental classiﬁcation [24]. SV single-task        -      2.27 ± 0.03                                                5. ",cs.SD,C,-0.08902328,-0.15208994,-0.08705735
http://arxiv.org/pdf/2203.16930v1,WavThruVec: Latent speech representation as intermediate features for neural speech synthesis,"Although we use WavThruVec as
throughout all the converted voices. In contrast, WavThruVec                                                                                            a two-stage architecture, future work can explore joint training
discards most of the acoustic properties through intermediate                                                                                           with a WAV2VEC-like objective. Extending this approach with
                                                                                                                                                        additional modules e.g. ",cs.SD,C,-0.3775962,0.03065554,0.09166485
http://arxiv.org/pdf/2203.16930v2,WavThruVec: Latent speech representation as intermediate features for neural speech synthesis,"However, individual phonetic segments                                                                                          listening tests with regards to speech naturalness, outperforming
can vary between speakers (Figure 3b), while VITS forces the                                                                                            state-of-the-art TTS systems. Although we use WavThruVec as
converted voice to match the input one’s characteristics (Figure                                                                                        a two-stage architecture, future work can explore joint training
3a). This is particularly evident, for example, in the case of the                                                                                      with a WAV2VEC-like objective. ",cs.SD,C_centroid,-0.33138597,-0.08708344,-0.10026209
http://arxiv.org/pdf/2203.17023v1,CTA-RNN: Channel and Temporal-wise Attention RNN Leveraging Pre-trained ASR Embeddings for Speech Emotion Recognition,"The experi-                       beddings across different speakers and domains. In future work,
mental results are reported in Table 2. Compared with the E(i)                      we intend to explore the correlation of emotional speech in sev-
                                                                                    eral languages and expand on our work to multi-lingual SER. ",cs.SD,C,-0.1755257,-0.22647542,-0.37680143
http://arxiv.org/pdf/2203.17113v1,Pre-Training Transformer Decoder for End-to-End ASR Model with Unpaired Speech Data,"10 937–10 947. [24] T. Hori, S. Watanabe, and J. Hershey, “Joint CTC/attention decod-
                                                                                ing for end-to-end speech recognition,” in Proceedings of the 55th
 [8] D. Jiang, W. Li, R. Zhang, M. Cao, N. Luo, Y. Han, W. Zou,                 Annual Meeting of the Association for Computational Linguistics
      K. Han, and X. Li, “A further study of unsupervised pretraining           (Volume 1: Long Papers), Jul. 2017, pp. ",cs.SD,C,-0.21660124,-0.3246496,0.09450257
http://arxiv.org/pdf/2203.17113v2,Pre-Training Transformer Decoder for End-to-End ASR Model with Unpaired Speech Data,"10 937–10 947. [24] T. Hori, S. Watanabe, and J. Hershey, “Joint CTC/attention decod-
                                                                                ing for end-to-end speech recognition,” in Proceedings of the 55th
 [8] D. Jiang, W. Li, R. Zhang, M. Cao, N. Luo, Y. Han, W. Zou,                 Annual Meeting of the Association for Computational Linguistics
      K. Han, and X. Li, “A further study of unsupervised pretraining           (Volume 1: Long Papers), Jul. 2017, pp. ",cs.SD,C,-0.21660124,-0.3246496,0.09450257
http://arxiv.org/pdf/2203.17242v1,Automatic Detection of Expressed Emotion from Five-Minute Speech Samples: Challenges and Opportunities,"Lin-SVC and LR classiﬁers performed signiﬁcantly better than
KNN and RF. In future work, we intend to prioritise the expansion of the
                                                                    dataset with additional transcriptions. A larger dataset would
     Figure 2 shows the Receiver Operating Characteristic           open up the possibility of using more sophisticated classiﬁca-
(ROC) curves for one of the representative runs of the best per-    tion models. ",cs.SD,A,0.16746043,-0.122576736,0.06890303
http://arxiv.org/pdf/2204.00061v1,Data-augmented cross-lingual synthesis in a teacher-student framework,"We conclude      ing the approach feasible for low-resource languages. that speech from the proposed model is able to retain the level
of intonation variation present in teacher forced data rather than       We see several opportunities for further research. First, we
the lower intonation variation from the augmented speech. ",cs.SD,C,-0.23762105,-0.16375896,-0.1505312
http://arxiv.org/pdf/2204.00331v1,Using segment-based features of jaw movements to recognize foraging activities in grazing cattle,"Assuming literature values
of 1.5 kg/h of dry matter consumption (Galli et al., 2018), previous val-
ues correspond to an approximate consumption with a median of 14.2 kg
(interquartile range 12.3 - 18.3 kg) and 12.0 kg (interquartile range 11.0 -
12.8 kg) for BUFAR and JMFAR respectively. Certainly, additional research
would be necessary to evaluate the application of acoustic methods for es-
timation of herbage dry matter intake. As the pioneer work by Laca et al. ",cs.SD,B,0.10756907,0.24258898,-0.16896781
http://arxiv.org/pdf/2204.00331v2,Using segment-based features of jaw movements to recognize foraging activities in grazing cattle,"Assuming literature values
of 1.5 kg/h of dry matter consumption (Galli et al., 2018), previous val-
ues correspond to an approximate consumption with a median of 14.2 kg
(interquartile range 12.3 - 18.3 kg) and 12.0 kg (interquartile range 11.0 -
12.8 kg) for BUFAR and JMFAR respectively. Certainly, additional research
would be necessary to evaluate the application of acoustic methods for es-
timation of herbage dry matter intake. As the pioneer work by Laca et al. ",cs.SD,B,0.10756907,0.24258898,-0.16896781
http://arxiv.org/pdf/2204.00652v1,End-to-end multi-talker audio-visual ASR using an active speaker attention module,"Comparison of WERs for T-T based SingleChan and Mul-            single speaker utterances in the training set. The goal of future work
                                                                         is to overcome the degradation associated with this and other unseen
tiTalker models on Single and Overlap test sets. conditions by further augmenting the training set. ",cs.SD,C,-0.21229193,-0.13564143,-0.19910333
http://arxiv.org/pdf/2204.00819v1,Leveraging Phone Mask Training for Phonetic-Reduction-Robust E2E Uyghur Speech Recognition,"In addition, deep investigations are carried out into dif-
                                       ferent units in masking, which shows the effectiveness of our          We try to solve PR from a mask training perspective un-
                                       proposed masking unit. We also further study the masking          der the E2E ASR framework. Recently, a lot of excellent works
                                       method and optimize ﬁlling strategy of phone mask. ",cs.SD,A,0.11990252,-0.14579116,0.098192886
http://arxiv.org/pdf/2204.00821v1,Improving Target Sound Extraction with Timestamp Information,"We have shown the pos-
time-domain and frequency-domain loss, we can get our base-          sibility of mutual learning for an extraction task and a detection
line performance of 10.25 for SI-SDRi and 5.14 for SI-SDRi-t.        task. A future work is to further improve the SI-SDRi-t, and
Comparing with [7] and [11], our baseline method has already         we think designing new sound extractors is a potential solution. surpassed them as they only use the time-domain loss. ",cs.SD,B,-0.017493833,0.13059127,0.23350766
http://arxiv.org/pdf/2204.00873v1,Acoustic-to-articulatory Inversion based on Speech Decomposition and Auxiliary Feature,"Ablation Study                                                                                  public datasets demonstrate that both in speaker-dependent
                                                                                                     and speaker-independent scenarios, the SAFN outperforms
To verify the effectiveness of the proposed modules in Sec-                                          SOTA by a large margin. For the future work, the self-
tion 2, we carry out the ablation experiment according to Ta-                                        supervised method based on Meta Learning will be applied
ble 3, and the results are shown in Fig. 3. ",cs.SD,C,-0.10314623,-0.110413805,0.014382966
