url,title,further research,primary category,label,x,y,z
http://arxiv.org/pdf/2201.00052v1,Evaluating Deep Music Generation Methods Using Data Augmentation,"4, pp. 299–310,
from a different distribution to the training data, using domain                    2012.
adversarial training [27], [28] would help to uncover domain
invariant features in the generated samples, and is therefore an              [10] N. Chen, A. Klushyn, R. Kurle, X. Jiang, J. Bayer, and P. Smagt,
interesting avenue for further research. We have also assumed                       “Metrics for deep generative models,” in International Conference on
that generated samples strictly inherit the label from an origi-                    Artiﬁcial Intelligence and Statistics. ",cs.SD,A,0.057216942,-0.19218987,0.2692148
http://arxiv.org/pdf/2201.00927v1,Classifying Autism from Crowdsourced Semi-Structured Speech Recordings: A Machine Learning Approach,"Such approaches have been demonstrated to improve socialization among children with
autism spectrum disorder [31, 36], suggesting that they could also be used to collect
naturalistic data similar to this experiment in an unobtrusive way. Another area of interest for future work may be examining the possibility of leveraging a
distributed workforce of humans for extracting audio-related features to bolster screening
accuracy. Previous work examined the use of crowdsourced annotations for autism,
indicating that similar approaches could perhaps be applied through audio [39-45]. ",cs.SD,B,-0.1629921,0.0603036,0.012805516
http://arxiv.org/pdf/2201.01763v1,Robust Self-Supervised Audio-Visual Speech Recognition,"With less than 10% of labeled data, our
noise-augmented pre-training approach reduces recognition error       model outperforms prior SOTA by ∼ 50%. Our future work
by 81.8% (42.9%→7.8%) / 60.8% (14.8%→5.8%) in low/mid-                includes applying audio-visual speech recognition in real-world
resource settings. low-resource and multilingual settings. ",cs.SD,C,-0.20170346,-0.09094983,0.21731779
http://arxiv.org/pdf/2201.01763v2,Robust Self-Supervised Audio-Visual Speech Recognition,"With less than 10% of labeled data, our
noise-augmented pre-training approach reduces recognition error       model outperforms prior SOTA by ∼ 50%. Our future work
by 81.8% (42.9%→7.8%) / 60.8% (14.8%→5.8%) in low/mid-                includes applying audio-visual speech recognition in real-world
resource settings. low-resource and multilingual settings. ",cs.SD,C,-0.20170346,-0.09094983,0.21731779
http://arxiv.org/pdf/2201.01763v3,Robust Self-Supervised Audio-Visual Speech Recognition,"With less than 10% of labeled data, our
noise-augmented pre-training approach reduces recognition error       model outperforms prior SOTA by ∼ 50%. Our future work
by 81.8% (42.9%→7.8%) / 60.8% (14.8%→5.8%) in low/mid-                includes applying audio-visual speech recognition in real-world
resource settings. low-resource and multilingual settings. ",cs.SD,C,-0.20170346,-0.09094983,0.21731779
http://arxiv.org/pdf/2201.01771v1,Self-Supervised Beat Tracking in Musical Signals with Polyphonic Contrastive Learning,"We struggled to train the model however. 37
38 discussion and future work

        learning, we truly believe that audio source separation algorithms
        such as Spleeter [27] could serve as a data augmentation technique
        tailored to musical representation learning. A key property of music
        is that it mixes sounds from one or more sources to produce a whole. ",cs.SD,B,-0.18450809,0.32688808,0.15112302
http://arxiv.org/pdf/2201.02994v1,Emotional Speaker Identification using a Novel Capsule Nets Model,"In addition, we plan to study speaker
identification performance in emotional environments using different input features, e.g., spectrograms. Finally,
further study into employing capsule networks in speaker and speech recognition with proven results is required
because capsule networks are currently in development. Compliance with Ethical Standards

   The authors thank the University of Sharjah for supporting this work through the Machine Learning and Arabic
Language Processing research group. ",cs.SD,C,-0.19969003,-0.19611305,-0.014416056
http://arxiv.org/pdf/2201.03217v2,Local Information Assisted Attention-free Decoder for Audio Captioning,"In       information, and overcomes the limitation of these attention-
                                                                 based methods. In a future work, we may explore the choice of
                                                                 adaptive window size to capture local information from audio
                                                                 clips with acoustic events and scenes of different duration. 1https://github.com/LittleFlyingSheep/P-LocalAFT/tree/main/examples
                                                                               5

                             REFERENCES                                        [16] Z. Liu, Y. Lin, Y. Cao, H. Hu, Y. Wei, Z. Zhang, S. Lin, B. Guo, “Swin
                                                                                     Transformer: Hierarchical vision Transformer using shifted windows”, in
 [1] K. Drossos, S. Lipping, T. Virtanen, “Clotho: An audio captioning               Proc. ",cs.SD,C,-0.15297656,0.1362715,0.10691818
http://arxiv.org/pdf/2201.03386v1,Sub-mW Keyword Spotting on an MCU: Analog Binary Feature Extraction and Binary Neural Networks,"and tiny circuit with a sufﬁciently simple sound detector based
on binary features. The full integration is left for future work. REFERENCES

                         VII. ",cs.SD,B,0.034848217,0.29658863,0.11198865
http://arxiv.org/pdf/2201.03967v2,Emotion Intensity and its Control for Emotional Voice Conversion,"Inspired by the successful  into the emotional speech synthesis systems, which moti-
attempts in prosody style control, several studies control        vates our study. We further study the use of perceptual
                                                                  losses in EVC training to improve the intelligibility of the
                                                                  converted emotion. 4

2.5 Research Gap (Summary)                                         Source            Linguistic Transplant
                                                                   Speech                                     Linguistic
Below, we summarise the gaps in the literature of emotional        (Neutral)
voice conversion that we aim to address in this paper. ",cs.SD,C,-0.31122717,-0.21687159,-0.26403183
http://arxiv.org/pdf/2201.03967v3,Emotion Intensity and its Control for Emotional Voice Conversion,"Inspired by the successful  into the emotional speech synthesis systems, which moti-
attempts in prosody style control, several studies control        vates our study. We further study the use of perceptual
                                                                  losses in EVC training to improve the intelligibility of the
                                                                  converted emotion. 4

2.5 Research Gap (Summary)                                         Source            Linguistic Transplant
                                                                   Speech                                     Linguistic
Below, we summarise the gaps in the literature of emotional        (Neutral)
voice conversion that we aim to address in this paper. ",cs.SD,C,-0.31122717,-0.21687159,-0.26403183
http://arxiv.org/pdf/2201.04583v1,VoxSRC 2021: The Third VoxCeleb Speaker Recognition Challenge,"Future work could involve increasing the amount of
VoxSRC workshops will be in person, but to maintain this wide        multi-modal data in the test set to reduce the uncertainty for less
access, we will endeavor to keep recording and livestreaming         frequent languages. presentations during future workshops. Participation in all four
of the tracks increased signiﬁcantly from last year (an increase          We are unable to make a direct comparison between the
of 21%, 157%, 140%, and 94% for Tracks 1, 2, 3, and 4 respec-        2020 and 2021 test sets, although the signiﬁcantly higher %
tively, in terms of numbers of teams submitting results). ",cs.SD,B,0.02583431,-0.015451545,-0.12548535
http://arxiv.org/pdf/2201.04583v2,VoxSRC 2021: The Third VoxCeleb Speaker Recognition Challenge,"We hope that in future the      work to be done to provide equally high performance across all
VoxSRC workshops will be in person, but to maintain this wide        languages. Future work could involve increasing the amount of
access, we will endeavor to keep recording and livestreaming         multi-modal data in the test set to reduce the uncertainty for less
presentations during future workshops. Participation in all four     frequent languages. ",cs.SD,C,-0.027899534,-0.08178306,-0.117328316
http://arxiv.org/pdf/2201.05554v1,Spectro-Temporal Deep Features for Disordered Speech Assessment and Recognition,"Sec.4 presents experiments and results of both speech intelli-     10                                                       10
gibility assessment and speech recognition on UASpeech. The
last section concludes and discuss possible future works. 20         U      0                               Σ      20                                                                                         ! ",cs.SD,C,-0.17569895,-0.14071226,-0.14321917
http://arxiv.org/pdf/2201.05562v1,Investigation of Data Augmentation Techniques for Disordered Speech Recognition,"Given an audio segment x(t), a perturbation factor α is
results on the UASpeech database. The last section concludes        applied along the time axis and gives the output y(t) as:
and discusses possible future works. y(t) = x(αt)                              (3)

              2. ",cs.SD,B,0.14261721,0.26731962,-0.17365873
http://arxiv.org/pdf/2201.05782v1,A Novel Multi-Task Learning Method for Symbolic Music Emotion Recognition,"BERT: pre-training of deep bidirectional
   We would like to apply the MT-SMNN framework to other                transformers for language understanding. In Proceedings of the
areas for future work. For example, the MT-SMNN based                   2019 Conference of the North American Chapter of the Associa-
models can be employed to build a metric for evaluating the             tion for Computational Linguistics: Human Language Technolo-
performance of emotion conditioned symbolic music genera-               gies, NAACL-HLT 2019, Minneapolis, MN, USA, June 2-7, 2019,
tion models. ",cs.SD,C,-0.101678595,-0.2844941,0.016559776
http://arxiv.org/pdf/2201.06426v1,On Training Targets and Activation Functions for Deep Representation Learning in Text-Dependent Speaker Verification,"We                  [17] F. Schroff, D. Kalenichenko, and J. Philbin, “Facenet: A uniﬁed
also believe that a better fusion strategy can further improve                       embedding for face recognition and clustering,” in arXiv:1503.03832/
the fusion system. Fusion in the feature domain is of interest                       IEEE Computer Society Conference on Computer Vision and Pattern
to investigate [52] and we keep it for future work. Recognition, 2015. ",cs.SD,A,0.19261706,-0.1607942,0.26101866
http://arxiv.org/pdf/2201.06460v1,"MsEmoTTS: Multi-scale emotion transfer, prediction, and control for emotional speech synthesis","step-wise method also increases the complexity of model
                                                                   training. For future work, jointly learning the classiﬁer under a
C. Local-level emotion presenting module (LM)                      multi-task framework is an alternative way to learn the global
                                                                   emotion representations within a uniﬁed acoustic model. As
   To demonstrate the effectiveness of the local emotion           for the local emotional strengths, it is worth exploring how to
strengths on the emotional speech synthesis, we replace the        model the strengths with neural networks in an unsupervised
syllable-level emotion strengths with the sentence-level emo-      manner, which beneﬁts to simplify both the training and
tion strengths, in which way only the global emotion strength      generation process. ",cs.SD,C,-0.2080144,-0.16322815,-0.06696716
http://arxiv.org/pdf/2201.07429v1,Opencpop: A High-Quality Open Source Chinese Popular Song Corpus for Singing Voice Synthesis,"Opencpop
3.3. Results                                                                                                              can open up a number of possibilities for further research in the
                                                                                                                          areas of SVS. Following [37], evaluation metrics, i.e., F0 Root Mean Square
Error (F0-RMSE), F0 Pearson Correlation Coefﬁcient (F0-PCC),                                                                            5. ",cs.SD,A,0.42120147,-0.049246002,-0.23235747
http://arxiv.org/pdf/2201.07429v2,Opencpop: A High-Quality Open Source Chinese Popular Song Corpus for Singing Voice Synthesis,"Opencpop
3.3. Results                                                                                                              can open up a number of possibilities for further research in the
                                                                                                                          areas of SVS. Following [37], evaluation metrics, i.e., F0 Root Mean Square
Error (F0-RMSE), F0 Pearson Correlation Coefﬁcient (F0-PCC),                                                                            5. ",cs.SD,A,0.42120147,-0.049246002,-0.23235747
http://arxiv.org/pdf/2201.07876v1,Unsupervised Personalization of an Emotion Recognition System: The Unique Properties of the Externalization of Valence in Speech,"The experimental results showed that        center session to a single user). As a future work,
                                                          we will evaluate more sophisticated methods to as-
sess the similarity of speakers by considering more                                                                                                                   15
than acoustic similarities. Also, we will explore the
use of the proposed adaptation schemes in other                           [11] E. Tournier, “Valence of emotional memories: A study
deep learning frameworks such as autoencoders,                                  of lexical and acoustic features in older adult affective
generative adversarial networks (GANs) or long short-                           speech,” Master’s thesis, Radboud University Nijmegen,
term memory (LSTM). ",cs.SD,C,-0.25847676,-0.1815685,0.03952142
http://arxiv.org/pdf/2201.08124v1,Cross-Lingual Text-to-Speech Using Multi-Task Learning and Speaker Classifier Joint Training,"In general, by using MTL and speaker classiﬁer joint     model. The future work will focus on the improvement in the
training, the speaker similarity can be consistently improved in     voice quality and naturalness of the cross-lingual speech. each language. ",cs.SD,C,-0.28482035,-0.09341852,-0.15801054
http://arxiv.org/pdf/2201.08448v1,"Kinit Classification in Ethiopian Chants, Azmaris and Modern Music: A New Dataset and CNN Benchmark","The authors deduced three essential features
for musical content, namely timbral texture, rhythm, and pitch content for Western music in various styles, including
classical, jazz, pop and rock. This work paved the way for further research in the area of genre classiﬁcation. Either
whole recordings or homogeneous sections within them were used, and a classiﬁcation accuracy of 61% was achieved
for ten genres, using statistical pattern recognition classiﬁers. ",cs.SD,B,-0.027412053,0.42959166,-0.13085975
http://arxiv.org/pdf/2201.09486v1,Bias in Automated Speaker Recognition,"Most affected by bias are female speakers
and non-US nationalities, who experience significant performance degradation due to aggregation, learning, evaluation,
deployment, historic and representation bias. Our findings lay a strong foundation for future work on bias and fairness
in automated speaker recognition. Manuscript submitted to ACM
16  Toussaint and Ding

ACKNOWLEDGMENTS

This research was partially supported by projects funded by EU Horizon 2020 research and innovation programme

under GA No. ",cs.SD,C,-0.24785592,-0.20575805,-0.097740576
http://arxiv.org/pdf/2201.09486v2,Bias in Automated Speaker Recognition,"DET curves, which have history in speaker           deployment, historic and representation bias. Our findings lay a
verification evaluation, should be used for visualizing model perfor-    strong foundation for future work on bias and fairness in automated
mance across speaker subgroups. Additionally error metrics should        speaker recognition. ",cs.SD,C,-0.21420664,-0.11959413,-0.19212642
http://arxiv.org/pdf/2201.09592v1,Unsupervised Audio Source Separation Using Differentiable Parametric Source Models,"Progress in research
on multiple F0 estimation may lead to further improvements. ACKNOWLEDGMENT
An extension of our method to polyphonic sources as well
as estimating the F0 jointly with the other source parameters        The authors would like to thank Emmanouil Benetos for
may be an interesting direction for future work. Moreover,        providing the Bach Chorals and Barbershop Quartet dataset. ",cs.SD,B,-0.02528994,0.29374492,-0.1425333
http://arxiv.org/pdf/2201.09692v1,Improving Factored Hybrid HMM Acoustic Modeling without State Tying,"FH+ivec         4-gram 8.0 16.3 8.7 12.0 16.1
For a similar search space size, the RTF of our decoder in a                   (GMM-Mono)   101∗ LSTM 7.2 14.8 7.8 10.7 14.4
CART system is 0.5. Despite the discrepancy, we believe that
in terms of an efﬁcient implementation there can still be room                                    4-gram 8.5 17.1 9.0 12.3 16.5
for improvement in a future work. ∗ Phonetic training: 20 (monophone) + 53 (diphone) + 28 or 30 (triphone)

               4. ",cs.SD,C,-0.014886482,-0.081981316,-0.18013614
http://arxiv.org/pdf/2201.10693v1,Noise-robust voice conversion with domain adversarial training,"Figure 10

                                                                                10
Figure 12: Similarity preference tests under clean scenario with 95%                Figure 16: Speech quality preference tests under real noisy scenario with 95%
conﬁdence intervals for (a) VAE-CN-C vs VAED-CN-C, (b) VAE-CD-C vs                  conﬁdence intervals for (a) VAE-CN-C vs VAED-CN-C, (b) VAE-CD-C vs
VAED-CN-C, (c) FHVAE-CN-CN vs VAED-CN-C.                                            VAED-CN-C, (c) FHVAE-CN-CN vs VAED-CN-C.

                                                                                    6. Conclusion and future work

Figure 13: Mean opinion score listening tests among diﬀerent systems under             In this paper, we propose a novel noise-robust voice
six types of noise with 5dB SNR. Error bar represents 95% conﬁdence interval. ",cs.SD,C,-0.18161774,-0.010107355,-0.21894051
http://arxiv.org/pdf/2201.10936v1,FIGARO: Generating Symbolic Music with Fine-Grained Artistic Control,"7.1. Future Work                                                 On a broader perspective, we hope that the proposed method
                                                                 is a step toward facilitating artists in their creative process as
While our work represents a step towards high-quality con-       well as enabling amateurs to express themselves by lowering
trollable symbolic music generation, we recognize several        the barrier of entry to music creation and making the process
avenues for future work. In terms of quality, the proposed       faster and easier over all. ",cs.SD,B,0.05196718,0.32588387,-0.09059358
http://arxiv.org/pdf/2201.10936v2,FIGARO: Generating Symbolic Music with Fine-Grained Artistic Control,"7.1. Future Work
                                                                 Ethical Considerations
While our work represents a step towards high-quality con-
trollable symbolic music generation, we recognize several        Automatic music generation may raise ethical concerns sim-
avenues for future work. The proposed model is good at           ilar to those of large language models. ",cs.SD,B,-0.072882175,0.08646169,-0.18569341
http://arxiv.org/pdf/2201.10936v3,FIGARO: Generating Symbolic Music with Fine-Grained Artistic Control,"7.1. Future Work
                                                                 Ethical Considerations
While our work represents a step towards high-quality con-
trollable symbolic music generation, we recognize several        Automatic music generation may raise ethical concerns sim-
avenues for future work. The proposed model is good at           ilar to those of large language models. ",cs.SD,B,-0.072882175,0.08646169,-0.18569341
http://arxiv.org/pdf/2201.11207v1,Discovering Phonetic Inventories with Crosslingual Automatic Speech Recognition,"Rare sounds, which are arguably the most interesting
to discover, and languages with large inventories (especially tone languages)
remain as the largest challenge for the task of automatic phonetic inventory
discovery, at least for our, arguably simple, proposed method (if they can
be automatically discovered at all). We believe that these challenges are
adequate future work candidates. An interesting future direction is the assessment of discovered inventory
quality by training and testing an ASR system using the discovered inven-
tory. ",cs.SD,B,-0.06913757,0.100378275,-0.058789797
http://arxiv.org/pdf/2201.11207v2,Discovering Phonetic Inventories with Crosslingual Automatic Speech Recognition,"Rare sounds, which are arguably the most interesting
to discover, and languages with large inventories (especially tone languages)
remain as the largest challenge for the task of automatic phonetic inventory
discovery, at least for our, arguably simple, proposed method (if they can
be automatically discovered at all). We believe that these challenges are
adequate future work candidates. An interesting future direction is the assessment of discovered inventory
quality by training and testing an ASR system using the discovered inven-
tory. ",cs.SD,B,-0.06913765,0.10037824,-0.058789887
http://arxiv.org/pdf/2201.11999v1,Dual Learning Music Composition and Dance Choreography,"viable music compositions. For future work, we seek to extend our
                                                                          framework to raw waveform based music composition and explore
4.5 Ablation Studies                                                      multi-persons dance choreography. We perform ablation studies focused on investigating the effec-
tiveness of our dual learning scheme. ",cs.SD,B,0.014613209,0.3341851,-0.08803882
http://arxiv.org/pdf/2202.00874v1,HTS-AT: A Hierarchical Token-Semantic Audio Transformer for Sound Classification and Detection,"As shown in Table 2, the results             ther explore its potential. Combining the audio classiﬁcation
shows that our HTS-AT achieves a new SOTA as 97.0% on                   model into more downstreaming tasks [28, 29] is also consid-
ESC-50 dataset and equals the SOTA 98.0% on Speech Com-                 ered a future work. mand V2. ",cs.SD,C,0.008443916,0.008978665,-0.097873196
http://arxiv.org/pdf/2202.01614v1,The RoyalFlush System of Speech Recognition for M2MeT Challenge,"in Section 4. Finally, Section 5 concludes the paper and discusses
                                       Some researchers pay more attention to data augmentation based          the future work. model training [10–12]. ",cs.SD,A,0.21897624,-0.15789422,0.19152302
http://arxiv.org/pdf/2202.01614v2,The RoyalFlush System of Speech Recognition for M2MeT Challenge,"The experiments and results are shown in Section 4. Finally,
                                        data augmentation techniques also play a crucial role in addressing   Section 5 concludes the paper and discusses the future work. data sparsity issues and the robustness of the model for far-ﬁeld
                                        ASR [2, 8, 9]. ",cs.SD,A,0.298221,-0.038972165,0.08327928
http://arxiv.org/pdf/2202.01646v1,Improving Lyrics Alignment through Joint Pitch Detection,"One possible solution is to add one pitch class for such voice. For
     The predicted pitch results and the ground truth on a short clip     future work, we plan to evaluate the acoustic model on lyrics tran-
from Jamendo are visualized in Fig. 4. ",cs.SD,B,-0.2797645,0.21836162,-0.123348616
http://arxiv.org/pdf/2202.02112v1,Musical Audio Similarity with Self-supervised Convolutional Neural Networks,"puted with Adam [12] for minibatches of 256 audio clips. In future work, we will explore stereophonic signals,
                       3. EVALUATION                          multi-track recordings, alternative loss functions [14] and
                                                              musical transformations [15], and ways of granting user
To know that encoders produce meaningful points in the        control to the similarity measure [16]. ",cs.SD,B,-0.08159709,0.3971998,0.10214262
