url,title,further research,primary category,label,x,y,z
http://arxiv.org/pdf/2202.10111v1,"Optical, luminescence, and scintillation properties of advanced ZnWO$_4$ crystal scintillators","Surprisingly the double crystallization leads to
deterioration of the optical, luminescent and scintillation properties of the material, despite lower
level of phosphorescence and thermally stimulated luminescence that is evidence of a lower defects’
concentration. It can be explained by the increase of competing centres of nonradiative
recombination concentration (further study of the material luminescence mechanisms is a subject of
another report [45]). No clear correlation was observed between the scintillation light output and
luminescence intensity of the samples that can be explained by phosphorescence and dose

                                                                                                                                   11
dependence of XRL intensity that are both negligible in scintillation measurements. ",physics.ins-det,A,-0.16478953,-0.41042554,-0.20248081
http://arxiv.org/pdf/2202.10274v2,Compact Michelson interferometers with subpicometer sensitivity,"over the range of a full fringe and a simple fringe-counting
algorithm was implemented to extend the range over multiple         A more detailed study on the impact of drifts in the parame-
fringes. Our ﬁxed mirror measurement showed an improved          ters of the elliptical ﬁt will be left for future work. Our simpli-
level of sensitivity over existing shadow sensors. ",physics.ins-det,A,0.14241688,-0.26626462,0.12917963
http://arxiv.org/pdf/2202.10385v1,Calibration of BAS-TR image plate response to GeV gold ions,"be almost zero (∼10−13 PSL0/MeV), although the er-                These two eﬀects could lead to a “steeper” rise compared
ror in this calculation (one standard deviation) was sig-         to what is predicted, which is what is observed experi-
niﬁcantly larger, ∼1, and it was observed that using              mentally. The interaction of extremely heavy, high LET
any value within this range made no discernible diﬀer-            particles (such as gold) with matter is a complex topic
that requires further study, and is beyond the scope of                                                                                                        5
this paper. prospectives heavy ion acceleration in future multi-PW
2.00    logistic function                                                             laser systems will see generation of Au beams of several
        Au(48 ± 3) +                                                                  GeV8,9. ",physics.ins-det,B,-0.13180774,0.11367715,-0.29053152
http://arxiv.org/pdf/2202.11004v1,A novel active veto prototype detector with an inner target for improved rare event searches,"This will also improve the S/N ratio pro-        scattering events and rare signals like CEνNS or dark matter in-
viding scope to explore lower energy regions (in eV scale) in          teractions are basically single scatter (SS) events. Events with
future work. energy deposition above the threshold in the inner detector and
                                                                       energy deposition consistent with noise in the other detectors
                                                                       are considered as single scatter events (SS) in the analysis. ",physics.ins-det,B,-0.0551498,0.14917582,-0.09860737
http://arxiv.org/pdf/2202.12392v1,Radiopurity studies of a rock sample from the Aut region,"This also
results in signiﬁcantly enhanced background at lower energies, < 1500 keV, for the BWH0 as compared to the AUT0. Although many gamma rays from 232Th and 238U decay chains are visible, only a few dominant ones which could be
unambiguously assigned to a particular nuclide, were used for further analysis. To extract the peak area, the photopeaks
of interest were ﬁtted with a gaussian + background (second order polynomial). ",physics.ins-det,B,-0.27185303,-0.067564085,-0.1478934
http://arxiv.org/pdf/2202.12392v2,Radiopurity studies of a rock sample from the Aut region,": Preprint submitted to Elsevier                                Page v of xii
                                                          Radiopurity studies in Aut rock

line at 242.6 keV has contribution from 214Pb in 238U decay chain (242.0 keV) and 224Ra in 232Th decay chain
(241.9 keV), similarly for 351.9 keV (214Pb, 211Bi), 185.9 keV (226Ra, 235U) etc. Hence, only those gamma rays which
could be unambiguously assigned to a particular nuclide were considered in further analysis. Further, a subset was
selected from coincident summing corrections as explained earlier. ",physics.ins-det,B,-0.27004647,0.048287965,-0.17104885
http://arxiv.org/pdf/2202.12809v3,Design development and implementation of an irradiation station at the neutron time-of-flight facility at CERN,"ported are intended to be general estimations only. Ded-
icated simulations taking into account the speciﬁc com-                               C. Container opening
position and irradiation position of each sample will be
performed and the results will be detailed in future works,       After irradiation, samples were examined under a fume
along with the post-irradiation analyses. hood. ",physics.ins-det,C,0.2329154,-0.06809798,-0.013690531
http://arxiv.org/pdf/2202.13108v1,Improving position resolution of neutron detectors with ultra-thin B4C foils,"Our results take into account only the contribution of the range of the secondary particles to
the spatial resolution. Although it is considered to be the main contributor to position resolution
[15], it is important to include other contributions in future work, such as those caused by
charge transfer and collection processes in the gaseous detector, in order to reach a more
accurate spatial resolution. The geometry of the gaseous detector, namely the depth of the drift
region, also impacts significantly the position resolution [21]. ",physics.ins-det,B,0.20449539,0.22163552,-0.12718219
http://arxiv.org/pdf/2202.13989v1,Measurement of high-pressure xenon gas absorption in acrylic,"3 the systematics discussed above, with the instrumental
accuracy also shown for reference. With the systematics added, the amount of absorbed
xenon estimated by the pressure drop is 0.98+−00..0145 g

2.5 Absorption Dependance on the Sample Geometry

To further study the absorption dependence on the sample geometry, another stack of
acrylic sample plates (denoted by stack B) with diﬀerent weight, thickness, and surface
area were also measured following the same procedure of the main run stack (denoted by
stack A). This comparison run lasted for 19 days. ",physics.ins-det,C,0.046423923,-0.09541893,-0.05367615
http://arxiv.org/pdf/2203.00740v1,Low-Energy Physics in Neutrino LArTPCs,"For this reason, deployment of a large-volume LArTPC
at a fast neutron test beam, similar to miniCAPTAIN at the LANSCE facil-
ity [114], would be particularly valuable. While further analysis of existing min-
iCAPTAIN data may o↵er some value, deployment of a new high performance
LArTPC designed and operated with blip detection in mind o↵ers substantially
more promise. 28
4.2.2 Transport of High-Energy Hadrons
Looking again at the highest pictured energies of Figure 9, one can see inelastic
processes generating free baryons beginning to contribute substantially the total
neutron interaction cross-section. ",physics.ins-det,B,0.029078789,0.20646736,-0.25257933
http://arxiv.org/pdf/2203.01036v1,The Silicon Electron Multiplier Sensor,"For the conﬁgura-
4. Discussion and future work                                                         tion which have been studied, d=3 µm and w1=3 µm, the gain
                                                                                      estimation with the two methods agree to within ﬁve percent. Impact ionisation model. ",physics.ins-det,C_centroid,-0.1566217,0.07150336,0.040052265
http://arxiv.org/pdf/2203.01870v1,KamNet: An Integrated Spatiotemporal Deep Neural Network for Rare Event Search in KamLAND-Zen,"The KamLAND-Zen ex-
els the black-box nature of KamNet to reveal underly-          periment is supported by JSPS KAKENHI Grant Num-
ing physics. Our future work moves in two directions. bers 21000001, 26104002, and 19H05803; the Dutch Re-
We intend to perform a systematic interpretation study         search Council (NWO); and under the U.S. Department
to rigorously unveil the origin of KamNet’s classiﬁcation      of Energy (DOE) Grant No. ",physics.ins-det,C,-0.45601797,0.25933194,0.098972455
http://arxiv.org/pdf/2203.01870v2,KamNet: An Integrated Spatiotemporal Deep Neural Network for Rare Event Search in KamLAND-Zen,"The KamLAND-Zen ex-
els the black-box nature of KamNet to reveal underly-          periment is supported by JSPS KAKENHI Grant Num-
ing physics. Our future work moves in two directions. bers 21000001, 26104002, and 19H05803; the Dutch Re-
We intend to perform a systematic interpretation study         search Council (NWO); and under the U.S. Department
to rigorously unveil the origin of KamNet’s classiﬁcation      of Energy (DOE) Grant No. ",physics.ins-det,C,-0.45601797,0.25933194,0.098972455
http://arxiv.org/pdf/2203.01870v3,KamNet: An Integrated Spatiotemporal Deep Neural Network for Rare Event Search in KamLAND-Zen,"The KamLAND-Zen ex-
els the black-box nature of KamNet to reveal underly-          periment is supported by JSPS KAKENHI Grant Num-
ing physics. Our future work moves in two directions. bers 21000001, 26104002, and 19H05803; the Dutch Re-
We intend to perform a systematic interpretation study         search Council (NWO); and under the U.S. Department
to rigorously unveil the origin of KamNet’s classiﬁcation      of Energy (DOE) Grant No. ",physics.ins-det,C,-0.45601797,0.25933194,0.098972455
http://arxiv.org/pdf/2203.01870v4,KamNet: An Integrated Spatiotemporal Deep Neural Network for Rare Event Search in KamLAND-Zen,"The KamLAND-Zen ex-
els the black-box nature of KamNet to reveal underly-          periment is supported by JSPS KAKENHI Grant Num-
ing physics. Our future work moves in two directions. bers 21000001, 26104002, and 19H05803; the Dutch Re-
We intend to perform a systematic interpretation study         search Council (NWO); and under the U.S. Department
to rigorously unveil the origin of KamNet’s classiﬁcation      of Energy (DOE) Grant No. ",physics.ins-det,C,-0.45601797,0.25933194,0.098972455
http://arxiv.org/pdf/2203.01870v5,KamNet: An Integrated Spatiotemporal Deep Neural Network for Rare Event Search in KamLAND-Zen,"DE-AC02-05CH11231, as
ing physics. Our future work moves in two directions. well as other DOE and NSF grants to individual institu-
We intend to perform a systematic interpretation study         tions. ",physics.ins-det,C,-0.13466686,0.09864591,0.16156572
http://arxiv.org/pdf/2203.02332v1,Optimization study of the electrode design of a 5 mm thick orthogonal-strip CdZnTe detector system,"37
Figure 20: Comparison of the energy spectra for the shared events and the single events
for SE4 and A12

7. Conclusion and future work

    We studied the performance of a 5 mm thick orthogonal-strip CdZnTe
detector with diﬀerent electrode sizes with RENA 3b ASIC as the primary
readout electronics. The anodes were interspersed with SE strips. ",physics.ins-det,B,-0.08754505,-0.09956505,-0.127422
http://arxiv.org/pdf/2203.02535v2,A Semi-Monolithic Detector providing intrinsic DOI-encoding and sub-200 ps CRT TOF-Capabilities for Clinical PET Applications,"Although challenging for implementation on full system
level, this temperature can be realistically reached using liquid cooling systems, as demonstrated for a high grade of
integration in spatial demanding PET/MRI applications.78 For higher measurement temperatures, the dark count rate of the
detectors is expected to increase, resulting in many non-validated triggers and thus increased dead-time. To preserve the
detector sensitivity, one would need to relax the DPC trigger scheme requiring more optical photons, which typically
deteriorates the timing resolution.61 From experience in our lab, the detector could be operated up to room temperature,
sacrificing most of the timing capabilities, which requires verification in future work. The fan beam collimator enables a time-efficient procedure for positioning calibration along both monolithic- and DOI-
direction. ",physics.ins-det,A,0.46525696,-0.22473711,-0.27790964
http://arxiv.org/pdf/2203.02535v3,A Semi-Monolithic Detector providing intrinsic DOI-encoding and sub-200 ps CRT TOF-Capabilities for Clinical PET Applications,"Although challenging for implementation on full system
level, this temperature can be realistically reached using liquid cooling systems, as demonstrated for a high grade of
integration in spatial demanding PET/MRI applications.78 For higher measurement temperatures, the dark count rate of the
detectors is expected to increase, resulting in many non-validated triggers and thus increased dead-time. To preserve the
detector sensitivity, one would need to relax the DPC trigger scheme requiring more optical photons, which typically
deteriorates the timing resolution.61 From experience in our lab, the detector could be operated up to room temperature,
sacrificing most of the timing capabilities, which requires verification in future work. The fan beam collimator enables a time-efficient procedure for positioning calibration along both monolithic- and DOI-
direction. ",physics.ins-det,A,0.46525696,-0.22473711,-0.27790964
http://arxiv.org/pdf/2203.02876v1,Displacement calibration of optical tweezers with absolute gravitational acceleration,"Then we turn off the trapping
beam again and repeat the release and recapture cycle constantly. We record all periods of
oscillation signal for further analysis. Fig. ",physics.ins-det,A,0.0009634895,-0.0038326802,0.09921329
http://arxiv.org/pdf/2203.05200v1,Exploring the intrinsic energy resolution of liquid scintillator to approximately 1 MeV electrons,"The luminous efficiency of the liquid scintillator is relatively low, only approximately 3% of the
deposited energy is converted to photons. This indicates that the energy transfer inside the liquid
scintillator is relatively inefficient and may contribute to a relatively large statistical fluctuation,
which requires further study. Acknowledgments

      This research was supported by the National Natural Science Foundation of China (11775252). ",physics.ins-det,A,-0.119372636,-0.29172564,-0.1630239
http://arxiv.org/pdf/2203.05620v1,"KDSource, a tool for the generation of Monte Carlo particle sources using kernel density estimation","Furthermore, if the tracks list on which the KDE model is
ﬁtted is independent of the downstream problem, which is common in beams, the KDE source can
be reused with diﬀerent downstream conﬁgurations, increasing the beneﬁts of the methodology. In future works the capabilities of KDSource are expected to be extended in several ways. This includes the possibility of choosing between diﬀerent kernel functions (Epanechnikov, Gaus-
sian, triangular, Tophat, Exponential, etc. ",physics.ins-det,C,0.027708609,0.13460615,0.25925276
http://arxiv.org/pdf/2203.05620v2,"KDSource, a tool for the generation of Monte Carlo particle sources using kernel density estimation","Furthermore, if the tracks list on which the KDE model is
ﬁtted is independent of the downstream problem, which is common in beams, the KDE source can
be reused with diﬀerent downstream conﬁgurations, increasing the beneﬁts of the methodology. In future works the capabilities of KDSource are expected to be extended in several ways. This includes the possibility of choosing between diﬀerent kernel functions (Epanechnikov, Gaus-
sian, triangular, Tophat, Exponential, etc. ",physics.ins-det,C,0.027708609,0.13460615,0.25925276
http://arxiv.org/pdf/2203.05914v1,"Recoil imaging for dark matter, neutrinos, and physics beyond the Standard Model","They are broadly consistent
with the conclusion of a previous optimization study [339] which focused on DM-ﬂuorine recoils in
CF4. 7.2 Performance in practice

The performance requirements listed above are close to being met by current gas TPCs, although
further study is still needed to determine the optimal conﬁguration of readout segmentation, drift
length, gas mixtures and pressure. HD charge readout (as already discussed in Secs. ",physics.ins-det,C,0.32968235,0.20728569,-0.08206068
http://arxiv.org/pdf/2203.05914v2,"Recoil imaging for dark matter, neutrinos, and physics beyond the Standard Model","They are broadly consistent
with the conclusion of a previous optimization study [344] which focused on DM-ﬂuorine recoils in
CF4. 7.2 Performance in practice

The performance requirements listed above are close to being met by current gas TPCs, although
further study is still needed to determine the optimal conﬁguration of readout segmentation, drift
length, gas mixtures and pressure. HD charge readout (as already discussed in Secs. ",physics.ins-det,C,0.33059692,0.20558697,-0.08607584
http://arxiv.org/pdf/2203.05914v3,"Recoil imaging for directional detection of dark matter, neutrinos, and physics beyond the Standard Model","They are broadly consistent
with the conclusion of a previous optimization study [344] which focused on DM-ﬂuorine recoils in
CF4. 7.2 Performance in practice

The performance requirements listed above are close to being met by current gas TPCs, although
further study is still needed to determine the optimal conﬁguration of readout segmentation, drift
length, gas mixtures and pressure. HD charge readout (as already discussed in Secs. ",physics.ins-det,C,0.33059692,0.20558697,-0.08607584
http://arxiv.org/pdf/2203.06146v1,Cryogenic User Facilities for R&D on Nobel Liquid Detectors and Low Temperature Devices,"In addition, such a facility would serve as a repository of knowledge of low
temperature materials and other specialized information and oﬀer a medium to connect
researchers with specialized cryogenic engineering resources. Finally, such a facility is a vital
tool for training a future workforce by providing hands-on experience in the operation of
large cryogenic systems and measurement equipment, typically outside the capability of a
University level teaching laboratory. Such a facility would necessarily consist of more than a single refrigerator test stand,
since this is something that a well-equipped PI laboratory would be able to provide. ",physics.ins-det,A,0.2603447,-0.076079614,-0.1432843
http://arxiv.org/pdf/2203.06146v2,Cryogenic User Facilities for R&D on Noble Liquid Detectors and Low Temperature Devices,"In addition, such a facility would serve as a repository of knowledge of low
temperature materials and other specialized information and oﬀer a medium to connect
researchers with specialized cryogenic engineering resources. Finally, such a facility is a vital
tool for training a future workforce by providing hands-on experience in the operation of
large cryogenic systems and measurement equipment, typically outside the capability of a
University level teaching laboratory. Such a facility would necessarily consist of more than a single refrigerator test stand,
since this is something that a well-equipped PI laboratory would be able to provide. ",physics.ins-det,A,0.2603447,-0.076079614,-0.1432843
http://arxiv.org/pdf/2203.06525v1,MPGDs for tracking and Muon detection at future high energy physics colliders,"Discharge Probability with 241Am (Eα = 5.5M eV )

Detector system 10 × 10 cm2 CMS CMS GE1/1  ALICE IROC

             triple-GEM       triple-GEM   quadruple-GEM

Gas          Ar/C O2          Ar/C O2      N e/CO2/N2

             (70:30)          (70:30)      (90:10:5)

Upper limit  < 8 × 10−11      < 9 × 10−10  < 1.5 × 10−10

Table 2.2: Comparison of the upper limit of the discharge probability with alpha particles
for 10×10 cm2 triple-GEM [14], CMS GE1/1 triple-GEM [57] and ALICE IROC quadruple-

GEM [58]. More recently, additional studies were conducted in the framework of the CMS GEM
upgrade project in order to evaluate more precisely the consequences of discharges at a
microscopic level and to determine the critical value for the protection resistors [60]. The
measurements, based on a previous work from the LHCb GEM group [61], were taken with
a single-GEM hole design connected to a custom circuitry in order to control the discharge
energy and the protection resistance. ",physics.ins-det,B,-0.14387825,0.12751767,-0.23792574
http://arxiv.org/pdf/2203.07224v1,Promising Technologies and R&D Directions for the Future Muon Collider Detectors,"The policy for signatures is that, for each individual report, you can subscribe as ""Author"" or as
                                                  ""Signatory"", deﬁned as follows:

                                                      – “Author” indicates that you did contribute to the results documented in the report in any form,
                                                         including e.g. by participating to the discussions of the community meeting, sending comments
                                                         on the drafts, etc, or that you plan to contribute to the future work. The “Authors” will appear as
                                                         such on arXiv. ",physics.ins-det,C,0.0538048,-0.04340347,0.11450027
http://arxiv.org/pdf/2203.07247v1,Analytical Approach to Intensity Calculation in Scintillation Detectors,"Developed analytical method of intensity calculation in multi-mirror systems discover new possibilities for localization
of the ﬂash in the scintillation detectors. Careful investigation of this statement we leave on further research. References

 [1] A. J. González, S. Majewski, J. Profﬁtt, A. Aguilar, P. Conde, L. Hernandez, F. Sánchez, A. Stolin, and J. M.
        Benlloch, “Continuous or pixelated scintillators?, not longer a discussion,” in 2014 IEEE Nuclear Science
        Symposium and Medical Imaging Conference (NSS/MIC), 2014, pp. ",physics.ins-det,A_centroid,0.013580402,-0.30415115,-0.10331539
http://arxiv.org/pdf/2203.08821v1,Low Background kTon-Scale Liquid Argon Time Projection Chambers,"In these early
studies, TPC triggering requires sufﬁciently large, coincident clusters on the collection plane and at least one induction
plane. We expect future work will in fact lead to a much higher-efﬁciency, light-based trigger being implemented for
most work discussed in this paper. The dominant background in the 1.4 - 2.0 MeV energy window is radon in this
early TPC triggering study, not in fact solar neutrinos – despite the rate reduction by a factor of 103 predicted in the

                                                                     21
            Figure 18: NSI constraints for similar NSI assumptions from [57] (same contours as Figure 17). ",physics.ins-det,B,-0.08317032,0.13597682,-0.12755072
http://arxiv.org/pdf/2203.11280v1,"The EL-X8 computer and the BOL detector Networking, programming, time-sharing and data-handling in the Amsterdam nuclear research project `BOL' A personal historical review","In our team, a conversational program language, ‘Simplex’,56 inﬂuenced by Algol-60 had been developed for calculations
within the WSX framework. This was particularly important in the ﬁnal stage of the BOL data reduction and data
presentation, where we wanted to easily and ﬂexibly apply our instrumental and physics insights to prepare pictures
for further study or for publication. Spectra could be presented on a graphics storage display with hard-copy read-out
connected to a PDP8 (see Section 7). ",physics.ins-det,B,0.057691894,-0.08713908,0.014373958
http://arxiv.org/pdf/2203.11999v1,A low-threshold diamond cryogenic detector for sub-GeV Dark Matter searches,"Rev. D
that future work on the optimization of the W-TES de-
sign to better match the properties of thermal signals in                    100, 022004 (2019). diamonds will allow for further reduction of the energy                 5. ",physics.ins-det,A,-0.16666509,-0.24383557,-0.115574494
http://arxiv.org/pdf/2203.12542v1,Photon counting from the vacuum ultraviolet to the short wavelength infrared using semiconductor and superconducting technologies,"[169] Jean-Fran¸cois Pratte, Fr´ed´eric Nolet, Samuel Parent, Fr´ed´eric Vachon, Nicolas Roy,
         Tommy Rossignol, Keven Deslandes, Henri Dautet, R´ejean Fontaine, and Serge A
         Charlebois. 3d photon-to-digital converter for radiation instrumentation: Motiva-
         tion and future works. Sensors, 21(2), 2021. ",physics.ins-det,A,0.11487886,-0.35603756,-0.2698924
http://arxiv.org/pdf/2203.14354v1,GPU-based optical simulation of the DARWIN detector,"Optical simulations alone are not enough to fully guide the detector development, which
requires a complete simulation that includes energy deposition, electron drift and diﬀusion, co-
incidence with dark noise, electronics and other eﬀects. Incorporating the Chroma engine in the

                                                       – 20 –
simulation framework is a natural avenue for future work. It may also be noted that any simulation
is only as good as its input, and more measurements of optical parameters at VUV wavelengths and
in LXe environment for materials relevant to the next-generation detector (Tables 2, 8) are needed. ",physics.ins-det,B,0.044119507,-0.12504542,-0.20396957
