url,title,further research,primary category,label,x,y,z
http://arxiv.org/pdf/2202.11144v1,Robust Hierarchical Patterns for identifying MDD patients: A Multisite Study,"Unifying structural, functional and disease information would give a more
comprehensive view of neurobiological abnormalities and altered brain functioning and improve
MDD diagnosing ability. Our proposed model has a few weaknesses, adding directions for future work. First, we only consider
logistic regression as our classiﬁcation model, the results of which might be sub-optimal. ",q-bio.QM,C,-0.08002345,-0.13133301,0.32103956
http://arxiv.org/pdf/2202.11989v1,Analysis of Genotype-Phenotype Association using Fields and Information Theory,"Preliminary numericaly studies show this method highlights more
genes as having an inﬂuence on phenotype than classic GWAS; this is due to the ability
to distinguish between negative controls (SNPs which have no inﬂuence on phenotype) and
SNPS which have a weak inﬂuence. In future work, we propose to use these techniques to study the genome of arabidopsis
[1], includeing SNPs which are genuinely bi-allelic - that is - where the zero state is present
in the sample, along with with the +1 and -1 states, and use larger samples, so that the
informational ﬁelds can be explored. We also propose to study in more detail the relationship
between these methods and the work of Fisher, to explore the various sources of variance
in phenotype values, and to analyse cases where a single ﬁeld can be used to analyse the
phenotype-genotype correlation [13]. ",q-bio.QM,B,0.23163354,0.10072548,0.033183604
http://arxiv.org/pdf/2202.11989v2,Analysis of Genotype-Phenotype Association using Genomic Informational Field Theory (GIFT),"Preliminary results, both theoretical and numerical, show
that monotone ﬁelds are due to genotype causing a shft in the mean of the phenotype distri-
bution between different genotypes, as illustrated in (5.5) and Figure 5, whilst more general
ﬁelds can indicate the genotype causing a change in standard deviation of the phenotype
distributions (5.6). In future work, we propose to use these techniques to study the genome of arabidopsis
[3], includeing SNPs which are genuinely bi-allelic - that is - where the zero state is present
in the sample, along with with the +1 and -1 states, and use larger samples, so that the
informational ﬁelds can be explored. We also propose to study in more detail the relationship
between these methods and the work of Fisher, to explore the various sources of variance
in phenotype values, and to analyse cases where a single ﬁeld can be used to analyse the
phenotype-genotype correlation [15]. ",q-bio.QM,B,0.22794789,0.060909912,-0.023187855
http://arxiv.org/pdf/2202.12268v1,"Hyperacute pathophysiology of traumatic and vascular brain injury captured by ultrasound, photoacoustic, and magnetic resonance imaging","Previous human and animal studies have shown that this expanded area has reduced
perfusion in the acute phase and its size correlates with the extent of necrotic tissue
determined at later follow-up observations (52,53). This hyperacute pathological mechanism
and its relationship with possible neuronal changes and neurovascular dysregulation require
further research. Injury also alters blood flow velocities in the brain. ",q-bio.QM,C,-0.06951323,-0.44849783,0.18190107
http://arxiv.org/pdf/2202.12268v2,"Hyperacute pathophysiology of traumatic and vascular brain injury captured by ultrasound, photoacoustic, and magnetic resonance imaging","Previous human and animal studies have shown that this expanded area has reduced
perfusion in the acute phase and its size correlates with the extent of necrotic tissue
determined at later follow-up observations (52,53). This hyperacute pathological mechanism
and its relationship with possible neuronal changes and neurovascular dysregulation require
further research. Injury also alters blood flow velocities in the brain. ",q-bio.QM,C,-0.06951323,-0.44849783,0.18190107
http://arxiv.org/pdf/2203.00743v1,Uncovering the dynamic effects of DEX treatment on lung cancer by integrating bioinformatic inference and multiscale modeling of scRNA-seq and proteomics data,"As one of the most widely used          of human diseases especially cancers (Fu, et al., 2021). synthetic glucocorticoids, Dexamethasone (DEX) has shown anti-cancer
efficacy and anti-estrogenic activity in human non-small cell lung cancer           However, bioinformatics approaches rely on scRNA-seq data to infer
(NSCLC) whereby further study can be made to testify its efficacy. gene regulatory networks, which only address ""mechanisms"" by proxy
                                                                                 (i.e., correlations) without providing the underlying information (i.e., how
   Single-cell RNA sequencing (scRNA-seq) provides unprecedented                 genes interact with one another via activation, inhibition, or binding
opportunities for understanding cellular complexity (Athanasiadis, et al.,       pathways). ",q-bio.QM,A,0.055064738,0.22338736,0.031875335
http://arxiv.org/pdf/2203.01830v1,Understanding microbiome dynamics via interpretable graph representation learning,"ArXiv abs/2101.01229. There are several directions for future work: 1) how        [3] Caporaso, J., Lauber, C., Costello, E., Berg-Lyons, D., Gonzalez, A.,
to construct a time-evolving graph from metagonomic data             Stombaugh, J., Knights, D., Gajer, P., Ravel, J., Fierer, N., Gordon,
such that it contains a real dynamics occurring in the mi-           J., Knight, R., 2011. Moving pictures of the human microbiome. ",q-bio.QM,A,-0.13691111,0.06570332,-0.13551053
http://arxiv.org/pdf/2203.01830v2,Understanding microbiome dynamics via interpretable graph representation learning,"Concerning microbiome data, it means that our method coupled with a proper interpretation strategy can
help to reveal underlying disease patterns in the data. There are several directions for future work: 1) how to construct a time-evolving graph from metagonomic data such that it
contains a real dynamics occurring in the microbiome; 2) further biological analysis of results obtained from the interpretability
of the model; 3) visualization of topological graph features, such as nodes and edges, that have impacted the model the most,
and 4) mathematical explanation of how the model learns a graph embedding of the time-evolving graph maintaining metastable
dynamics. Method

We ﬁrst brieﬂy introduce all necessary notations and deﬁnitions, which are used in the paper, and state the problem. ",q-bio.QM,A,-0.1382101,0.122715205,-0.025275242
http://arxiv.org/pdf/2203.02308v1,Structural features of microvascular networks trigger blood-flow oscillations,"Also, we identiﬁed a feedback mechanism that
facilitates the onset of oscillations; here, the diameter ratio between the two branches (aﬀecting the
ﬂux in the redundant vessel) and the presence of haematocrit in the redundant vessel (allowing for
time-delay in the system) are crucial ingredients for such positive feedback to occur. In future work we
aim to evaluate the role that such three-node network motifs may have in the susceptibility of larger
vascular networks to oscillatory dynamics and multiple steady ﬂow solutions. Such an investigation
should consider the coupled behaviour of multiple sources of oscillations, and how their frequencies
and amplitudes are modulated. ",q-bio.QM,A,-0.21896127,-0.23402922,-0.2720418
http://arxiv.org/pdf/2203.02308v2,Structural features of microvascular networks trigger blood-flow oscillations,"Also, we identiﬁed a feedback mechanism that
facilitates the onset of oscillations; here, the diameter ratio between the two branches (aﬀecting the
ﬂux in the redundant vessel) and the presence of haematocrit in the redundant vessel (allowing for

                                                                 24
time-delay in the system) are crucial ingredients for such positive feedback to occur. In future work,
we aim to evaluate the eﬀect of redundant vessels in larger vascular networks and to explore diﬀerent
motifs which may generate larger feedback loops and, thereby, larger scale oscillatory dynamics. Such
an investigation should consider the coupled behaviour of multiple sources of oscillations, and how
their frequencies and amplitudes are modulated. ",q-bio.QM,A,-0.18861881,-0.24757619,-0.26755887
http://arxiv.org/pdf/2203.02568v1,"NEMAR: An open access data, tools, and compute resource operating on NeuroElectroMagnetic data","The data
standardized terms be used to describe the natures of all        are then synced with NEMAR providing additional
                                                                 functionally (data visualization and on-site computation). experimental events of interest identified in the recording      B. NEMAR BIDS-formatting tool

session, either during its capture or after the fact, for            We have released a bids-matlab-tools plug-in (version 6)
                                                                 for the popular EEGLAB [11] software environment
potential search and reuse in further analysis and               (sccn.ucsd.edu/eeglab) running on MATLAB (The
                                                                 Mathworks, Inc.) to export EEG data to BIDS. The plug-in
meta-analysis. ",q-bio.QM,C,0.053241394,-0.21337365,0.07178827
http://arxiv.org/pdf/2203.06263v1,Determining clinically relevant features in cytometry data using persistent homology,"Intuitively, feature score is an indicator of the importance of a
                particular feature while classifying the data. By ranking the proteins by their feature
                scores, we can reduce our further analysis to only a subset of the most important
                proteins. Our analysis (Fig 4) shows that the top three most important proteins to the
                XGBoost classifier are proteins T-bet, Eomes, and Ki-67. ",q-bio.QM,A,0.023826119,0.24193467,0.11798704
http://arxiv.org/pdf/2203.10094v1,Selection of entropy based features for the analysis of the Archimedes' spiral applied to essential tremor,"complex environments. In future works new non-linear
                                                                 features, entropy algorithms and automatic selection
      SmEn with m=3 appears as the best option for all          methodologies will be used. paradigms. ",q-bio.QM,A,-0.16644919,-0.03482492,-0.06390814
http://arxiv.org/pdf/2203.11687v1,BEFANA: A Tool for Biodiversity-Ecosystem Functioning Assessment by Network Analysis,"It allows ecologists to take advantage of graph theory and machine
learning on ecological networks that can help quantifying and testing hypotheses about how a
network's topology affects its dynamics and how the functioning of the network in turn affects its
structure. In the future work, we plan to upgrade BEFANA regularly with new features,
implementations and datasets. A particular focus will be on machine learning methods
optimised for ecological networks. ",q-bio.QM,A,-0.34796232,0.12716861,-0.22695747
http://arxiv.org/pdf/2203.11687v2,BEFANA: A Tool for Biodiversity-Ecosystem Functioning Assessment by Network Analysis,"It allows ecologists to take advantage of graph theory and machine
learning on ecological networks that can help quantifying and testing hypotheses about how a
network's topology affects its dynamics and how the functioning of the network in turn affects its
structure. In the future work, we plan to upgrade BEFANA regularly with new features,
implementations and datasets. A particular focus will be on machine learning methods optimised
for ecological networks. ",q-bio.QM,A,-0.34796232,0.12716861,-0.22695747
http://arxiv.org/pdf/2203.12113v3,Influence of the Endothelial Surface Layer on the Wall-induced Migration of Red Blood Cells,"While 3D simulations have become a standard approach in many
context, performing long-time simulations in 3D at realistic hematocrit remains computationally
challenging. On the other hand, 2D simulations are computationally feasible for long-time simula-
tions, and allow us to gain insights that may be used as a foundation for performing 3D simulations
more eﬀectively in future work. Another limitation of the 2D model is that it neglects the shear viscosity in the cell membrane,
which is believed to impact dynamic deformations of the RBC [55–58]. ",q-bio.QM,A,-0.23429872,-0.17661215,-0.25344512
http://arxiv.org/pdf/2203.12290v1,Cell segmentation from telecentric bright-field transmitted light microscopic images using a Residual Attention U-Net: a case study on HeLa line,"3), we applied the watershed segmentation method exemplarily
to separate the cells from each other, avoid the over-segmentation, label the
cells individually, and extract vital information about the cells (e.g., the total
number of the segmented cells, cell equivalent diameter, mean intensity and so-
lidity). Nevertheless, future works are still essential to expand the knowledge
on multi-class semantic segmentation with diﬀerent and eﬃcient CNN’s archi-
tecture and combine the constructed CNN models in the prediction process to
achieve the most accurate segmentation result. 22
FUNDING

    This work was supported by the Ministry of Education, Youth and Sports of
the Czech Republic – projects CENAKVA (LM2018099) and from the European
Regional Development Fund in frame of the project ImageHeadstart (ATCZ215)
in the Interreg V-A Austria–Czech Republic programme. ",q-bio.QM,A,-0.12034362,-0.029480737,-0.13486932
http://arxiv.org/pdf/2203.12290v2,Cell segmentation from telecentric bright-field transmitted light microscopy images using a Residual Attention U-Net: a case study on HeLa line,"3), the watershed segmentation method was applied to
separate the cells from each other, avoid over-segmentation, label the cells in-
dividually, and extract vital information about the cells (e.g., the total number
of the segmented cells, cell equivalent diameter, mean intensity and solidity). Nevertheless, future works are still essential to expand the knowledge on multi-

                                                  24
class semantic segmentation with diﬀerent and eﬃcient CNN’s architecture and
combine the constructed CNN models in the prediction process to achieve the
most accurate segmentation result. FUNDING
    This work was supported by the Ministry of Education, Youth and Sports of

the Czech Republic – projects CENAKVA (LM2018099) and from the European
Regional Development Fund in frame of the project ImageHeadstart (ATCZ215)
in the Interreg V-A Austria–Czech Republic programme. ",q-bio.QM,A,-0.12819262,-0.04956309,-0.14059843
http://arxiv.org/pdf/2203.12290v3,Cell segmentation from telecentric bright-field transmitted light microscopy images using a Residual Attention U-Net: a case study on HeLa line,"3), the watershed segmentation method was applied to
separate the cells from each other, avoid over-segmentation, label the cells in-
dividually, and extract vital information about the cells (e.g., the total number
of the segmented cells, cell equivalent diameter, mean intensity and solidity). Nevertheless, future works are still essential to expand the knowledge on multi-

                                                  24
class semantic segmentation with diﬀerent and eﬃcient CNN’s architecture and
combine the constructed CNN models in the prediction process to achieve the
most accurate segmentation result. FUNDING
    This work was supported by the Ministry of Education, Youth and Sports

of the Czech Republic – project CENAKVA (LM2018099), by the European
Regional Development Fund in frame of the project ImageHeadstart (ATCZ215)
in the Interreg V-A Austria–Czech Republic programme, and by the project
GAJU 017/2016/Z. ",q-bio.QM,A,-0.12579575,-0.04909487,-0.14164427
http://arxiv.org/pdf/2203.13946v1,Using genome-wide expression compendia to study microorganisms,"These three
platforms provide detailed and standardized meta-data that can be accessed programmatically
and easily used in high throughput computational analyses.121 An alternative approach is to
verify the strain annotation using taxonomy assignments provided in the SRA Run Browser
analysis tab, or to perform assignment using with a tool like sourmash gather, which selects the
minimum set of reference genomes in a database necessary to cover the reads in a sample.122

Alternatively, a pangenome could be used as a reference so that core genes are collapsed
across strain types while accessory genes are included in the analysis.109 Using these
pangenomes as a reference balances computational cost and fidelity to sample genomes, and
can take advantage of databases designed to address similar problems for metagenomic
sample processing.123 This approach was pioneered for the analysis of Staphylococcus aureus
(S. aureus) strains directly from metatranscriptomes, as no reference genome was available
with which to perform read quantification. This approach may be successful for building species-
wide compendia but needs further research. Indeed, one substantial draw back would be the
negation of spanning reads, as pangenomes are typically built from genes and not operons. ",q-bio.QM,B,0.20758787,0.29508442,0.044637747
http://arxiv.org/pdf/2203.13982v1,Implications of Mortality Displacement for Effect Modification and Selection Bias,"We acknowledge that statistical uncertainty may be obstacles in
inferring multiple RRls (43). This research area is nascent, and further research is warranted. Acknowledgement: This publication was developed under Assistance Agreement
No. ",q-bio.QM,C,0.16703576,-0.07385185,-0.024591237
http://arxiv.org/pdf/2204.01700v1,Modeling COVID-19 vaccine-induced immunological memory development and its links to antibody level and infectiousness,"Finally, we only fit the dataset of inactivated vaccines, while
the mRNA vaccines produce the spike protein, which may last a few weeks,
and maintain long-lasting immunogenicity. mRNA vaccine datasets can be
simulated by adding mRNA variables to our model, and we will expand our
model to adapt more types of vaccines in future work. Overall, our model provides a framework and predicts antibody levels
induced by inactivated vaccines at different vaccine doses and various
regimens, which may be a complement to clinical trials. ",q-bio.QM,A,-0.14927691,0.09871808,0.29929405
http://arxiv.org/pdf/2204.05415v1,Bayesian Parameter Estimation for Dynamical Models in Systems Biology,"To avoid global versus local identiﬁability complications, we ﬁxed K1 and K2 to their
nominal values. Additionally, we omitted the total concentration parameters, S1t, S2t, and S3t, from
further analysis because we assume they would be speciﬁed according to the cell type that corresponds
to the available data. As a result, we narrowed the free parameters down to a set of 9 parameters,
from a set of 14 originally. ",q-bio.QM,A,0.051771097,-0.045966454,-0.123874396
http://arxiv.org/pdf/2204.05415v2,Bayesian Parameter Estimation for Dynamical Models in Systems Biology,"To avoid global versus local identiﬁability complications, we ﬁxed K1 and K2 to their
nominal values. Additionally, we omitted the total concentration parameters, S1t, S2t, and S3t, from
further analysis because we assume they would be speciﬁed according to the cell type that corresponds
to the available data. As a result, we narrowed the free parameters down to a set of 9 parameters,
from a set of 14 originally. ",q-bio.QM,A,0.051771097,-0.045966454,-0.123874396
http://arxiv.org/pdf/2204.05919v4,Leveraging Reaction-aware Substructures for Retrosynthesis Analysis,"The substructures are stable and remain unchanged
during chemical reactions. For future work, we will improve the accuracy of extracted substruc-
tures. We might also investigate how to apply the substructures to other tasks like molecule
property prediction or molecular design. ",q-bio.QM,A,-0.0705631,0.18443543,-0.31802332
http://arxiv.org/pdf/2204.08608v1,G2GT: Retrosynthesis Prediction with Graph to Graph Attention Neural Network and Self-Training,"Hence, this
work can be viewed as a molecular representation pretraining task. We have obtained preliminary
results on some molecular property prediction tasks, which will be discussed in future works. References

 [1] W. L. Chen, D. Z. Chen, and K. T. Taylor. ",q-bio.QM,A_centroid,-0.15339753,0.39097506,-0.124050945
http://arxiv.org/pdf/2204.10073v1,New confidence interval methods for Shannon index,"However,
the limitations of our work rely on the restricted simulated scenarios leading us to produce
limited recommendations for community structures. So, in future work, we will explore more
biological scenarios. 10
                                       5 Conclusion

The simulation study showed that the bootstrap-t method produced a superior performance for
88% of the simulated dataset for Shannon’s diversity, H, indicating its superior overall perfor-
mance as compared to the others and, thus, we recommend it when the community structure
analysed is similar to the ones that we simulated. ",q-bio.QM,A,-0.15749583,0.027545914,-0.034963995
http://arxiv.org/pdf/2204.11006v1,In silico evaluation of Paxlovid's pharmacometrics for SARS-CoV-2: a multiscale approach,"Despite the mathematical model’s necessary
simpliﬁcations and the short scope of this case study we were able to visualize and verify the
importance of prophylactic interventions, moreover, we identiﬁed the speciﬁc time window
where delaying treatment initiation proves to be most costly. As for directions of future work, we highlight that such hybrid models and computational
frameworks hold a great deal of promise with applications such as supporting clinical trials
by means of in silico experiments. Computation-based evaluation and simulation of therapies
not only can enhance optimization of treatments, but a further development of this technology
could also serve to reduce the need for animal testing in the future. ",q-bio.QM,A,-0.18290822,-0.06414554,0.088438645
http://arxiv.org/pdf/2204.14141v1,Learning Anisotropic Interaction Rules from Individual Trajectories in a Heterogeneous Cellular Population,"Instead, one      compute statistics. We aim to investigate the requirements
          could further reﬁne the model by performing an ad-      for performing classiﬁcation with chaotic interacting particles
          ditional regression combining all data from the iden-   in future work. tiﬁed species. ",q-bio.QM,A,-0.20572186,-0.055839397,-0.022193417
http://arxiv.org/pdf/2205.01753v1,Self-focusing virtual screening with active design space pruning,"p∗ scheduling It is also possible to schedule the value of p∗ used in the pruning decision
to more conservatively prune in the beginning when the model has less data and more
aggressively as the optimization proceeds. As there a number of ways in which to schedule
this value, we leave the investigation of this idea to future work. Initialization Optimization performance is dependent on initialization conditions and
DSP is doubly sensitive. ",q-bio.QM,A,-0.018834777,-0.08816494,-0.1528512
http://arxiv.org/pdf/2205.02645v1,PyDaddy: A Python package for discovering stochastic dynamical equations from timeseries data,"we are indeed making rapid headways towards collect-       Modifying and adopting the package described here to
ing such data in many ecological systems. At the scale     account for realistic features presents interesting direc-
of individual organisms, both tag-based (radio collar,     tions for future work. GPS, etc) and high-resolution video based tracking of
animals [37] (or cells [38]) yield high spatio-temporal       In summary, as the era of big data looms over much of
resolution data of how animals (or cells) move in space. ",q-bio.QM,A,-0.168402,-0.06882973,-0.10551493
http://arxiv.org/pdf/2205.02645v2,PyDaddy: A Python package for discovering stochastic dynamical equations from timeseries data,"While            • Getting started with vector data
we are not aware of any studies that have looked at the          • Recovering SDEs from SDE-generated time series
minimum length required to estimate the drift and diffu-         • Advanced function ﬁtting
sion reliably, based on our own numerical simulations of         • Exporting data
models shown in this study, we speculate that the total          • Fitting non-polynomial functions
length must be at least a few orders of magnitude times      The tutorial notebooks can be accessed here:
the length of the autocorrelation time. https://pydaddy.readthedocs.io/en/latest/
   We expect many challenges, and hence opportuni-           tutorials.html
ties for future work, when applying these methods to            PyDaddy also comes with some sample datasets:
complex ecological systems. First, despite the fact that         • Real world data of ﬁsh schooling (taken from
we have automated various steps, there are still a few
choices the user will make. ",q-bio.QM,A,-0.09359138,-0.1197086,-0.17482427
http://arxiv.org/pdf/2205.04464v1,Differentiable Electron Microscopy Simulation: Methods and Applications for Visualization,"To mitigate this limitation, we believe it is possible to use neural networks to learn and
transfer the patterns from various data. With the differentiability of our simulator, future work can be done to embed a
neural network into the physics model of our simulator, taking advantage of the generalizability of neural networks
while preserving physical intuitions. Acknowledgment

The authors would like to thank Sai Li and his team at School of Life Sciences, Tsinghua University, China for sharing
the SARS-CoV-2 cryo-EM data for this work. ",q-bio.QM,A,-0.32505524,-0.027038723,-0.26172423
