url,title,further research,primary category,label,x,y,z
http://arxiv.org/pdf/2205.04464v2,Differentiable Electron Microscopy Simulation: Methods and Applications for Visualization,"To mitigate this limitation, we believe it is possible to use neural networks to learn and
transfer the patterns from various data. With the differentiability of our simulator, future work can be done to embed a
neural network into the physics model of our simulator, taking advantage of the generalizability of neural networks
while preserving physical intuitions. Acknowledgment

The authors would like to thank Sai Li and his team at School of Life Sciences, Tsinghua University, China for sharing
the SARS-CoV-2 cryo-EM data for this work. ",q-bio.QM,A,-0.32505524,-0.027038723,-0.26172423
http://arxiv.org/pdf/2205.05789v1,RITA: a Study on Scaling Up Generative Protein Sequence Models,"Following ProteInfer (Sanderson et al.,      tein design. We also look forward to future work studying
2021), we extract enzyme commission metadata from Swis-         RITA-designed proteins in-vitro, further scaling up protein
sProt (Bairoch & Apweiler, 2000) and focus on the tags          sequence models or augmenting them with target structure
belonging to the ﬁnest classiﬁcation level (randomly choos-     embeddings for ﬁxed-backbone protein design. RITA: a Study on Scaling Up Generative Protein Sequence Models

References                                                    Frazer, J., Notin, P., Dias, M., Gomez, A. N., Min, J. K.,
                                                                 Brock, K. P., Gal, Y., and Marks, D. S. Disease variant
Alley, E. C., Khimulya, G., Biswas, S., AlQuraishi,              prediction with deep generative models of evolutionary
   M., and Church, G. M. Uniﬁed rational pro-                    data. ",q-bio.QM,A,-0.022703987,0.36924806,0.09147957
http://arxiv.org/pdf/2205.05789v2,RITA: a Study on Scaling Up Generative Protein Sequence Models,"Following ProteInfer (Sanderson et al.,      tein design. We also look forward to future work studying
2021), we extract enzyme commission metadata from Swis-         RITA-designed proteins in-vitro, further scaling up protein
sProt (Bairoch & Apweiler, 2000) and focus on the tags          sequence models or augmenting them with target structure
                                                                embeddings for ﬁxed-backbone protein design. RITA: a Study on Scaling Up Generative Protein Sequence Models

References                                                    Frazer, J., Notin, P., Dias, M., Gomez, A. N., Min, J. K.,
                                                                 Brock, K. P., Gal, Y., and Marks, D. S. Disease variant
Alley, E. C., Khimulya, G., Biswas, S., AlQuraishi,              prediction with deep generative models of evolutionary
   M., and Church, G. M. Uniﬁed rational pro-                    data. ",q-bio.QM,A,-0.022383729,0.37991077,0.10426448
http://arxiv.org/pdf/2205.08308v1,The Relationship Between Insulin Resistance Neutrophil to Lymphocyte Ratio,"Also, DM not on
Insulin group showed a weak, negative correlation. However, the DM on Insulin group
showed a drastically increased HOMA-IR value, and therefore, the individuals in the group
were eliminated for further analysis. Bivariate and Multivariate Linear regression analyses

Table 2 shows the difference in the linear regression and significance of all study subjects
(n=3,375) and the subjects after excluding insulin users (n=3,307). ",q-bio.QM,C,0.08741109,-0.24115619,0.3942537
http://arxiv.org/pdf/2205.08308v2,The Relationship Between Insulin Resistance Neutrophil to Lymphocyte Ratio,"Also, DM not on
Insulin group showed a weak, negative correlation. However, the DM on the Insulin group
showed a drastically increased HOMA-IR value, and therefore, the individuals in the group
were eliminated for further analysis. Bivariate and Multivariate Linear regression analyses
Table 2 shows the difference in the linear regression and significance of all study subjects
(n=3,375) and the subjects after excluding insulin users (n=3,307). ",q-bio.QM,C,0.08851579,-0.24240595,0.38714486
http://arxiv.org/pdf/2205.15019v1,Protein Structure and Sequence Generation with Equivariant Denoising Diffusion Probabilistic Models,"quality will likely improve once we allow the network to cross-condition on structure, sequence, and
rotamers, rather than generate them sequentially, as in the current set-up. We leave exploration of
models of this type to future work. 4 Conclusions

We have introduced a generative model of protein structures, sequences, and rotamers that can
produce large protein domains that are both physically plausible and highly varied across domain
types in the PDB. ",q-bio.QM,A,-0.05199247,0.31344366,-0.09761328
http://arxiv.org/pdf/2206.00455v1,A robust and lightweight deep attention multiple instance learning algorithm for predicting genetic alterations,"These image patches with the highest and
lowest scores are believed to carry the most predictive information. Moreover, with the flexible
and interpretable attention-based MIL pooling mechanism, AMIML can further zero in on the
patches and ROIs that are more relevant for predicting mutations for further analysis by
pathologists. Acknowledgements

The research of Bangwei Guo, Xingyu Li, and Hong Zhang was partially supported by National
Natural Science Foundation of China (No. ",q-bio.QM,A,0.13589269,0.055397242,-0.070945054
http://arxiv.org/pdf/2206.02524v1,Comparison of aerosol emissions during specific speech tasks,"Despite this, the quantification of specific speech
sounds above noise is apparent and will prove important in validating computational
simulations and models. Additionally, the Micro-Particle Image Velocimetry (micro-PIV)
technique can be utilized in future work to resolve the aerosols between 10 micron and 1
micron near the mouth aperture that were not likely resolved with the current PIV setup. Such
quantification of the number, size, distribution, and speed of droplets being emitted within a
centimetre of the mouth aperture (loosely defined as the near field) is critical in specifying an

                                                        15
accurate boundary condition for numerical models of the polydisperse flow in the far field. ",q-bio.QM,A,-0.06387214,-0.16660878,-0.26856372
http://arxiv.org/pdf/2206.02534v1,"Scan4CFU: Low-cost, open-source bacterial colony tracking over large areas and extended incubation times","Thereafter, a number of parameters can be plotted, such as colony area,
diameter, and emergence. The data is exported to Microsoft Excel for further analysis. A representative image of the nutrient agar plate is shown on the right
with Â and y slide bars. ",q-bio.QM,A,-0.06303432,-0.109304,-0.18509358
http://arxiv.org/pdf/2206.02788v1,Accurate Virus Identification with Interpretable Raman Signatures by Machine Learning,"The major contributions of our work are that:

     (1) We developed a 1D-CNN classifier that achieved high accuracy for multiple virus
           identification and classification tasks, including differentiating enveloped from non-
           enveloped viruses, identifying types of human respiratory viruses, differentiating human
           FLUA from human FLUB viruses, classifying subtypes of Influenza A viruses, and
           differentiating among types of avian viruses;

     (2) We further investigated the association between classifier-selected important Raman
           ranges and peak ranges of lipids, proteins and relevant chemical functional groups, and
           observed correlations that are consistent with existing knowledge;

     (3) We delivered promising virus classification results that indicate Raman spectra of different
           virus types and subtypes contain recognizable Raman signatures that can be identified by
           ML models, which unravels the potential of using interpretable ML in a real-time virus
           surveillance system. In our future work, we will collect more Raman spectra of different virus samples (human and
animal, including DNA viruses) to build a large virus spectra database for training robust and highly
accurate ML models. We will study virus evolution using temporal ML models trained on Raman
spectra of virus strains of different types, from different years and locations. ",q-bio.QM,A,-0.14709637,0.34632295,0.07556315
http://arxiv.org/pdf/2206.03823v1,Multi-channel neural networks for predicting influenza A virus hosts and antigenic types,"However, as we only utilized protein sequence data, it cannot predict the type of receptor that the virus
may be compatible with. Therefore, further research is needed to predict potential viruses that are cross-species transmissible. Furthermore, we only apply supervised learning algorithms in this study, which rely on correctly labelled data and favour
the majority of data, resulting in the poor predictive ability for labels with insufﬁcient data. ",q-bio.QM,A,-0.11315136,0.5034276,0.32277966
http://arxiv.org/pdf/2206.03823v2,Multi-channel neural networks for predicting influenza A virus hosts and antigenic types,"However, as we only utilized protein sequence data, it cannot predict the type of receptor that the virus
may be compatible with. Therefore, further research is needed to predict potential viruses that are cross-species transmissible. Furthermore, we only apply supervised learning algorithms in this study, which rely on correctly labelled data and favour
the majority of data, resulting in the poor predictive ability for labels with insufﬁcient data. ",q-bio.QM,A,-0.11315136,0.5034276,0.32277966
http://arxiv.org/pdf/2206.03823v3,Multi-channel neural networks for predicting influenza A virus hosts and antigenic types,"However, as we only utilized protein sequence data, it cannot predict the type of receptor that the virus
may be compatible with. Therefore, further research is needed to predict potential viruses that are cross-species transmissible. Furthermore, we only apply supervised learning algorithms in this study, which rely on correctly labelled data and favour
the majority of data, resulting in the poor predictive ability for labels with insufﬁcient data. ",q-bio.QM,A,-0.11315136,0.5034276,0.32277966
http://arxiv.org/pdf/2206.04106v1,Characterization of Blast Waveforms Produced by Different Driver Gasses in an Open-Ended Shock Tube Model,"In the US military, an estimated 385,000 cases of TBI have occurred between the years
2000 and 2018,1 with studies estimating nearly 20% incidence in ongoing military conflicts.1-3 An
estimated eightfold increase in blast injuries has occurred during this same timeframe in civilian
populations,4, 5 extending the health relevance of these types of injuries. Those who suffer from
TBIs experience increased rates of post-traumatic stress disorder (PTSD), depression, and
suicide attempts.6, 7 These statistics outline the need for further study and the importance of
models for bTBI that recapitulate the enduring clinical comorbidities associated with injury. Military and improvised explosions consist of several different factors producing the
potential for TBI. ",q-bio.QM,C,0.068470806,-0.3177348,0.24828261
http://arxiv.org/pdf/2206.04915v1,Prediction and experimental evidence of the optimisation of the angular branching process in the thallus growth of Podospora anserina,"Finally, we
                                            propose here a validated model that, while being computationally low-cost, is powerful enough to test
                                            quickly multiple conditions and constraints. It will allow in future works to deepen the characterization of
                                            the growth dynamic of fungal network, in addition to laboratory experiments, that could be sometimes
                                            expensive, tedious or of limited scope. Introduction

                                           Filamentous fungi are characterized by their ability to form an interconnected hyphal network, the
                                           mycelium, based upon some key cellular processes, i.e. ",q-bio.QM,A,-0.3009241,-0.044003595,-0.24306202
http://arxiv.org/pdf/2206.05059v1,"Simulation, Modeling and Prediction of a Pharmacodynamic Animal Tissue Culture Compartment Model by Physical Informed Neural Network","In some perspective, this is an immature attempt. For further study, larger data sets, more
optimal network structure and training methods, and linkage with other machine learning
methods are necessary. Specifically, a large number of pharmacodynamic quantitative models
and their contrasts can to some extent be evaluated within the same training process, which
needs a large dataset with or without lebels. ",q-bio.QM,A,-0.096694954,0.19319525,0.12275539
http://arxiv.org/pdf/2206.06225v1,Human lumbar spine injury risk in dynamic combined compression and flexion loading,"In addition, prior field studies and full-body post-
                                                                                                               Page 16 of 24

mortem human subject sled tests have reported lumbar spine injuries in frontal
crashes. Therefore, further research with this IRF may enhance safety in both novel
postures suggested by ADS development trends and traditional driving postures. Although the IRF was developed using failure data, it can be applied in circumstances
in which exact failure loads may not be known or cannot be determined. ",q-bio.QM,C,0.0018724495,-0.4396517,0.30408287
http://arxiv.org/pdf/2206.06225v2,Human lumbar spine injury risk in dynamic combined compression and flexion loading,"In addition, prior field studies and full-body post-
                                                                                                               Page 16 of 24

mortem human subject sled tests have reported lumbar spine injuries in frontal
crashes. Therefore, further research with this IRF may enhance safety in both novel
postures suggested by ADS development trends and traditional driving postures. Although the IRF was developed using failure data, it can be applied in circumstances
in which exact failure loads may not be known or cannot be determined. ",q-bio.QM,C,0.0018724495,-0.4396517,0.30408287
http://arxiv.org/pdf/2206.06692v1,COVIDHunter: COVID-19 pandemic wave prediction and mitigation via seasonality-aware modeling,"The flexibility of configuring the environmental coeﬃcient and mitigation coeﬃcient allows our
proposed model to control for location-specific differences in population density, cultural practices, age
distribution, and time-variant mitigation responses in each location. COVIDHunter has three main limitations that can be addressed in future work. 1) Our
modeling approach acts across the overall population without assuming any specific age structure for
transmission dynamics. ",q-bio.QM,C,-0.18761612,-0.1741634,0.16899608
http://arxiv.org/pdf/2206.06862v1,Evaluating histopathology transfer learning with ChampKit,"We do not seek to make claims of state-of-the-art in any task or provide practice
recommendations. ChampKit is a powerful benchmarking toolkit that enables a systematic analyses
of many models across diverse datasets and could be used for this purpose in future work. All models included comparisons of transfer learning from image classiﬁcation on ImageNet-1K
[29] and training from random weight initialization. ",q-bio.QM,A,-0.07714045,0.11618596,-0.10556602
http://arxiv.org/pdf/2206.07760v2,Multiscale methods for signal selection in single-cell data,"Future
directions include the systematic comparison of multiple rankings (e.g., using Hodge the-
ory) and summary statistics to compare with methods that output one-dimensionally
ranked genes. The PRQ also gives a rich representation for each gene, and future work
will explore statistical integration with other pipelines. We provide available code, and a
future goal is to create a topological genomics signaling package to increase accessibility
and adoption. ",q-bio.QM,A,0.10404216,0.25487182,-0.079729296
http://arxiv.org/pdf/2206.08796v1,Robust Estimation of Field Inhomogeneity Map Following Magnitude-Based Water-Fat Separation with Resolved Ambiguity,"Examples of 1.5 T and 3 T were provided
within this work, though a more extensive 3T exploration needs to be carried out in the future. Noise
performance analysis was outside the scope of this paper –though we tested the robustness of the field
map adjustment step in simulated low SNR = 5– and needs to be carried out in future work. Field map regularization in complex-based estimation, notably due to incorrect smoothness
assumptions, may propagate wrong field map and PDFF values to the entire organ of interest (e.g. ",q-bio.QM,C,0.025199914,-0.2952438,-0.22147807
http://arxiv.org/pdf/2206.10612v1,Metareview-informed Explainable Cytokine Storm Detection during CAR-T cell Therapy,"These features were identiﬁed as the most signiﬁcant
          in CRS based on previous works. As a result of the pre-processing stage, 9 patients (102 timepoints together) were selected for further analysis. Model derivation
Hyperparameters and thresholds considered in model derivation are summarized in Suppl. ",q-bio.QM,C,0.03525242,-0.35159713,0.23127006
http://arxiv.org/pdf/2206.11255v1,Attention-aware contrastive learning for predicting T cell receptor-antigen binding specificity,"Prediction of
tive to antigenic peptide. From this perspective, we hope to
extend the model in our future work to narrow the region                speciﬁc tcr-peptide binding from large dictionaries of tcr-peptide pairs. Frontiers in Immunol-
where TCR binds to antigenic peptides for triggering immune             ogy, 11:1803, 2020.
responses, thereby reducing the experimental cost. ",q-bio.QM,A,-0.027500423,0.16026309,0.096292734
http://arxiv.org/pdf/2206.12747v1,HyGNN: Drug-Drug Interaction Prediction via Hypergraph Neural Network,"Accord-      also it is able to predict DDIs for new drugs. For future work,
ing to experimental results, HyGNN can successfully predict       we plan to extend our model to address other problems in
positive and negative interactions. To exemplify that, HyGNN      bioinformatics like protein-protein interaction prediction and
predicts that Esmolol and Rotigotine will cause side effects,     drug repurposing. ",q-bio.QM,A,-0.12928188,0.2750423,0.14314346
http://arxiv.org/pdf/2206.12747v2,HyGNN: Drug-Drug Interaction Prediction via Hypergraph Neural Network,"To evaluate our model for new drugs,   several experiments to show that our method outperforms
at ﬁrst, we randomly select a 5% drug from a dataset and      different types of baseline models and also it is able to predict
completely remove these drugs’ information from the corre-    DDIs for new drugs. For future work, we plan to extend our
sponding train set and keep those drugs’ information only in  model to address other problems in bioinformatics like protein-
the test set. These selected 5% drugs can be considered new   protein interaction prediction and drug repurposing. ",q-bio.QM,A,-0.04371037,0.32595265,0.11599182
http://arxiv.org/pdf/2206.12747v3,HyGNN: Drug-Drug Interaction Prediction via Hypergraph Neural Network,"To evaluate our model for new drugs,   several experiments to show that our method outperforms
at ﬁrst, we randomly select a 5% drug from a dataset and      different types of baseline models and also it is able to predict
completely remove these drugs’ information from the corre-    DDIs for new drugs. For future work, we plan to extend our
sponding train set and keep those drugs’ information only in  model to address other problems in bioinformatics like protein-
the test set. These selected 5% drugs can be considered new   protein interaction prediction and drug repurposing. ",q-bio.QM,A,-0.04371037,0.32595265,0.11599182
http://arxiv.org/pdf/2206.13345v1,A fully differentiable ligand pose optimization framework guided by deep learning and traditional scoring functions,"In the context of the
energy landscape, poses with high RMSDs are located far from the global minimum;
the local structure optimization algorithm, such as the gradient descent algorithm used
here, may not be able to traverse the energy barrier to locate the global minimum. More
advanced global minimization algorithms should be applied in future work. 3.3 Evaluation of DeepRMSD+Vina and the optimization framework on the
redocking and cross-docking tasks

     To demonstrate the practicality of DeepRMSD+Vina and the optimization
framework, we conducted additional tests on the redocking and cross-docking tasks. ",q-bio.QM,A,-0.08614036,-0.05332329,-0.30854395
http://arxiv.org/pdf/2206.14316v1,Modeling in higher dimensions to improve diagnostic testing accuracy: theory and examples for multiplex saliva-based SARS-CoV-2 antibody assays,"Given the competing
needs to understand correlates of protection and estimate prevalence, it is unclear
                                                                                                                                11

how to deﬁne an objective function that yields an optimal choice of antigens. We
leave this for future work. Finally, our classiﬁcation scheme minimizes average rates of false negatives and
false positives, which relate to sensitivity and speciﬁcity. ",q-bio.QM,C,0.13236168,-0.039830055,0.43170387
http://arxiv.org/pdf/2206.14316v2,Modeling in higher dimensions to improve diagnostic testing accuracy: theory and examples for multiplex saliva-based SARS-CoV-2 antibody assays,"Given the competing
needs to understand correlates of protection and estimate prevalence, it is unclear
                                                                                                                                11

how to deﬁne an objective function that yields an optimal choice of antigens. We
leave this for future work. Finally, our classiﬁcation scheme minimizes average rates of false negatives and
false positives, which relate to sensitivity and speciﬁcity. ",q-bio.QM,C,0.13236168,-0.039830055,0.43170387
http://arxiv.org/pdf/2206.14566v1,Massively Increasing the number of Antibody-Virus Interactions across Studies,"Finally, we emphasize
that there is currently no robust method to compute the error of NNM when predicting new virus
behavior across datasets, and that error quantification is essential to understand which predictions can
be trusted. Discussion
As experiments voraciously grow in size and scope, it is easy to overlook that the wealth of available
data can greatly expedite future work. Here, we developed an algorithm that leverages patterns in
antibody-virus data to predict how a virus measured in one study would behave in another study,
without requiring any additional experiments. ",q-bio.QM,A,-0.099494085,0.2629653,0.23566154
http://arxiv.org/pdf/2206.14566v2,Using Interpretable Machine Learning to Massively Increase the Number of Antibody-Virus Interactions Across Studies,"In this work, we consider the wealth of antibody inhibition data against variants of
the influenza virus. Due to this virus’s genetic diversity and evolvability, the variants examined in one
study will often have little-to-no overlap with other studies, making it difficult to discern common
patterns or unify datasets for further analysis. To that end, we develop a computational framework that
predicts how an antibody or serum would inhibit any variant from any other study. ",q-bio.QM,A,-0.05130497,0.2726863,0.2994299
http://arxiv.org/pdf/2207.00584v1,Distribution-based Sketching of Single-Cell Samples,"26, 40], or for rapid identification of phenotype-associated cells
Distribution-based Sketching of Single-Cell Samples                                                                                   BCB ’22, August 7–10, 2022, Northbrook, IL, USA

[8]. Finally, another area of future work may focus on generating                          [18] Xiaoyuan Han, Mohammad S Ghaemi, Kazuo Ando, Laura S Peterson, Edward A
                                                                                                 Ganio, Amy S Tsai, Dyani K Gaudilliere, Ina A Stelzer, Jakob Einhaus, Basile
variable sketch sizes across different subsections of the cellular                               Bertrand, Natalie Stanley, Anthony Culoar, Athena Tanada, Julien Hedou, Eileen S
                                                                                                 Tsai, Ramin Fallahzadeh, Ronald J Wong, Amy E Judy, Virginia D Winn, Mau-
landscape, depending on prior knowledge or scientific question. rice L Druzin, Yair J Blumendeld, Mark A Hlatky, Cecele C Quaintance, Ronald S
                                                                                                 Gibbs, Brendan Carvalho, Gary M Shaw, David K Stevenson, Martin S Angst,
ACKNOWLEDGMENTS                                                                                  Aghaeepour, and Brice Gaudilliere. ",q-bio.QM,A,0.029626295,0.07231942,-0.045144208
