Unnamed: 0,further research line,further research prefix,further research suffix,publication date,title,primary category,categories,authors,abstract,x,y,z,cluster
1447,"The higher order equations merit further study because they might be important

even for smal√l values of : for example, gi,1,W is not zero at the trapped-passing boundary,
but of order gi,1,W , and this boundary value is determined by the perturbation to the

passing particle distribution function, hi − fMi, that we have neglected.","The three previous diﬀerences mean that, even though the DKES kinetic equation leads

to the same equations as the full kinetic equation to lowest order in ρi∗ ∼ νi∗ 1 and

1, the higher order equations given by DKES will be very diﬀerent from the physical

ones.","DKES cannot

determine hi − fMi in the limit given by ρi∗ ∼ νi∗ 1 and 1.",2022-02-02 22:45:56+00:00,Finite orbit width effects in large aspect ratio stellarators,physics.plasm-ph,['physics.plasm-ph'],"[arxiv.Result.Author(""Vincent d'Herbemont""), arxiv.Result.Author('Felix I. Parra'), arxiv.Result.Author('Ivan Calvo'), arxiv.Result.Author('Jose Luis Velasco')]","A new set of orbit-averaged equations for low-collisionality neoclassical
fluxes in large aspect ratio stellarators is derived. The equations are
self-consistently local while retaining finite orbit width effects via the use
of the second adiabatic invariant $J$ as a coordinate. These new equations have
been implemented in the orbit-averaged neoclassical code KNOSOS
\citep{velasco20, velasco21}. The new equations are used to study the $1/\nu$
regime and the regimes that exist at lower collisionality. For generic large
aspect ratio stellarators, as the collision frequency decreases, the $1/\nu$
regime transitions directly into the $\nu$ regime, without passing through a
$\sqrt{\nu}$ regime. An explicit formula for the particle and heat fluxes in
the $\nu$ regime is obtained. The formula includes the effect of particles that
transition between different types of wells. While these transitions make the
particle motion stochastic, they only produce stochastic diffusion independent
of the value of the collision frequency in velocity space. The diffusion in
real space remains proportional to the collision frequency, as it should in the
$\nu$ regime. The $\sqrt{\nu}$ regime is only recovered in large aspect ratio
stellarators close to omnigeneity, and it only exists in an interval of
collisionality that depends on the deviation from omnigeneity $\delta$:
$\delta^2/|\ln \delta| \ll \nu_{ii} R a/\rho_i v_{ti} \ll 1$. Here, $\nu_{ii}$
is the ion-ion collision frequency, $\rho_i$ is the ion gyroradius, $v_{ti}$ is
the ion thermal speed, $a$ is the minor radius and $R$ is the major radius.",-0.4256214,0.00020353543,0.24411193,C_centroid
1448,"The higher order equations merit further study because they might be important

even for smal√l values of : for example, gi,1,W is not zero at the trapped-passing boundary,
but of order gi,1,W , and this boundary value is determined by the perturbation to the
30  V. d’Herbemont, F.I.","The three previous diﬀerences mean that, even though the DKES kinetic equation leads

to the same equations as the full kinetic equation to lowest order in ρi∗ ∼ νi∗ 1 and

1, the higher order equations given by DKES will be very diﬀerent from the physical

ones.","Parra, I. Calvo and J.L.",2022-02-02 22:45:56+00:00,Finite orbit width effects in large aspect ratio stellarators,physics.plasm-ph,['physics.plasm-ph'],"[arxiv.Result.Author(""Vincent d'Herbemont""), arxiv.Result.Author('Felix I. Parra'), arxiv.Result.Author('Ivan Calvo'), arxiv.Result.Author('Jose Luis Velasco')]","New orbit averaged equations for low collisionality neoclassical fluxes in
large aspect ratio stellarators with mirror ratios close to unity are derived.
The equations retain finite orbit width effects by employing the second
adiabatic invariant $J$ as a velocity space coordinate and they have been
implemented in the orbit-averaged neoclassical code KNOSOS. The equations are
used to study the $1/\nu$ regime and the lower collisionality regimes. For
generic large aspect ratio stellarators with mirror ratios close to unity, as
the collision frequency decreases, the $1/\nu$ regime transitions directly into
the $\nu$ regime, without passing through a $\sqrt{\nu}$ regime. An explicit
formula for the neoclassical fluxes in the $\nu$ regime is obtained. The
formula includes the effect of particles that transition between different
types of wells. While these transitions produce stochastic scattering
independent of the value of the collision frequency in velocity space, the
diffusion in real space remains proportional to the collision frequency. The
$\sqrt{\nu}$ regime is only recovered in large aspect ratio stellarators close
to omnigeneity: large aspect ratio stellarators with large mirror ratios and
optimized large aspect ratio stellarators with mirror ratios close to unity.
Neoclassical transport in large aspect ratio stellarators with large mirror
ratios can be calculated with the orbit-averaged equations derived by
\cite{calvo17}. In these stellarators, the $\sqrt{\nu}$ regime exists in the
collisionality interval $\epsilon |\ln \epsilon| \ll \nu_{ii} R a/\rho_i v_{ti}
\ll 1/\epsilon$. In optimized large aspect ratio stellarators with mirror
ratios close to unity, the $\sqrt{\nu}$ regime occurs in an interval of
collisionality that depends on the deviation from omnigeneity $\delta$:
$\delta^2 |\ln \delta | \ll \nu_{ii} R a/\rho_i v_{ti} \ll 1$.",-0.43002334,0.011067551,0.3049857,C
1603,"Analytical model and nu-              a plasma channel without numerical calculations and can
merical integration results match both in the range of             form a basis for further study of electron injection in di-
initial parameters and the maximum energies gained by              rect laser electron acceleration.","7
   These results are supported by the numerical integra-
                                                                   model provides knowledge about the electron’s motion in
tion of equations of motion.",electrons.,2022-02-06 17:30:00+00:00,Phase space consideration of low energy electron injection for Direct Laser Acceleration,physics.plasm-ph,['physics.plasm-ph'],"[arxiv.Result.Author('E. Starodubtseva'), arxiv.Result.Author('I. Tsymbalov'), arxiv.Result.Author('D. Gorlova'), arxiv.Result.Author('K. Ivanov'), arxiv.Result.Author(""A. Savel'ev"")]","Feasibility of ionization injection for Direct Laser Acceleration (DLA) of
electrons up to hundreds of MeV was studied analytically. Criteria for
effective injection determining range of background and in-channel plasma
parameters, laser intensity, etc. were found using phase portraits of the
system deduced from the simplified analytical model. The found optimal
trajectory in the phase space corresponds to the electron with low (few eV)
initial energy experiencing $\sim$10$^9$ times energy gain. For this to occur,
electron density should be a few percent of the critical density, while the
in-channel electron density should be $\sim$3 times lower. The analytically
obtained dependence of the energy gain on the initial electron longitudinal and
transverse momenta corresponds well to the results of exact numerical
simulations of an electron motion in the plasma channel. Developed approach can
form the basis for further studies of electron injection in DLA varying plasma
and laser parameters as well as initial electron energies.",0.28694826,0.16890767,-0.025462065,B
1914,"Similarly, further study of the Lie symmetries the CGL plasma equations
would be useful.","8; Yahalom (2017a,b); Yahalom and Qin (2021)) may yield
further insights.","Investigation of conservation laws for the CGL equations by using Lie
dragging remains open for further investigation.",2022-02-13 20:05:48+00:00,Action Principles and Conservation Laws for Chew-Goldberger-Low Anisotropic Plasmas,physics.plasm-ph,['physics.plasm-ph'],"[arxiv.Result.Author('G. M. Webb'), arxiv.Result.Author('S. C. Anco'), arxiv.Result.Author('S. V. Meleshko'), arxiv.Result.Author('G. P. Zank')]","The ideal CGL plasma equations, including the double adiabatic conservation
laws for the parallel ($p_\parallel$) and perpendicular pressure ($p_\perp$),
are investigated using a Lagrangian variational principle. An Euler-Poincar\'e
variational principle is developed and the non-canonical Poisson bracket is
obtained, in which the non-canonical variables consist of the mass flux ${\bf
M}$, the density $\rho$, three entropy variables, $\sigma=\rho S$,
$\sigma_\parallel=\rho S_\parallel$, $\sigma_\perp=\rho S_\perp$ ($S_\parallel$
and $S_\perp$ are the two scalar entropy invariants), and the magnetic
induction ${\bf B}$. Conservation laws of the CGL plasma equations are derived
via Noether's theorem. The Galilean group leads to conservation of energy,
momentum, center of mass, and angular momentum. Cross helicity conservation
arises from a fluid relabeling symmetry, and is local or nonlocal depending on
whether the entropy gradients of $S_\parallel$, $S_\perp$ and $S$ are
perpendicular to ${\bf B}$ or otherwise. The point Lie symmetries of the CGL
system are shown to comprise the Galilean transformations and scalings.",-0.13872476,0.49559575,0.39423615,C
1915,"Similarly, further study of the Lie symmetries the CGL plasma equations
would be useful.","8; Yahalom (2017a,b); Yahalom and Qin (2021)) may yield
further insights.","Investigation of conservation laws for the CGL equations by using Lie
dragging remains open for further investigation.",2022-02-13 20:05:48+00:00,Action Principles and Conservation Laws for Chew-Goldberger-Low Anisotropic Plasmas,physics.plasm-ph,['physics.plasm-ph'],"[arxiv.Result.Author('G. M. Webb'), arxiv.Result.Author('S. C. Anco'), arxiv.Result.Author('S. V. Meleshko'), arxiv.Result.Author('G. P. Zank')]","The ideal CGL plasma equations, including the double adiabatic conservation
laws for the parallel ($p_\parallel$) and perpendicular pressure ($p_\perp$),
are investigated using a Lagrangian variational principle. An Euler-Poincar\'e
variational principle is developed and the non-canonical Poisson bracket is
obtained, in which the non-canonical variables consist of the mass flux ${\bf
M}$, the density $\rho$, three entropy variables, $\sigma=\rho S$,
$\sigma_\parallel=\rho S_\parallel$, $\sigma_\perp=\rho S_\perp$ ($S_\parallel$
and $S_\perp$ are the two scalar entropy invariants), and the magnetic
induction ${\bf B}$. Conservation laws of the CGL plasma equations are derived
via Noether's theorem. The Galilean group leads to conservation of energy,
momentum, center of mass, and angular momentum. Cross helicity conservation
arises from a fluid relabeling symmetry, and is local or nonlocal depending on
whether the entropy gradients of $S_\parallel$, $S_\perp$ and $S$ are
perpendicular to ${\bf B}$ or otherwise. The point Lie symmetries of the CGL
system are shown to comprise the Galilean transformations and scalings.",-0.13872476,0.49559575,0.39423615,C
2389,"This work may contribute to
                                                                        clarify some advantages and limitations of the use of non-extensive statistics in plasma diagnostics,
                                                                        but the physical interpretation of the non-extensive parameters in plasma physics remains not fully
                                                                        clariﬁed, and requires further research.","We show
                                                                        that the q parameter has a very stable numerical value with the height.","New procedure to estimate plasma parameters through the q-Weibull distribution....  2

1.",2022-02-24 02:35:23+00:00,New procedure to estimate plasma parameters through the q-Weibull distribution by using a Langmuir probe in a cold plasma,physics.plasm-ph,['physics.plasm-ph'],"[arxiv.Result.Author('F J Gonzalez'), arxiv.Result.Author('J I Gonzalez'), arxiv.Result.Author('S Soler'), arxiv.Result.Author('C E Repetto'), arxiv.Result.Author('B J Gómez'), arxiv.Result.Author('D B Berdichevsky')]","We describe a procedure to obtain the plasma parameters from the I-V Langmuir
curve by using the Druyvesteyn equation. We propose to include two new
parameters, $q$ and $r$, to the usual plasma parameters: plasma potential
($V_p$), floating potential ($V_f$), electron density ($n$), and electron
temperature ($T$). These new parameters can be particularly useful to represent
non-Maxwellian distributions. The procedure is based on the fit of the I-V
Langmuir curve with the $q$-Weibull distribution function, and is motivated by
recent works which use the $q$-exponential distribution function derived from
Tsallis statistics. We obtain the usual plasma parameters employing three
techniques: the numerical differentiation using Savitzky Golay (SG) filters,
the $q$-exponential distribution function, and the $q$-Weibull distribution
function. We explain the limitations of the $q$-exponential function, where the
experimental data $V>V_p$ needs to be trimmed beforehand, and this results in a
lower accuracy compared to the numerical differentiation with SG. To overcome
this difficulty, the $q$-Weibull function is introduced as a natural
generalization to the $q$-exponential distribution, and it has greater
flexibility in order to represent the concavity change around $V_p$. We apply
this procedure to analyze the measurements corresponding to a nitrogen $N_2$
cold plasma obtained by using a single Langmuir probe located at different
heights from the cathode. We show that the $q$ parameter has a very stable
numerical value with the height. This work may contribute to clarify some
advantages and limitations of the use of non-extensive statistics in plasma
diagnostics, but the physical interpretation of the non-extensive parameters in
plasma physics remains not fully clarified, and requires further research.",0.088332206,0.24002706,0.0066945497,B
2390,"In this direction, the
q-Weibull function deserves further research regarding the ion current contribution that is beyond
this work.",3 is taken implicitly.,"Furthermore, the q-Weibull function may have problems to represent peaks in the EEPF,
like those coming from electron beams[64] or primary electron spikes [65].",2022-02-24 02:35:23+00:00,New procedure to estimate plasma parameters through the q-Weibull distribution by using a Langmuir probe in a cold plasma,physics.plasm-ph,['physics.plasm-ph'],"[arxiv.Result.Author('F J Gonzalez'), arxiv.Result.Author('J I Gonzalez'), arxiv.Result.Author('S Soler'), arxiv.Result.Author('C E Repetto'), arxiv.Result.Author('B J Gómez'), arxiv.Result.Author('D B Berdichevsky')]","We describe a procedure to obtain the plasma parameters from the I-V Langmuir
curve by using the Druyvesteyn equation. We propose to include two new
parameters, $q$ and $r$, to the usual plasma parameters: plasma potential
($V_p$), floating potential ($V_f$), electron density ($n$), and electron
temperature ($T$). These new parameters can be particularly useful to represent
non-Maxwellian distributions. The procedure is based on the fit of the I-V
Langmuir curve with the $q$-Weibull distribution function, and is motivated by
recent works which use the $q$-exponential distribution function derived from
Tsallis statistics. We obtain the usual plasma parameters employing three
techniques: the numerical differentiation using Savitzky Golay (SG) filters,
the $q$-exponential distribution function, and the $q$-Weibull distribution
function. We explain the limitations of the $q$-exponential function, where the
experimental data $V>V_p$ needs to be trimmed beforehand, and this results in a
lower accuracy compared to the numerical differentiation with SG. To overcome
this difficulty, the $q$-Weibull function is introduced as a natural
generalization to the $q$-exponential distribution, and it has greater
flexibility in order to represent the concavity change around $V_p$. We apply
this procedure to analyze the measurements corresponding to a nitrogen $N_2$
cold plasma obtained by using a single Langmuir probe located at different
heights from the cathode. We show that the $q$ parameter has a very stable
numerical value with the height. This work may contribute to clarify some
advantages and limitations of the use of non-extensive statistics in plasma
diagnostics, but the physical interpretation of the non-extensive parameters in
plasma physics remains not fully clarified, and requires further research.",0.14830747,0.21181028,-0.23814626,B
2460,Results summary and further research directions are discussed in Section 5.,"In Section 4 interpretive analysis of the JET HD plasma
discharge is presented along with sensitivity studies on terms entering to the TRANSP particle balance equation.",2.,2022-02-25 12:38:06+00:00,The hidden uncertainties in particle balance calculations and their implications for assessment of plasma performance,physics.plasm-ph,['physics.plasm-ph'],"[arxiv.Result.Author('A. A. Teplukhina'), arxiv.Result.Author('F. M. Poli'), arxiv.Result.Author('M. Podesta'), arxiv.Result.Author('M. Gorelenkova'), arxiv.Result.Author('G. Szepesi'), arxiv.Result.Author('Ye. O. Kazakov'), arxiv.Result.Author('Y. Baranov'), arxiv.Result.Author('Z. Stancar'), arxiv.Result.Author('the JET Contributors')]","Predictive simulations of mixed plasma discharges, like deuterium-tritium
plasmas, rely on self-consistent models for particle transport. These models
have to be validated with interpretive analysis of existing experiments.
Accounting for uncertainties in the particle balance equation is important for
modelling of mixed-plasma discharges because simulation results are directly
affected by plasma composition. JET deuterium and mixed hydrogen-deuterium
plasma discharges heated by neutral beams only are analysed with the TRANSP
code. Influence of prescribed quantities and terms entering into the particle
balance equation is quantitatively assessed on the computed plasma parameters,
in particular on the neutron rate and the plasma energy. Large uncertainties in
the prescribed ion temperature, plasma rotation and impurity content might
result in a noticeable over- or underestimate of the computed neutron rate. A
significant difference in the time evolution of the measured and computed
neutron rate is observed in the interpretive simulations if same diffusivity
for electrons and thermal ions is assumed. Increased thermal deuterium ion
transport is required to reach agreement with the plasma composition measured
at the plasma edge and the measured neutron rate. Thermal ion density computed
with the particle balance equation is mostly affected by the ion outflux term.",0.23934546,0.050306473,0.27754113,B
2766,"With further study, we ﬁnd that the non-
Maxwellian EVDF, found in our beam, requires a smaller electron density perturbation to
form an ESW of the same length than one where the EVDF is Maxwellian in the far-ﬁeld.",z planes along the beam axis at t = 3.12 µs.,"We demonstrate this by using the 1D BGK integral approach, described in Bernstein et
al.",2022-03-03 17:30:15+00:00,Kinetic modeling of three-dimensional electrostatic-solitary and surface waves in beam neutralization,physics.plasm-ph,"['physics.plasm-ph', 'physics.comp-ph']","[arxiv.Result.Author('Nakul Nuwal'), arxiv.Result.Author('Deborah A. Levin'), arxiv.Result.Author('Igor D. Kaganovich')]","This work studies the fundamental plasma processes involved in the
neutralization of an ion beam's space-charge by electrons emitted by a filament
using Particle-in-Cell simulations. While filament neutralization is
economical, previous experiments have shown that a variety of waves become
excited in this process that limit the space-charge neutralization. In this
work, the formation and movement of electrostatic solitary waves(ESWs), which
have low dissipation rates, are characterized for 2D planar and 3D cylindrical
beams and are observed to generate waves that survive for a long time and slow
the process of beam neutralization. Further, through a 1D
Bernstein-Greene-Kruskal (BGK) analysis, we find that the non-Maxwellian nature
of the beam electrons gives rise to large-sized ESWs that are not predicted by
theory which assumes that the electrons may be described by a Maxwellian
distribution. Our PIC simulations are sufficiently sensitive to be able to
resolve important three-dimensional effects in a 3D cylindrical geometry that
lead to the excitation of Trivelpiece-Gould surface waves due to high-energy
electrons present at the beginning of neutralization.",0.0790541,0.25167876,-0.2996251,B
2819,"Strong wave-particle resonance leads to phenomenon such as structure formation, re-
emission of waves, and frequency chirping, which are rich topical areas that merit further study
and increased emphasis.","En-
ergetic particles can excite waves by linear resonance, mediate nonlinear evolution via nonlinear
wave-particle scattering (i.e., nonlinear Landau damping), and terminate excitation by nonlinear
trapping.","Understanding the coherent structures formed in plasma and MHD turbulence is a central theo-
retical, observational, and experimental issue.",2022-03-04 16:23:29+00:00,Research Opportunities in Plasma Astrophysics,physics.plasm-ph,"['physics.plasm-ph', 'astro-ph.HE', 'astro-ph.IM', 'astro-ph.SR', 'physics.space-ph']","[arxiv.Result.Author('Stuart Bale'), arxiv.Result.Author('Amitava Bhattacharjee'), arxiv.Result.Author('Fausto Cattaneo'), arxiv.Result.Author('Jemes Drake'), arxiv.Result.Author('Hantao Ji'), arxiv.Result.Author('Marty Lee'), arxiv.Result.Author('Hui Li'), arxiv.Result.Author('Edison Liang'), arxiv.Result.Author('Marc Pound'), arxiv.Result.Author('Stewart Prager'), arxiv.Result.Author('Eliot Quataert'), arxiv.Result.Author('Bruce Remington'), arxiv.Result.Author('Robert Rosner'), arxiv.Result.Author('Dmitri Ryutov'), arxiv.Result.Author('Edward Thomas Jr'), arxiv.Result.Author('Ellen Zweibel')]","Major scientific questions and research opportunities are described on 10
unprioritized plasma astrophysics topics: (1) magnetic reconnection, (2)
collisionless shocks and particle acceleration, (3) waves and turbulence, (4)
magnetic dynamos, (5) interface and shear instabilities, (6) angular momentum
transport, (7) dusty plasmas, (8) radiative hydrodynamics, (9) relativistic,
pair-dominated and strongly magnetized plasmas, (10) jets and outflows. Note
that this is a conference report from a Workshop on Opportunities in Plasma
Astrophysics (WOPA, https://w3.pppl.gov/conferences/2010/WOPA/) in January
2010, that attracted broad representation from the community and was supported
by the U.S. Department of Energy, National Aeronautics and Space
Administration, National Science Foundation, American Physical Society's
Topical Group for Plasma Astrophysics and Division of Plasma Physics, and
Center for Magnetic Self-Organization in Laboratory and Astrophysical Plasmas.
Although there has been much planning and many developments in both science and
infrastructure since the report was written, most of the motivation,
priorities, problems and technical challenges discussed therein remain
unaddressed and are relevant at the time of posting.",0.12080574,0.25983435,-0.11095624,B
2820,"The larger telescopes planned for the next decade, such as the Thirty
Meter Telescope (TMT) and Large Magellan Telescope, will further study this phenomenon.","Recent ground-based observations using adaptive optics have just begun to probe the regions of
protostellar jet acceleration.","Diag-
nosing conditions within the inner parts of protostellar accretion disks — where radiation plays
a key role in the dynamics — is a real possibility.",2022-03-04 16:23:29+00:00,Research Opportunities in Plasma Astrophysics,physics.plasm-ph,"['physics.plasm-ph', 'astro-ph.HE', 'astro-ph.IM', 'astro-ph.SR', 'physics.space-ph']","[arxiv.Result.Author('Stuart Bale'), arxiv.Result.Author('Amitava Bhattacharjee'), arxiv.Result.Author('Fausto Cattaneo'), arxiv.Result.Author('Jemes Drake'), arxiv.Result.Author('Hantao Ji'), arxiv.Result.Author('Marty Lee'), arxiv.Result.Author('Hui Li'), arxiv.Result.Author('Edison Liang'), arxiv.Result.Author('Marc Pound'), arxiv.Result.Author('Stewart Prager'), arxiv.Result.Author('Eliot Quataert'), arxiv.Result.Author('Bruce Remington'), arxiv.Result.Author('Robert Rosner'), arxiv.Result.Author('Dmitri Ryutov'), arxiv.Result.Author('Edward Thomas Jr'), arxiv.Result.Author('Ellen Zweibel')]","Major scientific questions and research opportunities are described on 10
unprioritized plasma astrophysics topics: (1) magnetic reconnection, (2)
collisionless shocks and particle acceleration, (3) waves and turbulence, (4)
magnetic dynamos, (5) interface and shear instabilities, (6) angular momentum
transport, (7) dusty plasmas, (8) radiative hydrodynamics, (9) relativistic,
pair-dominated and strongly magnetized plasmas, (10) jets and outflows. Note
that this is a conference report from a Workshop on Opportunities in Plasma
Astrophysics (WOPA, https://w3.pppl.gov/conferences/2010/WOPA/) in January
2010, that attracted broad representation from the community and was supported
by the U.S. Department of Energy, National Aeronautics and Space
Administration, National Science Foundation, American Physical Society's
Topical Group for Plasma Astrophysics and Division of Plasma Physics, and
Center for Magnetic Self-Organization in Laboratory and Astrophysical Plasmas.
Although there has been much planning and many developments in both science and
infrastructure since the report was written, most of the motivation,
priorities, problems and technical challenges discussed therein remain
unaddressed and are relevant at the time of posting.",0.047038235,0.050295983,-0.021381453,B
