Unnamed: 0,further research line,further research prefix,further research suffix,publication date,title,primary category,categories,authors,abstract,x,y,z,cluster
2960,"To further study the BoozerLS method in the presence of islands or chaotic ﬁelds,
we examine the behavior of the residual as the number of Fourier modes (ntor, mpol)
and collocation points used in the parametrization of the surface increases (Figure 3).","However we
ﬁnd that this happens less frequently than it does for BoozerExact surfaces.","As the number of degrees of freedom and collocation points in Σs increase, the residual
decreases.",2022-03-07 22:27:01+00:00,Direct computation of magnetic surfaces in Boozer coordinates and coil optimization for quasi-symmetry,physics.plasm-ph,['physics.plasm-ph'],"[arxiv.Result.Author('Andrew Giuliani'), arxiv.Result.Author('Florian Wechsung'), arxiv.Result.Author('Matt Landreman'), arxiv.Result.Author('Georg Stadler'), arxiv.Result.Author('Antoine Cerfon')]","We propose a new method to compute magnetic surfaces that are parametrized in
Boozer coordinates for vacuum magnetic fields. We also propose a measure for
quasi-symmetry on the computed surfaces and use it to design coils that
generate a magnetic field that is quasi-symmetric on those surfaces. The
rotational transform of the field and complexity measures for the coils are
also controlled in the design problem.
  Using an adjoint approach, we are able to obtain analytic derivatives for
this optimization problem, yielding an efficient gradient-based algorithm.
Starting from an initial coil set that presents nested magnetic surfaces for a
large fraction of the volume, our method converges rapidly to coil systems
generating fields with excellent quasi-symmetry and low particle losses. In
particular for low complexity coils, we are able to significantly improve the
performance compared to coils obtained from the standard two-stage approach,
e.g.~reduce losses of fusion-produced alpha particles born at half-radius from
$17.7\%$ to $6.6\%$. We also demonstrate 16-coil configurations with alpha loss
< $1\%$ and neoclassical transport magnitude $\epsilon_{\mathrm{eff}}^{3/2}$
less than approximately $5\times 10^{-9}.$",-0.41092867,0.24356522,0.1527653,C
2961,"To further study the BoozerLS method in the presence of islands or chaotic ﬁelds,
we examine the behavior of the residual as the number of Fourier modes (ntor, mpol)
and collocation points used in the parametrization of the surface increases (Figure 3).","However we                       1.7
ﬁnd that this happens less frequently than it does for BoozerExact surfaces.","As the number of degrees of freedom and collocation points in Σs increase, the residual

1.7 1.1 1.3 1.5 decreases.",2022-03-07 22:27:01+00:00,Direct computation of magnetic surfaces in Boozer coordinates and coil optimization for quasi-symmetry,physics.plasm-ph,['physics.plasm-ph'],"[arxiv.Result.Author('Andrew Giuliani'), arxiv.Result.Author('Florian Wechsung'), arxiv.Result.Author('Matt Landreman'), arxiv.Result.Author('Georg Stadler'), arxiv.Result.Author('Antoine Cerfon')]","We propose a new method to compute magnetic surfaces that are parametrized in
Boozer coordinates for vacuum magnetic fields. We also propose a measure for
quasi-symmetry on the computed surfaces and use it to design coils that
generate a magnetic field that is quasi-symmetric on those surfaces. The
rotational transform of the field and complexity measures for the coils are
also controlled in the design problem.
  Using an adjoint approach, we are able to obtain analytic derivatives for
this optimization problem, yielding an efficient gradient-based algorithm.
Starting from an initial coil set that presents nested magnetic surfaces for a
large fraction of the volume, our method converges rapidly to coil systems
generating fields with excellent quasi-symmetry and low particle losses. In
particular for low complexity coils, we are able to significantly improve the
performance compared to coils obtained from the standard two-stage approach,
e.g.~reduce losses of fusion-produced alpha particles born at half-radius from
$17.7\%$ to $6.6\%$. We also demonstrate 16-coil configurations with alpha loss
< $1\%$ and neoclassical transport magnitude $\epsilon_{\mathrm{eff}}^{3/2}$
less than approximately $5\times 10^{-9}.$",-0.41472995,0.22985432,0.15276027,C
3433,"It is not known if this is the reason why equation (22) in the present work and
equation (34) in [33] are different, which requires further study.","33
may suffer from the singularity problem [10, 27], but this problem is avoided in our
work.",Figure 1.,2022-03-17 01:52:15+00:00,Analytical study on magnetic component of geodesic acoustic mode,physics.plasm-ph,['physics.plasm-ph'],"[arxiv.Result.Author('Baoyi Xie'), arxiv.Result.Author('Lei Ye'), arxiv.Result.Author('Yang Chen'), arxiv.Result.Author('Pengfei Zhao'), arxiv.Result.Author('Wenfeng Guo'), arxiv.Result.Author('Nong Xiang')]","The magnetic components of geodesic acoustic mode (GAM) are analytically
investigated under the gyrokinetic framework with both the m=1 and m=2
harmonics are considered, where m is the poloidal mode number. With the
quasi-neutrality condition and Ampere's law, the amplitudes of various poloidal
magnetic components are derived. It is shown that both m=1 and m=2 magnetic
components exist and are dominated by the cosine and sine components,
respectively. In addition, it is found that the amplitudes of all magnetic
components increase with respect to the ratio of plasma pressure to magnetic
pressure \b{eta} and safety factor q. Most importantly, the amplitude of m=1
magnetic component is significantly enhanced due to the coupling of magnetic
drift frequency with the first and second harmonics of the distribution
functions, thus it can be comparable to that of m=2 magnetic component under
certain conditions.",-0.46559733,0.11645387,-0.020085447,C
3458,"This is a sharp contrast to the energetic      the loss time is smaller than the pitch scattering time,
banana region where almost all REs were conﬁned and           passing particles are lost before they scatter back to
warrants further study.","Since
near the axis.",Losses are not present when           the trapped regime.,2022-03-17 14:24:30+00:00,Confinement of passing and trapped runaway electrons in the simulation of an ITER current quench,physics.plasm-ph,['physics.plasm-ph'],"[arxiv.Result.Author('Konsta Särkimäki'), arxiv.Result.Author('Javier Artola'), arxiv.Result.Author('Matthias Hoelzl')]","Runaway electrons (REs) present a high-priority issue for ITER but little is
known about the extent to which RE generation is affected by the stochastic
field intrinsic to disrupting plasmas. RE generation can be modelled with
reduced kinetic models and there has been recent progress in involving losses
due to field stochasticity, either via a loss-time parameter or radial
transport coefficients which can be estimated by tracing test electrons in 3D
fields. We evaluate these terms in ITER using a recent JOREK 3D MHD simulation
of plasma disruption to provide the stochastic magnetic fields where RE markers
are traced with the built-in particle tracing module. While the MHD simulation
modelled only the current quench phase, the case is MHD unstable and exhibits
similar relaxation as would be expected during the thermal quench. Therefore,
the RE simulations can be considered beginning right after the thermal quench
but before the MHD relaxation is complete. The plasma is found to become fully
stochastic for 8 ms and the resulting transport is sufficient to overcome RE
avalanche before flux surfaces are reformed. We also study transport mechanisms
for trapped REs and find those to be deconfined as well during this phase.
While the results presented here are not sufficient to assess the magnitude of
the formed RE beam, we show that significant RE losses could be expected to
arise due to field stochasticity.",-0.30940098,-0.21192239,-0.19678508,A
3615,"Pharmaceuticals

Pharmaceuticals are OMPs which are widely investigated and the attention for further research is
increasing due to the numerous reports of their presence in ground, surface and even drinking
water.","Application of plasma for removal of pollutants dissolved in water

3.1.","Despite low concentrations, the influence of continuous exposure to mixtures of different
therapeutic groups has become of growing concern, not just to the aquatic species, but for human
health as well (Arnold et al., 2014; Bernhardt et al., 2017).",2022-03-21 10:15:10+00:00,Pathways of organic micropollutants degradation in atmospheric pressure plasma processing,physics.plasm-ph,"['physics.plasm-ph', 'physics.chem-ph']","[arxiv.Result.Author('Barbara Topolovec'), arxiv.Result.Author('Nikola Skoro'), arxiv.Result.Author('Nevena Puac'), arxiv.Result.Author('Mira Petrovic')]","Concern of toxic compounds and their, potentially more harmful degradation
products, present in aquatic environment alarmed scientific community and
research on the development of novel technologies for wastewater treatment had
become of great interest. Up to this date, many papers pointed out the
challenges and limitations of conventional wastewater treatment and of some
advanced oxidation processes. Advanced technologies based on the use of
non-equilibrium or non-thermal plasma had been recognized as a possible
solution for, not only degradation, but for complete removal of recalcitrant
organic micropollutants. While previous review papers have been focused on
plasma physics and chemistry of different types of discharges for few organic
micropollutants, this paper brings comprehensive review of current knowledge on
the chemistry and degradation pathways by using different non-thermal plasma
types for several micropollutants classes, such as pharmaceuticals,
perfluorinated compounds, pesticides, phenols and dyes and points out some
major research gaps.",0.03681882,-0.20329869,0.46105927,A
4385,"However, the precise sequence, location
and evolution of the various processes are likely facilitated by the combination of 1)
low divertor electron temperatures (Te ≤ 0.2 eV) with 2) low divertor electron densities
(ne ≈ 1019m−3); which likely has been achieved due to the Super-X divertor although
further research is required.","The observed processes during detachment in the MAST-U Super-X
divertor are not unique to MAST Upgrade.","This phase progression is based upon line-of-sight spectroscopy through the Super-X
divertor chamber.",2022-04-05 11:29:53+00:00,Spectroscopic investigations of detachment on the MAST Upgrade Super-X divertor,physics.plasm-ph,['physics.plasm-ph'],"[arxiv.Result.Author('Kevin Verhaegh'), arxiv.Result.Author('Bruce Lipschultz'), arxiv.Result.Author('James Harrison'), arxiv.Result.Author('Nick Osborne'), arxiv.Result.Author('Aelwyn Williams'), arxiv.Result.Author('Peter Ryan'), arxiv.Result.Author('James Clark'), arxiv.Result.Author('Fabio Federici'), arxiv.Result.Author('Bob Kool'), arxiv.Result.Author('Tijs Wijkamp'), arxiv.Result.Author('Alexandre Fil'), arxiv.Result.Author('David Moulton'), arxiv.Result.Author('Omkar Myatra'), arxiv.Result.Author('Andrew Thornton'), arxiv.Result.Author('Thomas Bosman'), arxiv.Result.Author('Geof Cunningham'), arxiv.Result.Author('Basil Duval'), arxiv.Result.Author('Stuart Henderson'), arxiv.Result.Author('Rory Scannell'), arxiv.Result.Author('the MAST Upgrade team')]","We present the first analysis of the atomic and molecular processes at play
during detachment in the MAST-U Super-X divertor using divertor spectroscopy
data. Our analysis indicates detachment in the MAST-U Super-X divertor can be
separated into four sequential phases: First, the ionisation region detaches
from the target at detachment onset leaving a region of increased molecular
densities downstream. The plasma interacts with these molecules, resulting in
molecular ions ($D_2^+$ and/or $D_2^- \rightarrow D + D^-$) that further react
with the plasma leading to Molecular Activated Recombination and Dissociation
(MAR and MAD), which results in excited atoms and significant Balmer line
emission. Second, the MAR region detaches from the target leaving a sub-eV
temperature region downstream. Third, an onset of strong emission from
electron-ion recombination (EIR) ensues. Finally, the electron density decays
near the target, resulting in a density front moving upstream.
  The analysis in this paper indicates that plasma-molecule interactions have a
larger impact than previously reported and play a critical role in the
intensity and interpretation of hydrogen atomic line emission characteristics
on MAST-U. Furthermore, we find that the Fulcher band emission profile in the
divertor can be used as a proxy for the ionisation region and may also be
employed as a plasma temperature diagnostic for improving the separation of
hydrogenic emission arising from electron-impact excitation and that from
plasma-molecular interactions.
  We provide evidences for the presence of low electron temperatures ($<0.5$
eV) during detachment phases III-IV based on quantitative spectroscopy
analysis, a Boltzmann relation of the high-n Balmer line transitions together
with an analysis of the brightness of high-n Balmer lines.",0.1715081,-0.30566466,-0.095341094,A
4386,"Section 4.2
showed that tracking the D2 Fulcher band emission may, instead, be a suitable proxy
for the ionisation region (possibly in combination with atomic hydrogen spectroscopy),
meritorious of further study.","This is
supported by results from TCV [22, 21, 3]; JET [25, 24] and these MAST-U results,
where it was shown that molecules contribute strongly to the Dα emission.","Additional processes occur during deep detachment, beyond the ionisation front
movement (phase I detachment), which can also be tracked: 1) the MAR front, which
MAST-U spectroscopy detachment  27

can be tracked using the Dα emission on MAST-U (phase II detachment); 2) the EIR
emission ”high temperature”-end, which can be monitored by tracking any increase in
Balmer line ratio (phase III detachment); 3) the electron density bulk, i.e.",2022-04-05 11:29:53+00:00,Spectroscopic investigations of detachment on the MAST Upgrade Super-X divertor,physics.plasm-ph,['physics.plasm-ph'],"[arxiv.Result.Author('Kevin Verhaegh'), arxiv.Result.Author('Bruce Lipschultz'), arxiv.Result.Author('James Harrison'), arxiv.Result.Author('Nick Osborne'), arxiv.Result.Author('Aelwyn Williams'), arxiv.Result.Author('Peter Ryan'), arxiv.Result.Author('James Clark'), arxiv.Result.Author('Fabio Federici'), arxiv.Result.Author('Bob Kool'), arxiv.Result.Author('Tijs Wijkamp'), arxiv.Result.Author('Alexandre Fil'), arxiv.Result.Author('David Moulton'), arxiv.Result.Author('Omkar Myatra'), arxiv.Result.Author('Andrew Thornton'), arxiv.Result.Author('Thomas Bosman'), arxiv.Result.Author('Geof Cunningham'), arxiv.Result.Author('Basil Duval'), arxiv.Result.Author('Stuart Henderson'), arxiv.Result.Author('Rory Scannell'), arxiv.Result.Author('the MAST Upgrade team')]","We present the first analysis of the atomic and molecular processes at play
during detachment in the MAST-U Super-X divertor using divertor spectroscopy
data. Our analysis indicates detachment in the MAST-U Super-X divertor can be
separated into four sequential phases: First, the ionisation region detaches
from the target at detachment onset leaving a region of increased molecular
densities downstream. The plasma interacts with these molecules, resulting in
molecular ions ($D_2^+$ and/or $D_2^- \rightarrow D + D^-$) that further react
with the plasma leading to Molecular Activated Recombination and Dissociation
(MAR and MAD), which results in excited atoms and significant Balmer line
emission. Second, the MAR region detaches from the target leaving a sub-eV
temperature region downstream. Third, an onset of strong emission from
electron-ion recombination (EIR) ensues. Finally, the electron density decays
near the target, resulting in a density front moving upstream.
  The analysis in this paper indicates that plasma-molecule interactions have a
larger impact than previously reported and play a critical role in the
intensity and interpretation of hydrogen atomic line emission characteristics
on MAST-U. Furthermore, we find that the Fulcher band emission profile in the
divertor can be used as a proxy for the ionisation region and may also be
employed as a plasma temperature diagnostic for improving the separation of
hydrogenic emission arising from electron-impact excitation and that from
plasma-molecular interactions.
  We provide evidences for the presence of low electron temperatures ($<0.5$
eV) during detachment phases III-IV based on quantitative spectroscopy
analysis, a Boltzmann relation of the high-n Balmer line transitions together
with an analysis of the brightness of high-n Balmer lines.",0.16868445,-0.24529022,0.042153127,A
4387,"The achievement of ’stable’ operation ¶ with very low divertor temperatures ( 0.5
eV) may provide some preliminary anecdotal evidence of the Super-X divertor; although
further research is required.","This, for instance, would lead to an enhanced MAR/MAD
rate and PMI emission contribution at T < 1 eV compared to the calculations performed
in section 4.1 if there is a signiﬁcant population of vibrationally excited molecules.","Those low temperature regimes also have implications for
requirements on atomic/molecular data development.",2022-04-05 11:29:53+00:00,Spectroscopic investigations of detachment on the MAST Upgrade Super-X divertor,physics.plasm-ph,['physics.plasm-ph'],"[arxiv.Result.Author('Kevin Verhaegh'), arxiv.Result.Author('Bruce Lipschultz'), arxiv.Result.Author('James Harrison'), arxiv.Result.Author('Nick Osborne'), arxiv.Result.Author('Aelwyn Williams'), arxiv.Result.Author('Peter Ryan'), arxiv.Result.Author('James Clark'), arxiv.Result.Author('Fabio Federici'), arxiv.Result.Author('Bob Kool'), arxiv.Result.Author('Tijs Wijkamp'), arxiv.Result.Author('Alexandre Fil'), arxiv.Result.Author('David Moulton'), arxiv.Result.Author('Omkar Myatra'), arxiv.Result.Author('Andrew Thornton'), arxiv.Result.Author('Thomas Bosman'), arxiv.Result.Author('Geof Cunningham'), arxiv.Result.Author('Basil Duval'), arxiv.Result.Author('Stuart Henderson'), arxiv.Result.Author('Rory Scannell'), arxiv.Result.Author('the MAST Upgrade team')]","We present the first analysis of the atomic and molecular processes at play
during detachment in the MAST-U Super-X divertor using divertor spectroscopy
data. Our analysis indicates detachment in the MAST-U Super-X divertor can be
separated into four sequential phases: First, the ionisation region detaches
from the target at detachment onset leaving a region of increased molecular
densities downstream. The plasma interacts with these molecules, resulting in
molecular ions ($D_2^+$ and/or $D_2^- \rightarrow D + D^-$) that further react
with the plasma leading to Molecular Activated Recombination and Dissociation
(MAR and MAD), which results in excited atoms and significant Balmer line
emission. Second, the MAR region detaches from the target leaving a sub-eV
temperature region downstream. Third, an onset of strong emission from
electron-ion recombination (EIR) ensues. Finally, the electron density decays
near the target, resulting in a density front moving upstream.
  The analysis in this paper indicates that plasma-molecule interactions have a
larger impact than previously reported and play a critical role in the
intensity and interpretation of hydrogen atomic line emission characteristics
on MAST-U. Furthermore, we find that the Fulcher band emission profile in the
divertor can be used as a proxy for the ionisation region and may also be
employed as a plasma temperature diagnostic for improving the separation of
hydrogenic emission arising from electron-impact excitation and that from
plasma-molecular interactions.
  We provide evidences for the presence of low electron temperatures ($<0.5$
eV) during detachment phases III-IV based on quantitative spectroscopy
analysis, a Boltzmann relation of the high-n Balmer line transitions together
with an analysis of the brightness of high-n Balmer lines.",0.038980823,-0.40978777,-0.11734037,A_centroid
4388,"However,
whether MAR and MAD contribute signiﬁcantly below the ionisation region in reactors
with or without divertor baﬄes warrants further study.","Simpliﬁed
modelling may suggest that MAR/MAD can be important at high density regimes if the
molecular density in the divertor can be kept suﬃciently high (section 4.1).","Reactor concepts with possibly
tightly baﬄed alternative divertor concepts (ADC) (e.g.",2022-04-05 11:29:53+00:00,Spectroscopic investigations of detachment on the MAST Upgrade Super-X divertor,physics.plasm-ph,['physics.plasm-ph'],"[arxiv.Result.Author('Kevin Verhaegh'), arxiv.Result.Author('Bruce Lipschultz'), arxiv.Result.Author('James Harrison'), arxiv.Result.Author('Nick Osborne'), arxiv.Result.Author('Aelwyn Williams'), arxiv.Result.Author('Peter Ryan'), arxiv.Result.Author('James Clark'), arxiv.Result.Author('Fabio Federici'), arxiv.Result.Author('Bob Kool'), arxiv.Result.Author('Tijs Wijkamp'), arxiv.Result.Author('Alexandre Fil'), arxiv.Result.Author('David Moulton'), arxiv.Result.Author('Omkar Myatra'), arxiv.Result.Author('Andrew Thornton'), arxiv.Result.Author('Thomas Bosman'), arxiv.Result.Author('Geof Cunningham'), arxiv.Result.Author('Basil Duval'), arxiv.Result.Author('Stuart Henderson'), arxiv.Result.Author('Rory Scannell'), arxiv.Result.Author('the MAST Upgrade team')]","We present the first analysis of the atomic and molecular processes at play
during detachment in the MAST-U Super-X divertor using divertor spectroscopy
data. Our analysis indicates detachment in the MAST-U Super-X divertor can be
separated into four sequential phases: First, the ionisation region detaches
from the target at detachment onset leaving a region of increased molecular
densities downstream. The plasma interacts with these molecules, resulting in
molecular ions ($D_2^+$ and/or $D_2^- \rightarrow D + D^-$) that further react
with the plasma leading to Molecular Activated Recombination and Dissociation
(MAR and MAD), which results in excited atoms and significant Balmer line
emission. Second, the MAR region detaches from the target leaving a sub-eV
temperature region downstream. Third, an onset of strong emission from
electron-ion recombination (EIR) ensues. Finally, the electron density decays
near the target, resulting in a density front moving upstream.
  The analysis in this paper indicates that plasma-molecule interactions have a
larger impact than previously reported and play a critical role in the
intensity and interpretation of hydrogen atomic line emission characteristics
on MAST-U. Furthermore, we find that the Fulcher band emission profile in the
divertor can be used as a proxy for the ionisation region and may also be
employed as a plasma temperature diagnostic for improving the separation of
hydrogenic emission arising from electron-impact excitation and that from
plasma-molecular interactions.
  We provide evidences for the presence of low electron temperatures ($<0.5$
eV) during detachment phases III-IV based on quantitative spectroscopy
analysis, a Boltzmann relation of the high-n Balmer line transitions together
with an analysis of the brightness of high-n Balmer lines.",-0.08135762,-0.40822127,0.09113865,A
4929,"We performed a further study on the impact of the tungsten impurities on the
ITG.","4 clearly demonstrates that the ITG growth rate decreases as Lez changes
from negative to positive values.","Considering ionized impurities (W +6, W +18, and W +30) as impurity species, Fig.",2022-04-16 09:59:26+00:00,Impact of impurities on drift wave instabilities in reversed-field pinch plasmas,physics.plasm-ph,['physics.plasm-ph'],"[arxiv.Result.Author('Jingchun Li'), arxiv.Result.Author('Songfen Liu'), arxiv.Result.Author('Yilong Zhang'), arxiv.Result.Author('Jiaqi Dong'), arxiv.Result.Author('Wei Kong')]","The drift wave in the presence of impurity ions was investigated numerically
in reversed field pinch (RFP) plasmas, using the gyrokinetic integral eigenmode
equation. It was found that in RFP plasmas with hollow density profiles, an
increase in $k_\theta \rho_s$ increases the growth rate of the ion temperature
gradient (ITG). Comparing the results of regular and hollow plasma density
profile shows that the ITG mode under the hollow density profile is much harder
to be excited. For the impurities' effects, when the impurities' density
gradient is opposite to the primary ions, namely when $L_{ez}$ is negative,
impurities could enhance the instability. On the contrary, when $L_{ez}$ is
positive, the instability is stabilized. Regarding the trapped electron mode
(TEMs), the growth rate under the plasma with hollow density profile remained
minor than that for the standard density gradient. There exists a threshold of
$L_{ez}$. When $L_{ez}$ is less than this value, impurity destabilizes TEMs,
while as $L_{ez}$ is greater than this, impurity stabilizes TEMs. The effects
of $L_{ez}$ on TEM also depend on both the plasma density gradient and the
impurity species. In addition, the influence of collisionality on TEMs was also
studied.",-0.02846749,-0.29730624,0.025907733,A
