Unnamed: 0,further research line,further research prefix,further research suffix,publication date,title,primary category,categories,authors,abstract,x,y,z,cluster
6486,"No work is ever complete, therefore it is important to highlight a few possible further research
directions:

     Paired-trees: Worst-time complexities for k-nearest neighbors and the minimum spanning

                                                              123
124  Yury Elkin

tree problem can be potentially improved by using cover trees of both query and reference sets.","It was shown experimentally that mergegram produces excellent
results in 2d shape recognition when it was combined with Perslay-neural network architecture.","Given query and reference sets Q, R we wish to develop an algorithm that scans through all
relevant pairs of Q × R in time O(cO(1) · max{|Q|, |R|}), where c is an expansion constant that
depends on sets Q,R.",2022-05-20 14:13:43+00:00,New compressed cover tree for k-nearest neighbor search,cs.CG,"['cs.CG', 'cs.CC']",[arxiv.Result.Author('Yury Elkin')],"This thesis consists of two topics related to computational geometry and one
topic related to topological data analysis (TDA), which combines fields of
computational geometry and algebraic topology for analyzing data. The first
part studies the classical problem of finding k nearest neighbors to m query
points in a larger set of n reference points in any metric space. The second
part is about the construction of a Minimum Spanning Tree (MST) on any finite
metric space. The third part extends the key concept of persistence within
Topological Data Analysis in a new direction.",-0.616799,0.2487596,0.38057077,C_centroid
6487,"No work is ever complete, therefore it is important to highlight a few possible further research
directions:

     Paired-trees: Worst-time complexities for k-nearest neighbors and the minimum spanning

                                                              123
124  Yury Elkin

tree problem can be potentially improved by using cover trees of both query and reference sets.","It was shown experimentally that mergegram produces excellent
results in 2d shape recognition when it was combined with Perslay-neural network architecture.","Given query and reference sets Q, R we wish to develop an algorithm that scans through all
relevant pairs of Q × R in time O(cO(1) · max{|Q|, |R|}), where c is an expansion constant that
depends on sets Q,R.",2022-05-20 14:13:43+00:00,New compressed cover tree for k-nearest neighbor search,cs.CG,"['cs.CG', 'cs.CC']",[arxiv.Result.Author('Yury Elkin')],"This thesis consists of two topics related to computational geometry and one
topic related to topological data analysis (TDA), which combines fields of
computational geometry and algebraic topology for analyzing data. The first
part studies the classical problem of finding k nearest neighbors to m query
points in a larger set of n reference points in any metric space. The second
part is about the construction of a Minimum Spanning Tree (MST) on any finite
metric space. The third part extends the key concept of persistence within
Topological Data Analysis in a new direction.",-0.616799,0.2487596,0.38057077,C
8263,"A more practically oriented direction for further research would be to develop a less naive
method of ﬁlling gaps than the mixed morph.","Another direction is to develop other morphs that guarantee a smooth change of
some distance measure other than the Hausdorﬀ distance; we noted that it is unclear how
to employ the Fr´echet distance for morphing in the presence of multiple components.","It does not necessarily make sense to use the
same radius for the closing operator everywhere, which sometimes closes gaps that will be
opened again.",2022-06-30 15:12:18+00:00,Abstract morphing using the Hausdorff distance and Voronoi diagrams,cs.CG,['cs.CG'],"[arxiv.Result.Author('Lex de Kogel'), arxiv.Result.Author('Marc van Kreveld'), arxiv.Result.Author('Jordi L. Vermeulen')]","This paper introduces two new abstract morphs for two $2$-dimensional shapes.
The intermediate shapes gradually reduce the Hausdorff distance to the goal
shape and increase the Hausdorff distance to the initial shape. The morphs are
conceptually simple and apply to shapes with multiple components and/or holes.
We prove some basic properties relating to continuity, containment, and area.
Then we give an experimental analysis that includes the two new morphs and a
recently introduced abstract morph that is also based on the Hausdorff distance
(Van Kreveld et al. Between shapes, using the Hausdorff distance. Computational
Geometry 100:101817, 2022). We show results on the area and perimeter
development throughout the morph, and also the number of components and holes.
A visual comparison shows that one of the new morphs appears most attractive.",0.05010546,0.10239223,-0.19487607,C
8918,"Proving a sharp bound
on the approximation factor is an interesting problem for further research.",The bound of 1 ´ 4ε on the approximation factor is most likely not tight.,Corollary 6.4.,2022-07-14 21:33:31+00:00,Computing Optimal Kernels in Two Dimensions,cs.CG,['cs.CG'],"[arxiv.Result.Author('Pankaj K. Agarwal'), arxiv.Result.Author('Sariel Har-Peled')]","Let $P$ be a set of $n$ points in $\mathbb{R}^2$. A subset $C\subseteq P$ is
an $\varepsilon$-kernel of $P$ if the projection of the convex hull of $C$
approximates that of $P$ within $(1-\varepsilon)$-factor in every direction.
The set $C$ is a weak $\varepsilon$-kernel if its directional width
approximates that of $P$ in every direction. We present fast algorithms for
computing a minimum-size $\varepsilon$-kernel as well as a weak
$\varepsilon$-kernel. We also present a fast algorithm for the Hausdorff
variant of this problem.
  In addition, we introduce the notion of $\varepsilon$-core, a convex polygon
lying inside $CH(P)$, prove that it is a good approximation of the optimal
$\varepsilon$-kernel, present an efficient algorithm for computing it, and use
it to compute an $\varepsilon$-kernel of small size.",-0.153676,-0.3465417,-0.15432423,C
10077,We propose the following open questions for further study.,"One could
also try to generalize the set of objects, for example, adapting the minimum area algorithm
to arbitrary convex objects.","Is there a polynomial-time exact algorithm for the minimum area convex intersecting
    polygon of segments?",2022-08-16 07:15:30+00:00,Computing Smallest Convex Intersecting Polygons,cs.CG,['cs.CG'],"[arxiv.Result.Author('Antonios Antoniadis'), arxiv.Result.Author('Mark de Berg'), arxiv.Result.Author('Sándor Kisfaludi-Bak'), arxiv.Result.Author('Antonis Skarlatos')]","A polygon C is an intersecting polygon for a set O of objects in the plane if
C intersects each object in O, where the polygon includes its interior. We
study the problem of computing the minimum-perimeter intersecting polygon and
the minimum-area convex intersecting polygon for a given set O of objects. We
present an FPTAS for both problems for the case where O is a set of possibly
intersecting convex polygons in the plane of total complexity n.
  Furthermore, we present an exact polynomial-time algorithm for the
minimum-perimeter intersecting polygon for the case where O is a set of n
possibly intersecting segments in the plane. So far, polynomial-time exact
algorithms were only known for the minimum perimeter intersecting polygon of
lines or of disjoint segments.",-0.09085165,-0.14901647,-0.14070398,C
10365,There are numerous open problems for further research raised by our work.,"We then solved the dual problem of guarding a point set against convex regions by inserting guards, except
that in this case in addition to the rounding provided by the “standard” weak ε-net, we had to use dynamic
programming to ﬁnd bad convex regions if they exists.","The ﬁrst one is improving the
approximation quality even further.",2022-08-24 02:35:12+00:00,Halving by a Thousand Cuts or Punctures,cs.CG,['cs.CG'],"[arxiv.Result.Author('Sariel Har-Peled'), arxiv.Result.Author('Da Wei Zheng')]","$\newcommand{\Arr}{\mathcal{A}} \newcommand{\numS}{k}
\newcommand{\ArrX}[1]{\Arr(#1)} \newcommand{\eps}{\varepsilon}
\newcommand{\opt}{\mathsf{o}}$ For point sets $P_1, \ldots, P_\numS$, a set of
lines $L$ is halving if any face of the arrangement $\ArrX{L}$ contains at most
$|P_i|/2$ points of $P_i$, for all $i$. We study the problem of computing a
halving set of lines of minimal size. Surprisingly, we show a polynomial time
algorithm that outputs a halving set of size $O(\opt^{3/2})$, where $\opt$ is
the size of the optimal solution. Our solution relies on solving a new variant
of the weak $\eps$-net problem for corridors, which we believe to be of
independent interest.
  We also study other variants of this problem, including an alternative
setting, where one needs to introduce a set of guards (i.e., points), such that
no convex set avoiding the guards contains more than half the points of each
point set.",-0.09828857,-0.3097751,-0.031388864,C
10366,"Ultimately,
improving and simplifying Rubin’s construction in 2d seems like a worthy problem for further research.",It is natural to further investigate this connection.,"Beyond that, this work emphasize the “rounding is approximation” approach.",2022-08-24 02:35:12+00:00,Halving by a Thousand Cuts or Punctures,cs.CG,['cs.CG'],"[arxiv.Result.Author('Sariel Har-Peled'), arxiv.Result.Author('Da Wei Zheng')]","$\newcommand{\Arr}{\mathcal{A}} \newcommand{\numS}{k}
\newcommand{\ArrX}[1]{\Arr(#1)} \newcommand{\eps}{\varepsilon}
\newcommand{\opt}{\mathsf{o}}$ For point sets $P_1, \ldots, P_\numS$, a set of
lines $L$ is halving if any face of the arrangement $\ArrX{L}$ contains at most
$|P_i|/2$ points of $P_i$, for all $i$. We study the problem of computing a
halving set of lines of minimal size. Surprisingly, we show a polynomial time
algorithm that outputs a halving set of size $O(\opt^{3/2})$, where $\opt$ is
the size of the optimal solution. Our solution relies on solving a new variant
of the weak $\eps$-net problem for corridors, which we believe to be of
independent interest.
  We also study other variants of this problem, including an alternative
setting, where one needs to introduce a set of guards (i.e., points), such that
no convex set avoiding the guards contains more than half the points of each
point set.",-0.022494774,-0.1997819,-0.02150292,C
11033,This question is for further research.,"A workspace can be constructed in which the number of RTD cells with non-empty result
is greater by a factor of O(n) than the complexity of an optimal algorithm, even if the
workspace is simple (without holes).","3 Sensor Positions for a Fixed Reading

Given a sensor reading d, we concern ourselves in the section with the shape and com-
plexity of the locus of sensor positions that result in such a reading, namely ignoring the

    2For k = 0 we still need to check the cell at the top of the list to ﬁnd out that no relevant cells exist.",2022-09-11 11:10:34+00:00,Localization with Few Distance Measurements,cs.CG,"['cs.CG', 'cs.RO']","[arxiv.Result.Author('Dan Halperin'), arxiv.Result.Author('Steven M. LaValle'), arxiv.Result.Author('Barak Ugav')]","Given a polygon $W$, a depth sensor placed at point $p=(x,y)$ inside $W$ and
oriented in direction $\theta$ measures the distance $d=h(x,y,\theta)$ between
$p$ and the closest point on the boundary of $W$ along a ray emanating from $p$
in direction $\theta$. We study the following problem: Give a polygon $W$,
possibly with holes, with $n$ vertices, preprocess it such that given a query
real value $d\geq 0$, one can efficiently compute the preimage $h^{-1}(d)$,
namely determine all the possible poses (positions and orientations) of a depth
sensor placed in $W$ that would yield the reading $d$. We employ a
decomposition of $W\times S^1$, which is an extension of the celebrated
trapezoidal decomposition, and which we call rotational trapezoidal
decomposition and present an efficient data structure, which computes the
preimage in an output-sensitive fashion relative to this decomposition: if $k$
cells of the decomposition contribute to the final result, we will report them
in $O(k+1)$ time, after $O(n^2\log n)$ preprocessing time and using $O(n^2)$
storage space. We also analyze the shape of the projection of the preimage onto
the polygon $W$; this projection describes the portion of $W$ where the sensor
could have been placed. Furthermore, we obtain analogous results for the more
useful case (narrowing down the set of possible poses), where the sensor
performs two depth measurement from the same point $p$, one in direction
$\theta$ and the other in direction $\theta+\pi$. While localizations problems
in robotics are often carried out by exploring the full visibility polygon of a
sensor placed at a fixed point of the environment, the approach that we propose
here opens the door to sufficing with only few depth measurements, which is
advantageous as it allows for usage of inexpensive sensors and could also lead
to savings in storage and communication costs.",-0.10702676,-0.20213628,-0.41969052,C
11034,We leave this as an open problem for further research.,"It might be the case that special
properties of the regions Ψd(C) and their juxtaposition could be used to show that the
complexity of the union is o(k2).","9
(a)  (b)     (c)

Figure 7: Examples of the planar projection of possible conﬁgurations of a single cell with
a ﬁxed reading d: (a) both limiting vertices lie on the top edge, the resulting curves are arcs
and do not intersect the bottom edge (b) the limiting vertices and arc curves are similar to
(a), but the result intersects the bottom edge (c) one limiting vertex lies on the top edge and
one is not, resulting in an arc and a conchoid.",2022-09-11 11:10:34+00:00,Localization with Few Distance Measurements,cs.CG,"['cs.CG', 'cs.RO']","[arxiv.Result.Author('Dan Halperin'), arxiv.Result.Author('Steven M. LaValle'), arxiv.Result.Author('Barak Ugav')]","Given a polygon $W$, a depth sensor placed at point $p=(x,y)$ inside $W$ and
oriented in direction $\theta$ measures the distance $d=h(x,y,\theta)$ between
$p$ and the closest point on the boundary of $W$ along a ray emanating from $p$
in direction $\theta$. We study the following problem: Give a polygon $W$,
possibly with holes, with $n$ vertices, preprocess it such that given a query
real value $d\geq 0$, one can efficiently compute the preimage $h^{-1}(d)$,
namely determine all the possible poses (positions and orientations) of a depth
sensor placed in $W$ that would yield the reading $d$. We employ a
decomposition of $W\times S^1$, which is an extension of the celebrated
trapezoidal decomposition, and which we call rotational trapezoidal
decomposition and present an efficient data structure, which computes the
preimage in an output-sensitive fashion relative to this decomposition: if $k$
cells of the decomposition contribute to the final result, we will report them
in $O(k+1)$ time, after $O(n^2\log n)$ preprocessing time and using $O(n^2)$
storage space. We also analyze the shape of the projection of the preimage onto
the polygon $W$; this projection describes the portion of $W$ where the sensor
could have been placed. Furthermore, we obtain analogous results for the more
useful case (narrowing down the set of possible poses), where the sensor
performs two depth measurement from the same point $p$, one in direction
$\theta$ and the other in direction $\theta+\pi$. While localizations problems
in robotics are often carried out by exploring the full visibility polygon of a
sensor placed at a fixed point of the environment, the approach that we propose
here opens the door to sufficing with only few depth measurements, which is
advantageous as it allows for usage of inexpensive sensors and could also lead
to savings in storage and communication costs.",-0.005923721,-0.17639971,-0.15640971,C
11035,This question is for further research.,"A
workspace can be constructed in which the number of RTD cells with non-empty result
is greater by a factor of O(n) than the complexity of an optimal algorithm, even if the
workspace is simple (without holes).","11
A Calculating OC(θ, x)

For each RTD cell C, the opening function O(θ, x) deﬁned at Deﬁnition 1, can be an-

alytically           described.",2022-09-11 11:10:34+00:00,Localization with Few Distance Measurements,cs.CG,"['cs.CG', 'cs.RO']","[arxiv.Result.Author('Dan Halperin'), arxiv.Result.Author('Steven M. LaValle'), arxiv.Result.Author('Barak Ugav')]","Given a polygon $W$, a depth sensor placed at point $p=(x,y)$ inside $W$ and
oriented in direction $\theta$ measures the distance $d=h(x,y,\theta)$ between
$p$ and the closest point on the boundary of $W$ along a ray emanating from $p$
in direction $\theta$. We study the following problem: Give a polygon $W$,
possibly with holes, with $n$ vertices, preprocess it such that given a query
real value $d\geq 0$, one can efficiently compute the preimage $h^{-1}(d)$,
namely determine all the possible poses (positions and orientations) of a depth
sensor placed in $W$ that would yield the reading $d$. We employ a
decomposition of $W\times S^1$, which is an extension of the celebrated
trapezoidal decomposition, and which we call rotational trapezoidal
decomposition and present an efficient data structure, which computes the
preimage in an output-sensitive fashion relative to this decomposition: if $k$
cells of the decomposition contribute to the final result, we will report them
in $O(k+1)$ time, after $O(n^2\log n)$ preprocessing time and using $O(n^2)$
storage space. We also analyze the shape of the projection of the preimage onto
the polygon $W$; this projection describes the portion of $W$ where the sensor
could have been placed. Furthermore, we obtain analogous results for the more
useful case (narrowing down the set of possible poses), where the sensor
performs two depth measurement from the same point $p$, one in direction
$\theta$ and the other in direction $\theta+\pi$. While localizations problems
in robotics are often carried out by exploring the full visibility polygon of a
sensor placed at a fixed point of the environment, the approach that we propose
here opens the door to sufficing with only few depth measurements, which is
advantageous as it allows for usage of inexpensive sensors and could also lead
to savings in storage and communication costs.",-0.043856144,-0.30150682,-0.3997237,C
