Unnamed: 0,further research line,further research prefix,further research suffix,publication date,title,primary category,categories,authors,abstract,x,y,z,cluster
5674,"Closing this gap also for these objectives is a challenging
problem for further research.","The best known upper bound is 16 for k-median [9] and 32 for k-means [16] but no non-
trivial lower bounds are known.","Another natural question is which approximation factors can be achieved by algo-
rithms running in polynomial time.",2022-05-03 11:11:55+00:00,The Price of Hierarchical Clustering,cs.DS,['cs.DS'],"[arxiv.Result.Author('Anna Arutyunova'), arxiv.Result.Author('Heiko Röglin')]","Hierarchical Clustering is a popular tool for understanding the hereditary
properties of a data set. Such a clustering is actually a sequence of
clusterings that starts with the trivial clustering in which every data point
forms its own cluster and then successively merges two existing clusters until
all points are in the same cluster. A hierarchical clustering achieves an
approximation factor of $\alpha$ if the costs of each $k$-clustering in the
hierarchy are at most $\alpha$ times the costs of an optimal $k$-clustering. We
study as cost functions the maximum (discrete) radius of any cluster
($k$-center problem) and the maximum diameter of any cluster ($k$-diameter
problem). In general, the optimal clusterings do not form a hierarchy and hence
an approximation factor of $1$ cannot be achieved. We call the smallest
approximation factor that can be achieved for any instance the price of
hierarchy. For the $k$-diameter problem we improve the upper bound on the price
of hierarchy to $3+2\sqrt{2}\approx 5.83$. Moreover we significantly improve
the lower bounds for $k$-center and $k$-diameter, proving a price of hierarchy
of exactly $4$ and $3+2\sqrt{2}$, respectively.",-0.15559576,-0.23786348,-0.029125271,B
5719,"The toolbox of successful TA3 techniques can then become the starting point of further research;
moreover, it can be added to the bioinformatics curriculum in computer science.","It will be useful to also identify successful TA3 techniques from
areas of bioinformatics that are not based solely on sequencing data, such as whole-genome analysis and phylogeny
reconstruction.","The theoretical analysis of sequencing bioinformatics algorithms and beyond  9

   Viewing TA3 as its own research field would allow researchers to focus on retrospective prediction of algorithm
performance; i.e.",2022-05-03 21:17:53+00:00,The theoretical analysis of sequencing bioinformatics algorithms and beyond,cs.DS,['cs.DS'],[arxiv.Result.Author('Paul Medvedev')],"The theoretical analysis of performance has been an important tool in the
engineering of algorithms in many application domains. Its goals are to predict
the empirical performance of an algorithm and to be a yardstick that drives the
design of novel algorithms that perform well in practice. While these goals
have been achieved in many instances, they have not been achieved ubiquitously
across crucial application domains. I provide a case study in the area of
sequencing bioinformatics, an inter-disciplinary field that uses algorithms to
extract biological meaning from genome sequencing data. In particular, I give
three concrete examples: two showing how theoretical analysis has failed to
achieve its goals and one showing how it has been successful. I will then
catalog some of the challenges of applying theoretical analysis to sequencing
bioinformatics, argue why empirical analysis is not enough, and give a vision
for improving the relevance of theoretical analysis to sequencing
bioinformatics. By recognizing the problem, understanding its roots, and
providing potential solutions, this work can hopefully be a crucial first step
towards making theoretical analysis more relevant in sequencing bioinformatics
and potentially other fast-paced application domains.",0.3055269,0.23910794,0.21459489,C
5990,Section 8 summarizes the results and discusses possible directions for further research.,Section 7 describes experiments for an external implementation.,Our Contribution.,2022-05-10 08:42:03+00:00,PaCHash: Packed and Compressed Hash Tables,cs.DS,['cs.DS'],"[arxiv.Result.Author('Florian Kurpicz'), arxiv.Result.Author('Hans-Peter Lehmann'), arxiv.Result.Author('Peter Sanders')]","We introduce PaCHash, a hash table that stores its objects contiguously in an
array without intervening space, even if the objects have variable size. In
particular, each object can be compressed using standard compression
techniques. A small search data structure allows locating the objects in
constant expected time. PaCHash is most naturally described as a static
external hash table where it needs a constant number of bits of internal memory
per block of external memory. However, PaCHash can be dynamized and is also
useful for internal memory, having lower space consumption than all previous
approaches even when considering only objects of identical size. For example,
in some sense it beats a lower bound on the space consumption of k-perfect
hashing. An implementation for fast SSDs needs about 5 bits of internal memory
per block of external memory, requires only one disk access (of variable
length) per search operation and has internal search overhead small compared to
the disk access cost.",0.851084,-0.17019984,-0.10624193,C
5991,Section 8 summarizes the results and discusses possible directions for further research.,Section 7 describes experiments for an external implementation.,Our Contribution.,2022-05-10 08:42:03+00:00,PaCHash: Packed and Compressed Hash Tables,cs.DS,['cs.DS'],"[arxiv.Result.Author('Florian Kurpicz'), arxiv.Result.Author('Hans-Peter Lehmann'), arxiv.Result.Author('Peter Sanders')]","We introduce PaCHash, a hash table that stores its objects contiguously in an
array without intervening space, even if the objects have variable size. In
particular, each object can be compressed using standard compression
techniques. A small search data structure allows locating the objects in
constant expected time. PaCHash is most naturally described as a static
external hash table where it needs a constant number of bits of internal memory
per block of external memory. However, PaCHash can be dynamized and is also
useful for internal memory, having lower space consumption than all previous
approaches even when considering only objects of identical size. For example,
in some sense it beats a lower bound on the space consumption of k-perfect
hashing. An implementation for fast SSDs needs about 5 bits of internal memory
per block of external memory, requires only one disk access (of variable
length) per search operation and has internal search overhead small compared to
the disk access cost.",0.851084,-0.17019984,-0.10624193,C
5992,"Section 8 summarizes the results and discusses
   possible directions for further research.","Section 7 describes
   experiments for an external implementation.",Our Contribution.,2022-05-10 08:42:03+00:00,PaCHash: Packed and Compressed Hash Tables,cs.DS,['cs.DS'],"[arxiv.Result.Author('Florian Kurpicz'), arxiv.Result.Author('Hans-Peter Lehmann'), arxiv.Result.Author('Peter Sanders')]","We introduce PaCHash, a hash table that stores its objects contiguously in an
array without intervening space, even if the objects have variable size. In
particular, each object can be compressed using standard compression
techniques. A small search data structure allows locating the objects in
constant expected time. PaCHash is most naturally described as a static
external hash table where it needs a constant number of bits of internal memory
per block of external memory. Here, in some sense, PaCHash beats a lower bound
on the space consumption of k-perfect hashing. An implementation for fast SSDs
needs about 5 bits of internal memory per block of external memory, requires
only one disk access (of variable length) per search operation, and has small
internal search overhead compared to the disk access cost. Our experiments show
that it has lower space consumption than all previous approaches even when
considering objects of identical size.",0.851084,-0.17019984,-0.10624193,C
6058,"Another possible avenue of further research would be the generalizations of our
variants to the recently introduced extension of the BWT in the areas of graphs, languages
and automata [1, 17, 30].","We believe this larger class of transformation should
be further investigated: we have shown that some of them do have more eﬃcient inversion
and search algorithms and this suggests that there could be other subclasses of practical
interest.","References

  1 Jarno Alanko, Giovanna D’Agostino, Alberto Policriti, and Nicola Prezza.",2022-05-11 17:17:08+00:00,A New Class of String Transformations for Compressed Text Indexing,cs.DS,['cs.DS'],"[arxiv.Result.Author('Raffaele Giancarlo'), arxiv.Result.Author('Giovanni Manzini'), arxiv.Result.Author('Antonio Restivo'), arxiv.Result.Author('Giovanna Rosone'), arxiv.Result.Author('Marinella Sciortino')]","Introduced about thirty years ago in the field of Data Compression, the
Burrows-Wheeler Transform (BWT) is a string transformation that, besides being
a booster of the performance of memoryless compressors, plays a fundamental
role in the design of efficient self-indexing compressed data structures.
Finding other string transformations with the same remarkable properties of BWT
has been a challenge for many researchers for a long time. Among the known BWT
variants, the only one that has been recently shown to be a valid alternative
to BWT is the Alternating BWT (ABWT), another invertible string transformation
introduced about ten years ago in connection with a generalization of Lyndon
words. In this paper, we introduce a whole class of new string transformations,
called local orderings-based transformations, which have all the myriad virtues
of BWT. We show that this new family is a special case of a much larger class
of transformations, based on context adaptive alphabet orderings, that includes
BWT and ABWT. Although all transformations support pattern search, we show
that, in the general case, the transformations within our larger class may take
quadratic time for inversion and pattern search. As a further result, we show
that the local orderings-based transformations can be used for the construction
of the recently introduced r-index, which makes them suitable also for highly
repetitive collections. In this context, we consider the problem of finding,
for a given string, the BWT variant that minimizes the number of runs in the
transformed string, and we provide an algorithm solving this problem in linear
time.",0.09560998,0.27102023,0.00340628,C
6895,"Many of our bounds are close to optimal, but we have some avenues for
further research:

    • Reduce the gap between lower and upper bounds for shortest cycle in an unweighted undirected graph.","6 Conclusion and Further Research

We have presented several upper and lower bounds on the round complexity of RPaths, 2-SiSP, MWC and
ANSC in the CONGEST model.",• Reduce the gap between lower and upper bounds for RPaths in an unweighted directed graph.,2022-05-30 00:50:28+00:00,Near Optimal Bounds for Replacement Paths and Related Problems in the CONGEST Model,cs.DS,"['cs.DS', 'cs.DC']","[arxiv.Result.Author('Vignesh Manoharan'), arxiv.Result.Author('Vijaya Ramachandran')]","We present several results in the CONGEST model on round complexity for
Replacement Paths (RPaths), Minimum Weight Cycle (MWC), and All Nodes Shortest
Cycles (ANSC). We study these fundamental problems in both directed and
undirected graphs, both weighted and unweighted. Many of our results are
optimal to within a polylog factor: For an $n$-node graph $G$ we establish near
linear lower and upper bounds for computing RPaths if $G$ is directed and
weighted, and for computing MWC and ANSC if $G$ is weighted, directed or
undirected; near $\sqrt{n}$ lower and upper bounds for undirected weighted
RPaths; and $\Theta(D)$ bound for undirected unweighted RPaths. We also present
lower and upper bounds for approximation versions of these problems, notably a
$(2-(1/g))$-approximation algorithm for undirected unweighted MWC that runs in
$\tilde{O}(\sqrt{n}+D)$ rounds, improving on the previous best bound of
$\tilde{O}(\sqrt{ng}+D)$ rounds, where $g$ is the MWC length, and a
$(1+\epsilon)$-approximation algorithm for directed weighted RPaths and $(2+
\epsilon)$-approximation for weighted undirected MWC, for any constant
$\epsilon > 0$, that beat the round complexity lower bound for an exact
solution.",-0.20705819,0.10930237,-0.15986867,A_centroid
7335,As discussed in [11] this phenomenon merits further study.,"Also, the fact that Reduction
8 actually undoes an application of the chain reduction is interesting: it takes a step ‘back’,
in order to move forward.","Next, an empirical study in the spirit of [28] could investigate how much extra reductive
power the new 9k − 8 rules have in practice; the rules for the 11k − 9 kernel do have more
practical eﬀect than the 15k − 9 rules, does this trend continue?",2022-06-09 12:22:30+00:00,Deep kernelization for the Tree Bisection and Reconnnect (TBR) distance in phylogenetics,cs.DS,"['cs.DS', 'math.CO', 'q-bio.PE']","[arxiv.Result.Author('Steven Kelk'), arxiv.Result.Author('Simone Linz'), arxiv.Result.Author('Ruben Meuwese')]","We describe a kernel of size 9k-8 for the NP-hard problem of computing the
Tree Bisection and Reconnect (TBR) distance k between two unrooted binary
phylogenetic trees. We achieve this by extending the existing portfolio of
reduction rules with three novel new reduction rules. Two of the rules are
based on the idea of topologically transforming the trees in a
distance-preserving way in order to guarantee execution of earlier reduction
rules. The third rule extends the local neighbourhood approach introduced in
(Kelk and Linz, Annals of Combinatorics 24(3), 2020) to more global structures,
allowing new situations to be identified when deletion of a leaf definitely
reduces the TBR distance by one. The bound on the kernel size is tight up to an
additive term. Our results also apply to the equivalent problem of computing a
Maximum Agreement Forest (MAF) between two unrooted binary phylogenetic trees.
We anticipate that our results will be more widely applicable for computing
agreement-forest based dissimilarity measures.",0.27072388,0.2327029,-0.11176902,C
7494,"8 Open Problems

The results here suggest many open problems and avenues for further research.","So the total cost of requests in Items 5 and 6 above is at most twice the total cost of
all other requests.","Closing or tightening gaps left by our upper
and lower bounds would be of interest.",2022-06-11 17:52:10+00:00,Online Paging with Heterogeneous Cache Slots,cs.DS,['cs.DS'],"[arxiv.Result.Author('Marek Chrobak'), arxiv.Result.Author('Samuel Haney'), arxiv.Result.Author('Mehraneh Liaee'), arxiv.Result.Author('Debmalya Panigrahi'), arxiv.Result.Author('Rajmohan Rajaraman'), arxiv.Result.Author('Ravi Sundaram'), arxiv.Result.Author('Neal E. Young')]","It is natural to generalize the $k$-Server problem by allowing each request
to specify not only a point $p$, but also a subset $S$ of servers that may
serve it. To attack this generalization, we focus on uniform and star metrics.
For uniform metrics, the problem is equivalent to a generalization of Paging in
which each request specifies not only a page $p$, but also a subset $S$ of
cache slots, and is satisfied by having a copy of $p$ in some slot in $S$. We
call this problem Slot-Heterogeneous Paging.
  We parameterize the problem by specifying an arbitrary family ${\cal S}
\subseteq 2^{[k]}$, and restricting the sets $S$ to ${\cal S}$. If all request
sets are allowed (${\cal S}=2^{[k]}$), the optimal deterministic and randomized
competitive ratios are exponentially worse than for standard Paging (${\cal
S}=\{[k]\}$). As a function of $|{\cal S}|$ and the cache size $k$, the optimal
deterministic ratio is polynomial: at most $O(k^2|{\cal S}|)$ and at least
$\Omega(\sqrt{|{\cal S}|})$. For any laminar family ${\cal S}$ of height $h$,
the optimal ratios are $O(hk)$ (deterministic) and $O(h^2\log k)$ (randomized).
The special case that we call All-or-One Paging extends standard Paging by
allowing each request to specify a specific slot to put the requested page in.
For All-or-One Paging the optimal competitive ratios are $\Theta(k)$
(deterministic) and $\Theta(\log k)$ (randomized), while the offline problem is
NP-hard. We extend the deterministic upper bound to the weighted variant of
All-Or-One Paging (a generalization of standard Weighted Paging), showing that
it is also $\Theta(k)$.",0.18649438,-0.34515893,-0.03332757,B
7888,"Identifying a relationship of the two algorithms that establishes an identical loss is an intriguing
problem for further research.","Unfortunately, these arguments are heavily based on
steady-state analysis and are therefore hard to be made precise for non-Markovian processes.","Greedy algorithm We start by reasoning about the pool size similar to the proof sketch in
Section 4.1.",2022-06-21 12:13:14+00:00,High Satisfaction in Thin Dynamic Matching Markets,cs.DS,"['cs.DS', 'econ.TH']","[arxiv.Result.Author('Johannes Bäumler'), arxiv.Result.Author('Martin Bullinger'), arxiv.Result.Author('Stefan Kober'), arxiv.Result.Author('Donghao Zhu')]","Dynamic matching markets are an ubiquitous object of study with applications
in health, labor, or dating. There exists a rich literature on the formal
modeling of such markets. Typically, these models consist of an arrival
procedure, governing when and which agents enter the market, and a sojourn
period of agents during which they may leave the market matched with another
present agent, or after which they leave the market unmatched. One important
focus lies on the design of mechanisms for the matching process aiming at
maximizing the quality of the produced matchings or at minimizing waiting
costs.
  We study a dynamic matching procedure where homogeneous agents arrive at
random according to a Poisson process and form edges at random yielding a
sparse market. Agents leave according to a certain departure distribution and
may leave early by forming a pair with a compatible agent. The objective is to
maximize the number of matched agents. Our main result is to show that a mild
guarantee on the maximum sojourn time of agents suffices to get almost optimal
performance of instantaneous matching, despite operating in a thin market. This
has the additional advantages of avoiding the risk of market congestion and
guaranteeing short waiting times. We develop new techniques for proving our
results going beyond commonly adopted methods for Markov processes.",-0.049419064,-0.22476526,0.013774889,B
7889,"Still, a rigorous treatment of this model is beyond the
scope of this paper, and we leave it as an intriguing direction for further research.","It is possible to extend our results under certain assumptions on the relationship
between the diﬀerent density parameters.","Acknowledgements

This work was supported by the Deutsche Forschungsgemeinschaft (German Research Founda-
tion) under grants BR 2312/11-2, BR 2312/12-1, and 277991500/GRK2201.",2022-06-21 12:13:14+00:00,High Satisfaction in Thin Dynamic Matching Markets,cs.DS,"['cs.DS', 'econ.TH']","[arxiv.Result.Author('Johannes Bäumler'), arxiv.Result.Author('Martin Bullinger'), arxiv.Result.Author('Stefan Kober'), arxiv.Result.Author('Donghao Zhu')]","Dynamic matching markets are an ubiquitous object of study with applications
in health, labor, or dating. There exists a rich literature on the formal
modeling of such markets. Typically, these models consist of an arrival
procedure, governing when and which agents enter the market, and a sojourn
period of agents during which they may leave the market matched with another
present agent, or after which they leave the market unmatched. One important
focus lies on the design of mechanisms for the matching process aiming at
maximizing the quality of the produced matchings or at minimizing waiting
costs.
  We study a dynamic matching procedure where homogeneous agents arrive at
random according to a Poisson process and form edges at random yielding a
sparse market. Agents leave according to a certain departure distribution and
may leave early by forming a pair with a compatible agent. The objective is to
maximize the number of matched agents. Our main result is to show that a mild
guarantee on the maximum sojourn time of agents suffices to get almost optimal
performance of instantaneous matching, despite operating in a thin market. This
has the additional advantages of avoiding the risk of market congestion and
guaranteeing short waiting times. We develop new techniques for proving our
results going beyond commonly adopted methods for Markov processes.",0.18404987,-0.2401701,-0.27395543,B
8055,"This is material for further research and computational
testing in the future.","The ﬁrst step is to solve the Linear Program as in (5) to obtain the ﬁrst extreme point, then fol-
low the procedure outlined in Remark 1.","7 Lifting subset constraints to solve problem 128-vertex 1ZC

The problem instance is available at: https://oeis.org/A265032/a265032 1zc.128.txt.gz

7.1 Change (and abuse) of terminology

Traditionally, lifting means, in addition to the F [i] of the vertices of the original subset S, the
F [i] of some other vertices are added to the left side of the constraint.",2022-06-25 02:13:09+00:00,Maximum independent set (stable set) problem: A mathematical programming model with valid inequalities; Computational testing with binary search and alternate optimal basic solutions (extreme points),cs.DS,"['cs.DS', 'math.OC', '90C99, 68Q19, 68Q15, 68Q17, 03C13', 'F.2']",[arxiv.Result.Author('Prabhu Manyem')],"This paper deals with the maximum independent set (M.I.S.) problem, also
known as the stable set problem. The basic mathematical programming model that
captures this problem is an Integer Program (I.P.) with zero-one variables and
only the edge inequalities. We present an enhanced model by adding a polynomial
number of linear constraints, known as valid inequalities; this new model is
still polynomial in the number of vertices in the graph. We carried out
computational testing of the Linear Relaxation of the new Integer Program. We
tested about 7000 instances of randomly generated (and connected) graphs with
up to 64 vertices (as well as all 64, 128, and 256-vertex instances at the
""challenge"" website OEIS.org). In each of these instances, the Linear
Relaxation returned an optimal solution with (i) every variable having an
integer value, and (ii) the optimal solution value of the Linear Relaxation was
the same as that of the original (basic) Integer Program. Our computational
experience has been that a binary search on the objective function value is a
powerful tool which yields a (weakly) polynomial algorithm.",-0.15583399,-0.11491615,0.02370229,A
8056,The questions in Remarks (2) and (3) are topics for further research.,"A program is needed to remove
such duplicate constraints before solving the Linear programs.","8.1 Software Webpage URL

The software programs are available at the following URL:
https://sites.google.com/view/all-optimisation-slides/
We welcome readers to send us their comments and suggestions.",2022-06-25 02:13:09+00:00,Maximum independent set (stable set) problem: A mathematical programming model with valid inequalities; Computational testing with binary search and alternate optimal basic solutions (extreme points),cs.DS,"['cs.DS', 'math.OC', '90C99, 68Q19, 68Q15, 68Q17, 03C13', 'F.2']",[arxiv.Result.Author('Prabhu Manyem')],"This paper deals with the maximum independent set (M.I.S.) problem, also
known as the stable set problem. The basic mathematical programming model that
captures this problem is an Integer Program (I.P.) with zero-one variables and
only the edge inequalities. We present an enhanced model by adding a polynomial
number of linear constraints, known as valid inequalities; this new model is
still polynomial in the number of vertices in the graph. We carried out
computational testing of the Linear Relaxation of the new Integer Program. We
tested about 7000 instances of randomly generated (and connected) graphs with
up to 64 vertices (as well as all 64, 128, and 256-vertex instances at the
""challenge"" website OEIS.org). In each of these instances, the Linear
Relaxation returned an optimal solution with (i) every variable having an
integer value, and (ii) the optimal solution value of the Linear Relaxation was
the same as that of the original (basic) Integer Program. Our computational
experience has been that a binary search on the objective function value is a
powerful tool which yields a (weakly) polynomial algorithm.",0.083180405,-0.17430516,0.21297184,C
