Unnamed: 0,further research line,further research prefix,further research suffix,publication date,title,primary category,categories,authors,abstract,x,y,z,cluster
11448,"[18] evaluated the
maturity of state-of-the-art CNNs to automatically classify 2D maternal fetal US and released a
large open-source dataset to promote further research on the matter.","More recently, Burgos-Artizzu et al.","While some AI tools are being
implemented to recognise multiple views in fetal imaging [19], others focus their work on speciﬁc
anatomical structures [20, 21, 22].",2022-09-20 10:56:09+00:00,Generalisability of deep learning models in low-resource imaging settings: A fetal ultrasound study in 5 African countries,eess.IV,"['eess.IV', 'cs.CV']","[arxiv.Result.Author('Carla Sendra-Balcells'), arxiv.Result.Author('Víctor M. Campello'), arxiv.Result.Author('Jordina Torrents-Barrena'), arxiv.Result.Author('Yahya Ali Ahmed'), arxiv.Result.Author('Mustafa Elattar'), arxiv.Result.Author('Benard Ohene Botwe'), arxiv.Result.Author('Pempho Nyangulu'), arxiv.Result.Author('William Stones'), arxiv.Result.Author('Mohammed Ammar'), arxiv.Result.Author('Lamya Nawal Benamer'), arxiv.Result.Author('Harriet Nalubega Kisembo'), arxiv.Result.Author('Senai Goitom Sereke'), arxiv.Result.Author('Sikolia Z. Wanyonyi'), arxiv.Result.Author('Marleen Temmerman'), arxiv.Result.Author('Kamil Mikolaj'), arxiv.Result.Author('Martin Grønnebæk Tolsgaard'), arxiv.Result.Author('Karim Lekadir')]","Most artificial intelligence (AI) research have concentrated in high-income
countries, where imaging data, IT infrastructures and clinical expertise are
plentiful. However, slower progress has been made in limited-resource
environments where medical imaging is needed. For example, in Sub-Saharan
Africa the rate of perinatal mortality is very high due to limited access to
antenatal screening. In these countries, AI models could be implemented to help
clinicians acquire fetal ultrasound planes for diagnosis of fetal
abnormalities. So far, deep learning models have been proposed to identify
standard fetal planes, but there is no evidence of their ability to generalise
in centres with limited access to high-end ultrasound equipment and data. This
work investigates different strategies to reduce the domain-shift effect for a
fetal plane classification model trained on a high-resource clinical centre and
transferred to a new low-resource centre. To that end, a classifier trained
with 1,792 patients from Spain is first evaluated on a new centre in Denmark in
optimal conditions with 1,008 patients and is later optimised to reach the same
performance in five African centres (Egypt, Algeria, Uganda, Ghana and Malawi)
with 25 patients each. The results show that a transfer learning approach can
be a solution to integrate small-size African samples with existing large-scale
databases in developed countries. In particular, the model can be re-aligned
and optimised to boost the performance on African populations by increasing the
recall to $0.92 \pm 0.04$ and at the same time maintaining a high precision
across centres. This framework shows promise for building new AI models
generalisable across clinical centres with limited data acquired in challenging
and heterogeneous conditions and calls for further research to develop new
solutions for usability of AI in countries with less resources.",-0.20055963,0.27745336,0.12485561,A
11449,"Moreover, it also en-
courages for further research to develop highly generalisable solutions for usability of AI in countries
with less resources and consequently in higher need of clinical support.","This framework shows promise for generalisability across
multi-centre African datasets with challenging and heterogeneous conditions.","One of the main limitations of the present study is that the datasets obtained in Africa are not
complete, since they are less abundant and more diﬃcult to compile.",2022-09-20 10:56:09+00:00,Generalisability of deep learning models in low-resource imaging settings: A fetal ultrasound study in 5 African countries,eess.IV,"['eess.IV', 'cs.CV']","[arxiv.Result.Author('Carla Sendra-Balcells'), arxiv.Result.Author('Víctor M. Campello'), arxiv.Result.Author('Jordina Torrents-Barrena'), arxiv.Result.Author('Yahya Ali Ahmed'), arxiv.Result.Author('Mustafa Elattar'), arxiv.Result.Author('Benard Ohene Botwe'), arxiv.Result.Author('Pempho Nyangulu'), arxiv.Result.Author('William Stones'), arxiv.Result.Author('Mohammed Ammar'), arxiv.Result.Author('Lamya Nawal Benamer'), arxiv.Result.Author('Harriet Nalubega Kisembo'), arxiv.Result.Author('Senai Goitom Sereke'), arxiv.Result.Author('Sikolia Z. Wanyonyi'), arxiv.Result.Author('Marleen Temmerman'), arxiv.Result.Author('Kamil Mikolaj'), arxiv.Result.Author('Martin Grønnebæk Tolsgaard'), arxiv.Result.Author('Karim Lekadir')]","Most artificial intelligence (AI) research have concentrated in high-income
countries, where imaging data, IT infrastructures and clinical expertise are
plentiful. However, slower progress has been made in limited-resource
environments where medical imaging is needed. For example, in Sub-Saharan
Africa the rate of perinatal mortality is very high due to limited access to
antenatal screening. In these countries, AI models could be implemented to help
clinicians acquire fetal ultrasound planes for diagnosis of fetal
abnormalities. So far, deep learning models have been proposed to identify
standard fetal planes, but there is no evidence of their ability to generalise
in centres with limited access to high-end ultrasound equipment and data. This
work investigates different strategies to reduce the domain-shift effect for a
fetal plane classification model trained on a high-resource clinical centre and
transferred to a new low-resource centre. To that end, a classifier trained
with 1,792 patients from Spain is first evaluated on a new centre in Denmark in
optimal conditions with 1,008 patients and is later optimised to reach the same
performance in five African centres (Egypt, Algeria, Uganda, Ghana and Malawi)
with 25 patients each. The results show that a transfer learning approach can
be a solution to integrate small-size African samples with existing large-scale
databases in developed countries. In particular, the model can be re-aligned
and optimised to boost the performance on African populations by increasing the
recall to $0.92 \pm 0.04$ and at the same time maintaining a high precision
across centres. This framework shows promise for building new AI models
generalisable across clinical centres with limited data acquired in challenging
and heterogeneous conditions and calls for further research to develop new
solutions for usability of AI in countries with less resources.",-0.27682847,-0.0002818997,-0.288391,C
11764,"Furthermore, the mathematical proofs of the reconstruc-
tion conditions of deep learning-based CS methods are a problem worthy of
further study.","For future work, we will apply the residual network to obtain the multi-scale
feature information of the image, adopt the weighted fusion method to fuse the
feature information of diﬀerent scales to further improve the quality of image
reconstruction, and move our experiment implementations to the latest deep
learning frameworks.","Acknowledgments

The research work of this paper were supported by the National Natural Sci-
ence Foundation of China (No.",2022-09-28 01:11:56+00:00,Image Compressed Sensing with Multi-scale Dilated Convolutional Neural Network,eess.IV,"['eess.IV', 'cs.CV', 'cs.MM']","[arxiv.Result.Author('Zhifeng Wang'), arxiv.Result.Author('Zhenghui Wang'), arxiv.Result.Author('Chunyan Zeng'), arxiv.Result.Author('Yan Yu'), arxiv.Result.Author('Xiangkui Wan')]","Deep Learning (DL) based Compressed Sensing (CS) has been applied for better
performance of image reconstruction than traditional CS methods. However, most
existing DL methods utilize the block-by-block measurement and each measurement
block is restored separately, which introduces harmful blocking effects for
reconstruction. Furthermore, the neuronal receptive fields of those methods are
designed to be the same size in each layer, which can only collect single-scale
spatial information and has a negative impact on the reconstruction process.
This paper proposes a novel framework named Multi-scale Dilated Convolution
Neural Network (MsDCNN) for CS measurement and reconstruction. During the
measurement period, we directly obtain all measurements from a trained
measurement network, which employs fully convolutional structures and is
jointly trained with the reconstruction network from the input image. It
needn't be cut into blocks, which effectively avoids the block effect. During
the reconstruction period, we propose the Multi-scale Feature Extraction (MFE)
architecture to imitate the human visual system to capture multi-scale features
from the same feature map, which enhances the image feature extraction ability
of the framework and improves the performance of image reconstruction. In the
MFE, there are multiple parallel convolution channels to obtain multi-scale
feature information. Then the multi-scale features information is fused and the
original image is reconstructed with high quality. Our experimental results
show that the proposed method performs favorably against the state-of-the-art
methods in terms of PSNR and SSIM.",0.14198354,0.38951796,0.08215931,A
11880,"The table shows           and need for further research targeting energy efﬁciency in
which parameters inﬂuence the energy consumption of the                  online video, which is essential for sustainable deployment of
considered end-user devices, the networks, and the server tasks          online video technology in the future.","These examples show the high potential
of such dependencies is provided in Table VII.",on the provider side.,2022-09-30 12:04:30+00:00,Sweet Streams are Made of This: The System Engineer's View on Energy Efficiency in Video Communications,eess.IV,['eess.IV'],"[arxiv.Result.Author('Christian Herglotz'), arxiv.Result.Author('Matthias Kränzler'), arxiv.Result.Author('Robert Schober'), arxiv.Result.Author('André Kaup')]","In recent years, the global use of online video services has increased
rapidly. Today, a manifold of applications, such as video streaming, video
conferencing, live broadcasting, and social networks, make use of this
technology. A recent study found that the development and the success of these
services had as a consequence that, nowadays, more than 1% of the global
greenhouse-gas emissions are related to online video, with growth rates close
to 10% per year. This article reviews the latest findings concerning energy
consumption of online video from the system engineer's perspective, where the
system engineer is the designer and operator of a typical online video service.
We discuss all relevant energy sinks, highlight dependencies with
quality-of-service variables as well as video properties, review energy
consumption models for different devices from the literature, and aggregate
these existing models into a global model for the overall energy consumption of
a generic online video service. Analyzing this model and its implications, we
find that end-user devices and video encoding have the largest potential for
energy savings. Finally, we provide an overview of recent advances in energy
efficiency improvement for video streaming and propose future research
directions for energy-efficient video streaming services.",0.4238546,-0.2165621,-0.22280465,B
11966,The other employed                                                   to be conﬁrmed by further study.,"However, this needs
MFNet performing the best in most cases.","DL-based method, DVF, received the highest overall DMOS
values, which may be due to the assumption of simple linear                                                       V. EVALUATION OF OBJECTIVE QUALITY METRICS
motion between adjacent frames in the DVF approach, i.e.",2022-10-03 11:15:05+00:00,BVI-VFI: A Video Quality Database for Video Frame Interpolation,eess.IV,"['eess.IV', 'cs.CV']","[arxiv.Result.Author('Duolikun Danier'), arxiv.Result.Author('Fan Zhang'), arxiv.Result.Author('David Bull')]","Video frame interpolation (VFI) is a fundamental research topic in video
processing, which is currently attracting increased attention across the
research community. While the development of more advanced VFI algorithms has
been extensively researched, there remains little understanding of how humans
perceive the quality of interpolated content and how well existing objective
quality assessment methods perform when measuring the perceived quality. In
order to narrow this research gap, we have developed a new video quality
database named BVI-VFI, which contains 540 distorted sequences generated by
applying five commonly used VFI algorithms to 36 diverse source videos with
various spatial resolutions and frame rates. We collected more than 10,800
quality ratings for these videos through a large scale subjective study
involving 189 human subjects. Based on the collected subjective scores, we
further analysed the influence of VFI algorithms and frame rates on the
perceptual quality of interpolated videos. Moreover, we benchmarked the
performance of 28 classic and state-of-the-art objective image/video quality
metrics on the new database, and demonstrated the urgent requirement for more
accurate bespoke quality assessment methods for VFI. To facilitate further
research in this area, we have made BVI-VFI publicly available at
https://github.com/danielism97/BVI-VFI-database.",0.3085646,-0.12822872,-0.056892682,B
11967,"The other employed DL-based method,                                                   to be conﬁrmed by further study.","However, this needs
the best in most cases.","DVF, received the highest overall DMOS values, which may
be due to the assumption of simple linear motion between                                                          V. EVALUATION OF OBJECTIVE QUALITY METRICS
adjacent frames in the DVF approach, i.e.",2022-10-03 11:15:05+00:00,BVI-VFI: A Video Quality Database for Video Frame Interpolation,eess.IV,"['eess.IV', 'cs.CV']","[arxiv.Result.Author('Duolikun Danier'), arxiv.Result.Author('Fan Zhang'), arxiv.Result.Author('David Bull')]","Video frame interpolation (VFI) is a fundamental research topic in video
processing, which is currently attracting increased attention across the
research community. While the development of more advanced VFI algorithms has
been extensively researched, there remains little understanding of how humans
perceive the quality of interpolated content and how well existing objective
quality assessment methods perform when measuring the perceived quality. In
order to narrow this research gap, we have developed a new video quality
database named BVI-VFI, which contains 540 distorted sequences generated by
applying five commonly used VFI algorithms to 36 diverse source videos with
various spatial resolutions and frame rates. We collected more than 10,800
quality ratings for these videos through a large scale subjective study
involving 189 human subjects. Based on the collected subjective scores, we
further analysed the influence of VFI algorithms and frame rates on the
perceptual quality of interpolated videos. Moreover, we benchmarked the
performance of 28 classic and state-of-the-art objective image/video quality
metrics on the new database, and demonstrated the urgent requirement for more
accurate bespoke quality assessment methods for VFI. To facilitate further
research in this area, we have made BVI-VFI publicly available at
https://github.com/danielism97/BVI-VFI-database.",0.2659769,-0.24356724,-0.0053813476,B
11994,"In the further research, we should explore a new method to generate pseudo labels from the
image itself according to the characteristics of spectral CT, so that the network can learn noise
distribution more effectively.","Third, we use the similarity between adjacent pixels to construct training pairs.","In conclusion, we reconstruct spectral CT by combining deep learning with iterative
reconstruction methods, and the reconstruction performance on narrow energy channels has
been verified.",2022-10-03 03:07:33+00:00,Spectral2Spectral: Image-spectral Similarity Assisted Spectral CT Deep Reconstruction without Reference,eess.IV,"['eess.IV', 'cs.CV', 'cs.LG']","[arxiv.Result.Author('onghui Li'), arxiv.Result.Author('Peng He'), arxiv.Result.Author('Peng Feng'), arxiv.Result.Author('Xiaodong Guo'), arxiv.Result.Author('Weiwen Wu'), arxiv.Result.Author('Hengyong Yu')]","The photon-counting detector (PCD) based spectral computed tomography
attracts much more attentions since it has the capability to provide more
accurate identification and quantitative analysis for biomedical materials. The
limited number of photons within narrow energy-bin leads to low signal-noise
ratio data. The existing supervised deep reconstruction networks for CT
reconstruction are difficult to address these challenges. In this paper, we
propose an iterative deep reconstruction network to synergize model and data
priors into a unified framework, named as Spectral2Spectral. Our
Spectral2Spectral employs an unsupervised deep training strategy to obtain
high-quality images from noisy data with an end-to-end fashion. The structural
similarity prior within image-spectral domain is refined as a regularization
term to further constrain the network training. The weights of neural network
are automatically updated to capture image features and structures with
iterative process. Three large-scale preclinical datasets experiments
demonstrate that the Spectral2spectral reconstruct better image quality than
other state-of-the-art methods.",0.15125392,0.34936556,0.21993807,A
12059,"RESULTS

We evaluated the models both quantitatively and qualitatively, to account for the diﬀerent aspects which could
be of interest considering the further study of the obtained segmentations.",3.,Table 1.,2022-10-05 17:35:56+00:00,A deep learning model for brain vessel segmentation in 3DRA with arteriovenous malformations,eess.IV,"['eess.IV', 'cs.CV', 'cs.LG']","[arxiv.Result.Author('Camila García'), arxiv.Result.Author('Yibin Fang'), arxiv.Result.Author('Jianmin Liu'), arxiv.Result.Author('Ana Paula Narata'), arxiv.Result.Author('José Ignacio Orlando'), arxiv.Result.Author('Ignacio Larrabide')]","Segmentation of brain arterio-venous malformations (bAVMs) in 3D rotational
angiographies (3DRA) is still an open problem in the literature, with high
relevance for clinical practice. While deep learning models have been applied
for segmenting the brain vasculature in these images, they have never been used
in cases with bAVMs. This is likely caused by the difficulty to obtain
sufficiently annotated data to train these approaches. In this paper we
introduce a first deep learning model for blood vessel segmentation in 3DRA
images of patients with bAVMs. To this end, we densely annotated 5 3DRA volumes
of bAVM cases and used these to train two alternative 3DUNet-based
architectures with different segmentation objectives. Our results show that the
networks reach a comprehensive coverage of relevant structures for bAVM
analysis, much better than what is obtained using standard methods. This is
promising for achieving a better topological and morphological characterisation
of the bAVM structures of interest. Furthermore, the models have the ability to
segment venous structures even when missing in the ground truth labelling,
which is relevant for planning interventional treatments. Ultimately, these
results could be used as more reliable first initial guesses, alleviating the
cumbersome task of creating manual labels.",0.01832421,-0.21583506,-0.12796292,C
12233,"We used two clinical variables, AHT diagnosis and Functional
Status Scale (FSS) score, to arrive at the conclusion that CE is highly correlated with overall outcome and
that further study is needed to determine whether CE is a biomarker of AHT.","In addition, we perform
analysis of our system’s output to determine the association of CE with Abusive Head Trauma (AHT) – a
type of traumatic brain injury (TBI) associated with abuse – and overall functional outcome and in-hospital
mortality of infants and young children.","With that, this paper introduces
a simple yet powerful deep learning-based solution for automated CE classification.",2022-10-06 14:21:44+00:00,Deep Learning Mixture-of-Experts Approach for Cytotoxic Edema Assessment in Infants and Children,eess.IV,"['eess.IV', 'cs.CV', 'cs.LG']","[arxiv.Result.Author('Henok Ghebrechristos'), arxiv.Result.Author('Stence Nicholas'), arxiv.Result.Author('David Mirsky'), arxiv.Result.Author('Gita Alaghband'), arxiv.Result.Author('Manh Huynh'), arxiv.Result.Author('Zackary Kromer'), arxiv.Result.Author('Ligia Batista'), arxiv.Result.Author('Brent ONeill'), arxiv.Result.Author('Steven Moulton'), arxiv.Result.Author('Daniel M. Lindberg')]","This paper presents a deep learning framework for image classification aimed
at increasing predictive performance for Cytotoxic Edema (CE) diagnosis in
infants and children. The proposed framework includes two 3D network
architectures optimized to learn from two types of clinical MRI data , a trace
Diffusion Weighted Image (DWI) and the calculated Apparent Diffusion
Coefficient map (ADC). This work proposes a robust and novel solution based on
volumetric analysis of 3D images (using pixels from time slices) and 3D
convolutional neural network (CNN) models. While simple in architecture, the
proposed framework shows significant quantitative results on the domain
problem. We use a dataset curated from a Childrens Hospital Colorado (CHCO)
patient registry to report a predictive performance F1 score of 0.91 at
distinguishing CE patients from children with severe neurologic injury without
CE. In addition, we perform analysis of our systems output to determine the
association of CE with Abusive Head Trauma (AHT) , a type of traumatic brain
injury (TBI) associated with abuse , and overall functional outcome and in
hospital mortality of infants and young children. We used two clinical
variables, AHT diagnosis and Functional Status Scale (FSS) score, to arrive at
the conclusion that CE is highly correlated with overall outcome and that
further study is needed to determine whether CE is a biomarker of AHT. With
that, this paper introduces a simple yet powerful deep learning based solution
for automated CE classification. This solution also enables an indepth analysis
of progression of CE and its correlation to AHT and overall neurologic outcome,
which in turn has the potential to empower experts to diagnose and mitigate AHT
during early stages of a childs life.",-0.23638651,0.05716627,-0.22466214,A
12234,We believe our work paves the way to further study the stated hypothesis in detail.,"Further study and incorporation of more clinical data and variables is necessary to conclude whether CE is
a biomarker of AHT.","6 FUNDING

This work was supported by the Colorado TBI Trust Fund (MINDSOURCE).",2022-10-06 14:21:44+00:00,Deep Learning Mixture-of-Experts Approach for Cytotoxic Edema Assessment in Infants and Children,eess.IV,"['eess.IV', 'cs.CV', 'cs.LG']","[arxiv.Result.Author('Henok Ghebrechristos'), arxiv.Result.Author('Stence Nicholas'), arxiv.Result.Author('David Mirsky'), arxiv.Result.Author('Gita Alaghband'), arxiv.Result.Author('Manh Huynh'), arxiv.Result.Author('Zackary Kromer'), arxiv.Result.Author('Ligia Batista'), arxiv.Result.Author('Brent ONeill'), arxiv.Result.Author('Steven Moulton'), arxiv.Result.Author('Daniel M. Lindberg')]","This paper presents a deep learning framework for image classification aimed
at increasing predictive performance for Cytotoxic Edema (CE) diagnosis in
infants and children. The proposed framework includes two 3D network
architectures optimized to learn from two types of clinical MRI data , a trace
Diffusion Weighted Image (DWI) and the calculated Apparent Diffusion
Coefficient map (ADC). This work proposes a robust and novel solution based on
volumetric analysis of 3D images (using pixels from time slices) and 3D
convolutional neural network (CNN) models. While simple in architecture, the
proposed framework shows significant quantitative results on the domain
problem. We use a dataset curated from a Childrens Hospital Colorado (CHCO)
patient registry to report a predictive performance F1 score of 0.91 at
distinguishing CE patients from children with severe neurologic injury without
CE. In addition, we perform analysis of our systems output to determine the
association of CE with Abusive Head Trauma (AHT) , a type of traumatic brain
injury (TBI) associated with abuse , and overall functional outcome and in
hospital mortality of infants and young children. We used two clinical
variables, AHT diagnosis and Functional Status Scale (FSS) score, to arrive at
the conclusion that CE is highly correlated with overall outcome and that
further study is needed to determine whether CE is a biomarker of AHT. With
that, this paper introduces a simple yet powerful deep learning based solution
for automated CE classification. This solution also enables an indepth analysis
of progression of CE and its correlation to AHT and overall neurologic outcome,
which in turn has the potential to empower experts to diagnose and mitigate AHT
during early stages of a childs life.",-0.29221526,-0.40732992,-0.14145444,C
