Unnamed: 0,further research line,further research prefix,further research suffix,publication date,title,primary category,categories,authors,abstract,x,y,z,cluster
2672,"Therefore, we proceed with this intermediate model as an
optimum model for further study.","The result for
depth and breadth optimization indicates that the average accuracy of the intermediate model is >0.85 (including all the
classes), whereas it is <0.85 for shallow and deep networks.","Considering the intermediate model has the optimum breadth and depth, the further
optimization of the parameters and the results are as shown in Figure 5a.",2022-03-02 07:09:29+00:00,Machine learning based lens-free imaging technique for field-portable cytometry,eess.IV,"['eess.IV', 'cs.AI']","[arxiv.Result.Author('Rajkumar Vaghashiya'), arxiv.Result.Author('Sanghoon Shin'), arxiv.Result.Author('Varun Chauhan'), arxiv.Result.Author('Kaushal Kapadiya'), arxiv.Result.Author('Smit Sanghavi'), arxiv.Result.Author('Sungkyu Seo2'), arxiv.Result.Author('Mohendra Roy')]","Lens-free Shadow Imaging Technique (LSIT) is a well-established technique for
the characterization of microparticles and biological cells. Due to its
simplicity and cost-effectiveness, various low-cost solutions have been
evolved, such as automatic analysis of complete blood count (CBC), cell
viability, 2D cell morphology, 3D cell tomography, etc. The developed auto
characterization algorithm so far for this custom-developed LSIT cytometer was
based on the hand-crafted features of the cell diffraction patterns from the
LSIT cytometer, that were determined from our empirical findings on thousands
of samples of individual cell types, which limit the system in terms of
induction of a new cell type for auto classification or characterization.
Further, its performance is suffering from poor image (cell diffraction
pattern) signatures due to its small signal or background noise. In this work,
we address these issues by leveraging the artificial intelligence-powered auto
signal enhancing scheme such as denoising autoencoder and adaptive cell
characterization technique based on the transfer of learning in deep neural
networks. The performance of our proposed method shows an increase in accuracy
>98% along with the signal enhancement of >5 dB for most of the cell types,
such as Red Blood Cell (RBC) and White Blood Cell (WBC). Furthermore, the model
is adaptive to learn new type of samples within a few learning iterations and
able to successfully classify the newly introduced sample along with the
existing other sample types.",0.1246503,0.32721362,-0.16116142,A
2673,"Therefore, we proceed with this intermediate model as an
optimum model for further study.","The result for
depth and breadth optimization indicates that the average accuracy of the intermediate model is >0.85 (including all the
classes), whereas it is <0.85 for shallow and deep networks.","Considering the intermediate model has the optimum breadth and depth, the further
optimization of the parameters and the results are as shown in Figure 5a.",2022-03-02 07:09:29+00:00,Machine learning based lens-free imaging technique for field-portable cytometry,eess.IV,"['eess.IV', 'cs.AI']","[arxiv.Result.Author('Rajkumar Vaghashiya'), arxiv.Result.Author('Sanghoon Shin'), arxiv.Result.Author('Varun Chauhan'), arxiv.Result.Author('Kaushal Kapadiya'), arxiv.Result.Author('Smit Sanghavi'), arxiv.Result.Author('Sungkyu Seo'), arxiv.Result.Author('Mohendra Roy')]","Lens-free Shadow Imaging Technique (LSIT) is a well-established technique for
the characterization of microparticles and biological cells. Due to its
simplicity and cost-effectiveness, various low-cost solutions have been
evolved, such as automatic analysis of complete blood count (CBC), cell
viability, 2D cell morphology, 3D cell tomography, etc. The developed auto
characterization algorithm so far for this custom-developed LSIT cytometer was
based on the hand-crafted features of the cell diffraction patterns from the
LSIT cytometer, that were determined from our empirical findings on thousands
of samples of individual cell types, which limit the system in terms of
induction of a new cell type for auto classification or characterization.
Further, its performance is suffering from poor image (cell diffraction
pattern) signatures due to its small signal or background noise. In this work,
we address these issues by leveraging the artificial intelligence-powered auto
signal enhancing scheme such as denoising autoencoder and adaptive cell
characterization technique based on the transfer of learning in deep neural
networks. The performance of our proposed method shows an increase in accuracy
>98% along with the signal enhancement of >5 dB for most of the cell types,
such as Red Blood Cell (RBC) and White Blood Cell (WBC). Furthermore, the model
is adaptive to learn new type of samples within a few learning iterations and
able to successfully classify the newly introduced sample along with the
existing other sample types.",0.1246503,0.32721362,-0.16116142,A
2689,"Ex-
we believe that it is more valuable to direct further research          amples are joint modeling of myocardium, LV and RV, 3D car-
towards a 3D version of our approach.","Therefore,             concept can as well be applied to other segmentation tasks.","Since the parameter re-           diac segmentation or application of the method on other clinical
gression showed to be more sensitive to the number of samples,          data, e.g.",2022-03-02 13:20:30+00:00,Shape constrained CNN for segmentation guided prediction of myocardial shape and pose parameters in cardiac MRI,eess.IV,"['eess.IV', 'cs.CV']","[arxiv.Result.Author('Sofie Tilborghs'), arxiv.Result.Author('Jan Bogaert'), arxiv.Result.Author('Frederik Maes')]","Semantic segmentation using convolutional neural networks (CNNs) is the
state-of-the-art for many medical image segmentation tasks including myocardial
segmentation in cardiac MR images. However, the predicted segmentation maps
obtained from such standard CNN do not allow direct quantification of regional
shape properties such as regional wall thickness. Furthermore, the CNNs lack
explicit shape constraints, occasionally resulting in unrealistic
segmentations. In this paper, we use a CNN to predict shape parameters of an
underlying statistical shape model of the myocardium learned from a training
set of images. Additionally, the cardiac pose is predicted, which allows to
reconstruct the myocardial contours. The integrated shape model regularizes the
predicted contours and guarantees realistic shapes. We enforce robustness of
shape and pose prediction by simultaneously performing pixel-wise semantic
segmentation during training and define two loss functions to impose
consistency between the two predicted representations: one distance-based loss
and one overlap-based loss. We evaluated the proposed method in a 5-fold cross
validation on an in-house clinical dataset with 75 subjects and on the ACDC and
LVQuan19 public datasets. We show the benefits of simultaneous semantic
segmentation and the two newly defined loss functions for the prediction of
shape parameters. Our method achieved a correlation of 99% for left ventricular
(LV) area on the three datasets, between 91% and 97% for myocardial area,
98-99% for LV dimensions and between 80% and 92% for regional wall thickness.",-0.21449265,-0.09476642,0.095564365,C
2690,"The proposed method of DERDO creates a vast amount                           Picture Coding Symposium (PCS), Nu¨rnberg, Germany, Dec 2016.
of possible further research topics: Research can focus on
improving the decoding energy model or the training process               [13] E. Kalali, Y. Adibelli, and I. Hamzaoglu, “A high performance and low
of the speciﬁc energies.","[12] C. Herglotz, Y. Wen, B. Dai, M. Kra¨nzler, and A. Kaup, “A bitstream
                                                                                feature based model for video decoding energy estimation,” in Proc.","Furthermore, in the DERDO process,                     energy intra prediction hardware for HEVC video decoding,” in Con-
the transmission energy can be considered explicitly and new                    ference on Design and Architectures for Signal and Image Processing
encoder speed-up methods targeting the decoder energy con-                      (DASIP), Oct 2012, pp.",2022-03-02 13:36:41+00:00,Decoding-Energy-Rate-Distortion Optimization for Video Coding,eess.IV,['eess.IV'],"[arxiv.Result.Author('Christian Herglotz'), arxiv.Result.Author('Andreas Heindel'), arxiv.Result.Author('André Kaup')]","This paper presents a method for generating coded video bit streams requiring
less decoding energy than conventionally coded bit streams. To this end, we
propose extending the standard rate-distortion optimization approach to also
consider the decoding energy. In the encoder, the decoding energy is estimated
during runtime using a feature-based energy model. These energy estimates are
then used to calculate decoding-energy-rate-distortion costs that are minimized
by the encoder. This ultimately leads to optimal trade-offs between these three
parameters. Therefore, we introduce the mathematical theory for describing
decoding-energy-rate-distortion optimization and the proposed encoder algorithm
is explained in detail. For rate-energy control, a new encoder parameter is
introduced. Finally, measurements of the software decoding process for
HEVC-coded bit streams are performed. Results show that this approach can lead
to up to 30% of decoding energy reduction at a constant visual objective
quality when accepting a bitrate increase at the same order of magnitude.",0.5396545,0.007782541,-0.07706617,B
2714,will further study this issue in our future work.,8).,"The pro-
                                                                    posed method can be embedded in imaging devices such as
5.3.",2022-03-02 13:30:56+00:00,Self-Supervised Learning for Real-World Super-Resolution from Dual Zoomed Observations,eess.IV,"['eess.IV', 'cs.CV']","[arxiv.Result.Author('Zhilu Zhang'), arxiv.Result.Author('Ruohao Wang'), arxiv.Result.Author('Hongzhi Zhang'), arxiv.Result.Author('Yunjin Chen'), arxiv.Result.Author('Wangmeng Zuo')]","In this paper, we consider two challenging issues in reference-based
super-resolution (RefSR), (i) how to choose a proper reference image, and (ii)
how to learn real-world RefSR in a self-supervised manner. Particularly, we
present a novel self-supervised learning approach for real-world image SR from
observations at dual camera zooms (SelfDZSR). For the first issue, the more
zoomed (telephoto) image can be naturally leveraged as the reference to guide
the SR of the lesser zoomed (short-focus) image. For the second issue, SelfDZSR
learns a deep network to obtain the SR result of short-focal image and with the
same resolution as the telephoto image. For this purpose, we take the telephoto
image instead of an additional high-resolution image as the supervision
information and select a patch from it as the reference to super-resolve the
corresponding short-focus image patch. To mitigate the effect of various
misalignment between the short-focus low-resolution (LR) image and telephoto
ground-truth (GT) image, we design a degradation model and map the GT to a
pseudo-LR image aligned with GT. Then the pseudo-LR and LR image can be fed
into the proposed adaptive spatial transformer networks (AdaSTN) to deform the
LR features. During testing, SelfDZSR can be directly deployed to super-solve
the whole short-focus image with the reference of telephoto image. Experiments
show that our method achieves better quantitative and qualitative performance
against state-of-the-arts. The code and pre-trained models will be publicly
available.",0.20530623,-0.15571508,0.34469074,B
2977,"As a result, as shown      facts that commonly exist in both SoTA and ours methods
in Table 3, such a model can still achieve comparable per-      and require further study.","Hence we train a model without amplifying the input       signals in each color channel, leading to those color arti-
raw images with the predeﬁned ratio.","formance, with only a slight decrease in PSNR and SSIM.",2022-03-08 12:22:31+00:00,Learning to Erase the Bayer-Filter to See in the Dark,eess.IV,"['eess.IV', 'cs.CV']","[arxiv.Result.Author('Xingbo Dong'), arxiv.Result.Author('Wanyan Xu'), arxiv.Result.Author('Zhihui Miao'), arxiv.Result.Author('Lan Ma'), arxiv.Result.Author('Chao Zhang'), arxiv.Result.Author('Jiewen Yang'), arxiv.Result.Author('Zhe Jin'), arxiv.Result.Author('Andrew Beng Jin Teoh'), arxiv.Result.Author('Jiajun Shen')]","Low-light image enhancement - a pervasive but challenging problem, plays a
central role in enhancing the visibility of an image captured in a poor
illumination environment. Due to the fact that not all photons can pass the
Bayer-Filter on the sensor of the color camera, in this work, we first present
a De-Bayer-Filter simulator based on deep neural networks to generate a
monochrome raw image from the colored raw image. Next, a fully convolutional
network is proposed to achieve the low-light image enhancement by fusing
colored raw data with synthesized monochrome raw data. Channel-wise attention
is also introduced to the fusion process to establish a complementary
interaction between features from colored and monochrome raw images. To train
the convolutional networks, we propose a dataset with monochrome and color raw
pairs named Mono-Colored Raw paired dataset (MCR) collected by using a
monochrome camera without Bayer-Filter and a color camera with Bayer-Filter.
The proposed pipeline take advantages of the fusion of the virtual monochrome
and the color raw images and our extensive experiments indicate that
significant improvement can be achieved by leveraging raw sensor data and
data-driven learning.",0.28378403,-0.030324904,-0.11663586,B
2978,"signals in each color channel, leading to those color arti-
                                                              facts that commonly exist in both SoTA and ours methods
Baseline                      DBF  SSIM            DBLE       and require further study.",Ablation study on the MCR dataset.,"Baseline wo CA [8]   PSNR (dB)     0.8254  PSNR (dB) SSIM
Baseline wo ratio                  0.7948                     6.",2022-03-08 12:22:31+00:00,Abandoning the Bayer-Filter to See in the Dark,eess.IV,"['eess.IV', 'cs.CV']","[arxiv.Result.Author('Xingbo Dong'), arxiv.Result.Author('Wanyan Xu'), arxiv.Result.Author('Zhihui Miao'), arxiv.Result.Author('Lan Ma'), arxiv.Result.Author('Chao Zhang'), arxiv.Result.Author('Jiewen Yang'), arxiv.Result.Author('Zhe Jin'), arxiv.Result.Author('Andrew Beng Jin Teoh'), arxiv.Result.Author('Jiajun Shen')]","Low-light image enhancement - a pervasive but challenging problem, plays a
central role in enhancing the visibility of an image captured in a poor
illumination environment. Due to the fact that not all photons can pass the
Bayer-Filter on the sensor of the color camera, in this work, we first present
a De-Bayer-Filter simulator based on deep neural networks to generate a
monochrome raw image from the colored raw image. Next, a fully convolutional
network is proposed to achieve the low-light image enhancement by fusing
colored raw data with synthesized monochrome raw data. Channel-wise attention
is also introduced to the fusion process to establish a complementary
interaction between features from colored and monochrome raw images. To train
the convolutional networks, we propose a dataset with monochrome and color raw
pairs named Mono-Colored Raw paired dataset (MCR) collected by using a
monochrome camera without Bayer-Filter and a color camera with Bayer-Filter.
The proposed pipeline take advantages of the fusion of the virtual monochrome
and the color raw images and our extensive experiments indicate that
significant improvement can be achieved by leveraging raw sensor data and
data-driven learning.",0.0842192,-0.3789839,-0.13136858,B
2996,"Recently researchers are focusing on the gene sequence data as it is a wide area and there is always room for further research
and results.","So, this gives future
researchers an opportunity to use Attention to improve the accuracy of deep learning models.","There are several opportunities for future researchers to contribute by merging multiple gene sequencing datasets to predict
additional outcomes with larger dataset.",2022-03-08 13:51:17+00:00,Breast cancer detection using artificial intelligence techniques: A systematic literature review,eess.IV,"['eess.IV', 'cs.AI', 'cs.CV', 'cs.LG', 'q-bio.QM']","[arxiv.Result.Author('Ali Bou Nassif'), arxiv.Result.Author('Manar Abu Talib'), arxiv.Result.Author('Qassim Nasir'), arxiv.Result.Author('Yaman Afadar'), arxiv.Result.Author('Omar Elgendy')]","Cancer is one of the most dangerous diseases to humans, and yet no permanent
cure has been developed for it. Breast cancer is one of the most common cancer
types. According to the National Breast Cancer foundation, in 2020 alone, more
than 276,000 new cases of invasive breast cancer and more than 48,000
non-invasive cases were diagnosed in the US. To put these figures in
perspective, 64% of these cases are diagnosed early in the disease's cycle,
giving patients a 99% chance of survival. Artificial intelligence and machine
learning have been used effectively in detection and treatment of several
dangerous diseases, helping in early diagnosis and treatment, and thus
increasing the patient's chance of survival. Deep learning has been designed to
analyze the most important features affecting detection and treatment of
serious diseases. For example, breast cancer can be detected using genes or
histopathological imaging. Analysis at the genetic level is very expensive, so
histopathological imaging is the most common approach used to detect breast
cancer. In this research work, we systematically reviewed previous work done on
detection and treatment of breast cancer using genetic sequencing or
histopathological imaging with the help of deep learning and machine learning.
We also provide recommendations to researchers who will work in this field",-0.12387315,0.3683139,-0.3232785,A
3042,"The related codes will
   be released for further research.",comprehensive comparisons.,Degradation pool.,2022-03-09 11:30:38+00:00,Learning the Degradation Distribution for Blind Image Super-Resolution,eess.IV,"['eess.IV', 'cs.CV']","[arxiv.Result.Author('Zhengxiong Luo'), arxiv.Result.Author('Yan Huang'), arxiv.Result.Author('Shang Li'), arxiv.Result.Author('Liang Wang'), arxiv.Result.Author('Tieniu Tan')]","Synthetic high-resolution (HR) \& low-resolution (LR) pairs are widely used
in existing super-resolution (SR) methods. To avoid the domain gap between
synthetic and test images, most previous methods try to adaptively learn the
synthesizing (degrading) process via a deterministic model. However, some
degradations in real scenarios are stochastic and cannot be determined by the
content of the image. These deterministic models may fail to model the random
factors and content-independent parts of degradations, which will limit the
performance of the following SR models. In this paper, we propose a
probabilistic degradation model (PDM), which studies the degradation
$\mathbf{D}$ as a random variable, and learns its distribution by modeling the
mapping from a priori random variable $\mathbf{z}$ to $\mathbf{D}$. Compared
with previous deterministic degradation models, PDM could model more diverse
degradations and generate HR-LR pairs that may better cover the various
degradations of test images, and thus prevent the SR model from over-fitting to
specific ones. Extensive experiments have demonstrated that our degradation
model can help the SR model achieve better performance on different datasets.
The source codes are released at \url{git@github.com:greatlog/UnpairedSR.git}.",0.25869745,-0.27799836,-0.296745,B
3139,"Other directions of further research include
more principled ways to integrate spatial smoothness priors, and experimenting with diﬀerent com-
partment models to explain the data.","Future work will consider integrating this approach with cerebral blood ﬂow estimation from
arterial spin labelling data [Alsop et al., 2015], which will permit straightforward inference of the
cerebral metabolic rate of Oxygen [An et al., 2001].","Acknowledgments: We acknowledge funding from the University of Brighton Rising Stars
initiative and support from Brighton and Sussex Medical School.",2022-03-11 10:47:16+00:00,Flexible Amortized Variational Inference in qBOLD MRI,eess.IV,"['eess.IV', 'cs.CV', 'cs.LG', 'stat.ML']","[arxiv.Result.Author('Ivor J. A. Simpson'), arxiv.Result.Author('Ashley McManamon'), arxiv.Result.Author('Alan J. Stone'), arxiv.Result.Author('Nicholas P. Blockley'), arxiv.Result.Author('Alessandro Colasanti'), arxiv.Result.Author('Mara Cercignani')]","Streamlined qBOLD acquisitions enable experimentally straightforward
observations of brain oxygen metabolism. $R_2^\prime$ maps are easily inferred;
however, the Oxygen extraction fraction (OEF) and deoxygenated blood volume
(DBV) are more ambiguously determined from the data. As such, existing
inference methods tend to yield very noisy and underestimated OEF maps, while
overestimating DBV.
  This work describes a novel probabilistic machine learning approach that can
infer plausible distributions of OEF and DBV. Initially, we create a model that
produces informative voxelwise prior distribution based on synthetic training
data. Contrary to prior work, we model the joint distribution of OEF and DBV
through a scaled multivariate logit-Normal distribution, which enables the
values to be constrained within a plausible range. The prior distribution model
is used to train an efficient amortized variational Bayesian inference model.
This model learns to infer OEF and DBV by predicting real image data, with few
training data required, using the signal equations as a forward model.
  We demonstrate that our approach enables the inference of smooth OEF and DBV
maps, with a physiologically plausible distribution that can be adapted through
specification of an informative prior distribution. Other benefits include
model comparison (via the evidence lower bound) and uncertainty quantification
for identifying image artefacts. Results are demonstrated on a small study
comparing subjects undergoing hyperventilation and at rest. We illustrate that
the proposed approach allows measurement of gray matter differences in OEF and
DBV and enables voxelwise comparison between conditions, where we observe
significant increases in OEF and $R_2^\prime$ during hyperventilation.",-0.11538671,-0.22411521,0.0970376,C
3140,"Other directions of further research include
more principled ways to integrate spatial smoothness priors, and experimenting with diﬀerent com-
partment models to explain the data.","Future work will consider integrating this approach with cerebral blood ﬂow estimation from
arterial spin labelling data [Alsop et al., 2015], which will permit straightforward inference of the
cerebral metabolic rate of Oxygen [An et al., 2001].","Acknowledgments: We acknowledge funding from the University of Brighton Rising Stars
initiative and support from Brighton and Sussex Medical School.",2022-03-11 10:47:16+00:00,Flexible Amortized Variational Inference in qBOLD MRI,eess.IV,"['eess.IV', 'cs.CV', 'cs.LG', 'stat.ML']","[arxiv.Result.Author('Ivor J. A. Simpson'), arxiv.Result.Author('Ashley McManamon'), arxiv.Result.Author('Balázs Örzsik'), arxiv.Result.Author('Alan J. Stone'), arxiv.Result.Author('Nicholas P. Blockley'), arxiv.Result.Author('Iris Asllani'), arxiv.Result.Author('Alessandro Colasanti'), arxiv.Result.Author('Mara Cercignani')]","Streamlined qBOLD acquisitions enable experimentally straightforward
observations of brain oxygen metabolism. $R_2^\prime$ maps are easily inferred;
however, the Oxygen extraction fraction (OEF) and deoxygenated blood volume
(DBV) are more ambiguously determined from the data. As such, existing
inference methods tend to yield very noisy and underestimated OEF maps, while
overestimating DBV.
  This work describes a novel probabilistic machine learning approach that can
infer plausible distributions of OEF and DBV. Initially, we create a model that
produces informative voxelwise prior distribution based on synthetic training
data. Contrary to prior work, we model the joint distribution of OEF and DBV
through a scaled multivariate logit-Normal distribution, which enables the
values to be constrained within a plausible range. The prior distribution model
is used to train an efficient amortized variational Bayesian inference model.
This model learns to infer OEF and DBV by predicting real image data, with few
training data required, using the signal equations as a forward model.
  We demonstrate that our approach enables the inference of smooth OEF and DBV
maps, with a physiologically plausible distribution that can be adapted through
specification of an informative prior distribution. Other benefits include
model comparison (via the evidence lower bound) and uncertainty quantification
for identifying image artefacts. Results are demonstrated on a small study
comparing subjects undergoing hyperventilation and at rest. We illustrate that
the proposed approach allows measurement of gray matter differences in OEF and
DBV and enables voxelwise comparison between conditions, where we observe
significant increases in OEF and $R_2^\prime$ during hyperventilation.",-0.11538671,-0.22411521,0.0970376,C
