Unnamed: 0,further research line,further research prefix,further research suffix,publication date,title,primary category,categories,authors,abstract,x,y,z,cluster
6440,"The presented method shows great potential
                                                to facilitate further research in the domain of artiﬁcial medical image generation.","Obtained results demonstrate the suitability of the
                                                proposed adversarial approach for the accurate generation of high-quality CT images.","Index Terms

                                                     conditional generative adversarial networks, CT, deep learning, generative adversarial networks, medical image generation,
                                                unsupervised deep learning

                                                                                                            I.",2022-05-19 20:29:25+00:00,Generation of Artificial CT Images using Patch-based Conditional Generative Adversarial Networks,eess.IV,"['eess.IV', 'cs.CV']","[arxiv.Result.Author('Marija Habijan'), arxiv.Result.Author('Irena Galic')]","Deep learning has a great potential to alleviate diagnosis and prognosis for
various clinical procedures. However, the lack of a sufficient number of
medical images is the most common obstacle in conducting image-based analysis
using deep learning. Due to the annotations scarcity, semi-supervised
techniques in the automatic medical analysis are getting high attention.
Artificial data augmentation and generation techniques such as generative
adversarial networks (GANs) may help overcome this obstacle. In this work, we
present an image generation approach that uses generative adversarial networks
with a conditional discriminator where segmentation masks are used as
conditions for image generation. We validate the feasibility of GAN-enhanced
medical image generation on whole heart computed tomography (CT) images and its
seven substructures, namely: left ventricle, right ventricle, left atrium,
right atrium, myocardium, pulmonary arteries, and aorta. Obtained results
demonstrate the suitability of the proposed adversarial approach for the
accurate generation of high-quality CT images. The presented method shows great
potential to facilitate further research in the domain of artificial medical
image generation.",-0.12834619,0.3942645,0.22448987,A
6441,"The two main limitations of this work, low generability since we only used one dataset and modality and lack of appropriate
quantitative evaluation, are good starting points for further research.","Obtained results demonstrate the suitability of
the proposed adversarial approach for the accurate generation of high-quality CT images.","Therefore, future work on this topic includes the use
of a number of datasets of different organs of the human body as well as the use of different imaging modalities to prove
the generality of the proposed approach.",2022-05-19 20:29:25+00:00,Generation of Artificial CT Images using Patch-based Conditional Generative Adversarial Networks,eess.IV,"['eess.IV', 'cs.CV']","[arxiv.Result.Author('Marija Habijan'), arxiv.Result.Author('Irena Galic')]","Deep learning has a great potential to alleviate diagnosis and prognosis for
various clinical procedures. However, the lack of a sufficient number of
medical images is the most common obstacle in conducting image-based analysis
using deep learning. Due to the annotations scarcity, semi-supervised
techniques in the automatic medical analysis are getting high attention.
Artificial data augmentation and generation techniques such as generative
adversarial networks (GANs) may help overcome this obstacle. In this work, we
present an image generation approach that uses generative adversarial networks
with a conditional discriminator where segmentation masks are used as
conditions for image generation. We validate the feasibility of GAN-enhanced
medical image generation on whole heart computed tomography (CT) images and its
seven substructures, namely: left ventricle, right ventricle, left atrium,
right atrium, myocardium, pulmonary arteries, and aorta. Obtained results
demonstrate the suitability of the proposed adversarial approach for the
accurate generation of high-quality CT images. The presented method shows great
potential to facilitate further research in the domain of artificial medical
image generation.",-0.10369578,0.40300965,0.2557417,A
6442,"Moreover, the proposed approach could alleviate further research by incorporating cross-modality images, such as mapping
from CT to PET data.","Some other cases, such as tumors, may
be more challenging to analyze even by an expert, and artiﬁcially created images may be too unsafe for algorithms training.","This may reduce the risk factor, and the cost of medical image acquisition which will provide better
diagnostic decision-making.",2022-05-19 20:29:25+00:00,Generation of Artificial CT Images using Patch-based Conditional Generative Adversarial Networks,eess.IV,"['eess.IV', 'cs.CV']","[arxiv.Result.Author('Marija Habijan'), arxiv.Result.Author('Irena Galic')]","Deep learning has a great potential to alleviate diagnosis and prognosis for
various clinical procedures. However, the lack of a sufficient number of
medical images is the most common obstacle in conducting image-based analysis
using deep learning. Due to the annotations scarcity, semi-supervised
techniques in the automatic medical analysis are getting high attention.
Artificial data augmentation and generation techniques such as generative
adversarial networks (GANs) may help overcome this obstacle. In this work, we
present an image generation approach that uses generative adversarial networks
with a conditional discriminator where segmentation masks are used as
conditions for image generation. We validate the feasibility of GAN-enhanced
medical image generation on whole heart computed tomography (CT) images and its
seven substructures, namely: left ventricle, right ventricle, left atrium,
right atrium, myocardium, pulmonary arteries, and aorta. Obtained results
demonstrate the suitability of the proposed adversarial approach for the
accurate generation of high-quality CT images. The presented method shows great
potential to facilitate further research in the domain of artificial medical
image generation.",-0.24877816,0.1424665,0.25279474,A
6547,Both issues represent interesting ﬁelds for further research.,"For this to be the case, new architectural designs need to be explored.",Acknowledgments.,2022-05-22 17:52:02+00:00,Improving AMD diagnosis by the simultaneous identification of associated retinal lesions,eess.IV,"['eess.IV', 'cs.CV']","[arxiv.Result.Author('José Morano'), arxiv.Result.Author('Álvaro S. Hervella'), arxiv.Result.Author('José Rouco'), arxiv.Result.Author('Jorge Novo'), arxiv.Result.Author('José I. Fernández-Vigo'), arxiv.Result.Author('Marcos Ortega')]","Age-related Macular Degeneration (AMD) is the predominant cause of blindness
in developed countries, specially in elderly people. Moreover, its prevalence
is increasing due to the global population ageing. In this scenario, early
detection is crucial to avert later vision impairment. Nonetheless,
implementing large-scale screening programmes is usually not viable, since the
population at-risk is large and the analysis must be performed by expert
clinicians. Also, the diagnosis of AMD is considered to be particularly
difficult, as it is characterized by many different lesions that, in many
cases, resemble those of other macular diseases. To overcome these issues,
several works have proposed automatic methods for the detection of AMD in
retinography images, the most widely used modality for the screening of the
disease. Nowadays, most of these works use Convolutional Neural Networks (CNNs)
for the binary classification of images into AMD and non-AMD classes. In this
work, we propose a novel approach based on CNNs that simultaneously performs
AMD diagnosis and the classification of its potential lesions. This latter
secondary task has not yet been addressed in this domain, and provides
complementary useful information that improves the diagnosis performance and
helps understanding the decision. A CNN model is trained using retinography
images with image-level labels for both AMD and lesion presence, which are
relatively easy to obtain. The experiments conducted in several public datasets
show that the proposed approach improves the detection of AMD, while achieving
satisfactory results in the identification of most lesions.",0.16726379,-0.25219187,-0.18292807,B
6643,"However, to establish the clinical relevance, further research
relating the adjusted Agatston scores with CHD events is warranted.","The results showed an improved agreement for the proposed method, compared
to automatic clinical calcium scoring.","Future research on evaluation of the proposed method in non-ECG-synchronized against cal-
cium scoring in dedicated calcium scoring CT is needed.",2022-05-24 10:59:32+00:00,Generative Models for Reproducible Coronary Calcium Scoring,eess.IV,"['eess.IV', 'cs.CV']","[arxiv.Result.Author('Sanne G. M. van Velzen'), arxiv.Result.Author('Bob D. de Vos'), arxiv.Result.Author('Julia M. H. Noothout'), arxiv.Result.Author('Helena M. Verkooijen'), arxiv.Result.Author('Max A. Viergever'), arxiv.Result.Author('Ivana Išgum')]","Purpose: Coronary artery calcium (CAC) score, i.e. the amount of CAC
quantified in CT, is a strong and independent predictor of coronary heart
disease (CHD) events. However, CAC scoring suffers from limited interscan
reproducibility, which is mainly due to the clinical definition requiring
application of a fixed intensity level threshold for segmentation of
calcifications. This limitation is especially pronounced in
non-ECG-synchronized CT where lesions are more impacted by cardiac motion and
partial volume effects. Therefore, we propose a CAC quantification method that
does not require a threshold for segmentation of CAC. Approach: Our method
utilizes a generative adversarial network where a CT with CAC is decomposed
into an image without CAC and an image showing only CAC. The method, using a
CycleGAN, was trained using 626 low-dose chest CTs and 514 radiotherapy
treatment planning CTs. Interscan reproducibility was compared to clinical
calcium scoring in radiotherapy treatment planning CTs of 1,662 patients, each
having two scans. Results: A lower relative interscan difference in CAC mass
was achieved by the proposed method: 47% compared to 89% manual clinical
calcium scoring. The intraclass correlation coefficient of Agatston scores was
0.96 for the proposed method compared to 0.91 for automatic clinical calcium
scoring. Conclusions: The increased interscan reproducibility achieved by our
method may lead to increased reliability of CHD risk categorization and
improved accuracy of CHD event prediction.",-0.19396402,-0.33104545,0.04420791,C
6998,"This method can be used to obtain good quality DWI in a shortened examination time, but
further research is necessary to improve denoising results and investigate the clinical utility of the denoised real MRI
images and ADC maps.","We showed that denoised images are significantly closer to a clean reference
than averaged images.","References

[Batson2019] Batson J., Royer L., Noise2Self: Blind Denoising by Self-Supervision, Proceedings of Machine Learning
Research, vol.",2022-06-01 08:14:35+00:00,Supervised Denoising of Diffusion-Weighted Magnetic Resonance Images Using a Convolutional Neural Network and Transfer Learning,eess.IV,"['eess.IV', 'cs.CV']","[arxiv.Result.Author('Jakub Jurek'), arxiv.Result.Author('Andrzej Materka'), arxiv.Result.Author('Kamil Ludwisiak'), arxiv.Result.Author('Agata Majos'), arxiv.Result.Author('Kamil Gorczewski'), arxiv.Result.Author('Kamil Cepuch'), arxiv.Result.Author('Agata Zawadzka')]","In this paper, we propose a method for denoising diffusion-weighted images
(DWI) of the brain using a convolutional neural network trained on realistic,
synthetic MR data. We compare our results to averaging of repeated scans, a
widespread method used in clinics to improve signal-to-noise ratio of MR
images. To obtain training data for transfer learning, we model, in a
data-driven fashion, the effects of echo-planar imaging (EPI): Nyquist ghosting
and ramp sampling. We introduce these effects to the digital phantom of brain
anatomy (BrainWeb). Instead of simulating pseudo-random noise with a defined
probability distribution, we perform noise scans with a brain-DWI-designed
protocol to obtain realistic noise maps. We combine them with the simulated,
noise-free EPI images. We also measure the Point Spread Function in a DW image
of an AJR-approved geometrical phantom and inter-scan movement in a brain scan
of a healthy volunteer. Their influence on image denoising and averaging of
repeated images is investigated at different signal-to-noise ratio levels.
Denoising performance is evaluated quantitatively using the simulated EPI
images and qualitatively in real EPI DWI of the brain. We show that the
application of our method allows for a significant reduction in scan time by
lowering the number of repeated scans. Visual comparisons made in the acquired
brain images indicate that the denoised single-repetition images are less noisy
than multi-repetition averaged images. We also analyse the convolutional neural
network denoiser and point out the challenges accompanying this denoising
method.",-0.07162835,-0.00796706,0.34576717,C
7426,"De Cock, I. Katsavounidis,
   A direction of further research that is worthy of exploration
is to apply RCN-Hull on encoding parameter spaces having          and A. Aaron.","[3] M. Manohara, A. Moorthy, J.",(Mar.,2022-06-10 05:11:02+00:00,Efficient Per-Shot Convex Hull Prediction By Recurrent Learning,eess.IV,"['eess.IV', 'cs.CV', 'cs.LG']","[arxiv.Result.Author('Somdyuti Paul'), arxiv.Result.Author('Andrey Norkin'), arxiv.Result.Author('Alan C. Bovik')]","Adaptive video streaming relies on the construction of efficient bitrate
ladders to deliver the best possible visual quality to viewers under bandwidth
constraints. The traditional method of content dependent bitrate ladder
selection requires a video shot to be pre-encoded with multiple encoding
parameters to find the optimal operating points given by the convex hull of the
resulting rate-quality curves. However, this pre-encoding step is equivalent to
an exhaustive search process over the space of possible encoding parameters,
which causes significant overhead in terms of both computation and time
expenditure. To reduce this overhead, we propose a deep learning based method
of content aware convex hull prediction. We employ a recurrent convolutional
network (RCN) to implicitly analyze the spatiotemporal complexity of video
shots in order to predict their convex hulls. A two-step transfer learning
scheme is adopted to train our proposed RCN-Hull model, which ensures
sufficient content diversity to analyze scene complexity, while also making it
possible capture the scene statistics of pristine source videos. Our
experimental results reveal that our proposed model yields better
approximations of the optimal convex hulls, and offers competitive time savings
as compared to existing approaches. On average, the pre-encoding time was
reduced by 58.0% by our method, while the average Bjontegaard delta bitrate
(BD-rate) of the predicted convex hulls against ground truth was 0.08%, while
the mean absolute deviation of the BD-rate distribution was 0.44%",0.2224167,-0.005514132,-0.16020226,B
7434,"The proposed approach encourages further research
8 Conclusion                                                directions on both algorithmic and computing archi-
                                                            tecture levels.",43× to 77× in the case of 9 × 9 inputs.,"In the ﬁrst direction, we would extend
This paper presents a GPU-accelerated computational         the SR model to handle a more challenging noise set-
framework for reconstructing high-resolution SAI from       ting, i.e., photon noise, which follows the Poisson dis-
4D LF data under mixed Gaussian-Impulse noise con-          tribution.",2022-06-09 05:23:05+00:00,A GPU-Accelerated Light-field Super-resolution Framework Based on Mixed Noise Model and Weighted Regularization,eess.IV,"['eess.IV', 'cs.CV', 'cs.PF']","[arxiv.Result.Author('Trung-Hieu Tran'), arxiv.Result.Author('Kaicong Sun'), arxiv.Result.Author('Sven Simon')]","This paper presents a GPU-accelerated computational framework for
reconstructing high resolution (HR) LF images under a mixed Gaussian-Impulse
noise condition. The main focus is on developing a high-performance approach
considering processing speed and reconstruction quality. From a statistical
perspective, we derive a joint $\ell^1$-$\ell^2$ data fidelity term for
penalizing the HR reconstruction error taking into account the mixed noise
situation. For regularization, we employ the weighted non-local total variation
approach, which allows us to effectively realize LF image prior through a
proper weighting scheme. We show that the alternating direction method of
multipliers algorithm (ADMM) can be used to simplify the computation complexity
and results in a high-performance parallel computation on the GPU Platform. An
extensive experiment is conducted on both synthetic 4D LF dataset and natural
image dataset to validate the proposed SR model's robustness and evaluate the
accelerated optimizer's performance. The experimental results show that our
approach achieves better reconstruction quality under severe mixed-noise
conditions as compared to the state-of-the-art approaches. In addition, the
proposed approach overcomes the limitation of the previous work in handling
large-scale SR tasks. While fitting within a single off-the-shelf GPU, the
proposed accelerator provides an average speedup of 2.46$\times$ and
1.57$\times$ for $\times 2$ and $\times 3$ SR tasks, respectively. In addition,
a speedup of $77\times$ is achieved as compared to CPU execution.",0.33681327,0.023216074,0.131543,B
7707,"Moreover, the
                                                                    contributions of the detected ROIs varied across different
The interpretability of the model is crucial for clinical pre-      time points and are also worthy of further study.","Furthermore, the precuneus, which is
                                                                    associated with a high level of cognitive function [37], was
5.3.3 Interpretability of the Proposed Method                       explored by PET data at most time points.","diction and can help us discover some potential information
associated with AD.",2022-06-16 09:20:41+00:00,Multi-View Imputation and Cross-Attention Network Based on Incomplete Longitudinal and Multi-Modal Data for Alzheimer's Disease Prediction,eess.IV,"['eess.IV', 'cs.CV']","[arxiv.Result.Author('Meiyan Huang'), arxiv.Result.Author('Tao Wang'), arxiv.Result.Author('Xiumei Chen'), arxiv.Result.Author('Xiaoling Zhang'), arxiv.Result.Author('Shuoling Zhou'), arxiv.Result.Author('Qianjin Feng')]","Longitudinal variations and complementary information inherent in
longitudinal and multi-modal data play an important role in Alzheimer's disease
(AD) prediction, particularly in identifying subjects with mild cognitive
impairment who are about to have AD. However, longitudinal and multi-modal data
may have missing data, which hinders the effective application of these data.
Additionally, previous longitudinal studies require existing longitudinal data
to achieve prediction, but AD prediction is expected to be conducted at
patients' baseline visit (BL) in clinical practice. Thus, we proposed a
multi-view imputation and cross-attention network (MCNet) to integrate data
imputation and AD prediction in a unified framework and achieve accurate AD
prediction. First, a multi-view imputation method combined with adversarial
learning, which can handle a wide range of missing data situations and reduce
imputation errors, was presented. Second, two cross-attention blocks were
introduced to exploit the potential associations in longitudinal and
multi-modal data. Finally, a multi-task learning model was built for data
imputation, longitudinal classification, and AD prediction tasks. When the
model was properly trained, the disease progression information learned from
longitudinal data can be leveraged by BL data to improve AD prediction. The
proposed method was tested on two independent testing sets and single-model
data at BL to verify its effectiveness and flexibility on AD prediction.
Results showed that MCNet outperformed several state-of-the-art methods.
Moreover, the interpretability of MCNet was presented. Thus, our MCNet is a
tool with a great application potential in longitudinal and multi-modal data
analysis for AD prediction. Codes are available at
https://github.com/Meiyan88/MCNET.",-0.27345237,-0.22101708,-0.09569415,C
7720,"We also use several                      [18] F. Chollet, “Xception: Deep learning with depthwise separable convolu-
SOTA baselines and benchmark them on Kvasir-Capsule to                                tions,” in Proceedings of the IEEE conference on computer vision and
streamline further research in this area.","Thus, reducing the
effort required for manual inspection.","In the future, we plan                      pattern recognition, 2017, pp.",2022-06-16 16:57:45+00:00,Video Capsule Endoscopy Classification using Focal Modulation Guided Convolutional Neural Network,eess.IV,"['eess.IV', 'cs.CV']","[arxiv.Result.Author('Abhishek Srivastava'), arxiv.Result.Author('Nikhil Kumar Tomar'), arxiv.Result.Author('Ulas Bagci'), arxiv.Result.Author('Debesh Jha')]","Video capsule endoscopy is a hot topic in computer vision and medicine. Deep
learning can have a positive impact on the future of video capsule endoscopy
technology. It can improve the anomaly detection rate, reduce physicians' time
for screening, and aid in real-world clinical analysis. CADx classification
system for video capsule endoscopy has shown a great promise for further
improvement. For example, detection of cancerous polyp and bleeding can lead to
swift medical response and improve the survival rate of the patients. To this
end, an automated CADx system must have high throughput and decent accuracy. In
this paper, we propose FocalConvNet, a focal modulation network integrated with
lightweight convolutional layers for the classification of small bowel
anatomical landmarks and luminal findings. FocalConvNet leverages focal
modulation to attain global context and allows global-local spatial
interactions throughout the forward pass. Moreover, the convolutional block
with its intrinsic inductive/learning bias and capacity to extract hierarchical
features allows our FocalConvNet to achieve favourable results with high
throughput. We compare our FocalConvNet with other SOTA on Kvasir-Capsule, a
large-scale VCE dataset with 44,228 frames with 13 classes of different
anomalies. Our proposed method achieves the weighted F1-score, recall and MCC}
of 0.6734, 0.6373 and 0.2974, respectively outperforming other SOTA
methodologies. Furthermore, we report the highest throughput of 148.02
images/second rate to establish the potential of FocalConvNet in a real-time
clinical environment. The code of the proposed FocalConvNet is available at
https://github.com/NoviceMAn-prog/FocalConvNet.",0.09217654,0.3645662,-0.044566248,A
7906,"Possible further research in this topic could be                [5] “LCD - Cardiac Computed Tomography and Angiography (CCTA)
                                                                        (L33423).” Medicare-Coverage-Database, www.cms.gov/medicare-
   • Low-cost, efﬁcient, and real time computational platform           coverage-database/view/lcd.aspx?LCDId=33423.","Prevention, 7 Feb. 2022, www.cdc.gov/heartdisease/facts.htm.","Accessed 12 June
      for immediate Agaston Score and bucketing score of level          2022.
      of calciﬁcation in the arteries of a patient when scan is
      clicked.",2022-06-13 20:02:02+00:00,Automated Coronary Calcium Scoring using U-Net Models through Semi-supervised Learning on Non-Gated CT Scans,eess.IV,"['eess.IV', 'cs.CV', 'cs.LG']",[arxiv.Result.Author('Sanskriti Singh')],"Every year, thousands of innocent people die due to heart attacks. Often
undiagnosed heart attacks can hit people by surprise since many current medical
plans don't cover the costs to require the searching of calcification on these
scans. Only if someone is suspected to have a heart problem, a gated CT scan is
taken, otherwise, there's no way for the patient to be aware of a possible
heart attack/disease. While nongated CT scans are more periodically taken, it
is harder to detect calcification and is usually taken for a purpose other than
locating calcification in arteries. In fact, in real time coronary artery
calcification scores are only calculated on gated CT scans, not nongated CT
scans. After training a unet model on the Coronary Calcium and chest CT's gated
scans, it received a DICE coefficient of 0.95 on its untouched test set. This
model was used to predict on nongated CT scans, performing with a mean absolute
error (MAE) of 674.19 and bucket classification accuracy of 41% (5 classes).
Through the analysis of the images and the information stored in the images,
mathematical equations were derived and used to automatically crop the images
around the location of the heart. By performing semi-supervised learning the
new cropped nongated scans were able to closely resemble gated CT scans,
improving the performance by 91% in MAE (62.38) and 23% in accuracy.",-0.19639039,-0.30439782,0.16253445,C
