Unnamed: 0,further research line,further research prefix,further research suffix,publication date,title,primary category,categories,authors,abstract,x,y,z,cluster
9792,Much further research can be done as a continuation of this paper.,"Some unsolved problems and remarks

   In this section, we present some unsolved problems related to the results proved in this
paper.",The following question is on conformal diameter corresponding to solutions to (0.1).,2022-08-07 01:34:26+00:00,Some geometric inequalities related to Liouville equation,math.AP,['math.AP'],"[arxiv.Result.Author('Changfeng Gui'), arxiv.Result.Author('Qinfeng Li')]","In this paper, we prove that if $u$ is a solution to the Liouville equation
\begin{align} \label{scalliouville} \Delta u+e^{2u} =0 \quad \mbox{in
$\mathbb{R}^2$,} \end{align}then the diameter of $\mathbb{R}^2$ under the
conformal metric $g=e^{2u}\delta$ is bounded below by $\pi$. Here $\delta$ is
the Euclidean metric in $\mathbb{R}^2$. Moreover, we explicitly construct a
family of solutions such that the corresponding diameters of $\mathbb{R}^2$
range over $[\pi,2\pi)$.
  We also discuss supersolutions. We show that if $u$ is a supersolution and
$\int_{\mathbb{R}^2} e^{2u} dx<\infty$, then the diameter of $\mathbb{R}^2$
under the metric $e^{2u}\delta$ is less than or equal to $2\pi$.
  For radial supersolutions, we use both analytical and geometric approaches to
prove some inequalities involving conformal lengths and areas of disks in
$\mathbb{R}^2$. We also discuss the connection of the above results with the
sphere covering inequality in the case of Gaussian curvature bounded below by
$1$.
  Higher dimensional generalizations are also discussed.",-0.2433464,0.11478682,-0.22906914,B
9870,"27
    Finally, let us mention one direction for further research in connection with the results
formulated and proved in this sections.","The proof of Theorem 4.2
is completed.","In order to remove the negativity condition posed
on the coeﬃcient c = c(x, t) in Theorem 4.2 (ii), one needs a unique existence result
for solutions to the initial-boundary value problems of type (2.4) with non-zero Robin
boundary condition similar to the one formulated in Theorem 2.1.",2022-08-09 08:49:11+00:00,Comparison principles for the linear and semiliniar time-fractional diffusion equations with the Robin boundary condition,math.AP,"['math.AP', '26A33 (primary), 35B30, 35L05, 35R11, 35R30, 45K05, 60E99']","[arxiv.Result.Author('Yuri Luchko'), arxiv.Result.Author('Masahiro Yamamoto')]","The main objective of this paper is analysis of the initial-boundary value
problems for the linear and semilinear time-fractional diffusion equations with
a uniformly elliptic spatial differential operator of the second order and the
Caputo type fractional derivative acting in the fractional Sobolev spaces. The
boundary conditions are formulated in form of the homogeneous Neumann or Robin
conditions. First we deal with the uniqueness and existence of the solutions to
these initial-boundary value problems. Then we show a positivity property for
the solutions and derive the corresponding comparison principles. In the case
of the semilinear time-fractional diffusion equation, we also apply the
monotonicity method by upper and lower solutions. As an application of our
results, we present some a priori estimates for solutions to the semilinear
time-fractional diffusion equations.",-0.19486718,-0.21168879,-0.085152425,B
9963,Prospects for further research are given.,"In particular, we outline the fundamentally diﬀerent limit problems that
occur for the two diﬀerent ﬂow regimes (two inlets, one outlet or (one inlet, two outlets) and relate them to
the aforementioned studies on pure network models.","4                                TARAS MEL’NYK & CHRISTIAN ROHDE

                                                      2.",2022-08-11 13:18:47+00:00,Asymptotic expansion for convection-dominated transport in a thin graph-like junction,math.AP,"['math.AP', '35K20, 35R02, 35B40, 35B25, 35B45, 35K57, 35Q49']","[arxiv.Result.Author(""Taras Mel'nyk""), arxiv.Result.Author('Christian Rohde')]","We consider for a small parameter $\varepsilon >0$ a parabolic
convection-diffusion problem with P\'eclet number of order
$\mathcal{O}(\varepsilon^{-1})$ in a three-dimensional graph-like junction
consisting of thin curvilinear cylinders with radii of order
$\mathcal{O}(\varepsilon)$ connected through a domain (node) of diameter
$\mathcal{O}(\varepsilon).$ Inhomogeneous Neumann type boundary conditions,
that involve convective and diffusive fluxes, are prescribed both on the
lateral surfaces of the thin cylinders and the boundary of the node.
  The asymptotic behaviour of the solution is studied as $\varepsilon \to 0,$
i.e., when the diffusion coefficients are eliminated and the thin junction is
shrunk into a three-part graph connected in a single vertex. A rigorous
procedure for the construction of the complete asymptotic expansion of the
solution is developed and the corresponding energetic and uniform pointwise
estimates are proven. Depending on the directions of the limit convective
fluxes, the corresponding limit problems $(\varepsilon = 0)$ are derived in the
form of first-order hyperbolic differential equations on the one-dimensional
branches with novel gluing conditions at the vertex. These generalize the
classical Kirchhoff transmission conditions and might require the solution of a
three-dimensional cell-like problem associated with the vertex to account for
the local geometric inhomogeneity of the node and the physical processes in the
node. The asymptotic ansatz consists of three parts, namely, the regular part,
node-layer part, and boundary-layer one. Their coefficients are classical
solutions to mixed-dimensional limit problems. The existence and other
properties of those solutions are analyzed.",0.2912087,-0.008300315,-0.041600205,A
10745,"Bourdaud, in the same paper [2, p. 1217 (1)], poses as a question for further study the
characterization of the notion of vanishing at inﬁnity for functions in bmo(Rn).","Note that the fact that the vanishing at inﬁnity of the averages over large
cubes in the second condition is suﬃcient to give the vanishing at inﬁnity of the oscillation on
small cubes in the third condition can be seen by combining Sarason’s VMO condition (2) with
the standard log estimate (5), but may fail when not working on all of Rn (see Example 2).","We answer this
question by giving an analogue of Proposition 1 for functions which do not necessarily satisfy
the VMO condition (2) .",2022-09-02 19:13:07+00:00,Local vanishing mean oscillation,math.AP,"['math.AP', '42B35, 46E35, 41A30']","[arxiv.Result.Author('Almaz Butaev'), arxiv.Result.Author('Galia Dafni')]","We consider various notions of vanishing mean oscillation on a (possibly
unbounded) domain $\Omega \subset \mathbb{R}^n$, and prove an analogue of
Sarason's theorem, giving sufficient conditions for the density of bounded
Lipschitz functions in the nonhomogeneous space $\rm{vmo}(\Omega)$. We also
study $\rm{cmo}(\Omega)$, the closure in $\rm{bmo}(\Omega)$ of the continuous
functions with compact support in $\Omega$. Using these approximation results,
we prove that there is a bounded extension from $\rm{vmo}(\Omega)$ and
$\rm{cmo}(\Omega)$ to the corresponding spaces on $\mathbb{R}^n$, if and only
if $\Omega$ is a locally uniform domain.",-0.050346382,-0.16299729,-0.019442745,C
10986,"In Theorem 1(ii), we can further study and prove the uniqueness in the case

where we replace assumption (7) by more general conditions, e.g., bj = 0 and c

is not necessarily non-negative, but we omit details.","The proof of (9) is given

in Appendix A.","Moreover, here we omit the

treatments for the case 1 < α < 2.",2022-09-09 05:13:48+00:00,Uniqueness of inverse source problems for time-fractional diffusion equations with singular functions in time,math.AP,['math.AP'],"[arxiv.Result.Author('Yikan Liu'), arxiv.Result.Author('Masahiro Yamamoto')]","We consider a fractional diffusion equations of order $\alpha\in(0,1)$ whose
source term is singular in time: $(\partial_t^\alpha+A)u(x,t)=\mu(t)f(x)$,
$(x,t)\in\Omega\times(0,T)$, where $\mu$ belongs to a Sobolev space of negative
order. In inverse source problems of determining $f|_\Omega$ by the data
$u|_{\omega\times(0,T)}$ with a given subdomain $\omega\subset\Omega$ or
$\mu|_{(0,T)}$ by the data $u|_{\{x_0\}\times(0,T)}$ with a given point
$x_0\in\Omega$, we prove the uniqueness by reducing to the case $\mu\in
L^2(0,T)$. The key is a transformation of a solution to an initial-boundary
value problem with a regular function in time.",-0.07112241,-0.19397339,-0.18235119,B
11579,"From there, the authors derive a kinetic-
renewal system and further study the relevant macroscopic limits in various scenarios of diﬀerent
complexity.","The models are based on individual-cell dynamics,
where the switching of direction of an agent is modelled by a probability, depending on the
microscopic “steps” the agent did in that direction.","3
    The structure of the paper is the following: in Section 2, we prove existence and uniqueness of
measure solutions to the reversal collision dynamics (3).",2022-09-23 05:02:40+00:00,Reversal Collision Dynamics,math.AP,"['math.AP', '35Q70, 35B40, 82B20']","[arxiv.Result.Author('Amic Frouvelle'), arxiv.Result.Author('Laura Kanzler'), arxiv.Result.Author('Christian Schmeiser')]","Motivated by the study of reversal behaviour of myxobacteria, in this article
we are interested in a kinetic model for reversal dynamics, in which particles
with directions close to be opposite undergo binary collision resulting in
reversing their orientations. To this aim, a generic model for binary
collisions between particles with states in a general metric space exhibiting
specific symmetry properties is proposed and investigated. The reversal process
is given by an involution on the space, and the rate of collision is only
supposed to be bounded and lower semi-continuous. We prove existence and
uniqueness of measure solutions as well as their convergence to equilibrium,
using the graph-theoretical notion of connectivity. We first characterise the
shape of equilibria in terms of connected components of a graph on the state
space, which can be associated to the initial data of the problem.
Strengthening the notion of connectivity on subsets for which the rate of
convergence is bounded below, we then show exponential convergence towards the
unique steady-state associated to the initial condition. The article is
concluded with numerical simulations set on the one-dimensional torus giving
evidence to the analytical results.",0.49573797,-0.11133428,0.0519801,A
11605,"The rigorous
study of their existence would be an extremely interesting direction for further study.","We conjecture that this may indeed result
in both time-periodic and quasiperiodic solutions that are not traveling waves.","CONVECTIVE-WAVE SOLUTIONS OF THE RICHARD-GAVRILYUK MODEL  29

         Figure 9.",2022-09-24 02:49:37+00:00,Convective-wave solutions of the Richard-Gavrilyuk model for inclined shallow water flow,math.AP,"['math.AP', '35Q35, 35C07, 35B35, 76E15, 35L40, 35L67, 35P15']","[arxiv.Result.Author('L. Miguel Rodrigues'), arxiv.Result.Author('Zhao Yang'), arxiv.Result.Author('Kevin Zumbrun')]","We study for the Richard-Gavrilyuk model of inclined shallow water flow, an
extension of the classical Saint Venant equations incorporating vorticity, the
new feature of convective-wave solutions analogous to contact discontinuitis in
inviscid conservation laws. These are traveling waves for which fluid velocity
is constant and equal to the speed of propagation of the wave, but fluid height
and/or enstrophy (thus vorticity) varies. Together with hydraulic shocks, they
play an important role in the structure of Riemann solutions.",-0.012984691,0.1030944,-0.09971209,B
11612,"Then,
we further study the change of the forms of various variables with Ra = 103, 104, 105.",We present the vertical/horizontal velocity at mid-height for various Ra in Figure 4.,"Firstly,
Figure 5 shows the streamlines of velocity, we can easily observe that the streamline of velocity
changes from one large vortex to two large vortices, and then and moved to both sides.",2022-09-24 11:47:57+00:00,Coupled iterative analysis for the stationary thermally coupled inductionless MHD system based on charge-conservative finite element method,math.AP,['math.AP'],"[arxiv.Result.Author('Shitian Dong'), arxiv.Result.Author('Haiyan Su')]","This paper mainly considers three iterations based on charge-conservative
finite element approximation in Lipschitz domain for the stationary thermally
coupled inductionless MHD equations. Based on the hybrid finite element method,
the unknowns of hydrodynamic are discretized by the stable velocity-pressure
finite element pair, and the current density along with electric potential are
similarly discretized by the comforming finite element pair in
$\boldsymbol{H}(\boldsymbol{div}, \Omega)\times L^2(\Omega)$. And on account of
the strong nonlinearity of the equations, we present three coupled iterative
methods, namely, the Stokes, Newton and Oseen iteration and the convergence and
stability under different uniqueness conditions are analyzed strictly. It is
proved especially that the error estimates of velocity, current density,
temperature and pressure do not depend on potential. The theoretical analysis
is validated by the given numerical results, and for the proposed methods, the
applicability and effectiveness are demonstrated.",0.19079942,0.33772558,-0.11317829,C
11740,"Taking this observation of increased regularity of the averaging operator as a start-
ing point, one can exploit this local gain of regularity to further study Riemann-sum
type expressions of the form

      ITn =      (Ts−,tw b)(us )

             [s,t]∈Pn([0,T ])

for partitions Pn([0, T ]) of [0, T ] and a continuous function u.","While
the canonical paths for which this gain in regularity can be quantiﬁed are realiza-

tions of fractional Brownian motion [CG16], [GG21], [Ger22], ρ irregularity is in fact

a typical property among Hölder continuous paths in the sense of prevalence [GG20].","The tool that then
ensures the convergence of such Riemann-sums in the limit |Pn| → 0 is Gubinelli’s

Sewing Lemma [Gub04], [FH14], also cited in the Appendix as Lemma 7.3.",2022-09-27 15:13:05+00:00,A pathwise regularization by noise phenomenon for the evolutionary $p$-Laplace equation,math.AP,"['math.AP', 'math.PR']","[arxiv.Result.Author('Florian Bechtold'), arxiv.Result.Author('Jörn Wichmann')]","We study an evolutionary $p$-Laplace problem whose potential is subject to a
translation in time. Provided the trajectory along which the potential is
translated admits a sufficiently regular local time, we establish existence of
solutions to the problem for singular potentials for which a priori bounds in
classical approaches break down, thereby establishing a pathwise regularization
by noise phenomena for this non-linear problem.",-0.082602546,-0.12500551,0.33675236,B
11775,"An interesting open problem for further study is the relaxation of Fα when the integrand admits
additional dependence on the values of u.","In particular,
the area-integrand f (A) = 1 + |A|2 − 1 in Example 4.3 is an admissible candidate, providing a
fractional analogue to the famous Plateau problem [26].","Indeed, in the introduction of [14] it is mentioned for
u ∈ BV α(Rn; Rm) that Dαu can be non-zero on sets of Hausdorﬀ dimension n − 1, just as the
classical variation, while the precise representative of u is only deﬁned for Hn−α+ε-a.e.",2022-09-28 09:39:55+00:00,Extending linear growth functionals to functions of bounded fractional variation,math.AP,"['math.AP', '49J45, 35R11, 26B30']",[arxiv.Result.Author('Hidde Schönberger')],"In this paper we consider the minimization of a novel class of fractional
linear growth functionals involving the Riesz fractional gradient. These
functionals lack the coercivity properties in the fractional Sobolev spaces
needed to apply the direct method. We therefore utilize the recently introduced
spaces of bounded fractional variation and study the extension of the linear
growth functional to these spaces through relaxation with respect to the weak*
convergence. Our main result establishes an explicit representation for this
relaxation, which includes an integral term accounting for the singular part of
the fractional variation and features the quasiconvex envelope of the
integrand. The role of quasiconvexity in this fractional framework is explained
by a technique to switch between the fractional and classical settings. We
complement the relaxation result with an existence theory for minimizers of the
extended functional.",-0.24251941,-0.1252003,0.14208701,B
11782,"In the next section, we further study the behavior of bs for
θ → 0 when s → ∞.","This completes the proof of the limit of the non-cutoﬀ collision kernel to the
hard-sphere kernel.",3.,2022-09-28 13:17:18+00:00,Vanishing angular singularity limit to the hard-sphere Boltzmann equation,math.AP,"['math.AP', 'math-ph', 'math.MP', '35Q20 (Primary) 35R11, 76P05, 82C40, 26A33 (Secondary)']","[arxiv.Result.Author('Jin Woo Jang'), arxiv.Result.Author('Bernhard Kepka'), arxiv.Result.Author('Alessia Nota'), arxiv.Result.Author('Juan J. L. Velázquez')]","In this note we study Boltzmann's collision kernel for inverse power law
interactions $U_s(r)=1/r^{s-1}$ for $s>2$ in dimension $ d=3 $. We prove the
limit of the non-cutoff kernel to the hard-sphere kernel and give precise
asymptotic formulas of the singular layer near $\theta\simeq 0$ in the limit $
s\to \infty $. Consequently, we show that solutions to the homogeneous
Boltzmann equation converge to the respective solutions.",-0.10390596,-0.059578426,-0.11267671,B
11965,"A point of
further research would be to strengthen this result and to potentially derive a rate of convergence.","The solution of the limiting problem u, is the weak limit of a convergent subsequence.","This research would be based oﬀ of the work of Cherednichenko, Dondl and Ro¨sler [8], who prove
that the resolvent of the Laplace operator −∆|Ωǫ converges, in the sense of the operator norm,
to η − ∆ for periodically arranged inclusions and homogeneous Dirichlet, Neumann and Robin
boundary conditions.",2022-10-03 11:09:20+00:00,A strange term coming from the boundary data,math.AP,"['math.AP', '74Q15, 35B27']",[arxiv.Result.Author('Aaron Pim')],"In this paper, I derive the limiting behaviour of the solutions to Poisson's
equation, in a perforated domain, subject to inhomogeneous Robin boundary
conditions. In the first half of the paper, I derive a generalised limit for
non-periodic domains and arbitrary boundary data. In the second half of this
paper, I demonstrate that for periodically arranged spheres and identical Robin
boundary data on each sphere, the homogenised limit of Poisson's equation
satisfies the Helmholtz equation with an additional term in the domain data,
which represents the contribution from the inhomogeneous Robin boundary data.
These results are a generalisation of the work of Kaizu, who derived the limit
of the solutions to the homogeneous Robin problem.",-0.16887988,-0.110375,0.13169149,B
11973,"MEAN-FIELD LIMITS FOR ENTROPIC MULTI-POPULATION DYNAMICAL SYSTEMS                                       3

   In [6], a further research direction has been explored.","Under a rather general set of assumptions on v and T (which, in particular, encompass the

case of the replicator dynamics), it has been shown in [26] that the empirical measures ΛNt
associated with system (1.1) converge to a probability measure on the state space, which solves

the continuity equation

                                                       ∂tΛt + div(bΛt Λt) = 0,                                                    (1.2)

where bΛt is the vector ﬁeld which drives the state in system (1.1).","There, the replicator equation is slightly
modiﬁed adding an entropy regularization H , see (1.3) below.",2022-10-03 13:02:35+00:00,Mean-field limits for entropic multi-population dynamical systems,math.AP,"['math.AP', '35Q91, 91A16, 60J76, 49J27, 37C10, 35Q49']","[arxiv.Result.Author('Stefano Almi'), arxiv.Result.Author(""Claudio D'Eramo""), arxiv.Result.Author('Marco Morandotti'), arxiv.Result.Author('Francesco Solombrino')]","The well-posedness of a multi-population dynamical system with an entropy
regularization and its convergence to a suitable mean-field approximation are
proved, under a general set of assumptions. Under further assumptions on the
evolution of the labels, the case of different time scales between the agents'
locations and labels dynamics is considered. The limit system couples a
mean-field-type evolution in the space of positions and an instantaneous
optimization of the payoff functional in the space of labels.",0.2580517,-0.2392757,0.15549028,A
12108,"arXiv:2210.03285v1 [math.AP] 7 Oct 2022  Improved Caﬀarelli-Kohn-Nirenberg Inequalities and
                                                           Uncertainty Principle

                                                                       Pei Dang, Weixiong Mai∗
                                                                           October 10, 2022

                                                                                         Abstract

                                             In this paper we prove some improved Caﬀarelli-Kohn-Nirenberg inequalities
                                         and uncertainty principle for complex- and vector-valued functions on Rn, which
                                         is a further study of the results in [8].","Faculty of Innovation Engineering, Macau University of Science and Technology, Macao,
China

     E-mail address: pdang@must.edu.mo
     Macao Center for Mathematical Sciences, Macau University of Science and Tech-
nology, Macao, China
     E-mail address: wxmai@must.edu.mo

                                                       25","Moreover, we also extend the extra-strong
                                         uncertainty principle given in [9] to cases for complex- and vector-valued functions
                                         deﬁned on Sn, n ≥ 2.",2022-10-07 02:22:48+00:00,Improved Caffarelli-Kohn-Nirenberg Inequalities and Uncertainty Principle,math.AP,['math.AP'],"[arxiv.Result.Author('Pei Dang'), arxiv.Result.Author('Weixiong Mai')]","In this paper we prove some improved Caffarelli-Kohn-Nirenberg inequalities
and uncertainty principle for complex- and vector-valued functions on $\mathbb
R^n$, which is a further study of the results in \cite{Dang-Deng-Qian}.
Moreover, we also extend the extra-strong uncertainty principle given in
\cite{Dang-Qian-Chen} to cases for complex- and vector-valued functions defined
on $\mathbb S^n,n\geq 2.$",-0.09067178,-0.15010768,0.13289227,C
12337,"Then, incorporated

the proposed technique leading to ﬁnding solution of (1.1), we construct the integral representation of

the solution to (1.5)-(1.9) which will be play a key role in the further study of solvability and waiting

time phenomena of the corresponding contact Muskat problem.","In this work, performing special change of variables and then Laplace and Fourier transforms, we reduce

problem (1.5)-(1.9) to the functional diﬀerence equation like (1.1) with β = s0 + 1.",The paper is organized as follows.,2022-10-12 12:45:59+00:00,"On a class of functional difference equations: explicit solutions, asymptotic behavior and applications",math.AP,"['math.AP', 'math.CV', '39A06, 39B32 (Primary), 35C15, 35R11, 35R35 (Secondary)']",[arxiv.Result.Author('Nataliya Vasylyeva')],"For $\nu\in[0,1]$ and a complex parameter $\sigma,$ $Re\, \sigma>0,$ we
discuss a linear inhomogeneous functional difference equation with variable
coefficients on a complex plane $z\in\mathbb{C}$: \[
(a_{1}\sigma+a_{2}\sigma^{\nu})\mathcal{Y}(z+\beta,\sigma)-\Omega(z)\mathcal{Y}(z,\sigma)=\mathbb
F(z,\sigma), \quad\beta\in\mathbb{R},\, \beta\neq 0, \] where $\Omega(z)$ and
$\mathbb{F}(z)$ are given complex functions, while $a_{1}$ and $a_{2}$ are
given real non-negative numbers. Under suitable conditions on the given
functions and parameters, we construct explicit solutions of the equation and
describe their asymptotic behavior as $|z|\to +\infty$. Some applications to
the theory of functional difference equations and to the theory of boundary
value problems governed by subdiffusion in nonsmooth domains are then
discussed.",0.07151113,-0.13294482,0.107435584,C
